speaker	role	text	extra
MAURIZIO LUPI		Grazie Presidente, ringrazio anche l'onorevole Baldelli. Il mio è un richiamo al Regolamento, perché lei correttamente nell'annuncio del risultato delle votazioni che si sono appena svolte ha sottolineato che, come previsto dall'articolo 5 del Regolamento, commi 3 e 4, non siamo nel pieno del funzionamento dell'Ufficio di Presidenza, proprio perché, lo sottolineo, siamo all'insediamento di questo Ufficio di Presidenza, al suo primo atto, e quindi il fatto che almeno un gruppo, che è regolarmente costituito, non sia rappresentato nell'Ufficio di Presidenza ovviamente non da atto alla formazione completa di questo Ufficio di Presidenza. Contemporaneamente lei, però, ha annunciato di aver convocato domani mattina l'Ufficio di Presidenza stesso; è evidente che le due cose sono in contraddizione l'una con l'altra, e glielo dico proprio per l'esperienza che ho fatto in questi cinque anni, l'aver apprezzato cosa vuol dire nelle istituzioni, come il Parlamento, il rispetto puntuale dei Regolamenti, perché non sarà una forma se è previsto che nell'Ufficio di Presidenza siano rappresentati tutti i gruppi regolarmente costituiti ed eletti e quindi in rappresentanza del nostro popolo. Ovviamente ricordo che c’è sempre stata non solo questa consuetudine, appena eletto l'Ufficio di Presidenza di convocarlo – ma proprio perché era nel suo pieno completamento – nella giornata immediatamente vicina alla elezione dello stesso. Qui però siamo in un caso assolutamente diverso e affermare che ci sia una convocazione formale dell'Ufficio di Presidenza quando questo non è nel suo pieno completamento e quindi nella sua piena funzionalità, mi sembra creare un precedente per il Parlamento, non in funzione dell'eventuale cortesia, ovviamente, del fatto che domani ci si possa trovare anzitutto per fare gli auguri a lei – non l'abbiamo ancora fatto – e farseli vicendevolmente, ma per entrare nel pieno funzionamento del lavoro anche formale, a partire dalle sue comunicazioni e dal modo con cui l'Ufficio di Presidenza vorrà organizzare il proprio lavoro e darsi le proprie priorità. Credo che domani non possa essere assolutamente convocato un Ufficio di Presidenza, ma che si debba, come ha detto l'onorevole Caparini, procedere urgentemente, anche perché abbiamo tante cose importanti da affrontare, alla convocazione di una Assemblea della Camera per l'elezione e il completamento dell'Ufficio di Presidenza, così da procedere poi formalmente al tutto. Quindi, non è solo una richiesta formale la mia, ma è una richiesta sostanziale. Dal mio punto di vista e, quindi, dal punto di vista del nostro gruppo, domani non può essere convocato alcun Ufficio di Presidenza ma, ovviamente, siamo, invece, disponibili a qualsiasi incontro informale che si volesse fare con lei, anche per iniziare, magari, non solo a conoscerci, ma anche a discutere. Ma, il tutto può essere solo nella pura informalità e non nella pienezza della convocazione dell'organo.	
LAURA BOLDRINI	PRESIDENTE	Onorevole Lupi, ha ragione. Difatti, non si intendeva avviare formalmente i lavori, ma fare un'informativa. Non prenderemo nessuna decisione domani.	
DAVIDE CAPARINI		Chiedo di parlare.	
LAURA BOLDRINI	PRESIDENTE	Ne ha facoltà.	
DAVIDE CAPARINI		Signor Presidente, l'informativa – mi scusi – non la trovo nel Regolamento. O è una convocazione formale o è una convocazione informale.	
LAURA BOLDRINI	PRESIDENTE	Noi l'avevamo comunicato già e quello che posso dirle è che noi non prenderemo decisioni. Dunque, qual è il problema che osta ?	
DAVIDE CAPARINI		Signor Presidente, a tutela del gruppo che mi pregio di rappresentare, dato che l'Ufficio di Presidenza, a norma del Regolamento ha i pieni poteri nel momento in cui tutti i gruppi sono rappresentati, ovviamente mi preoccupo di tutelare i diritti dei miei colleghi che rappresento ed essere certo che quella di domani sarà qualsiasi cosa, ma non una convocazione dell'Ufficio di Presidenza, a cui il mio gruppo ha diritto, in base al Regolamento, di partecipare.	
LAURA BOLDRINI	PRESIDENTE	Quando noi l'abbiamo convocato non vi è stata nessuna obiezione a questo.	
DAVIDE CAPARINI		Signor Presidente, la convocazione è avvenuta nel momento in cui ha proclamato l'Ufficio di Presidenza. Prima, come lei ben sa, non è possibile convocare alcunché, perché non vi erano eletti. Mi scusi, ma questo è un punto che mi sembra lapalissiano e che mi sembra quasi superfluo sottolineare. Non vorrei offendere la sua intelligenza.	
LAURA BOLDRINI	PRESIDENTE	Dunque, penso che la prassi ci possa consentire questo. Le faremo avere anche un'informazione documentata sui precedenti. Domani, riterrei di procedere con questo incontro, nel quale noi non prenderemo alcuna decisione.	
SIMONE BALDELLI		Chiedo di parlare.	
LAURA BOLDRINI	PRESIDENTE	Ne ha facoltà.	
SIMONE BALDELLI		Signor Presidente, prima di fare un intervento sull'ordine dei lavori, mi unisco all'intervento del collega Lupi sul richiamo al Regolamento, nel senso che a questo punto non si è capito se quello di domani è un Ufficio di Presidenza oppure è una riunione informale che il Presidente fa con i componenti eletti dell'Ufficio di Presidenza, ma non è una riunione dell'Ufficio di Presidenza. Se così è, mi pare di capire che non vi sia questione. Se dovesse essere, invece, una convocazione dell'Ufficio di Presidenza rileva la questione sollevata dal collega Lupi. Quindi, su questo punto la invito a darci un elemento di chiarezza. Quanto, Presidente, all'intervento che intendevo svolgere sull'ordine dei lavori, era semplicemente per consegnare a quest'Assemblea, brevissimamente, per trenta secondi, due parole in memoria di Pietro Mennea (Applausi), che oggi ci ha lasciato, a 61 anni. È stato un atleta, un campione internazionale, è stato un uomo anche impegnato nelle istituzioni, poiché ha ricoperto l'incarico di deputato europeo. Una persona il cui nome risuona familiare nel cuore di tante generazioni di italiani che lo hanno visto segnare record mondiali (penso a Città del Messico, nel 1979). Si tratta di una figura che è stata trasversalmente ricordata nella giornata di oggi con grande, grande affetto da parte di esponenti delle istituzioni, della società civile e del mondo sportivo.	
LAURA BOLDRINI	PRESIDENTE	Io ritengo che domani ci sia questa convocazione dell'Ufficio di presidenza e che, come detto, io mi farò garante che non prenderò nessuna decisione.	
MAURIZIO LUPI		Chiedo di parlare.	
LAURA BOLDRINI	PRESIDENTE	Ne ha facoltà.	
MAURIZIO LUPI		Mi spiace, Presidente, iniziare in questo modo, ma, con tutto il rispetto per la sua persona e per il ruolo che interpreta, la forma è sostanza e lo dico anche a chi ci può ascoltare a quest'ora: qui non stiamo facendo cavilli giuridici. Nel Parlamento poi si approvano provvedimenti importanti. Noi rappresentiamo l'Italia in questo caso e approveremo leggi e l'Ufficio di Presidenza dovrà ovviamente occuparsi di questioni importantissime. Se si tratta di una riunione informale noi siamo assolutamente disponibili – io e credo di parlare anche a nome del collega, il Questore Fontana – a partecipare ad una riunione informale. Se si tratta di una riunione formale dell'Ufficio di Presidenza convocato ai sensi del Regolamento, le diciamo sin d'ora – senza alcuno sgarbo istituzionale e con tutto il profondo rispetto, ovviamente, per la sua persona – che non ci sentiamo di partecipare all'Ufficio di Presidenza. Quando, ovviamente, questo sarà convocato nel pieno della sua consistenza, benissimo, inizieremo a lavorare come previsto e come potremmo fare (giorno, notte, quando lei lo riterrà più opportuno). Questo per correttezza, in modo che sia chiaro, che sia messo agli atti, perché non può fare precedente quello che sta accadendo. Non credo ci siano precedenti – poi magari lo rivedremo domani mattina –, nel Parlamento, di una convocazione di un Ufficio di Presidenza non successivamente, ma all'atto dell'insediamento. È evidente che, laddove ci sia stata la costituzione di nuovi gruppi all'interno della legislatura che si sono costituiti successivamente, non si poteva sospendere l'attività dell'Ufficio di Presidenza che si era già costituito regolarmente, tanto è vero che l'attività è proseguita e si è integrata, nel tempo opportuno e nel calendario, con l'integrazione degli altri rappresentanti dei gruppi nell'Ufficio di Presidenza. Ma questo è il primo atto costitutivo di questa legislatura. C’è stata la sua elezione a Presidente e il secondo atto, che noi stiamo compiendo, che abbiamo compiuto, è l'elezione dell'Ufficio di Presidenza. Se riteniamo che tutto questo non conti più nulla possiamo anche deciderlo, nel senso che possiamo decidere che i Regolamenti non contano nulla, che la forma non conta nulla, che l'Ufficio di Presidenza non conta nulla. Tutto quello che vogliamo. Ma io le ricordo – e l'avevo apprezzato – che nel suo discorso di insediamento lei ha fatto innanzitutto una grande difesa dell'istituzione che noi rappresentiamo. La si difende con la passione, la si difende con la correttezza, con l'attenzione a quello che il Paese è, ma la si difende anche difendendo la storia che questa istituzione ha e apprezzando e imparando il valore dei Regolamenti, come io l'ho imparato facendo il Vicepresidente tutte le volte che l'opposizione lo richiamava e interveniva in questa Aula. Questa è la nostra posizione, non ha nulla di polemico, ma ha semplicemente la voglia di sottolineare la forza di questa istituzione. Poi, ognuno decida quello che vuole e se ne assuma la responsabilità. Noi ci assumiamo la nostra responsabilità – e glielo dico e concludo il mio intervento – di partecipare ad una riunione informale, di non partecipare ad una riunione, che non può esserci, dell'Ufficio di Presidenza.	
LAURA BOLDRINI	PRESIDENTE	Vorrei sottolinearle che la Presidenza ha agito correttamente e che comunque io prendo atto delle sue considerazioni.	
RENATO BRUNETTA		Chiedo di parlare.	
LAURA BOLDRINI	PRESIDENTE	Ne ha facoltà.	
RENATO BRUNETTA		Signor Presidente, vorrei capire quale è la sua determinazione a questo riguardo. C’è stato un preciso intervento, una precisa motivazione e si è chiesto – penso in maniera assolutamente rispettosa – che, se la convocazione sarà informale, potrà essere accettata, ma non potrà essere accettata se sarà formale. Sarebbe estremamente grave che si iniziasse la vita di questa legislatura con un incidente di questo tipo.	
LAURA BOLDRINI	PRESIDENTE	Onorevole Brunetta, non è un incidente: ci sono dei precedenti e io le ho garantito che non prenderemo decisioni. Qual è il problema se ci sono i precedenti e se le garantisco che non prenderemo decisioni (Applausi) ?	
RENATO BRUNETTA		Signora Presidente, ha fatto una domanda, posso rispondere ?	
LAURA BOLDRINI	PRESIDENTE	Sì, ne ha facoltà.	
RENATO BRUNETTA		Signora Presidente, penso che il vicepresidente Lupi abbia ben esposto le ragioni formali e sostanziali per le quali noi richiediamo che la convocazione dell'Ufficio di Presidenza sia a titolo assolutamente informale. Se questo non sarà, noi saremo costretti a non partecipare, ovvero i nostri due rappresentanti dell'Ufficio di Presidenza non parteciperanno e, per così dire, questa legislatura inizierà con un conflitto, perché questo diventa un conflitto, signora Presidente. Diventa un conflitto che penso non possa essere risolto da precedenti che, a detta del vicepresidente Lupi e da me condivisa, non possono rappresentare una giustificazione di questo comportamento della Presidenza. Quindi, con tutto il rispetto che le è dovuto, le sto chiedendo di considerare la convocazione dell'Ufficio di Presidenza di domani a titolo del tutto informale. A titolo del tutto informale lei potrà fare tutte le informative che ritiene, in attesa che si configuri nella sua pienezza l'Ufficio di Presidenza con la partecipazione dell'altra rappresentanza del gruppo della Lega Nord.	
			Su un lutto del deputato Giuseppe Romele.
LAURA BOLDRINI	PRESIDENTE	La ringrazio, onorevole Brunetta, prenderò atto di queste considerazioni.	
			Ordine del giorno della prossima seduta.
LAURA BOLDRINI	PRESIDENTE	Comunico che il collega Giuseppe Romele è stato colpito da un grave lutto: la perdita del fratello. La Presidenza della Camera ha fatto pervenire al collega le espressioni della più sentita partecipazione al suo dolore, che desidero ora rinnovare anche a nome dell'intera Assemblea.	
			La seduta termina alle 23,15.
			ELENCO DEI COMPONENTI DEI GRUPPI PARLAMENTARI:
