speaker	role	text	extra
DANIELE PESCO		Presidente, ringrazio il Viceministro di aver avuto la cortesia di venire a risponderci in prima persona, cosa che non è successa purtroppo nelle ultime due settimane, dove ad interpellanze rivolte al Ministro dell’Economia e delle finanze abbiamo ricevuto altri sottosegretari. Questo vuol dire che questo tema è particolarmente sentito e ciò non può che farci piacere. Ci riferiamo al tema delle cooperative e del risparmio sociale. Prima di entrare nel merito della questione, però, devo dire, Presidente, che mi sento abbastanza in soggezione. Non per altro, perché ho affrontato temi molto più delicati di questo. Mi riferisco a temi come l’uccisione di David Rossi. Tra l’altro, è qui presente Giulia Sarti, la collega con la quale abbiamo discusso a fondo questo tema. In quel caso, però, che cosa c’era? C’è stata una morte, rispetto alla quale noi, ma purtroppo anche la procura, non siamo in grado di capire quale sia stata la causa. Invece, in questo caso, per quanto riguarda le cooperative, vi è secondo noi una bolla che sta crescendo ed è lampante: i bilanci delle cooperative in questione, che ho citato nell’interpellanza, secondo noi sono in qualche modo diversi da quelli che dovrebbero essere nella realtà. Mi riferisco alle partecipazioni e al valore delle partecipazioni. Ci riferiamo al gruppo Unipol, le cui azioni sono comunque di proprietà di diverse cooperative e anche di diversi altri enti giuridici. Queste azioni sono di proprietà delle cooperative sia in modo diretto che in modo indiretto. Quando lo sono in modo diretto, le cooperative indicano nei propri bilanci valori attinenti alla realtà; Unipol attualmente viaggia in Borsa intorno a 3,5 euro e, bene o male, il valore che indicano nei loro bilanci è coerente. Invece, non è coerente la valutazione della loro partecipazione in una società che detiene una grossa fetta del gruppo Unipol, il 31,4 per cento, e questa società è la Finsoe. Ebbene, le attività di Finsoe sono esclusivamente quelle della partecipazione al gruppo Unipol, non è che faccia altre cose: è un contenitore che detiene le azioni del gruppo Unipol. Le cooperative di cui parlavo prima, se detengono le azioni in modo diretto di Unipol, le indicano in modo corretto; invece la partecipazione di Finsoe secondo noi è particolarmente gonfiata. Questo che cosa determina? Determina il fatto che i bilanci, soprattutto lo stato patrimoniale di queste cooperative, sono al di sopra di quello che dovrebbero essere nella realtà. Questo potrebbe comunque non significare un grosso problema se appunto il patrimonio non avesse valenza su cose particolari; mi riferisco nello specifico al risparmio sociale. Sì, perché il risparmio sociale, cioè la raccolta che le cooperative fanno dei risparmi dei cittadini, dei loro consociati, è direttamente proporzionale al patrimonio. La legge ci indica che la raccolta che può essere svolta dalle cooperative non può essere superiore a tre volte il patrimonio delle stesse cooperative: capite bene come, se queste cooperative raccolgono i soldi dei cittadini facendo vedere un patrimonio più grande del reale, la cosa può destare veramente preoccupazione. Non per altro, ma perché molte cooperative negli ultimi tempi sono già saltate; ne sanno qualcosa i risparmiatori del Friuli o dell’Emilia che hanno investito o prestato soldi - diciamo così - alle cooperative Carnica, Trieste, o altre dell’Emilia Romagna. Devo comunque ricordare che Coop Alleanza 3.0, per le cooperative friulane, ha impegnato proprie risorse per restituire qualcosa alle persone che ci hanno rimesso tanto; questo va ricordato. Il fatto è che questa partecipazione nei bilanci delle cooperative da parte di Finsoe secondo noi ha un valore troppo elevato. Di quanto si sta parlando? Si sta parlando di cinque, sei volte il valore reale delle azioni del gruppo Unipol UGF. La cosa secondo noi è molto pericolosa. Ma andiamo un pochino nello specifico, analizziamo il bilancio di Finsoe. Il numero di azioni di Finsoe è pari a circa 3 miliardi; non 3 miliardi di euro, 3 miliardi è il numero di azioni. Ebbene, vi è una perizia che viene adottata da queste cooperative che permette loro di valutare la partecipazione in Finsoe, arrivando addirittura a 1 euro, e consigliano di utilizzare 0,85 euro. Se prendiamo questo valore e lo moltiplichiamo per il numero delle azioni, verrebbe fuori - scusate il termine - un valore intorno a circa 2 miliardi e mezzo; ma, se noi prendiamo tutte le azioni Unipol che Finsoe possiede e le moltiplichiamo per il valore di Borsa, otteniamo dei valori molto più bassi, praticamente - mi sembra, non vorrei sbagliarmi - circa 800 milioni di euro. Capite bene che la differenza è veramente tanta. È tanta perché quel valore che ho detto prima, 0,85 euro, praticamente è il valore che hanno utilizzato le cooperative per valutare la loro partecipazione in Finsoe. Quindi, la bolla c’è, la bolla, secondo noi, c’è, e ci sono cooperative in difficoltà: non mi riferisco alla cooperativa più grande, Alleanza 3.0, che riesce a rispettare comunque i limiti patrimoniali - quindi, ci tengo a rassicurare i risparmiatori su questo -, però altre cooperative sono in seria difficoltà. Quindi, quello a cui voglio fare riferimento è questo: quali sono gli strumenti che il Ministro intende attuare o adottare affinché vi sia più sicurezza per i risparmiatori e che si faccia piena trasparenza su queste cose, cioè sul fatto che molte cooperative stanno utilizzando una perizia. E diciamo quale perizia è: la perizia Deloitte, l’abbiamo letto sui giornali, la stessa Deloitte che ha fatto una perizia per dire che per Banca Etruria, nel caso fosse stata non risolta, come è avvenuto, ma liquidata, ci sarebbe stato lo stesso risultato, quando poi, due anni dopo, per una liquidazione delle banche venete abbiamo visto che la valutazione dei crediti deteriorati è stata molto più alta rispetto a quella delle quattro banche. Quindi, la stessa Deloitte, secondo noi, fa delle perizie un pochino arbitrarie e, secondo me, va ricordato, l’abbiamo sempre letto sul giornale, che quella perizia utilizzata ora per il caso delle cooperative è una perizia molto, ma molto riservata: e, quando si scrivono, secondo noi, cose riservate, vuol dire che sono cose un pochino da tener nascoste e, se sono cose da tenere nascoste, vuol dire che c’è poco da fidarsi. Questo secondo me, è il mio parere personale. E cosa si dice? Si dice che questa perizia non potrà essere distribuita a terzi - il documento -, che non risponderà, chi l’ha scritto, di eventuali danni che i soggetti, che avranno accesso al presente documento o altri soggetti, potranno subire in caso di uso improprio; esclude esplicitamente il valore di borsa come base di calcolo. Quindi, la cosa ci lascia molto, molto perplessi. Quindi, la nostra domanda, la ripeto, è la seguente: cosa intende fare il Governo per dare trasparenza ai fatti narrati, per dare, in qualche modo, evidenza dei fatti narrati, se li condivide e, soprattutto, cosa intende fare per tutelare il risparmio sociale. Dopo aggiungerò alcune cose che ci lasciano, comunque, molto perplessi.	
LUIGI DI MAIO	PRESIDENTE	Il Vice Ministro dell’Economia e delle finanze, Enrico Morando, ha facoltà di rispondere.	
ENRICO MORANDO	Vice Ministro dell'Economia e delle finanze	Grazie, signor Presidente. Articolerò questa risposta in due parti: la prima, relativa alle questioni sollevate in tema di prestito sociale e alle iniziative che il Governo intende sviluppare, e sta sviluppando, in proposito, sia per preservare l’istituto del prestito sociale quale strumento di rafforzamento, dal lato del capitale, delle cooperative, sia per tutelare l’interesse dei soci prestatori. In questa prima parte riferirò anche, sia pure sommariamente, delle iniziative assunte da Banca d’Italia tradottesi nella nuova disciplina del prestito sociale, entrata in vigore il 1° gennaio del 2017. La seconda parte di questa risposta affronterà, invece, il tema delle partecipazioni delle società cooperative citate in alcuni importanti istituti di credito. Voglio dire subito, a proposito del primo tema, che il Governo si è impegnato nell’elaborazione di una nuova regolazione per la traduzione in norma di legge - in norma di legge - di regole che il movimento cooperativo, nel suo complesso, ha finalmente deciso di darsi. Siamo partiti dalla definizione di quattro precisi obiettivi. Il primo: introdurre, con la forza della legge, limiti più severi alla possibilità di raccolta del prestito sociale in rapporto al patrimonio netto di ogni singola cooperativa. Secondo: introdurre un obbligo di mantenimento di una parte del prestito raccolto in forma liquida, almeno il 30 per cento. Terzo: introdurre forme di garanzia per i soci prestatori e la stabilità delle stesse cooperative, che non finiscano con l’assimilare il prestito sociale al deposito bancario, perché il prestito sociale non è raccolta di risparmio modello banche, ma consentano, tuttavia, di meglio tutelare sia i prestatori sia la stabilità della cooperativa. Quarto: fissare obblighi - fissare con la forza della legge e con le relative sanzioni - di informazione, trasparenza e responsabilità in capo sia agli organismi dirigenti delle singole cooperative sia in capo ai rispettivi organi di revisione. Questi i quattro obiettivi per il cui conseguimento ci siamo mossi. Parallelamente, si è proceduto ad elaborare le linee guida di un intervento normativo, volto a rafforzare i poteri e l’effettiva capacità di vigilanza del Ministero dello sviluppo economico che, come lei sa, è il Ministero vigilante sulle cooperative, sia sulle cooperative in generale - competenza di tipo, quindi, orizzontale - sia la vigilanza su quelle che raccolgono il prestito sociale, che non sono tutte le cooperative. Tutto ciò potrebbe e dovrebbe, secondo il Governo, trovare manifestazione in una precisa proposta del Governo di integrazione, tramite emendamenti presentati dal Governo stesso, del disegno di legge attualmente in discussione al Senato per il contrasto alle false cooperative. Come lei sa, è un progetto di legge di iniziativa popolare, cui poi si sono affiancati altri progetti di legge di iniziativa parlamentare. Ecco, l’idea sarebbe, sulla base di questa elaborazione ormai compiuta, di presentare delle proposte di integrazione di quel disegno di legge per affrontare sia il tema della vigilanza e del suo rafforzamento sia il tema della regolazione, diversa dal passato - quindi, dandole forza di legge - del prestito sociale, con l’obiettivo di giungere, entro gennaio, all’approvazione definitiva di un sistema coerente di regole per la gestione del prestito sociale capace di fare in modo che ciò che è accaduto nei casi di cooperative andate in default, che avevano prestito sociale, non possa più accadere nel futuro. Contemporaneamente, come le dicevo, si è sviluppata l’iniziativa di Banca d’Italia. Nell’ambito delle proprie competenze normative, Banca d’Italia ha posto in consultazione, a novembre del 2015 e, poi, ha emanato nel novembre del 2016, esattamente un anno dopo, una revisione della disciplina secondaria - prima le ho parlato di leggi, quindi non è una normativa secondaria, ed ovviamente Banca d’Italia, invece, si occupa dell’emanazione di normativa secondaria - in materia di raccolta del risparmio da parte dei soggetti diversi dalle banche. L’intervento normativo ha l’obiettivo di rafforzare i presìdi a tutela dei risparmiatori che prestano fondi a soggetti diversi dalle banche entro i margini di manovra consentiti dalle fonti normative di rango superiore. Nell’ambito della disciplina della raccolta del risparmio effettuata da società cooperative, quindi anche nella forma del prestito sociale, la revisione normativa ha introdotto alcune modifiche, finalizzate a rafforzare la garanzia patrimoniale e ad accrescere la consapevolezza dei risparmiatori che prestano il proprio denaro a soggetti non bancari. A questo fine, le nuove disposizioni, in primo luogo, precisano le caratteristiche e finanziarie contrattuali delle garanzie prestate da soggetti vigilati e quelle degli schemi di garanzia costituiti in ambito cooperativo, necessari affinché le cooperative con più di cinquanta soci possano raccogliere fondi presso i propri soci per un ammontare compreso tra il triplo e il quintuplo - di qui l’esigenza di un cambiamento della norma che, soprattutto, su questo quintuplo intervenga - del patrimonio netto. Inoltre le disposizioni introducono un divieto per le cooperative di prestare, a loro volta, controgaranzie o altre forme di collateralizzazione, a fronte delle garanzie ricevute. Secondo: nell’intento di evitare aggiramenti della normativa, resi possibili attraverso il compimento di operazioni con altre società del gruppo, le disposizioni di Banca d’Italia stabiliscono che il valore del patrimonio della cooperativa da assumere a riferimento ai fini del rispetto dei limiti quantitativi alla raccolta presso i soci - ho già detto da tre a cinque volte, sto parlando a legislazione vigente, non dell’ipotesi di innovazione di cui abbiamo già detto: è esattamente il tema che lei pone a proposito di alcune cooperative - è quello risultante dal bilancio consolidato o quello individuale rettificato degli effetti derivanti dalle operazioni intragruppo nel caso in cui la società non abbia l’obbligo di redigere il bilancio consolidato. Infine, le disposizioni nuove introducono alcune misure di trasparenza, come l’obbligo per la società cooperativa di includere, nella nota integrativa di bilancio e nelle relazioni semestrali, informazioni concernenti l’ammontare della raccolta in essere, l’identità del garante e le caratteristiche della garanzia nel caso in cui l’ammontare della raccolta superi il triplo del patrimonio, il valore aggiornato delle eventuali garanzie reali e finanziarie e un indice di struttura finanziaria (dato dal rapporto tra capitale più debiti a medio e lungo termine e attivo immobilizzato) utile ad evidenziare situazioni di squilibrio finanziario della società. Inoltre, la revisione normativa chiarisce il concetto di “raccolta a vista” - questo è molto importante -, rilevante ai fini del rispetto dell’articolo 11 del testo unico bancario, che vieta la raccolta a vista a tutti i soggetti diversi dalle banche e, dunque, anche alle società cooperative che effettuano il prestito sociale. In particolare, in base alle disposizioni, la raccolta di fondi è a vista anche quando, pur essendo previsto un obbligo per il prestatore di dare un preavviso di almeno 24 ore, alla società che raccoglie i fondi è attribuita la facoltà di restituirli al momento della richiesta o prima di 24 ore dal preavviso. La nuova disciplina è entrata in vigore il 1° gennaio 2017; le disposizioni transitorie prevedevano termini fino al 30 giugno 2017 per l’adeguamento a taluni requisiti, adempimenti e un regime di phase-in per il raggiungimento degli obiettivi di funding ex ante degli schemi di garanzia. In merito alle partecipazioni di talune società cooperative nel capitale di gruppi bancari, la Banca d’Italia ha fatto presente che, con riferimento a Banca Carige, in primo luogo, Coop Liguria partecipa sia direttamente sia indirettamente al capitale dell’intermediario, con un’interessenza diretta dello 0,43 per cento e indiretta dell’1,33 (per il tramite di Talea Spa, immobiliare partecipata al 100 per cento), per un totale pari all’1,76 per cento del capitale della banca, valorizzata nei bilanci delle società con il metodo del patrimonio netto per euro 37,6 milioni. Quanto a MPS, la Coop Centro Italia figura tra gli azionisti della banca senese con una partecipazione pari all’1,4 per cento a fine 2016. Nel bilancio consolidato della Coop Centro Italia è riportata una partecipazione pari all’1,40 per cento e valorizzata in bilancio con il metodo del patrimonio netto per euro 90 milioni. Infine, l’istituto ha fatto presente che Unipol è un conglomerato finanziario a prevalenza assicurativa, per cui l’autorità che coordina la vigilanza supplementare sul medesimo è l’IVASS, cioè l’istituto che si occupa di vigilanza delle assicurazioni. Detto conglomerato ha a capo la holding Finsoe, a cui lei ha fatto riferimento, che esercita il controllo di fatto sulla sub-holding quotata Unipol Gruppo (ex UGF) tramite una partecipazione del 31,40 per cento. Finsoe, il cui azionariato è composto prevalentemente da società del mondo cooperativo, nessuna delle quali esercita individualmente un controllo sulla holding nel suo complesso, ha sinora delegato il ruolo di capogruppo sia del comparto bancario che di quello assicurativo a Unipol Gruppo, come consentito dalla normativa bancaria e assicurativa italiana, al ricorrere di determinate condizioni che sembrano sussistere in questo caso. L’operazione di scissione di Finsoe, citata da lei nella interpellanza, è finalizzata a semplificare la struttura del conglomerato e a mantenere in capo a Unipol Gruppo il ruolo di capogruppo, non più delegabile per effetto di recenti modifiche della normativa assicurativa in materia. La realizzazione dell’operazione è subordinata al buon esito della verifica degli assetti proprietari del gruppo e, in particolare, delle cooperative aderenti al suddetto patto parasociale, in qualità di soggetti che acquisirebbero, di concerto, una partecipazione qualificata nel gruppo. Tali procedimenti, attualmente in fase istruttoria, coinvolgono per i profili di rispettiva competenza la Banca Centrale Europea, l’IVASS e la Banca d’Italia, a cui il Governo si impegna a chiedere di fornire ulteriori informazioni in esito alla istruttoria stessa. Infine - e mi scuso, signor Presidente, se questa risposta è un po’ lunga - Consob, richiesta di fornire sue osservazioni sulla questione posta dagli interpellanti, ha precisato che, in relazione all’operazione di scissione di Finsoe Spa e ai conseguenti effetti sull’azionariato di UGF, il 7 giugno 2017, la Consob ha assunto un provvedimento ex articolo 106, comma 6, del testo unico finanziario, mediante il quale ha dichiarato che l’acquisto di concerto - ne abbiamo appena parlato - di una partecipazione in Unipol Gruppo Finanziario Spa e, indirettamente, in Unipol Sai Spa, potenzialmente rilevante ai sensi del combinato disposto degli articoli 106, comma 1, e 109, comma 1, del testo unico finanziario, che si sarebbe realizzato per effetto della suddetta scissione e della contestuale sottoscrizione di un patto parasociale da parte degli ex azionisti di Finsoe, non avrebbe dato luogo ad un obbligo di OPA in capo ai soggetti paciscenti; ciò in quanto è stato ritenuto applicabile il caso di esenzione dall’obbligo di OPA di cui agli articoli 106, comma 5, lettera b), del testo unico finanziario, cioè l’esenzione per operazioni infragruppo.	
LUIGI DI MAIO	PRESIDENTE	Il collega Pesco ha facoltà di dichiarare se sia soddisfatto per la risposta alla sua interpellanza, per dieci minuti.	
			(Intendimenti e iniziative di competenza per la stabilizzazione del personale precario assunto con mansioni di portalettere presso Poste Italiane spa – n. 2-01920)
DANIELE PESCO		Sono parzialmente soddisfatto per il fatto che sembrerebbe che il Ministero ha preso questa causa come una giusta causa e che, quindi, intende operare in proposito. Purtroppo, non sono molto contento del metodo che intende applicare, perché, se ho capito bene, intende fare degli emendamenti a un progetto di legge in discussione al Senato che, appunto, visti i tempi che corrono, temo che difficilmente riuscirà a fare tutto l’iter legislativo, tornare qui alla Camera ed essere approvato. Io spero di sì, vivamente; ma, magari, ci potrebbero essere metodi più veloci, come quello dell’approvazione di qualcuno di questi strumenti nella legge di bilancio, nella legge di stabilità. I metodi, secondo me, possono esserci, magari, anche più veloci. Tornando, invece, al merito della risposta, purtroppo, sembra che il Governo non abbia fatto nulla e non abbia fatto nessun riferimento a ciò che noi cerchiamo di denunciare con questa interpellanza: il fatto che molte cooperative hanno nei loro bilanci o, meglio, nel loro stato patrimoniale, delle partecipazioni ad un valore molto, molto più alto di quello reale. Ora, tutti possono inserire dei valori non vicini a quelli reali, ma dei valori maggiori, non lo mettiamo in dubbio; però, purtroppo, questo ha delle ripercussioni sul patrimonio - come ho già detto prima - e, quindi, sugli indici patrimoniali da rispettare per la raccolta del risparmio sociale. Inoltre, noi abbiamo un ulteriore dubbio; è solo un dubbio, non è un’accusa, non è nulla; il fatto che Finsoe verrà sciolta in ventidue società, cioè praticamente verrà sciolta tra gli attuali soci, può essere anche riferito al fatto che, a breve, entreranno in vigore le famose leggi per il bilancio, pardon, i procedimenti per il bilancio, gli IFRS9. Che cosa comporteranno questi obblighi? Comporteranno per la capogruppo che, in questo caso, secondo noi, non può essere diversa da Finsoe, in quanto è quella che ha la partecipazione maggiore, di fare una tabellina molto semplice che è questa: questa tabellina, praticamente, che cosa ci dice? Ci dice che va indicato, di ogni partecipazione, il valore di bilancio, quindi, il valore inserito in bilancio e il valore al fair value, cioè il valore reale. Ora possiamo capire come, magari, potrebbero essere in difficoltà i futuri dirigenti di questa società, che dovrà, appunto, fare il confronto tra dei valori reali e dei valori, secondo noi, un pochino - diciamo così - gonfiati. Quindi, forse, si farà la scissione, ma abbiamo il dubbio che quella scissione venga fatta per questo, per riuscire ad aggirare questi obblighi di trasparenza. La trasparenza, qui, va fatta, va fatta in modo veramente sostanziale, perché ci sono due cooperative importanti che, secondo noi, utilizzando i valori reali, non avrebbero i requisiti tali per continuare a raccogliere il risparmio e non starebbero in piedi. La cosa è molto delicata, quindi, non aggiungo altro. No, pardon, una cosa la voglio aggiungere sul ruolo della vigilanza, sul ruolo del Ministro dello Sviluppo economico, sul ruolo del Governo sulla vigilanza delle cooperative e abbiamo fatto anche diverse interpellanze su questo. Le cooperative versano una quota per essere vigilate. Cumulate queste quote, fanno tanti soldi, centinaia di milioni di euro, per non dire forse miliardi, ma non vorrei spingermi su delle cifre che non ricordo. Questi soldi, purtroppo, il Governo non li usa tutti per vigilare le cooperative, probabilmente ne ha fatto altri usi e la cosa è molto, molto delicata. Praticamente l’Italia sta diventando il Bengodi delle cooperative e questo non va bene, perché la vigilanza ci vuole e deve essere fatta bene. Se invece vengono tagliati i fondi per fare la vigilanza capiamo come molte cooperative potrebbero approfittarsene. Per non parlare poi delle cooperative che hanno scelto di essere vigilate, perché glielo permette la legge, dalle loro associazioni di cui fanno parte. Questo secondo noi è veramente un ossimoro legislativo, normativo, che va assolutamente sanato al più presto e anche questo invito il Governo a farlo. Insomma, la vigilanza deve essere svolta dal Governo o da altri enti pubblici, seri, che facciano la vigilanza fatta bene. I fondi per la vigilanza non vanno tagliati, vanno utilizzati tutti per fare la vigilanza fatta bene, e le cooperative devono fare il loro mestiere, cioè sviluppare questo istituto, che secondo noi è un istituto nobile, che va rispettato, e che non deve essere utilizzato per fare del malaffare.	
LUIGI DI MAIO	PRESIDENTE	Passiamo all’interpellanza urgente Sgambato ed altri n. 2-01920 (Vedi l'allegato A). Chiedo alla deputata Sgambato se intenda illustrare la sua interpellanza o se si riservi di intervenire in sede di replica.	
