speaker	role	text	extra
CAMILLA SGAMBATO		Grazie, Presidente. L’interpellanza di cui discutiamo oggi riguarda il tema, appunto, della precarietà dei lavoratori a tempo determinato assunti da Poste S.p.A., società direttamente partecipata dal Ministero dell’economia e delle finanze, posta sotto il controllo e la vigilanza del Ministero per lo sviluppo economico. Tale società fornisce servizi logistico-postali, servizi di risparmio, di pagamento, assicurativi e di comunicazione digitale. La società Poste Italiane apre periodicamente, ormai da già da qualche anno, campagne di recruiting con lo scopo di reclutare portalettere su tutto il territorio nazionale, con contratto di lavoro a tempo determinato, al fine di rispondere alle carenze di personale addetto a tali mansioni. Tale carenza di personale, pur manifestandosi molto di più nei periodi delle ferie natalizie ed estive, sembrerebbe essere diventata una carenza per Poste assolutamente cronica. La nuova campagna di recruiting, infatti, per portalettere di Poste Italiane rientrerebbe nel piano assunzionale 2015-2020 che pare preveda la creazione di circa 8 mila posti di lavoro, di cui circa 4 mila per i giovani. Tra gli altri requisiti richiesti per le mansioni di portalettere ci sono il diploma o la laurea, in particolare il diploma di scuola media superiore con votazione minima di 70 su 100, e la laurea, anche triennale, con votazione minima di 102 su 110. Attualmente i contratti a termine di Poste Italiane per i portalettere pare non superino i 24 mesi circa complessivi, tra proroghe e rinnovi, pur ottenendo valutazioni positive da parte dei responsabili delle risorse degli uffici, e avendo questi giovani curriculum altamente qualificati, e nonostante sia prevista, come da normativa vigente, la possibilità di proroga fino a 36 mesi. Ad oggi, sono circa 6 mila i lavoratori e le lavoratrici sottoposti a questo continuo stillicidio occupazionale, 6 mila giovani a cui non è consentito accedere ad un progetto di vita stabile, confinati da Poste società per azioni ad una vita da precario. I dubbi sorgono, quindi, sull’improprio uso, lasciatemelo dire, se non proprio abuso, del contratto a termine, che è quello riscontrato proprio nel modus operandi della società, relativamente a queste assunzioni. Quello che preoccupa è che si passa da una prima fase dove il contratto a termine viene utilizzato in forma eccezionale, ad una fase successiva, che è proprio quella odierna, della regola. Tale comportamento altro non ha fatto finora che creare e reiterare nel tempo il tanto combattuto precariato, senza realmente creare nuovi posti di lavoro stabili. Quindi, noi interpellanti chiediamo al Governo quali iniziative intenda assumere affinché Poste Italiane S.p.A. riveda intanto i parametri di valutazione dei requisiti richiesti, in quanto sembrerebbe a nostro avviso assurdo escludere già da una fase iniziale di recruiting un laureato in qualsiasi disciplina che non abbia una votazione di almeno 102 su 110 o sia in possesso di un diploma con almeno 70 su 100. Ma chiediamo soprattutto quali iniziative intenda adottare per assicurare la stabilizzazione del personale con contratto a termine, dando priorità a coloro che hanno maturato già esperienza, conoscenza, competenza in questo ramo, in quanto riassunti più volte attraverso l’utilizzo di proroghe e/o rinnovi, affinché si possa fronteggiare l’oggettiva forte carenza di personale.	
LUIGI DI MAIO	PRESIDENTE	Il Sottosegretario di Stato per gli Affari esteri e la cooperazione internazionale, Amendola, ha facoltà di rispondere.	
VINCENZO AMENDOLA	Sottosegretario di Stato per gli Affari esteri e la cooperazione internazionale	Grazie Presidente. Ringrazio l’onorevole Sgambato e gli altri firmatari di questa interpellanza urgente per la sensibilità su un tema sociale di estrema rilevanza. Rispondo esclusivamente sulla base degli elementi pervenuti al Ministero dello sviluppo economico dalla società Poste Italiane, in quanto il processo di recruiting e selezione del personale nel gruppo Poste Italiane società per azioni non rientra nelle specifiche competenze del citato Ministero. Quest’ultimo evidenzia al riguardo che in ambito postale si occupa in senso più ampio della fornitura del servizio universale dei titoli abilitativi, licenze e autorizzazioni. Ciò premesso, informo con quel che segue: il processo di recruiting e selezione del personale del gruppo Poste Italiane S.p.A. è presidiato centralmente dalla funzione preposta ed è disciplinato da un’apposita procedura redatta tenendo conto, tra l’altro, dei principi di controllo previsti dal vigente modello organizzativo che la società ha adottato ai sensi del decreto legislativo n. 231 del 2001. Tale procedura definisce le modalità di svolgimento delle attività di assunzione e selezione di personale da inserire in azienda anche con un contratto a tempo determinato, in linea con le disposizioni normative tempo per tempo vigenti, rispetto a esigenze temporanee e/o una tantum. Le attività di reclutamento del personale si attivano a seguito di specifica richiesta da parte dell’unità organizzativa che necessità di rafforzamento di personale. A tale riguardo, il ricorso alla fattispecie del contratto a tempo determinato, disciplinato agli articoli 19 e seguenti del decreto legislativo n. 81 del 2015, consente di rispondere in maniera flessibile in termini sia di durata, che di luogo di svolgimento della prestazione lavorativa, ad esigenze organizzative legate a dinamiche di andamento dell’attività del business o del presidio dello stesso. Il processo di recruiting prevede la raccolta e la valutazione delle candidature ricevute, nonché specifiche prove di verifica dei requisiti richiesti differenziate per profilo professionale ricercato quali, a titolo meramente esemplificativo, test, colloquio o prove pratiche di idoneità alla mansione da svolgere. La raccolta delle candidature, oltre che mediante il sito internet aziendale, per alcune specifiche tipologie di ricerca di personale, viene svolta tramite la pubblicazione di annunci dedicati sul sito internet aziendale o sulla stampa locale e nazionale, o ancora sui siti esterni specializzati. Tali annunci, in linea con quanto indicato nella citata procedura, precisano tra le altre informazioni alcuni requisiti minimi rilevanti per l’accesso al processo di selezione, quale il voto minimo di diploma e/o laurea, o specifiche idoneità rispetto al ruolo di inserimento, quale ad esempio la guida del motomezzo, nonché la vicinanza della propria residenza alla sede di lavoro e la disponibilità al trasferimento. Anche per il ricorso ai contratti a termine, l’azienda adotta politiche interne coerenti con la cornice normativa e contrattuale, con riferimento tra l’altro al numero di contratti complessivamente stipulati in ciascun anno solare, alla durata degli stessi, al numero di proroghe. Quanto, infine, all’eventuale stabilizzazioni dei lavoratori impiegati con tale tipologia contrattuale, Poste Italiane riferisce che il prossimo piano strategico aziendale, e la determinazione dei fabbisogni correlati, consentiranno una più puntuale definizione delle valutazioni in proposito.	
LUIGI DI MAIO	PRESIDENTE	La collega Sgambato ha facoltà di dichiarare se sia soddisfatta per la risposta alla sua interpellanza.	
			(Iniziative politico-diplomatiche, anche in ambito europeo, in merito al referendum di autodeterminazione promosso dalla comunità autonoma catalana per il prossimo 1° ottobre 2017 – n. 2-01948)
CAMILLA SGAMBATO		Grazie, sottosegretario Amendola, io esprimo la mia sorpresa, se non il mio rammarico, per l’assenza del MEF, azionista di maggioranza di Poste S.p.A., o quanto meno del MISE, tenuto al controllo delle attività della suddetta società. La risposta non è del tutto pertinente né completamente esaustiva in ordine alle questioni poste all’attenzione del Governo dagli interpellanti. Non può non rappresentarsi come l’aver delegato solo a Poste Italiane la risposta risulti o possa risultare indice di un’attenzione non adeguata rispetto ad una fenomeno di sicura rilevanza, non fosse altro per l’elevato numero di soggetti coinvolti o interessati. È del tutto evidente l’anomala spirale che si crea attraverso meccanismi di precariato, che determinano peraltro oneri aggiuntivi e paralleli a carico del bilancio dello Stato. Sappiamo, infatti, che l’INPS è tenuto al riconoscimento di indennità di disoccupazione a questi giovani licenziati, pur in presenza di esigenze di personale soddisfatte con altre assunzioni, sempre precarie. Ciò pare evidenziare peraltro, in assenza di una risposta chiara da parte della società Poste Italiane, una carenza di strategia complessiva e di programmazione di attività che consentirebbe una predisposizione di un piano assunzionale in grado di far fronte ai concreti fabbisogni dell’azienda. Speriamo dunque che il Governo intervenga, ma nella figura del MEF e del MISE, affinché Poste Italiane preveda a breve un vero piano assunzionale, conforme alla normativa vigente, specificando dei criteri di assunzione che tengano conto dei curriculum e valorizzino coloro che abbiano già maturato esperienza. È arrivato il momento di gestire il personale su un modello di contratto stabile, atteso che l’azienda mostra di aver bisogno di questi lavoratori, tant’è vero che garantisce il servizio con molti centri di distribuzione, uffici di recapito, nei quali i precari rappresentano la maggioranza dei dipendenti o comunque ne rappresentano un numero considerevole. Quanto detto non ci consente di essere pienamente soddisfatti, dal momento che i temi centrali dell’interpellanza proposta da noi hanno avuto una risposta non del tutto esauriente e nemmeno definitiva. Grazie.	
LUIGI DI MAIO	PRESIDENTE	Passiamo all’interpellanza urgente Fedriga ed altri n. 2-01948 (Vedi l'allegato A). Chiedo al deputato Guidesi se intenda illustrare l’interpellanza, di cui è cofirmatario, o se si riservi di intervenire in sede di replica. Sì, ha quindici minuti.	
GUIDO GUIDESI		Grazie, Presidente. Le autorità elettive della comunità autonoma catalana hanno promosso lo svolgimento di un referendum popolare di autodeterminazione, che dovrebbe svolgersi domenica prossima, il 1° ottobre. Il Governo centrale spagnolo e la Corte costituzionale del regno hanno dichiarato illegittima la consultazione, chiudendo ogni spazio di trattativa e ogni possibile mediazione. Nel prosieguo del confronto è stato impartito addirittura a tutte le forze di polizia nazionali e catalane l’ordine di impedire lo svolgimento dell’iniziativa referendaria, in primo luogo attraverso la ricerca sistematica ed il sequestro delle schede preparate per la consultazione e del relativo materiale propagandistico. La procura dello Stato spagnolo ha inoltre ingiunto ai procuratori provinciali territorialmente competenti di notificare agli oltre 700 sindaci catalani, regolarmente eletti, aderenti all’Associazione dei Municipi per l’indipendenza, favorevoli allo svolgimento del referendum, l’apertura a loro carico di un’indagine, minacciandone l’arresto qualora rifiutino l’ordine di comparizione. Lo Stato spagnolo ha quindi ripreso il controllo dell’Agenzia fiscale catalana e da ultimo, il 20 settembre scorso, la Guardia civile è entrata nella sede della Generalitat, provvedendo ad arrestare alcuni elementi di spicco legati al Governo catalano, tra i quali il più stretto collaboratore del Vicepresidente. La circostanza ha determinato l’immediato scoppio di manifestazioni spontanee di protesta a Barcellona ed in tutta la Catalogna. Tra le ulteriori ritorsioni prospettate dal Governo centrale, vi sarebbe anche il ritiro dello statuto di autonomia della Catalogna. È evidente come il confronto tra le autorità centrali spagnole e quelle autonome della Catalogna rischi di precipitare in un conflitto vero e proprio, con ripercussioni al momento imprevedibili, ma certamente drammatiche, per la penisola iberica e probabilmente per l’Europa intera. Potrebbero contribuire ad attenuare le tensioni eventuali pressioni alle autorità spagnole da parte dei Paesi partner dell’Unione europea e nell’Alleanza Atlantica, inclusa l’Italia. Quindi, chiediamo al Governo: se intenda assumere delle iniziative politiche diplomatiche utili a riportare la calma in Spagna e quali tra queste iniziative; se il Governo, in tale ambito, non ritenga di dover adottare iniziative volte a fermare la progressione della spirale di azioni e reazioni che sta caratterizzando la gestione dell’aspirazione catalana all’autodeterminazione, chiedendo moderazione e soprattutto di por fine agli arresti disposti nei confronti di chi abbia incarichi istituzionali o elettivi nella comunità autonoma catalana; se il Governo non giudichi utile proporre, in ambito europeo, l’eventuale adozione di sanzioni nei confronti della Spagna, qualora insista su quella che agli interpellanti appare la via della repressione penale e poliziesca dell’esercizio di autodeterminazione intrapreso dalle legittime autorità catalane; se, nel contesto delle iniziative esercitabili e nei confronti della Spagna, il Governo consideri anche il richiamo in patria per consultazioni dell’ambasciatore d’Italia a Madrid, qualora la tensione non si attenui e l’Esecutivo centrale spagnolo insista, come pare, sulla strada intrapresa; se e come il Governo ritenga di sostenere politicamente e diplomaticamente l’avvio di un dialogo interno alla Spagna finalizzato alla definizione di tempi e procedure di garanzie, che permettano ai catalani di pronunciarsi legalmente sul loro futuro.	
LUIGI DI MAIO	PRESIDENTE	Il sottosegretario di Stato per gli Affari esteri e la cooperazione internazionale, Vincenzo Amendola, ha facoltà di rispondere.	
VINCENZO AMENDOLA	Sottosegretario di Stato per gli Affari esteri e la cooperazione internazionale	Grazie, Presidente. Ringrazio gli onorevoli interpellanti per la richiesta. La Farnesina segue con grande attenzione l’evolversi della situazione in Spagna e le crescenti tensioni tra la capitale e la Catalogna, che fanno registrare, proprio in questi giorni, livelli di crisi senza precedenti in un confronto interno che dura da decenni. Molti Paesi, non solo nell’Unione europea, conoscono forze centrifughe interne e la Spagna in primis ha vissuto con estremo travaglio e sofferenza la lunga e violenta stagione del separatismo basco, mentre è ora la spinta autonomista catalana a costringere le parti ad un confronto particolarmente intenso. Le cronache delle crescenti mobilitazioni, a fronte dei fermi dei principali protagonisti della macchina referendaria a Barcellona, anche se poi revocati, dei sequestri di materiale elettorale, della chiusura di siti web e delle azioni nei confronti dei sindaci che mettessero a disposizione i locali comunali per il voto, tutto ciò indica che l’intensità dello scontro, a distanza di due giorni dall’appuntamento referendario, continua a salire. Madrid sta proseguendo l’azione di impedimento materiale del secessionismo catalano; sono state adottate misure concrete nei confronti delle persone ree, o potenzialmente tali, di dare corpo al secessionismo, sia con l’approvazione di norme, sia con la loro attuazione. Come è noto, anche sul piano finanziario, Madrid sta applicando una stretta sul funzionamento della macchina regionale. Nel dare esecuzione ai dispositivi delle sentenze che ne hanno dichiarata l’illegittimità, l’azione del Governo Rajoy mantiene la piena coerenza con la tesi politica di fondo, ossia l’incompatibilità costituzionale di qualunque tipo di autonomia, assunta da mesi. Sullo sfondo si sta profilando un tema di attrito ulteriore e parallelo a quello dell’indipendenza: il tema del metodo per gestire l’autonomismo catalano. È chiaro che non vi può essere autonomia laddove la Costituzione non lo prevede, né vi può essere una deriva di atti contrari alla Costituzione, volti a realizzare de facto tale scopo, a meno che la congiuntura politica non suggerisca, a livello concordato e centrale, l’avvio di una stagione di riflessione di alto tenore. Va detto che, fino ad ora, regge l’equilibrio e la misura mostrata dalle forze dell’ordine nella complessa geometria di forze governative locali nonché di competenze di queste ultime gestite localmente, ordine pubblico, e centralmente, esecuzione di provvedimenti giudiziari. Madrid e Barcellona, pure in un crescendo di toni, non hanno ancora trovato un canale di dialogo di reciproca soddisfazione, ma concordano senz’altro, e lo hanno ripetuto proprio in queste ore, sull’astensione da ogni forma di violenza. Si tratta di un principio importante, che confidiamo verrà mantenuto, consentendo così di affrontare i prossimi giorni senza traumi ulteriori. Il Governo, infine, continuerà pertanto a monitorare con attenzione l’evolversi della situazione. È nostro vivo auspicio che il confronto in atto maturi e si sviluppi sul piano dei contenuti, dei rapporti fra centro e periferia, entrando così in una nuova fase di maggiore prospettiva, ma sempre nel pieno rispetto della Costituzione spagnola. Grazie.	
LUIGI DI MAIO	PRESIDENTE	Il collega Guidesi ha facoltà di dichiarare se sia soddisfatto per la risposta alla interpellanza.	
			(Iniziative di competenza a tutela dei diritti sindacali in relazione al trasferimento di un dirigente sindacale presso la Wartsila spa di Trieste – n. 2-01906)
GUIDO GUIDESI		Grazie, Presidente. È ovvio che ci aspettavamo qualcosa in più dal Governo italiano, vista la vicinanza anche con la Spagna. La questione da chiarire è che qui non esiste nessun paragone con atti di terrorismo precedenti. Qui esiste sostanzialmente una rappresentazione di idee e di volontà in maniera assolutamente democratica e il confronto fortunatamente non è ancora sfociato in violenze, sperando che questo ovviamente non succeda, solo grazie alla responsabilità del Governo catalano e dei catalani. Qui ci troviamo di fronte non ad un processo alle idee, non ad un confronto, ma addirittura all’arresto delle idee, al fatto di chiudere e bloccare i seggi dove le persone, i cittadini, catalani ed europei, andavano ad esprimersi su un quesito assolutamente legittimo per rappresentare la loro volontà popolare. Se il Governo spagnolo, se Madrid pensa che quel quesito non sia condivisibile, la battaglia la doveva fare in campagna elettorale, doveva rappresentare le proprie idee in campagna elettorale, doveva fare la propria campagna per dire che quello che stavano proponendo l’Assemblea catalana e il Governo Catalano era sbagliato. Così non è stato. Si ha paura di un confronto, ma non solo si ha paura del confronto, si ha paura della volontà popolare, tanto che si reprime quella volontà. E che in Unione europea succeda una cosa del genere è, da parte nostra, per come la vediamo noi, un atto estremamente grave. Il fatto che il confronto delle idee venga bloccato con gli arresti, con le minacce, con l’arrivo dell’esercito, è un passo indietro sul quale anche il Governo italiano dovrebbe assolutamente riflettere. Qua siamo in una situazione dove c’è un popolo che ha il diritto di esprimere la propria volontà davanti ad un Governo nazionale che quella volontà non gliela fa esprimere con la forza. Di questo stiamo parlando! Stiamo parlando di una vicenda che rasenta i limiti della dittatura e io credo che su questo bisognerebbe riflettere molto e credo che il Governo italiano dovrebbe invitare il Governo spagnolo a lasciare libertà di espressione ai catalani, perché altrimenti trasformeremmo quella situazione, da una situazione democratica, ad una situazione dittatoriale, e i Paesi dell’Unione europea, Italia compresa, non possono assolutamente fare finta di niente. L’auspicio nostro è che domenica i catalani possano esprimere la loro volontà e che quella volontà, qualsiasi essa sia, sia rispettata, perché non c’è niente che può superare la volontà di un popolo.	
LUIGI DI MAIO	PRESIDENTE	Passiamo all’interpellanza urgente Pellegrino ed altri n. 2-01906 (Vedi l'allegato A). Chiedo alla deputata Pellegrino se intenda illustrare la sua interpellanza o se si riservi di intervenire in sede di replica.	
SERENA PELLEGRINO		Sì, grazie, Presidente. Sottosegretario, il caso su cui verte questa interpellanza, per noi di Sinistra Italiana, è significativo di un approccio, purtroppo, non nuovo nella storia delle relazioni tra padronato e rappresentanza dei lavoratori. Quanto è avvenuto ci preoccupa e assieme ci scandalizza, perché, alla luce della nostra Costituzione e delle leggi vigenti, risulta del tutto in contrasto con i diritti e le conquiste sindacali di questo nostro Paese. Il fatto è avvenuto a Trieste, ai confini della nostra terra, dove opera una multinazionale, la Wartsila Spa, una società specializzata nella metalmeccanica e in tecnologie marine, con sede centrale in Finlandia, che ha un’importante rilevanza nel tessuto economico del Friuli-Venezia Giulia. La vicenda su cui la interpelliamo riguarda Sasha Colautti, dipendente della Wartsila Spa nello stabilimento di Trieste. Racconto un po’ che cosa è accaduto, sottosegretario: Colautti, dopo essersi espresso contro l’ultimo contratto, si è dimesso da segretario della FIOM e ha aderito all’USB. Per questo, terminato il periodo di distacco sindacale, che ha coinciso con la guida dei metalmeccanici della CGIL, ha chiesto all’azienda di poter rientrare in fabbrica, un suo diritto. L’ufficio del personale della controllata italiana della multinazionale finlandese si è riservato per un po’ di tempo la risposta e poi, nella mattinata dello scorso 6 giugno, ha comunicato allo stupefatto Colautti che sarebbe rientrato in fabbrica, ma non nella sede di Trieste, bensì nella sede di Taranto, distante più di mille chilometri, in quanto la sede di Bagnoli non era disponibile a seguito della ristrutturazione degli organici. Dopo quanto accaduto l’USB ha promosso una serie di mobilitazioni a sostegno e a difesa di Sasha Colautti: una manifestazione molto partecipata si è tenuta il 24 giugno a Trieste per chiedere la revoca del trasferimento e il ritorno in fabbrica nella sede di Trieste di Sasha Colautti. In quella circostanza noi presentammo un’interrogazione al Ministero, che non ci ha dato risposta. Lo scorso 3 luglio si è svolta l’udienza presso il tribunale di Taranto con la richiesta al giudice del reintegro di Sasha Colautti, dove? Nella sede di Trieste, perché aveva diritto a stare nella sede di Trieste. Il giudice, a quanto ci consta, avrebbe rinviato a questo settembre la discussione. È evidente che il mancato rientro del lavoratore nella sede di Trieste e il suo trasferimento a Taranto senza alcuna giustificazione plausibile è stato fatto per colpire un lavoratore scomodo, impegnato sindacalmente. Si è trattato di una vera e propria rappresaglia contro un operaio impegnato nell’azione sindacale e scomodo, davvero scomodo, per l’azienda. Questo trasferimento non può non essere letto come arbitrario e punitivo e la condotta da parte dell’azienda è apertamente in contrasto con i diritti sindacali sanciti dalle leggi del nostro ordinamento. Io le chiedo, sottosegretaria, con questa interpellanza, evidentemente, davanti all’interrogazione a cui non abbiamo avuto risposta - da parte del Governo non ci sono state grandi manifestazioni a seguito di quello che è accaduto in quel lembo di terra -, se sia a conoscenza dei fatti accaduti a Trieste e quali siano i suoi orientamenti a tal proposito; in particolare, nel rispetto delle disposizioni vigenti, vorremmo conoscere quali iniziative intenda assumere per favorire al più presto il rientro di Sasha Colautti nello stabilimento di Trieste.	
LUIGI DI MAIO	PRESIDENTE	La Sottosegretaria di Stato per il lavoro e le politiche sociali, Franca Biondelli, ha facoltà di rispondere.	
