speaker	role	text	extra
SILVIA GIORDANO		Presidente, io vorrei partire con l'unica nota positiva che c’è stata in questa legge di bilancio adesso in discussione, ossia che, grazie all'approvazione di un nostro emendamento, abbiamo rimediato alla totale inerzia del Ministero della salute e del Governo. Infatti, nella scorsa legge di stabilità, sempre grazie a un emendamento del MoVimento 5 Stelle, a mia prima firma, si è istituito un Fondo per l'autismo di 5 milioni l'anno, dal 2016; peccato però che, nel 2016, questo Fondo non sia stato mai sbloccato, infatti avevate 60 giorni di tempo per il decreto attuativo da mandare poi in Conferenza Stato-regioni ma questo decreto è stato mandato solo a settembre, nove mesi dopo rispetto a quando dovevate mandarlo, praticamente un parto. Fatto sta che i soldi sono ancora sbloccati e abbiamo chiesto, in un emendamento presentato in questa legge di bilancio, di avere l'accortezza che i soldi che non sono stati utilizzati per il 2016 venissero almeno reimpiegati sempre per il Fondo per l'autismo, portandoli così in aggiunta ai 5 milioni del 2017, di modo che, almeno nel 2017, il Fondo per l'autismo sarà di 10 milioni. Questa purtroppo è l'unica nota positiva che ho constatato in questa legge di bilancio, almeno per quanto riguarda la parte sanitaria. Sì, andiamo a parlare un attimo del Fondo nazionale sanitario. Questo famoso Fondo nazionale sanitario ha diverse interpretazioni numeriche, perché, ahimè, abbiamo scoperto che anche i numeri hanno un'interpretazione, a quanto pare. Iniziamo a capire il perché. Innanzitutto il Patto per la salute prevedeva che per il 2016 dovevano essere stanziati 115,440 miliardi, ma purtroppo nel 2016 in realtà vennero stanziati solo 111 miliardi, quindi in realtà già c’è stato un vago definanziamento: chiamiamolo così, perché la parola «taglio» non piace. Ma in più l'attuale legge di bilancio fissa il Fondo sanitario nazionale in modo totalmente differente rispetto all'intesa, a quello che è stato fissato nell'intesa Stato-regioni. E infatti nel 2017 fissa 113 miliardi invece che 113,63, e detta così sembrano bruscolini, ma in realtà sono 63 milioni in meno; e per il 2018 fissa 114 miliardi invece che 114,998, dove qui sono 998 milioni in meno, quasi un miliardo: infatti, sommando i due anni, sono meno 1 miliardo e 61 milioni. Però voi continuate a dire che in realtà per il 2017 c’è un aumento, perché adesso avete stanziato 113 miliardi, mentre per l'anno successivo erano 111 miliardi: è un calcolo matematico, è semplice, 113 miliardi è più di 111 miliardi, sì, però andiamo a vedere ed a capire che cosa c’è dietro ! Infatti, rispetto all'anno scorso, le regioni dovranno prendere da questo Fondo sanitario nazionale innanzitutto 600 milioni in più per i farmaci innovativi, oncologici e non; da 500 milioni a un miliardo, che è una stima non fatta dal MoVimento 5 Stelle ma dalle stesse regioni, per la mancanza di una gara per i biosimilari, visto che non avete voluto aggiungerla nell'articolo 59 dell'attuale legge di bilancio e così non permettete neanche una reale concorrenza, come vi è stato fatto notare non solo da noi, dai deputati del MoVimento 5 Stelle, ma direttamente dall'Antitrust. In più ci sono 100 milioni per il Piano vaccini, 800 milioni stabiliti in Conferenza Stato-regioni per i livelli essenziali di assistenza: in realtà, com'era già stato detto in Conferenza Stato-regioni, questi 800 milioni non erano sufficienti, tanto che in realtà la stima reale era di un miliardo e mezzo. Quindi, se andiamo a fare già un semplice calcolo, stiamo a meno 700 milioni. Però durante la discussione è comparsa anche un'altra chicca, ossia il fatto di voler attingere da questo Fondo per il rinnovo dei contratti del personale sanitario: a differenza di quanto aveva annunciato il Ministro Lorenzin, che invece diceva di voler attingere per questa spesa dal Fondo per la pubblica amministrazione. In realtà la stima non l'avete fornita voi, ma sempre le regioni: anche qui si parla di all'incirca 500 milioni, che aggiunti ai 700 milioni di euro di prima, andiamo a meno 1,2 miliardi. Ora, sia chiaro: noi vogliamo totalmente il rinnovo dei contratti del personale sanitario, ma vi abbiamo anche proposto attraverso emendamenti di aumentarlo, questo Fondo, tanto che la nostra proposta con relative coperture era di 900 milioni di aggiunta. Ora, chiamatelo come volete: mancato aumento, definanziamento, taglio; non appartiene a noi la truffa semantica. Fatto sta che i soldi noi li state mettendo, e anzi ce ne sarebbe molto più bisogno. Ma la vera chicca di tutta la legge di bilancio per quanto riguarda la sanità è questa fantastica «marchetta» che avete fatto al presidente della regione Campania: presidente della regione Campania che abbiamo capito che, come hanno già detto altri colleghi, conta più di chiunque altro all'interno del Governo, anche se non fa parte del Governo. È sempre più simpatico e interessante capire quanto vi tenga in pugno il signor Vincenzo De Luca. Già lo scorso maggio, quando stavamo discutendo sia in Commissione, e poi successivamente in Aula, della cosiddetta delega Madia, che doveva portare novità, aria di freschezza per le nomine dei direttori sanitari, che ci doveva essere un elenco pubblico e che ci doveva essere trasparenza: siete andati ovunque, ovunque a dire «finalmente non ci sono più clientele nella sanità, grazie alla delega Madia, finalmente freschezza perché ci sarà meritocrazia nella sanità, basta alle chiamate dirette, basta al clientelismo»; e in contemporanea De Luca vi ha dato talmente retta che con la legge del 31 maggio scorso ha deciso di nominare per chiamata diretta i direttori sanitari. Noi ve l'abbiamo fatto presente, in ogni modo: a livello regionale, con i consiglieri regionali che hanno subito convocato una conferenza stampa per denunciare questa strana incongruenza con la legge nazionale; l'abbiamo fatto a livello parlamentare, con due interrogazioni e due interpellanze; ma niente, niente di niente. Fino a quando a luglio, dopo due mesi, decidete di dirci qualcosa, e lo stesso sottosegretario De Filippo con la risposta ad una mia interrogazione dice che sì, in effetti ci sono dei rilievi di incompatibilità costituzionale, che lo stesso Ministero della salute farà presente in Consiglio dei Ministri. Bene: il Consiglio dei ministri però decide di non impugnare la legge, nonostante i rilievi di incompatibilità costituzionale avanzati dallo stesso Ministero di competenza; tanto che io il giorno dopo ho voluto presentare un'interrogazione per chiedere a questo punto quale sia l'importanza che voi attribuite al Ministero della salute, visto che non ne calcolate neanche le valutazioni che svolge negli ambiti di sua competenza. E decidete così di permettere al De Luca di fare le chiamate dirette in sanità per i direttori sanitari; e la cosa bella è che vi giustificate dicendo che, avete permesso questa cosa perché tanto De Luca vi ha mandato una lettera dicendo che non lo farà più: che ha sbagliato, è vero, però non lo farà più; anche perché non capisco più che cosa doveva fare, visto che ormai i direttori sanitari li aveva nominati ! E invece poi l'ho capito adesso cos'altro poteva fare: chiedervi di farlo diventare commissario. E infatti così ha fatto; tanto che, siete così forti del fatto che «basta clientele nella sanità e basta andare per scambi e per chiamate dirette», che volete nominare commissario una persona che dice le testuali parole: «Prendiamo Franco Alfieri, notoriamente clientelare: come sa fare lui la clientela lo sappiamo, una clientela organizzata, scientifica, razionale, come Cristo comanda». Che cosa bella ! «Ecco: l'impegno di Alfieri sarà di portare a votare la metà dei suoi concittadini, 4 mila persone su 8 mila. Li voglio vedere in blocco, armati, con le bandiere andare alle urne e votare il «sì». Franco, vedi tu come Madonna devi fare, offri una frittura di pesce, portali sulle barche e sugli yacht, fai come cavolo vuoi, – perché, scusi, anche quando lo leggo, non potrò mai essere della stessa cafonaggine del presidente della regione Campania – ma non venire qui con un voto in meno di quelli che mi hai promesso». Ecco, questa è la mancanza di clientele e di clientelismo in sanità che voi state promuovendo ! Infatti, dopo che viene pubblicata ovunque questa registrazione, grazie anche a il Fatto Quotidiano, voi cosa decidete di fare ? Di promuoverlo, di fargli fare carriera e di portarlo anche a potervi chiedere di diventare commissario in sanità. Avete detto di tutto: voi lo fate, perché è un buon amministratore. Sì, è veramente un ottimo amministratore. Vogliamo parlare un poco di De Luca amministratore ? Tanto l'avete nel vostro partito da vent'anni, dovreste sapere cosa fa De Luca come amministratore. Ebbene: ha lasciato in mano ad uno dei suoi manichini – con la supervisione del figlio, perché ovviamente dev'essere sempre per via ereditaria la discendenza in quella famiglia – e ha lasciato un buco in bilancio di 9 milioni di euro; ovviamente non sono bruscolini, un'azienda seria privata sarebbe già fallita. Tre condanne da parte della Corte dei conti per debiti fuori bilancio e stipendi elargiti ai suoi dirigenti illegittimamente: infatti, al comune di Salerno ha fatto del giardiniere il suo direttore generale, ha sistemato uomini e figli di amici nelle partecipate, lasciandole con il conto in rosso e gli stipendi in bilico; e da undici anni continua a spendere centinaia di milioni di euro per Luci d'Artista: non si capisce ancora dove prenda i soldi, da quali fondi li distragga e in quali voci di bilancio sia nascosta la spesa. Perché vi assicuro che io, evidentemente a differenza vostra, i bilanci comunali della città di Salerno, di cui è stato sindaco per molti, troppi anni, li sono andati a vedere, anche perché sono tutti pubblicati sul sito, ma non c’è una voce in bilancio che si riferisca alle Luci d'Artista. È obiettivamente un illusionista fantastico: di questo gli devo dare atto, ma probabilmente è proprio quello che a voi piace, che a voi interessa.	
LUIGI DI MAIO	PRESIDENTE	La invito a concludere.	
SILVIA GIORDANO		Allora, vedete, visto che non è un buon amministratore, tanto che abbiamo talmente tante opere incompiute che continuano ad essere pagate con i soldi pubblici dei cittadini, e lui si vanta che è la città europea; ci sono almeno quattro opere incompiute di cui continuiamo a pagare i lavori, anche perché una di queste è stata posta sotto sequestro giudiziario fino a pochi mesi fa, e attualmente è ancora indagato per il Crescent, per abuso di ufficio; voi, nonostante sia un fallimento come amministratore e il promotore del clientelismo in sanità, gli concedete tutto. L'unica cosa che è cambiata rispetto a quando voi stessi avete deciso di rendere incompatibile il commissario con il presidente della regione, è la sua elezione, è il fatto che il 4 dicembre, caro Vice Ministro, si va a votare e a voi i suoi voti vi fanno comodo; questa clientela vi fa comodo, la volete promuovere e avete addirittura cambiato la norma in peggio, perché, mentre nell'emendamento originale prevedevate il vaglio del Consiglio dei ministri, adesso avete così tanta paura che non ci sarete voi nel prossimo Governo e che il prossimo Governo non sarà composto dal PD, che avete tolto il vaglio del Consiglio dei ministri e avete messo quella farsa dei tavoli tecnici, perché dovete permettergli di fare ciò che vuole anche quando non ci sarà più Renzi. Allora la sua frase, lo so, già me la vedo, sarà: stai sereno, Mattè !	
LUIGI DI MAIO	PRESIDENTE	iscritta a parlare la collega Ghizzoni, prego.	
MANUELA GHIZZONI		Grazie, signor Presidente, intervengo con piacere su un pacchetto di norme che ritengo molto positivo. Si tratta di una misura inedita per l'Italia, e cioè la no tax area per gli studenti universitari meno abbienti e tre provvedimenti complementari che sono in grado di graduare gli interventi per affrontare le diverse sfaccettature dello stesso diritto sociale culturale, cioè il diritto allo studio universitario. In gioco ci sono bisogni diversi a cui vanno date risposte diverse, perché, come disse don Milani, non c’è nulla di più ingiusto che fare parti uguali tra disuguali. Nei pochi minuti che ho a disposizione mi soffermerò su queste misure, perché ritengo che qualifichino questa legge di bilancio in quanto organicamente attuative dell'articolo 34 della Costituzione, laddove recita che i capaci e meritevoli, anche se privi di mezzi, hanno diritto a raggiungere i più alti gradi degli studi e che la Repubblica interviene e rende effettivo questo diritto con provvidenze che devono essere assegnate o attribuite per concorso. Si tratta di quattro misure già inserite nella legge di bilancio presentata dal Governo e che il dibattito parlamentare ha contribuito a migliorare, molto sensibilmente in un caso, quello della contribuzione universitaria, argomento su cui la Camera lavora ormai da tre anni: su questo tema, finalmente, grazie ad un lavoro che io ritengo essere corale, oggi incominciamo a raccogliere i frutti. La prima misura, come dicevo, riguarda l'istituzione nelle università statali di una no tax area per gli iscritti ai corsi di laurea ed ai corsi di laurea magistrale che hanno un reddito familiare ISEE inferiore ai 13.000 euro, per incoraggiarli nella formazione universitaria e aiutarli a superare gli ostacoli che derivano dalle condizioni economiche familiari; per gli studenti che hanno un reddito di poco superiore, cioè tra i 13.000 e i 30.000 euro ISEE, sono poi previste delle tasse calmierate. Queste agevolazioni sono disposte per gli studenti fino al primo anno fuori corso; inoltre, per i dottorandi di ricerca che non beneficiano della borsa di studio è previsto l'esonero dalle tasse. Per compensare il minor gettito derivato da queste misure sono garantiti complessivamente 105 milioni di euro agli atenei, affinché possano comunque continuare a garantire i livelli di servizio e di didattica. La seconda misura serve ad affrontare il secondo bisogno: si finanzia stabilmente, per la prima volta nel nostro Paese, l'attività di orientamento e di tutorato, perché ostacolo al conseguimento del titolo non è soltanto l'ambiente economicamente svantaggiato, ma è anche il contesto culturale meno favorevole. Quindi, ai giovani che possono incontrare eventuali difficoltà nel loro percorso di studio per debiti formativi o per studi pregressi alle spalle poco orientati alla formazione teorica, si offre un supporto di tutorato che possa in questo modo accompagnare lo studente nei momenti di difficoltà e aiutarlo ad affrontare con profitto gli esami e quindi a conseguire la laurea. Il terzo caso di bisogno riguarda i ragazzi che hanno già usufruito o che già usufruiscono delle prestazioni del sistema del diritto allo studio, ma non in modo completo: si stabilizza, quindi, l'incremento di 50 milioni già disposto nel 2016 del fondo statale che integra le, ahimè, poche risorse regionali, così che questo fondo possa superare stabilmente i 210 milioni di euro; si prevede poi che queste risorse siano ripartite con un nuovo criterio tra le regioni, cioè con un criterio che tenga conto del fabbisogno al fine di dare una risposta più coerente, rispetto all'attuale, con le necessità territoriali, che sono ovviamente differenti, dati i gap economici esistenti tra le regioni, e così contrastare anche più efficacemente il fenomeno delle studenti donne senza borsa per carenze di risorse. Infine, il quarto bisogno che prende in considerazione i giovani con particolari meriti scolastici o particolari talenti che provengono da classi sociali meno abbienti. Per almeno 400 di loro è prevista una borsa di studio consistente che gli consentirà di poter affrontare la vita universitaria in autonomia anche lontano dalla famiglia. Signor Presidente, voglio solo ricordare che ho raccontato ovviamente in pillole le disposizioni di questi quattro provvedimenti diversi che portano 160 milioni al tema del diritto allo studio e all'accesso all'università; ma non è solo un problema di risorse: ci troviamo davanti davvero ad un pacchetto di norme coerenti, siamo di fronte a un cambiamento reale di prospettiva che mantiene il baricentro nell'articolo 34 della Costituzione e questo cambio di prospettiva ci consente anche di fare un vero passo avanti verso l'equità e la giustizia sociale, grazie (Applausi dei deputati del gruppo Partito Democratico).	
LUIGI DI MAIO	PRESIDENTE	iscritto a parlare il collega Vacca. Prego.	
			PRESIDENZA DELLA PRESIDENTE LAURA BOLDRINI (ore 13,05)
GIANLUCA VACCA		La ringrazio, Presidente. Siamo qui discutendo, in fase di discussione generale, sul provvedimento più importante che normalmente si esamina in Parlamento, ovvero la legge di bilancio, oltretutto con una nuova formulazione a seguito della riforma che abbiamo visto passare nei mesi scorsi. Ebbene, quello che dovrebbe essere il momento più importante per i lavori del Parlamento abbiamo visto come si sia in realtà trasformato in un momento di assoluto caos, in un momento imbarazzante anche per la nostra democrazia, in un momento dove è avvenuto tutto ed il contrario di tutto. Vede, questo è un provvedimento di 105 articoli, è un provvedimento dal quale, di fatto, dipende poi tutta la politica del nostro Paese, tutto quello che accadrà l'anno prossimo nel nostro Paese; si tratta del provvedimento più delicato, della legge principale del nostro lavoro parlamentare, quella che dovrebbe essere discussa con maggior attenzione, quella che dovrebbe essere discussa con una maggiore partecipazione democratica da parte di tutti quanti i gruppi. Invece che cosa è successo ? Questa legge ha iniziato il suo iter in Commissione appena domenica, quindi cinque giorni fa, ed è rimasta in discussione in Commissione appena tre giorni, nei quali abbiamo visto di tutto, abbiamo visto emendamenti che scomparivano, emendamenti che spuntano dal nulla ed abbiamo fatto le nottate, costretti a lavorare di notte perché i tempi imposti erano questi, perché dovevamo votare tutti gli emendamenti soltanto in tre giorni; abbiamo fatto di tutto e abbiamo visto emendamenti del Governo che arrivavano e poi venivano ritirati, arrivavano in una formulazione diversa, dovevano essere subemendati e non si capiva il testo sul quale subemendare... gli uffici legislativi sono andati in completa confusione anche loro, giustamente con questi ritmi e tempi lavorativi. Insomma, un caos senza precedenti, ed una riduzione del dibattito senza precedenti: probabilmente questo è stato il record di discussione di una legge di bilancio in questo Parlamento, un record ovviamente negativo. Tutto questo perché ? Perché noi dobbiamo liquidare, dobbiamo fare in modo che questa legge di bilancio venga votata, venga approvata prima del referendum del 4 dicembre. Dobbiamo quindi terminare la prima lettura alla Camera dei deputati prima del 4 dicembre e siccome la settimana prossima il Parlamento sarà chiuso – perché, lo sappiamo tutti, il Parlamento prima delle elezioni chiude ed interrompe i propri lavori – dobbiamo sbrigarci e in una settimana, di fatto, tra Commissione e Assemblea, voteremo questa legge di bilancio con la fiducia del governo che arriverà a breve. Questo avviene all'interno del Parlamento. Ora i cittadini devono capire che se noi lavoriamo in questo modo è difficile parlare di qualità delle leggi; anzi, quelli che impongono questi ritmi al Parlamento sono gli stessi che poi vanno in giro e vogliono far credere ai cittadini che il Parlamento lavora male, che il Parlamento lavora poco e che quindi bisogna modificare la Costituzione per avere delle leggi migliori e per avere più leggi; cioè, gli stessi che hanno fatto in modo che la legge di bilancio si approvasse in tre giorni in Commissione, che gli emendamenti venissero discussi in appena tre giorni in Commissione con delle nottate di mezzo, con un contingentamento degli emendamenti senza precedenti, con questi ritmi assurdi, con una qualità normativa che sarà inevitabilmente pessima e che, inevitabilmente, verrà corretta al Senato, perché ci saranno delle correzioni da fare e già lo sappiamo che il testo verrà corretto. Vi sono delle correzioni da fare, delle aggiunte, degli interventi dovranno essere necessariamente fatti. Quegli stessi ci vengono a dire che, invece, bisogna modificare la Costituzione per far lavorare meglio il Parlamento. Allora, è schizofrenia questa ? No, è malafede, è assoluta malafede e questo i cittadini lo devono sapere. E perché questa corsa ? Perché dev'essere approvata prima del referendum ? Perché bisogna pagare pegno a gente come De Luca, a governatori come De Luca, che poi dovranno fare campagna elettorale per il «sì» e, in cambio, dovranno ricevere quella che ormai è diventata la famosa marchetta, uscita fuori due giorni fa, che è stata presentata con un emendamento di questa maggioranza, che, di fatto, ha istituzionalizzato il voto di scambio. Noi stiamo istituzionalizzando e politicizzando il voto di scambio. Questo stanno facendo questo Parlamento e questa maggioranza. Mi chiedo: ma con che faccia, sottosegretario e maggioranza, voi andate in giro, nelle piazze – ormai poche, le piazze sono vuote perché nessuno vi segue più –, a parlare e a prendere in giro i cittadini dicendo che bisogna riformare la Costituzione per far lavorare meglio il Parlamento, quando siete voi che lo fate lavorare male, quando siete voi, con i vostri ritmi, perché dovete andare via, perché dovete fare i vostri giochi politici, a far lavorare male questo Parlamento ? Mi scusi, Presidente, per questa premessa, ma era doverosa, perché, francamente, assistere e vivere di persona queste situazioni è francamente mortificante per un cittadino che si ritrova a dover vedere queste cose e che non capisce, non riesce a capire perché ci sia tanta falsità nella nostra classe politica. Io parlerò e mi soffermerò, nei minuti che mi rimangono, sulle parti di nostra competenza, ovvero istruzione, scuola, università, ricerca e cultura, e su quello che è contenuto in questa legge di bilancio. Partiamo da quelli che noi riteniamo siano due furti politici che questo Governo ha fatto nei confronti del MoVimento 5 Stelle. Si tratta di due furti politici che sono evidenti e che riguardano due misure che sono state inserite, ma che di fatto sono misure sulle quali il MoVimento 5 Stelle sta lavorando da anni, sulle quale ha chiesto varie volte al Governo di votare; l'ultima volta è stata qualche mese fa; il Governo e la maggioranza non hanno avuto neanche il coraggio di votare e hanno rimandato il provvedimento in Commissione, come sono soliti fare. Quindi, sono due furti che il Governo ha fatto nei confronti del MoVimento 5 Stelle; sono due proposte che il Governo ha sottratto al MoVimento 5 Stelle, come ama fare, insomma. Sappiamo che questo Governo ama appropriarsi di idee, di proposte dell'opposizione, in particolare, del MoVimento 5 Stelle, per poi fare finta di aver fatto delle proposte nell'interesse dei cittadini. Spesso è una finzione, perché in realtà, poi, sono provvedimenti vuoti, non c’è nulla dietro. Questi furti di cui sto parlando sono la no tax area (articolo 36), ossia l'introduzione di una no tax area all'interno delle università italiane. È una norma rispetto alla quale MoVimento 5 Stelle sta lottando in Parlamento da tre anni e mezzo. È un provvedimento rispetto al quale il MoVimento 5 Stelle ha chiesto che si iniziasse a lavorare in Commissione dal luglio 2013 e che è arrivato in quest'Aula appena tre mesi fa. Si tratta di un provvedimento rispetto al quale il MoVimento 5 Stelle ha cercato di interloquire con il Governo tantissime volte. Fino a un anno fa, anzi fino a sei mesi fa il Governo era completamente sordo, non veniva in audizione in Commissione, si rifiutava di fornire i dati al Parlamento e alle Commissioni che stavano lavorando su questo provvedimento. Era un Governo che si disinteressava completamente di questo provvedimento.	
