speaker	role	text	extra
			PRESIDENZA DEL VICEPRESIDENTE ROBERTO GIACHETTI
			La seduta comincia alle 9,35.
			Missioni.
CLAUDIA MANNINO	Segretario	legge il processo verbale della seduta di ieri. (È approvato).	
			Preavviso di votazioni elettroniche (ore 9,39).
ROBERTO GIACHETTI	PRESIDENTE	Comunico che, ai sensi dell'articolo 46, comma 2, del Regolamento, i deputati Gioacchino Alfano, Bellanova, Bindi, Brunetta, Caparini, Catania, De Girolamo, Dellai, Di Lello, Epifani, Faraone, Fedriga, Fico, Fioroni, Gregorio Fontana, Losacco, Manciulli, Pes, Pisicchio, Rampelli, Realacci, Sanga, Sani, Scalfarotto, Scotto, Speranza, Tabacci, Vargiu e Vignali sono in missione a decorrere dalla seduta odierna. I deputati in missione sono complessivamente novantuno, come risulta dall'elenco depositato presso la Presidenza e che sarà pubblicato nell’allegato A al resoconto della seduta odierna. Ulteriori comunicazioni all'Assemblea saranno pubblicate nell’allegato A al resoconto della seduta odierna.	
			La seduta, sospesa alle 9,40, è ripresa alle 10.
			Discussione del disegno di legge: Conversione in legge del decreto-legge 18 novembre 2014, n. 168, recante proroga di termini previsti da disposizioni legislative concernenti il rinnovo dei Comitati degli italiani all'estero e gli adempimenti relativi alle armi per uso scenico, nonché ad altre armi ad aria compressa o gas compresso destinate all'attività amatoriale e agonistica (A.C. 2727) (Esame e votazione di una questione pregiudiziale).
ROBERTO GIACHETTI	PRESIDENTE	Poiché nel corso della seduta potranno aver luogo votazioni mediante procedimento elettronico, decorrono da questo momento i termini di preavviso di cinque e venti minuti previsti dall'articolo 49, comma 5, del Regolamento. Sospendo pertanto la seduta, che riprenderà alle ore 10.	
ROBERTO GIACHETTI	PRESIDENTE	L'ordine del giorno reca la discussione della questione pregiudiziale Sibilia ed altri n. 1 (Vedi l'allegato A – A.C. 2727), presentata al disegno di legge n. 2727: Conversione in legge del decreto-legge 18 novembre 2014, n. 168, recante proroga di termini previsti da disposizioni legislative concernenti il rinnovo dei Comitati degli italiani all'estero e gli adempimenti relativi alle armi per uso scenico, nonché ad altre armi ad aria compressa o gas compresso destinate all'attività amatoriale e agonistica. Avverto che a norma del comma 3 dell'articolo 40 e del comma 3 dell'articolo 96-bis del Regolamento, la questione pregiudiziale può essere illustrata per non più di dieci minuti da uno solo dei proponenti. Potrà altresì intervenire un deputato per ognuno degli altri gruppi per non più di cinque minuti. L'onorevole Sibilia ha facoltà di illustrare la sua questione pregiudiziale n. 1.	
CARLO SIBILIA		Signor Presidente, io sono qui ad illustrare questa questione pregiudiziale su un decreto-legge che porta come titolo: «Proroga di termini previsti da disposizioni legislative concernenti il rinnovo dei Comitati degli italiani all'estero e gli adempimenti relativi alle armi per uso scenico, nonché ad altre armi ad aria compressa o gas compresso destinate all'attività amatoriale e agonistica». Ci ho tenuto a leggere queste tre-quattro righe per il semplice fatto che sembra veramente imbarazzante oggi doverci preoccupare delle armi ad aria compressa destinate all'attività amatoriale e agonistica, quando il Paese è distrutto e dilaniato dalle peggiori tragedie del dissesto idrogeologico (Applausi dei deputati del gruppo MoVimento 5 Stelle). Avremmo potuto utilizzare questi decreti-legge in mille altre maniere. Inoltre, noi sostanzialmente pensiamo che questo articolato – due o tre articoli di decreto – serva semplicemente per tappare un buco che si era creato per leggi fatte dallo stesso Governo, che propone questo decreto per risolvere i problemi che ha creato con le leggi che esso stesso aveva fatto. In sostanza in due articoli si riesce a fare un concentrato di illegittimità costituzionali veramente da record. Infatti, questo sarà il Governo dei record anche per questo: uno dei record che avrà il Governo Renzi sarà proprio quello di essere riuscito a condensare in due articoli una quantità infinita di illegittimità costituzionali e, oltre ad essere il Governo con il più alto debito pubblico della storia, oltre ad essere il Governo con il più alto tasso di disoccupazione della storia dopo la seconda guerra mondiale, avrà anche questo tipo di primato. Dunque, entrando un attimo nel merito di questo decreto-legge, se proprio dobbiamo farlo, perché naturalmente crediamo sia giusto, riteniamo sostanzialmente che ci siano dei profili di incostituzionalità, perché quello che descrive questo decreto-legge consolida anche un'infausta e sistematica utilizzazione di uno strumento che per sua natura è temporaneo e straordinario per correggere disposizioni legislative in vigore, quindi cogliendo l'occasione di modificare i termini e le scadenze delle medesime (Commenti)...	
ROBERTO GIACHETTI	PRESIDENTE	Scusi, onorevole Sibilia... Colleghi... Grazie. Prego, onorevole Sibilia.	
CARLO SIBILIA		quindi, quasi sempre, come nel caso specifico, a causa di inadempienze e ritardi della pubblica amministrazione. Secondo noi, quindi, con questo decreto si inaugura anche una pratica molto particolare, che è un sottoinsieme che va nell'alveo della consolidata fattispecie di fine d'anno, meglio conosciuta come il «mille-proroghe». Praticamente noi abbiamo fatto, o meglio, il Governo si è fatto un decreto ad hoc composto di due articoli, che si va a sommare a questa nuova pratica. Noi già conosciamo bene i decreti di fine anno conosciuti come «mille-proroghe», adesso abbiamo aggiunto una nuova pratica, che praticamente dà una nuova possibilità a chiunque, magari per qualsiasi problematica riscontrata in qualche legge approvata dallo Stato: il Presidente del Consiglio firma oppure adotta un decreto-legge, che viene firmato dal Presidente della Repubblica e, quindi, si va avanti, magari risolvendo i problemi degli amici degli amici oppure per qualche sciocchezza fatta semplicemente durante il proprio mandato. Inoltre, si consolida altresì un nuovo requisito per il ricorso alla decretazione d'urgenza. Potendo cogliere la ghiotta e contestuale occasione offerta dal disegno di legge di riforma costituzionale in itinere in questo ramo del Parlamento, quindi alla Camera, all'articolo 77 della Costituzione potrebbe essere introdotto il requisito dell'occasionalità, per cui oltre all'urgenza si potrà anche inserire questo nuovo termine: l'occasionalità, perché effettivamente questo decreto non ha i profili di urgenza, come abbiamo già detto. Ma la cosa più bella, il primato assoluto, è anche quest'altra singolarità: l'articolo 1 di questo decreto-legge sta per trasbordare nel disegno di legge di stabilità 2015. Praticamente, che cosa ha fatto il Governo ? Per essere sicurissimo che la proroga dei COMITES venisse inserita comunque, non solo ha emanato un decreto-legge (quindi, urgenza massima secondo il Governo), ma successivamente ha preso il primo articolo del decreto e l'ha proposto come emendamento al disegno di legge di stabilità, che sicuramente entrerà in vigore entro il 1o gennaio 2015. Signori, secondo me, qui siamo arrivati ai limiti dell'assurdo, perché non si può pensare che questa sia la priorità assoluta del Governo, allorché emana un decreto-legge e poi, per essere certo, con un emendamento riprende il primo articolo di quel decreto-legge e lo inserisce nella legge di stabilità 2015. Signori, siamo alla follia legislativa, veramente vi state accartocciando ! Caro Governo, fai qualcosa ! Io veramente prenoterei una visita d'urgenza dallo psichiatra o dallo psicologo, perché bisogna veramente guardarsi dentro per capire qual è la difficoltà che vi spinge a fare questo tipo di azioni (Applausi dei deputati del gruppo MoVimento 5 Stelle). Poi, non ho mai visto questa solerzia quando, invece, si tratta, ad esempio, di parlare dei diritti dei lavoratori; mai vista questa solerzia. Non ho mai visto questa solerzia quando si parla di persone e lavoratori vittime dell'amianto. Non ho mai visto emanare un decreto-legge a favore di quelle persone affette da asbestosi, che oggi stanno lavorando ancora, vista l'annosa e grave «legge Fornero», che impone di lavorare anche alle persone affette da asbestosi (alcune di queste con malattie chiaramente legate alle conseguenze del lavoro con l'amianto). Mai che il Governo si prendesse la briga di emanare un decreto per risolvere il problema dei lavoratori che hanno contratto malattie asbesto correlate. Questo non succede mai, però ci permettiamo di fare un decreto sulla proroga dei COMITES e poi di inserire il primo articolo, come emendamento, nella legge di stabilità. Dovete sapere che l'emendamento 11.20 potrebbe risolvere il problema dei lavoratori che sono affetti da malattie asbesto correlate; ebbene, quell'emendamento è stato accantonato. Noi emaniamo un decreto-legge per le armi per uso scenico destinate all'attività amatoriale e agonistica e non ci preoccupiamo, invece, di queste situazioni ben più gravi, ben più gravi (Applausi dei deputati del gruppo MoVimento 5 Stelle) ! Allora, in questi primi venti mesi della legislatura in corso, abbiamo assistito ad un'impressionante sequela di deroghe alle procedure ordinarie di formazione delle leggi. Le deroghe hanno assunto la forma del ricorso sistematico alla decretazione di urgenza, alla pratica dei decreti omnibus, alla fiducia, alla decretazione d'urgenza coniugata ad una legge-delega, come sta succedendo per il Jobs Act, alla decretazione d'urgenza coniugata alla posizione della questione di fiducia. Ciò lede le prerogative del Parlamento e altera gli equilibri costituzionali, viola, in maniera palese o latente, il dettato costituzionale, l'ordinamento democratico-parlamentare e i pronunciamenti della Corte costituzionale. In termini meno aulici, a nostro avviso, ad avviso del MoVimento 5 Stelle, nei decreti-legge, svincolati o deviati dalle norme costituzionali, confluiscono, molto semplicemente, le questioni sulle quali il Governo non intende perdere tempo o, come peculiarmente in questo caso, l'amministrazione pubblica è chiamata agli adempimenti, proprio perché ha perso del tempo. Allora, siccome abbiamo votato tante questioni pregiudiziali di costituzionalità e, da quello che mi ricordo, almeno in questa legislatura, non c’è stata mai una bocciatura di un decreto-legge per questioni di incostituzionalità, mi verrebbe da dire quasi, ovviamente, dal momento che la pratica...	
ROBERTO GIACHETTI	PRESIDENTE	Scusi, onorevole Sibilia. Per favore, colleghi, dovete lasciare libero il tavolo del Governo.	
CARLO SIBILIA		Dicevo che non mi sembra che sia mai stato bocciato un decreto-legge per motivi di incostituzionalità, anche perché un Governo che vuole stravolgere la Costituzione figuriamoci se si preoccupa di rispettarla quando si fa un decreto (Applausi dei deputati del gruppo MoVimento 5 Stelle). Però vorrei invitare quest'Aula alla riflessione solo su questa fattispecie (non lo farei se stessimo parlando di qualcosa di differente), in cui abbiamo lo stesso decreto-legge inserito, con un emendamento, all'interno della legge di stabilità. Quindi già c’è la possibilità di risolvere questo problema, magari votando a favore di questa porcata, ossia di questo emendamento al disegno di legge di stabilità; mettete questo provvedimento all'interno della legge di stabilità. Sicuramente entrerà in vigore il 1o gennaio 2015, però fatemi la cortesia: bocciamo questo decreto-legge per dignità parlamentare, perché non è possibile (Applausi dei deputati del gruppo MoVimento 5 Stelle) ! Veramente vi chiedo uno sforzo. Lo so benissimo che dovete sostenere il Governo, però chiedo uno sforzo a tutti i parlamentari che magari hanno un minimo di indecisione. Il contenuto di questo stesso decreto-legge è presente in un emendamento al disegno di legge di stabilità. Pensateci, perché questo nelle statistiche andrà a finire tra i decreti-legge adottati dal Governo Renzi. Quindi, vi facciamo anche un favore, cerchiamo di abbassare un po’ questa statistica. Fateci questa cortesia: bocciamo questo decreto-legge per motivi di incostituzionalità e votate a favore della questione pregiudiziale (Applausi dei deputati del gruppo MoVimento 5 Stelle).	
ROBERTO GIACHETTI	PRESIDENTE	Ha chiesto di parlare l'onorevole Picchi. Ne ha facoltà. Colleghi, vi pregherei sempre di abbassare un po’ il tono della voce, per favore. Prego, onorevole Picchi.	
GUGLIELMO PICCHI		Signor Presidente, la questione pregiudiziale di costituzionalità presentata dal MoVimento 5 Stelle, per quanto scritta con attenzione, in realtà lascia molto a desiderare e anche quanto ha affermato l'onorevole Sibilia non è propriamente corretto. Ci sono la necessità e l'urgenza di rinviare le elezioni dei Comites, che erano state già indette il giorno 19 settembre e che sarebbero avvenute il giorno 19 dicembre, e quindi o si adottava un decreto-legge o queste elezioni non si potevano rinviare. Infatti, c'era una previsione normativa precedente, approvata qualche anno fa, che prevedeva che queste elezioni dovessero avvenire entro la fine del 2014. Il punto su cui ci sarebbe veramente da discutere non è tanto la costituzionalità o meno di questo decreto-legge, che ritengo sia assolutamente legittimo e un atto dovuto. Piuttosto dovremmo interrogarci sul perché siamo arrivati a dover adottare un decreto-legge, sul perché il Governo ha dovuto adottare un decreto-legge ad hoc per rinviare le elezioni dei Comites. È una questione estremamente politica, ossia con questo decreto-legge, di fatto, il Governo ammette la propria incapacità nell'effettuare le elezioni dei Comites. Il punto politico e, magari, di costituzionalità è, più che altro, come sia possibile che questo Parlamento abbia votato a favore di una legge che prevede l'istituzione di un registro elettorale per poter esercitare il proprio diritto di voto e che questo registro elettorale produca, di fatto, l'esclusione del 96,7 per cento degli aventi diritto. Ora, l'esempio dell'Emilia Romagna di ieri ci dice che c’è già una grande disaffezione dei cittadini nei confronti della politica. Se poi noi rendiamo ancora più difficoltoso l'esercizio del voto, allora questa disaffezione diventa totale. Quindi, il punto della discussione che dovrà avvenire – non è questa la sede, ma vi arriveremo quando dovremo poi iniziare la discussione del decreto-legge vero e proprio – sarà quello di mettere in evidenza come il Partito Democratico abbia fatto un vero e proprio pasticcio su queste elezioni dei Comites e il Governo gli è andato dietro. Si sono volute fare in tutta fretta, secondo modalità, direi, incostituzionali. Infatti, vi immaginate se avessimo dovuto istituire un registro elettorale per far votare alle elezioni regionali ? L'affluenza sarebbe stata anche in quel caso del 4, 5 o 6 per cento. Tanto più che si limita ancora di più il diritto di voto perché impediamo e limitiamo la possibilità di iscriversi al registro elettorale a trenta giorni prima della data delle elezioni.	
ROBERTO GIACHETTI	PRESIDENTE	Scusi, onorevole Picchi. Per favore, liberate i banchi del Governo. Per favore, onorevole Giorgis... Onorevole Giorgis... Onorevole Giorgis, per favore. Prego, onorevole Picchi.	
GUGLIELMO PICCHI		Quindi, la questione della costituzionalità risiede altrove. Sulla necessità e sull'urgenza di questo decreto-legge non possiamo che concordare. Quindi, voteremo contro la questione pregiudiziale presentata dal MoVimento 5 Stelle. E la necessità e l'urgenza, almeno sulla parte delle elezioni dei Comites, ci sono, perché queste elezioni si sarebbero dovute tenere il 19 dicembre e aspettare la legge di stabilità, senza avere la certezza della sua approvazione entro il 19 dicembre, avrebbe fatto sì che ci saremmo trovati in un processo elettorale iniziato, provocando altri disastri. Sulla seconda parte, sulle armi sceniche, preferisco non intervenire, perché lì qualche dubbio sulla necessità e l'urgenza ce l'abbiamo. Comunque, come gruppo di Forza Italia, voteremo contro le questioni pregiudiziali presentate dal MoVimento 5 Stelle.	
ROBERTO GIACHETTI	PRESIDENTE	Ha chiesto di parlare l'onorevole Marcolin. Ne ha facoltà.	
MARCO MARCOLIN		Signor Presidente ed onorevoli colleghi, è chiaro che riteniamo del tutto infondata la questione pregiudiziale sulla costituzionalità dell'atto Camera 2727, di cui oggi siamo chiamati a discutere e su cui dovremo anche decidere. È un fatto obiettivo che il ricorso alla decretazione d'urgenza abbia da tempo superato i suoi limiti fisiologici, per diventare qualcosa d'altro: uno strumento di cui i Governi si avvalgono non per fronteggiare un'emergenza effettiva, ma solo per beneficiare dei vantaggi regolamentari che rendono più veloce l'esame dei decreti-legge, in ragione della tagliola del termine di 60 giorni per convertirli in legge. Esaminiamo i fatti spassionatamente: il decreto-legge in questione, che reca la data del 18 novembre, è il centosessantottesimo varato quest'anno. Praticamente se ne emana uno ogni giorno pari dell'anno, o dispari se preferite, ed anche di più, se escludiamo dal computo i sabati, le domeniche, il mese di agosto, la pausa natalizia e quella pasquale. Siamo giunti ad un punto tale che l'azione legislativa del Governo si identifica ormai con la decretazione d'urgenza e quella nostra prevalentemente nell'esercizio del potere di emanarla, il che vuol dire due cose: o che lo strumento è stato snaturato, come riteniamo probabile, o che l'emergenza in cui ci troviamo è diventata strutturale, a causa di problemi che hanno a che fare con la stessa architettura del nostro regime parlamentare, cosa che neanche può essere esclusa. Nello specifico, il contenuto del provvedimento pare confermare la nostra interpretazione. Dobbiamo infatti convertire un decreto-legge che consta di due soli articoli, che concernono rispettivamente il rinnovo dei Comites, per i quali peraltro si sta provvedendo anche attraverso l'inserimento di norme appropriate nella legge di stabilità, e la proroga del termine di alcuni adempimenti relativi alle armi destinate ad uso scenico, nonché ad altre armi ad aria compressa o a gas compresso, destinate all'attività amatoriale ed agonistica. Non parliamo di guerre, catastrofi naturali od altri eventi imprevedibili e drammatici, onorevoli colleghi, ma di altri fatti e di scadenze per cui si sarebbe potuto provvedere in modo diverso da questo. Specialmente nel caso dei comitati degli italiani all'estero, gli interventi e le proroghe stanno diventando talmente frequenti e numerosi da far pensare che ci sia qualcosa di più profondo e strutturale da correggere, mentre nel caso delle armi sceniche siamo alle prese con un regime di verifiche che gli operatori ancora non conoscono perfettamente. Capiamo anche poco l'accostamento operato tra materie tanto diverse, una cosa che ricorda davvero i vecchi «milleproroghe», come ci viene detto. Diamo quindi ragione ai nostri colleghi: questo metodo non va, è estraneo allo spirito della Costituzione e va corretto, se serve anche modificando le regole che disciplinano il procedimento legislativo, come tentammo di fare tra il 2001 ed il 2006, durante la XIV legislatura. Ovviamente questa posizione concerne la costituzionalità del decreto-legge al nostro esame. Sul metodo stesso dell'azione legislativa nulla dice e vuol dire a proposito del merito del provvedimento, sul quale ci sarà tempo e modo di discutere, perché, ad esempio, mentre abbiamo delle riserve sulle norme che riguardano il rinnovo dei Comites, la proroga dei termini per gli adempimenti sulle armi sceniche la consideriamo importante, anche per salvare dei posti di lavoro, visto che si stanno fermando i set cinematografici. Siamo stupiti, semmai, che si sia aspettato così tanto e si sia fatto così tanto tardi da dover correre ai ripari con un decreto. In base a queste considerazioni, la Lega voterà a favore della questione pregiudiziale.	
ROBERTO GIACHETTI	PRESIDENTE	Ha chiesto di parlare l'onorevole Garavini. Ne ha facoltà.	
LAURA GARAVINI		Signor Presidente, con la pregiudiziale di costituzionalità oggi all'ordine del giorno si cerca di contestare la decisione del Governo volta a salvare il rinnovo delle elezioni di questi importanti organi di rappresentanza. Si tratta di una decisione che non avrebbe potuto essere altra, non avrebbe potuto essere altrimenti e mira a garantire la realizzazione delle normali basi democratiche così da favorire una più alta partecipazione al voto. Bisogna innanzitutto rimarcare il fatto che per la prima volta si è introdotto un nuovo meccanismo, un nuovo obbligo, in virtù del quale si prevede l'inversione dell'opzione. In altre parole, per la prima volta – in Italia non si è mai avuto questo meccanismo – si prevede che potranno votare a queste elezioni soltanto coloro i quali abbiano preventivamente provveduto a rendere nota al consolato di riferimento l'intenzione di partecipare al voto per corrispondenza. Si tratta di un nuovo meccanismo, di un obbligo poco noto che, tra l'altro, concerne un appuntamento elettorale che, non coincidendo con altre scadenze elettorali a livello nazionale, è anche poco conosciuto. Allora tutti questi motivi inducono al fatto che ci sia stata una partecipazione in termini di pre-registrazione molto risicata, molto bassa. Inoltre, non dobbiamo dimenticare un altro aspetto e mi preme sottolinearlo. Noi usciamo da un decennio buio in materia di politiche di rappresentanza per gli italiani all'estero, nel quale i diversi Governi di destra che si sono succeduti hanno previsto ben tre rinvii di questi importanti organi di rappresentanza che sono equiparabili ai consigli comunali, il che significa che per la bellezza di dieci anni i nostri concittadini all'estero non sono stati affatto confrontati con l'appuntamento di rinnovo delle elezioni dei Comites. Significa che si è fondamentalmente ucciso l'argomento dei Comites per la bellezza di dieci anni. Si è avuto un basso tasso di pre-registrazione, nonostante il Governo si sia impegnato e abbia inviato 2 milioni e 600 mila lettere alle famiglie degli aventi diritto al voto. Ciononostante ci trovavamo in una situazione di difficoltà in virtù della quale il tasso di pre-registrazione era troppo basso per garantire invece un democratico esercizio del diritto di voto. Allora, bene aveva fatto il Governo Renzi a prevedere il rispetto dei limiti previsti dalla legge affinché si provvedesse al rinnovo nei termini, vale a dire entro il dicembre di quest'anno. Così come molto opportuna era stata la decisione di prevedere l'inversione dell'opzione, proprio finalizzata a garantire una maggiore legalità dell'esercizio del voto volta ad evitare brogli, volta ad evitare abusi dei plichi e dunque dell'esercizio del voto per corrispondenza. Ma questo nuovo meccanismo introdotto, che è pane quotidiano in altri Paesi, come ad esempio in Francia, rappresenta una novità per i nostri connazionali, per gli elettori. Ben venga dunque il rinvio, pensato proprio per evitare una troppo scarsa partecipazione al voto. È vero ciò che fanno rilevare i colleghi del MoVimento 5 Stelle circa il fatto che si proceda al recepimento e alla conversione di questo decreto-legge durante la legge di stabilità.	
ROBERTO GIACHETTI	PRESIDENTE	Mi scusi, onorevole Garavini, gentilmente il Governo deve essere messo nelle condizioni di ascoltare, grazie. Prego.	
LAURA GARAVINI		Lo stesso vale anche per l'altro aspetto trattato dal decreto-legge relativo al rinvio al dicembre dell'anno prossimo della verifica del Banco nazionale di prova per le armi ad uso scenico, oltre che per le armi ad aria compressa. Torno a ribadire, però, che il decreto-legge che qui oggi viene contestato è lo strumento attraverso il quale si possono salvare le elezioni dei Comites. Allora, non abbiamo di certo bisogno di dibattiti sterili, anzi posso tranquillizzare i colleghi rispetto al fatto che il decreto-legge in questione è del tutto legittimo e anche la prassi di recepimento in sede di legge di stabilità è del tutto congruo e non sono presenti vizi di incostituzionalità. Credo invece che ci debba essere l'impegno di tutti, a partire dalle forze politiche. Ci sono state fino ad ora responsabilità. Magari anche all'interno delle fila del mio partito non c’è stato un impegno sufficiente affinché si possa promuovere al massimo questa partecipazione al rinnovo dei Comites. Io mi auguro che adesso, invece, non ci siano scuse, non ci siano alibi, che ci sia un impegno congiunto collettivo proprio per far sì che si abbia la massima partecipazione possibile a questo importante appuntamento. E nel ringraziarla, Presidente, comunico dunque il voto contrario del mio gruppo alla questione pregiudiziale di costituzionalità all'ordine del giorno (Applausi dei deputati del gruppo Partito Democratico).	
ROBERTO GIACHETTI	PRESIDENTE	Ha chiesto di parlare l'onorevole Garofalo. Ne ha facoltà.	
