speaker	role	text	extra
DANIELE FARINA		Io capisco che l'argomento sia noioso e a tratti anche poco comprensibile, ma stiamo parlando – Presidente, lo ricordo – di norme che sovrintendono alla materia della sicurezza sul lavoro e antinfortunistica, che questa delega al Governo comprende. Dunque, dicevo, bisognava piuttosto andare – e questo era il senso dell'impegno – verso ipotesi tipiche di ricorso giudiziario, da parte delle organizzazioni sindacali, per la repressione della condotta antisindacale. Queste dovrebbero essere attivabili anche in caso di violazioni amministrative, quali lavoro nero – ribadisco –, appalti abusivi, mancata predisposizione delle misure di prevenzione e sicurezza. Di questo stiamo parlando e, a nostro modo di vedere, sarebbe interessante che, in sede di adozione dei decreti legislativi, il Governo fosse più stringentemente portato ad una revisione della normativa in senso anche parzialmente diverso rispetto a quanto previsto al comma 6, lettera f), di questo articolo unico.	
ROBERTO GIACHETTI	PRESIDENTE	Passiamo ai voti. Indìco la votazione nominale, mediante procedimento elettronico, sull'ordine del giorno Daniele Farina n. 9/2660-A/21, con il parere contrario del Governo. Dichiaro aperta la votazione. (Segue la votazione). Covello, Piccoli Nardelli, Abrignani, Dellai, Ragosta, Vitelli, Nicchi... Colleghi, però vi prego di restare in aula, perché non possiamo aspettare 20 minuti per ogni voto. Dichiaro chiusa la votazione. Comunico il risultato della votazione: Presenti 456 Votanti 453 Astenuti 3 Maggioranza 227 Hanno votato sì 102 Hanno votato no 351. La Camera respinge (Vedi votazioni). Prendo atto che i presentatori accettano la riformulazione e non insistono per la votazione dell'ordine del giorno Pellegrino n. 9/2660-A/22, accettato dal Governo, purché riformulato. Chiedo ai presentatori se insistano per la votazione dell'ordine del giorno Ricciatti n. 9/2660-A/23, su cui vi è il parere contrario del Governo.	
LARA RICCIATTI		Signor Presidente, immagino di aver meritato un parere contrario su questo ordine del giorno, perché il gruppo di Sinistra Ecologia Libertà scrive che questo testo appare molto pericoloso sia sotto il profilo della tutela e della protezione sociale dei lavoratori, sia – e conseguentemente – sotto il profilo del rilancio delle attività di sviluppo industriale del nostro Paese, perché omette di indicare in modo chiaro e preciso la via da seguire per riformare l'articolo 18 in merito alle sanzioni per i licenziamenti individuali illegittimi e neppure parla di quelli collettivi. E non è un caso che il provvedimento in esame, di fatto, non menzioni mai espressamente l'articolo 18, ma neanche definisca i limiti specificatamente individuati per circoscrivere l'intervento su tale norma, che disciplina il quadro regolatorio delle sanzioni incombenti sui datori di lavoro per i licenziamenti nulli e illegittimi. Andando avanti, vediamo la promozione del contratto a tempo indeterminato quale forma – riprendiamo proprio il virgolettato – «privilegiata di contratto di lavoro», con l'impegno a renderlo più conveniente rispetto agli altri tipi di contratto, con riferimento agli organi diretti ed indiretti. L'Esecutivo quindi, stando a quanto previsto dal provvedimento in esame, potrà ampiamente modificare i contenuti dell'attuale articolo 18 dello Statuto dei lavoratori, fino a restringere in modo particolarmente rilevante i casi di reintegrazione del lavoratore licenziato e a ridurre gli importi dovuti dal datore di lavoro a titolo di indennizzo ovvero di risarcimento. Con tutta probabilità il provvedimento in esame, non avendo ricevuto specifiche puntualizzazioni in tema di modifiche da apportare all'articolo 18 dello Statuto dei lavoratori neanche durante l'esame in sede referente presso la Commissione lavoro, potrebbe produrre un pesante contenzioso costituzionale, attivabile da qualsiasi giudice che venga chiamato a valutare la legittimità di un licenziamento individuale. Con questo ordine del giorno, quindi, chiedevamo degli impegni abbastanza semplici e, se volete, anche di buon senso a questo Governo, perché chiedevamo di adottare le opportune iniziative normative tese ad evitare il rischio di un pesante – e costosissimo, peraltro – contenzioso che la presumibile incostituzionalità del provvedimento in esame potrebbe provocare, soffocando al contempo qualsiasi iniziativa imprenditoriale ad operare nuove assunzioni. Chiedevamo di valorizzare la conciliazione vita-lavoro come principio fondamentale che guida il datore di lavoro pubblico o privato nell'esercizio del potere organizzativo dell'azienda e chiedevamo di consentire ai lavoratori e alle lavoratrici di accrescere il proprio benessere e alle imprese di ridurre i propri costi e a beneficiare di una maggiore produttività dei dipendenti e delle dipendenti, nonché di incrementare le assunzioni e di sostenere l'occupazione. Scusatemi, care colleghe e cari colleghi, ma non dovrebbe essere anche questo il vostro obiettivo ? E chiedevamo una cosa un po’ rivoluzionaria, ma forse troppo di buon senso: chiedevamo di adottare ogni iniziativa normativa tesa a sostenere, in particolare, le nuove cooperative costituite da quelle lavoratrici dipendenti che intendono riscattare l'azienda subentrando nella gestione per il mantenimento della continuità produttiva, qualora si tratti di piccole e medie imprese che versano in gravi difficoltà di produzione e commercializzazione dei prodotti, con l'imminente pericolo di chiusura, oppure che abbiano avviato procedure di delocalizzazione delle attività produttive. Vedete, non ha senso andare nelle piazze e sostenere alcune cose, quando poi non concediamo un parere favorevole a un ordine del giorno che dice di aiutare quelle lavoratrici e quei lavoratori a poter riscattare l'azienda in crisi, che poi vede in quel caso abbassare la saracinesca per andare magari a delocalizzare altrove. Non è questa l'idea di Italia che viene chiesta qua fuori (Applausi dei deputati del gruppo Sinistra Ecologia Libertà).	
ROBERTO GIACHETTI	PRESIDENTE	Passiamo ai voti. Indìco la votazione nominale, mediante procedimento elettronico, sull'ordine del giorno Ricciatti n. 9/2660-A/23, con il parere contrario del Governo. Dichiaro aperta la votazione. (Segue la votazione). Totaro, Russo, Carra, Ciracì, Carbone, Ragosta, Portas... Dichiaro chiusa la votazione. Comunico il risultato della votazione: Presenti 460 Votanti 459 Astenuti 1 Maggioranza 230 Hanno votato sì 120 Hanno votato no 339. La Camera respinge (Vedi votazioni). Prendo atto che i presentatori non insistono per la votazione dell'ordine del giorno Palazzotto n. 9/2660-A/24, sul quale il Governo ha espresso parere favorevole. Chiedo ai presentatori se insistano per la votazione dell'ordine del giorno Duranti n. 9/2660-A/25, sul quale il Governo ha espresso parere contrario.	
DONATELLA DURANTI		Signor Presidente, ovviamente chiedo di metterlo ai voti. Nel tentativo, però, di far cambiare idea al Governo e alla sottosegretaria Bellanova, che so molto sensibile ai temi quali quelli appunto della disoccupazione involontaria, che è il tema di cui si occupa questo ordine del giorno, proverò velocemente a ricordare quello che chiediamo. In questo ordine del giorno ci riferiamo...	
ROBERTO GIACHETTI	PRESIDENTE	Scusi, onorevole Duranti, se la interrompo. Velocemente anche perché voi avete terminato pure il tempo aggiuntivo, quindi posso darvi un minuto per ciascuno.	
DONATELLA DURANTI		Velocemente, grazie.	
ROBERTO GIACHETTI	PRESIDENTE	Lei non era stata avvisata e le darò qualcosa in più, però sappiate che adesso avete terminato il tempo.	
DONATELLA DURANTI		Sarò velocissima, grazie. L'ordine del giorno si riferisce al comma 1 dell'articolo 1 del provvedimento, in cui è previsto appunto che, in via sperimentale e in tutti i casi di disoccupazione involontaria, si possa intervenire sul sistema dell'ASpI, rimodulando e omogeneizzando la disciplina di ASpI e mini-ASpI, estendendo lo strumento ai soli collaboratori coordinati e continuativi, incrementando la durata massima della prestazione, solo per quei lavoratori che hanno delle elevate anzianità contributive, e introducendo in tal modo un ulteriore elemento di conflitto generazionale – insomma, torniamo al tema del conflitto generazionale –, oltre a quello previsto per il contratto a tutele crescenti. Riguardo a quest'ultimo aspetto, cioè alla volontà di introdurre dei massimali per la prestazione in funzione della contribuzione figurativa, vuol dire limitare le erogazioni a tutti quei lavoratori per i quali non siano stati versati dei contributi sociali effettivi, ma solo figurativi, circostanza che si verifica in caso di interruzione o riduzione dell'attività lavorativa dovuta a determinate fattispecie quali la Cassa integrazione guadagni. Quello dell'anzianità contributiva è peraltro un parametro del quale attualmente già si tiene conto per l'accesso all'integra Nella prospettiva generale di legare le tutele del reddito alla storia contributiva dei lavoratori si colloca la volontà di introdurre dei massimali per le prestazioni in funzione della contribuzione figurativa. Ciò significa, secondo noi, voler limitare le erogazioni nei confronti dei lavoratori per i quali non siano stati versati contributi sociali effettivi, ma appunto figurativi. In caso di disoccupazione involontaria – e chiudo –, la tutela non deve essere legata alla storia contributiva, perché non c’è nulla di più discriminatorio che la storia contributiva di chi si trova privo di reddito e in condizione di bisogno. Inoltre, rapportare la durata della prestazione, compresa la cassa integrazione guadagni, alla storia contributiva del singolo è improprio, perché introdurrebbe dei criteri troppo rigidamente assicurativi in un ambito, quale è quello degli ammortizzatori sociali, che dovrebbe avere appunto valore solidale. La suddetta previsione, inoltre, sarebbe fonte di problemi gestionali per l'impresa, che male si concilierebbero con la semplificazione amministrativa e burocratica più volte evocata dal provvedimento. Chiediamo, quindi, al Governo, in sede di adozione dei decreti delegati, di prevedere che il sussidio di cui all'articolo 1, comma 1, si applichi ai lavoratori di cui alla lettera b) a prescindere da qualsiasi requisito di anzianità contributiva e assicurativa, per il carattere discriminatorio che abbiamo provato ad illustrare in questo ordine del giorno.	
ROBERTO GIACHETTI	PRESIDENTE	Passiamo ai voti. Indìco la votazione nominale, mediante procedimento elettronico, sull'ordine del giorno Duranti n. 9/2660-A/25, con il parere contrario del Governo. Dichiaro aperta la votazione. (Segue la votazione). Marti, Beni, Ciracì, Capodicasa, Carbone, Pastorino, Tino Iannuzzi, Fauttilli... Dichiaro chiusa la votazione. Comunico il risultato della votazione: Presenti 466 Votanti 465 Astenuti 1 Maggioranza 233 Hanno votato sì 103 Hanno votato no 362. La Camera respinge (Vedi votazioni). Prendo atto che il presentatore accetta la riformulazione e non insiste per la votazione dell'ordine del giorno Costantino n. 9/2660-A/26, accettato dal Governo, purché riformulato. Prendo atto che i presentatori non insistono per la votazione degli ordini del giorno Airaudo n. 9/2660-A/27 e Paglia n. 9/2660-A/28, sui quali il Governo ha espresso parere favorevole. Chiedo ai presentatori se insistano per la votazione dell'ordine del giorno Piras n. 9/2660-A/29, su cui il Governo ha espresso parere contrario.	
MICHELE PIRAS		Signor Presidente, francamente mi sarei aspettato probabilmente una riformulazione rispetto al testo dell'impegno che abbiamo proposto, certamente non un parere contrario. Voglio ricordare, anche se Jobs Act per chi parla correttamente l'inglese è una formulazione, un anglicismo abbastanza poco trasparente, che si tratta di una riforma pretesa, voluta, profonda del mercato del lavoro e del diritto del lavoro. E quindi mi chiedo come sia possibile, se questa è l'intenzione del Governo, escludere le organizzazioni sindacali dalla fase di preparazione dei decreti legislativi discendenti da questa delega. Concludo semplicemente dicendo che, se anche molti di noi, rispetto alle dichiarazioni iniziali di questo Governo, forse avevano visto un lumicino di speranza dalla volontà di uscire dalla palude, ci sembra che nella palude ancora ci siamo, ci rimarremo a lungo e che questa fondamentalmente sia quello che abbiamo già conosciuto: la continuazione del berlusconismo con altri mezzi.	
ROBERTO GIACHETTI	PRESIDENTE	Passiamo ai voti. Indìco la votazione nominale, mediante procedimento elettronico, sull'ordine del giorno Piras n. 9/2660-A/29, con il parere contrario del Governo. Dichiaro aperta la votazione. (Segue la votazione). Rosato, Piccoli Nardelli, Ragosta, Grillo, Cassano... Dichiaro chiusa la votazione. Comunico il risultato della votazione: Presenti 466 Votanti 465 Astenuti 1 Maggioranza 233 Hanno votato sì 106 Hanno votato no 359. La Camera respinge (Vedi votazioni). (Il deputato Cani ha segnalato che ha erroneamente votato a favore e che avrebbe voluto votare contro). Chiedo ai presentatori se insistano per la votazione dell'ordine del giorno Franco Bordo n. 9/2660-A/30, con il parere contrario del Governo.	
FRANCO BORDO		Signor Presidente, una breve testimonianza: l'operaia Cinzia, signor Ministro, non Marta, ma si chiama Cinzia, mi ha detto e mi ha raccontato la sua storia: mi hanno spremuto in fabbrica con i contratti a tempo determinato nella stessa mansione. Mi hanno spremuto, perché ovviamente speravo nell'assunzione a tempo indeterminato. No, mi hanno detto: adesso passi nell'agenzia interinale. Tale agenzia è estera e ha unica sede presso la sua fabbrica in cui assume gli stessi lavoratori per farli lavorare nella stessa fabbrica, dopodiché le hanno detto: forse, se farai la brava, finiti questi contratti vedremo con il nuovo Jobs Act che cosa fare e se tenerti in un contratto cosiddetto a tempo indeterminato. Si parla per l'operaia Cinzia di nove-dieci anni di lavoro precario. È per questo che nel Jobs Act bisogna assolutamente rivedere il «decreto Poletti», che non può essere mantenuto così com’è, ma assolutamente ripreso nella politica di normativa del lavoro.	
ROBERTO GIACHETTI	PRESIDENTE	Passiamo ai voti. Indìco la votazione nominale, mediante procedimento elettronico, sull'ordine del giorno Franco Bordo n. 9/2660-A/30, con il parere contrario del Governo. Dichiaro aperta la votazione. (Segue la votazione). Piccoli Nardelli, Totaro, Carfagna, Rizzetto. Dichiaro chiusa la votazione. Comunico il risultato della votazione: Presenti 466 Votanti 463 Astenuti 3 Maggioranza 232 Hanno votato sì 105 Hanno votato no 358. La Camera respinge (Vedi votazioni). Prendo atto che i presentatori insistono per la votazione dell'ordine del giorno Quaranta n. 9/2660-A/31, sul quale vi è il parere contrario del Governo. Ha chiesto di parlare per dichiarazione di voto l'onorevole Quaranta. Ne ha facoltà, per un minuto.	
STEFANO QUARANTA		Signor Presidente, signor Ministro, sottosegretario, con questo ordine del giorno vorremmo dare un contributo al tema «come si crea lavoro», che non è soltanto suddividere, spesso precarizzando, il poco lavoro che c’è. La situazione del Paese la conosciamo: è quella fatta di disoccupazione e, laddove anche c’è l'occupazione, spesso è di scarsa qualità. Noi pensiamo che serva, a questo punto, mettere in campo un piano in cui lo Stato sia il datore di lavoro di ultima istanza. Oltre 3 milioni di disoccupati non si sconfiggono con interventi così marginali e non di sostanza. Noi pensiamo che questa sia anche una grande occasione per provare a cambiare il nostro modello di sviluppo, una sorta di «green New Deal», tra l'altro, molto di attualità rispetto a tutte le cose che sono successe in questo periodo.	
ROBERTO GIACHETTI	PRESIDENTE	La invito a concludere.	
STEFANO QUARANTA		Servirebbero investimenti sulla cura del territorio, contro il dissesto idrogeologico: le risorse si possono trovare. Noi vi abbiamo fatto una proposta che è positiva, non negativa, e pensiamo che sarebbe utile per questo Governo, se vuole davvero «cambiare verso», accoglierla, perché ne va del futuro del nostro Paese (Applausi dei deputati del gruppo Sinistra Ecologia Libertà).	
ROBERTO GIACHETTI	PRESIDENTE	Passiamo ai voti. Indìco la votazione nominale, mediante procedimento elettronico, sull'ordine del giorno Quaranta n. 9/2660-A/31, con il parere contrario del Governo. Dichiaro aperta la votazione. (Segue la votazione). Di Lello. Abbiamo votato tutti ? Dichiaro chiusa la votazione. Comunico il risultato della votazione: Presenti 462 Votanti 461 Astenuti 1 Maggioranza 231 Hanno votato sì 103 Hanno votato no 358. La Camera respinge (Vedi votazioni). (La deputata Pellegrino ha segnalato che non è riuscita ad esprimere voto favorevole). Prendo atto che i presentatori insistono per la votazione dell'ordine del giorno Pannarale n. 9/2660-A/34, sul quale vi è il parere contrario del Governo. Ha chiesto di parlare per dichiarazione di voto l'onorevole Pannarale. Ne ha facoltà, per un minuto.	
ANNALISA PANNARALE		Signor Presidente, io vorrei provare ad interloquire con la sottosegretaria Bellanova, oltre che con il Ministro, perché credo che dovremmo, quanto meno, provare a salvare il principio che è contenuto in questo ordine del giorno, cioè quello della preminenza della prevenzione in materia di salute e di sicurezza nei luoghi di lavoro. Noi stiamo dando al Governo una delega per la razionalizzazione e la semplificazione in materia di igiene e di sicurezza del lavoro e lo stiamo facendo senza alcun principio né criterio direttivo.	
ROBERTO GIACHETTI	PRESIDENTE	La invito a concludere.	
ANNALISA PANNARALE		Ci preoccupa la possibilità che vi siano delle manutenzioni al testo unico, al decreto legislativo n. 81 del 2008, che possano andare ad indebolire il principio della prevenzione. La sottosegretaria prima ci diceva che, probabilmente, un tavolo c’è già: ci piacerebbe sapere dove e, soprattutto, su quali obiettivi, perché quello che chiediamo in questo ordine del giorno è verificare lo stato di attuazione...	
ROBERTO GIACHETTI	PRESIDENTE	Concluda, onorevole Pannarale.	
ANNALISA PANNARALE		del testo unico prima di intervenire. Allora, forse, una riformulazione ci consentirebbe almeno di salvaguardare il principio contenuto in questo ordine del giorno (Applausi dei deputati del gruppo Sinistra Ecologia Libertà).	
ROBERTO GIACHETTI	PRESIDENTE	Passiamo ai voti. Indìco la votazione nominale, mediante procedimento elettronico, sull'ordine del giorno Pannarale n. 9/2660-A/34, con il parere contrario del Governo. Dichiaro aperta la votazione. (Segue la votazione). Di Lello, Carbone, Beni. Ci siamo ? Dichiaro chiusa la votazione. Comunico il risultato della votazione: Presenti 466 Votanti 450 Astenuti 16 Maggioranza 226 Hanno votato sì 103 Hanno votato no 347. La Camera respinge (Vedi votazioni). Prendo atto che il presentatore insiste per la votazione dell'ordine del giorno Melilla n. 9/2660-A/35, sul quale vi è il parere contrario del Governo. Ha chiesto di parlare per dichiarazione di voto l'onorevole Melilla. Ne ha facoltà, per un minuto.	
GIANNI MELILLA		Presidente, parliamo, in questo ordine del giorno, dei patronati. Come per la Resistenza occorre andare sulle montagne, per capire qual è oggi la situazione di una parte consistente del nostro popolo basta andare una mattina in una sede di un patronato, all'INCA, all'INAS, all'ITAL, e vedere tante persone, che appartengono alla parte meno abbiente di questo Paese, che vanno a chiedere informazioni sulle pensioni, l'invalidità, le contribuzioni, i permessi per i disabili e via discorrendo. Bene, un atto ambizioso, che vuole unificare tutta la normativa in materia di rapporti di lavoro, non può escludere i patronati. Anzi, non può emarginare i patronati, che invece hanno una dignità costituzionale essendo citati all'articolo 38 della Costituzione. Sottosegretario, sono anche disponibile a togliere nel dispositivo il riferimento all'incremento delle risorse finanziarie disponibili, – anche se i patronati non sono a carico dello Stato ma del Fondo previdenziale – per chiederle di riformulare il suo parere negativo.	
ROBERTO GIACHETTI	PRESIDENTE	Prendo atto che il Governo non intende intervenire. Passiamo ai voti. Indìco la votazione nominale, mediante procedimento elettronico, sull'ordine del giorno Melilla n. 9/2660-A/35, con il parere contrario del Governo. Dichiaro aperta la votazione. (Segue la votazione). Paolo Russo, Dellai, Basso, Beni... Dichiaro chiusa la votazione. Comunico il risultato della votazione: Presenti 457 Votanti 374 Astenuti 83 Maggioranza 188 Hanno votato sì 29 Hanno votato no 345. La Camera respinge (Vedi votazioni). (La deputata Covello ha segnalato che non è riuscita ad esprimere voto contrario). Prendo atto che il presentatore insiste per la votazione dell'ordine del giorno Sannicandro n. 9/2660-A/36, sul quale vi è il parere contrario del Governo. Ha chiesto di parlare per dichiarazione di voto l'onorevole Sannicandro. Ne ha facoltà, per un minuto.	
ARCANGELO SANNICANDRO		Presidente, l'articolo 39 della Costituzione dice che i sindacati possono stipulare contratti collettivi di lavoro con efficacia obbligatoria per tutti gli appartenenti alle categorie alle quali il contratto si riferisce, i cosiddetti contratti erga omnes. Ma perché ciò possa accadere, la Costituzione ricorda che i sindacati devono essere rappresentativi dell'intero mondo del lavoro. Ora, sono quaranta, cinquant'anni che manca una legge su tale materia e sappiamo qual è stata l'evoluzione dell'articolo 19 dello Statuto dei diritti dei lavoratori, che la prassi ha rivoltato contro i sindacati maggiormente rappresentativi. Noi chiediamo al Governo di intervenire su questa materia e assumere un'iniziativa legislativa. Purtroppo, prendo atto che il Governo è sordo a questa intenzione, però devo anche dare atto che questo parere contrario è un contributo alla chiarezza, perché si capisce ancora una volta da che parte questo Governo sta.	
ROBERTO GIACHETTI	PRESIDENTE	Passiamo ai voti. Indìco la votazione nominale, mediante procedimento elettronico, sull'ordine del giorno Sannicandro n. 9/2660-A/36, con il parere contrario del Governo. Dichiaro aperta la votazione. (Segue la votazione). Rizzetto, Carbone, Beni, Saltamartini, Luciano Agostini, Toninelli... Dichiaro chiusa la votazione. Comunico il risultato della votazione: Presenti 470 Votanti 386 Astenuti 84 Maggioranza 194 Hanno votato sì 24 Hanno votato no 362. La Camera respinge (Vedi votazioni). (La deputata Grillo ha segnalato di aver erroneamente votato a favore mentre avrebbe voluto astenersi). Prendo atto che il presentatore accetta la riformulazione e non insiste per la votazione dell'ordine del giorno Kronbichler n. 9/2660-A/37, accolto dal Governo, purché riformulato. Chiedo al presentatore se accetti la riformulazione dell'ordine del giorno Marcon n. 9/2660-A/38, accolto dal Governo, purché riformulato.	
GIULIO MARCON		Presidente, non accettiamo questa riformulazione, anche perché il nostro ordine del giorno dice una cosa abbastanza scontata, che il Governo debba mettere, nel primo provvedimento possibile, le risorse necessarie per politiche attive del lavoro. Noi siamo in questa situazione: che il Governo ci propone di inserire l'espressione «valutare la possibilità», ma, mentre abbiamo una legge stabilità che in tre anni darà 21 miliardi di euro di sgravi alle imprese, abbiamo lo stesso provvedimento che praticamente non dà niente per le politiche attive del lavoro, e il Governo ci propone di valutare la possibilità. Nel primo caso per le imprese si danno 21 miliardi, nel secondo caso si valuta la possibilità. È anche questo il segno che indica da che parte state.	
ROBERTO GIACHETTI	PRESIDENTE	Passiamo ai voti. Indìco la votazione nominale, mediante procedimento elettronico, sull'ordine del Marcon n. 9/2660-A/38, con il parere contrario del Governo. Dichiaro aperta la votazione. (Segue la votazione). Paolo Russo, Grassi... Dichiaro chiusa la votazione. Comunico il risultato della votazione: Presenti 464 Votanti 442 Astenuti 22 Maggioranza 222 Hanno votato sì 109 Hanno votato no 333. La Camera respinge (Vedi votazioni). Prendo atto che il presentatore insiste per la votazione dell'ordine del giorno Scotto n. 9/2660-A/39, con il parere contrario del Governo. Passiamo ai voti. Indìco la votazione nominale, mediante procedimento elettronico, sull'ordine del Scotto n. 9/2660-A/39, con il parere contrario del Governo. Dichiaro aperta la votazione. (Segue la votazione). Totaro, Colaninno, Rotta, Palma... Intanto ne approfitto per salutare gli studenti e i docenti dell'Istituto comprensivo Caio Giulio Cesare di Osimo, in provincia di Ancona, che stanno assistendo ai nostri lavori dalle tribune e che ringrazio (Applausi). Ciò ci ha consentito di risolvere anche il problema dell'onorevole Palma. Dichiaro chiusa la votazione. Comunico il risultato della votazione: Presenti 452 Votanti 448 Astenuti 4 Maggioranza 225 Hanno votato sì 103 Hanno votato no 345. La Camera respinge (Vedi votazioni). (I deputati Segoni, Matarrelli e Terzoni hanno segnalato che non sono riusciti ad esprimere voto favorevole. I deputati Marantelli e Gianni Farina hanno segnalato che non sono riusciti ad esprimere voto contrario). Prendo atto che i presentatori non insistono per la votazione dei seguenti ordini del giorno, accettati dal Governo: Boccuzzi n. 9/2660-A/40, Baruffi n. 9/2660-A/41,Mura n. 9/2660-A/42, Miotto n. 9/2660-A/43. mentre invece c’è un parere contrario sull'ordine del giorno Calabria n. 9/2660-A/44.	
TERESA BELLANOVA	Sottosegretario di Stato per il lavoro e le politiche sociali	Chiedo di parlare.	
ROBERTO GIACHETTI	PRESIDENTE	Ne ha facoltà.	
