speaker	role	text	extra
FRANCA BIONDELLI	Sottosegretaria di Stato per il Lavoro e le politiche sociali	La ringrazio, Presidente. Con riferimento all’atto parlamentare dell’onorevole Pellegrino, che ringrazio, e altri, inerente alla vicenda del signor Colautti, dipendente dalla società Wartsila Italia Spa, passo ad illustrare quanto segue, sulla base di informazioni fornite dal competente ufficio territoriale del lavoro di Trieste e del Ministero della giustizia. Il signor Colautti è stato assunto nel 2005 dalla Wartsila Italia in qualità di addetto alle lavorazioni meccaniche con un contratto di inserimento, successivamente trasformato in contratto a tempo indeterminato. Ha ricoperto l’incarico di segretario provinciale della FIOM, con conseguente aspettativa sindacale, e il signor Colautti ha aderito, negli ultimi due anni, all’organizzazione USB, usufruendo di un periodo di aspettativa. Il 6 giugno 2017, al termine del proprio distacco, la società ha disposto il trasferimento del lavoratore dalla sede originaria di San Dorligo della Valle (Trieste) a quella di Taranto. L’organizzazione sindacale a cui appartiene il lavoratore lamenta che il trasferimento configuri una condotta antisindacale. Dagli accertamenti, su richiesta del Ministero del lavoro che rappresento, degli ispettori dell’Ufficio territoriale del lavoro di Trieste è emerso che, presso il sito di San Dorligo della Valle è tuttora presente il reparto di lavorazioni meccaniche, presso il quale il signor Colautti era stato adibito al momento dell’assunzione, pur avendo avuto tale reparto un ammodernamento tecnologico nell’ultimo periodo. Da ultimo, il Ministero della Giustizia ha riferito che lo scorso 3 luglio il signor Colautti ha presentato presso il tribunale di Trieste il ricorso ex articolo 700 del codice di procedura civile nei confronti della società Wartsila Italia. Con quest’atto introduttivo il ricorrente ha richiesto la declaratoria di illegittimità del proprio trasferimento dalla sede di Trieste a quella di Taranto. Lo scorso 28 luglio si è tenuta la prima udienza del procedimento cautelare, all’esito della quale il giudice, su istanza congiunta delle parti, ha fissato lo scorso 11 settembre una seconda udienza, finalizzata all’esperimento di un tentativo di conciliazione. L’udienza è stata successivamente rinviata per medesimi incombenti al prossimo 6 ottobre. Pertanto, in caso di esito negativo del tentativo di conciliazione, ogni valutazione in ordine alla legittimità del comportamento posto in essere da Wartsila Spa sarà rimessa alle statuizioni definitive della competente autorità giudiziaria.	
LUIGI DI MAIO	PRESIDENTE	La deputata Pellegrino ha facoltà di dichiarare se sia soddisfatta per la risposta alla sua interpellanza. Ha dieci minuti.	
SERENA PELLEGRINO		Grazie, Presidente. Sottosegretaria, quello che esprime con la sua risposta fa comprendere che, se non ci fossero state le sollecitazioni da parte del Parlamento, della popolazione tutta, che è scesa in piazza a sostegno di un lavoratore che manifestava tutto il diritto di dissidenza, la Wartsila avrebbe potuto agire in modo del tutto indisturbato, creando un precedente che legittimerebbe azioni che già moltissime aziende stanno attuando su tutto il territorio. Il fatto che situazioni come questa, illustrata nella nostra interpellanza, si verifichino nell’ambito di grandi aziende private multinazionali, non sposta la prospettiva di valutazione di merito e politica, e il Ministro del lavoro non può sottrarsi dal suo ruolo. Possiamo accettare che sia sempre la magistratura a intervenire dove la politica e il suo Governo sono assenti? Il formalismo delle risposte a cui siamo purtroppo abituati - non è questo il caso, sottosegretaria, purtroppo accade troppo spesso - ci sembra sufficientemente indicativo del fatto che siete costantemente in contraddizione tra un atteggiamento di sudditanza nei confronti del capitale - se poi è straniero, ovviamente ci rende ancora più piegati - e il fatto che siete costretti a definirvi pubblicamente di sinistra parlando per spot di tutela del lavoro. Invece di incentivare il lavoro, avete esaltato la flessibilità come una grande ed eccezionale conquista del lavoratore, che si è trasformata nella legalizzazione della precarietà: lavoretti purtroppo sottopagati e sempre meno tutelati. Con il Jobs Act e l’abolizione dell’articolo 18 avete reso insicuri anche i lavoratori a tempo indeterminato. Avete spianato la strada a un padronato sempre più arrogante nei rapporti con i propri dipendenti e nei confronti delle organizzazioni sindacali. Il caso di Sasha Colautti è emblematico, ed è l’essenza di quello che volevate ottenere con la vostra pseudo-riforma del lavoro. Chissà se vi siete resi conto dell’abuso di potere che avete lasciato a una multinazionale, che crede di poter ledere impunemente i diritti conquistati negli anni dai lavoratori italiani. Eppure, questa azienda, la società Wartsila Spa, è stata notevolmente supportata dalle finanze pubbliche. Le ricordo che la regione Friuli-Venezia Giulia e il Governo hanno partecipato, anche recentemente, ai tavoli di trattativa per evitare esuberi nello stabilimento di Trieste. E il ricatto occupazionale, anche questa volta, è servito per far entrare risorse pubbliche nelle casse dell’azienda, denaro di cittadini che dovevano andare a tutelare i lavoratori e non generare mobbing. La società Wartsila Spa, infatti, per evitare licenziamenti, si è vista assegnare 900 mila euro dalla regione Friuli-Venezia Giulia, e 2,8 milioni di euro dal Governo: risorse provenienti dal Fondo per la crescita sostenibile per sostenere il progetto di sviluppo da parte della società di tecnologie innovative nell’unità produttiva di Trieste. Noi riteniamo che decisioni così gravi della dirigenza italiana del gruppo finlandese devono venire considerate anche all’interno delle stesse dinamiche che producono l’intervento economico pubblico a sostegno dell’occupazione dei lavoratori e del profitto della proprietà. Certi provvedimenti non possono essere unilaterali, vanno considerati anche in forza della rilevanza degli interventi pubblici effettuati e non soltanto in base alla garanzia costituzionale della rappresentanza sindacale e della libertà d’associazione. È per questo, sottosegretaria, che le dico che vi staremo con il fiato sul collo, per ottenere da voi, davvero, un impegno concreto, una posizione chiara da parte del suo Ministero. Le riforme vanno fatte, ma a vantaggio del lavoro e non del capitale. Il primo articolo della Costituzione è chiaro ed inequivocabile, e i padri costituenti lo sapevano bene che il rischio di venderci al capitale era sull’uscio di ogni scelta di qualsiasi Governo. Lo Statuto dei lavoratori, conquistato con grande fatica, è diventato, ahimè e ahinoi, carta straccia nelle mani del mito della globalizzazione. Vorrei ricordarle, sottosegretaria, una figura emblematica della storia della nostra Repubblica, il socialista Giacomo Brodolini, uno dei padri dello Statuto dei lavoratori, diventato Ministro del lavoro. Ebbene, questo Ministro amava dire di essere Ministro dei lavoratori, non del lavoro. E voi, con il Jobs Act, di chi siete rappresentanti?	
			Organizzazione dei tempi di esame di mozioni.
LUIGI DI MAIO	PRESIDENTE	così esaurito lo svolgimento delle interpellanze urgenti all'ordine del giorno.	
			Ordine del giorno della prossima seduta.
LUIGI DI MAIO	PRESIDENTE	Avverto che nell’Allegato A al resoconto stenografico della seduta odierna sarà pubblicato lo schema recante l’organizzazione dei tempi per l’esame delle mozioni Quartapelle Procopio ed altri n. 1-01714 e Rondini ed altri n. 1-01715, concernenti la candidatura di Milano quale sede dell’Agenzia europea per i medicinali, e della mozione Martelli ed altri n. 1-01716, concernente iniziative per prevenire e contrastare la violenza contro le donne (Vedi l’allegato A).	
			La seduta termina alle 10,40.
			IL CONSIGLIERE CAPO
			DEL SERVIZIO RESOCONTI
			ESTENSORE DEL PROCESSO VERBALE
			Dott. Renzo Dickmann
			Licenziato per la stampa alle 15,10.
