speaker	role	text	extra
MASSIMO ENRICO BARONI		Signor Presidente, mi inserisco all'interno della discussione sulle linee generali cercando di mettere in luce alcune situazioni e di sollecitare un dibattito che spero verrà raccolto anche domani e nei giorni successivi. Relativamente all'aspetto culturale di questa proposta di legge, bisogna fare un inciso, Presidente: qui si vuole cercare di giustificare un fallimento istituzionale italiano, soprattutto dato dalla politica, per cercare di mantenere uno status quo. Questo status quo è della casta italiana; noi ad esempio sappiamo che circa 33 mila politici in Italia danno lavoro su chiamata diretta a oltre un milione e cinquanta mila italiani. Allora, di questi 33 mila, abbiamo mille parlamentari e poi tutti i consiglieri regionali, comunali e quant'altro. La cifra di un milione e cinquanta mila ovviamente comprende anche il collegio dei sindaci e il collegio dei revisori; allora il potere che ha la politica, che ha la casta dei politici e dei loro amici all'interno delle partecipate, è impressionante. È per questo che noi vediamo costantemente sempre le stesse persone da vent'anni che ci governano e che si palleggiano questo tipo di governo, nonostante abbiano fatto le più emerite schifezze in ambito istituzionale e siano riusciti a passarla liscia con prescrizioni delle cose che in altri Paesi sarebbero assolutamente incomunicabili per il tasso di vergogna che solleciterebbero in un cittadino normale. In merito a uno degli ultimi interventi, quindi quando si parla di aborrire la cultura dell'indagine o la cultura del sospetto, ricordiamo al collega che la cultura dell'indagine – di cui il MoVimento 5 Stelle in questo momento si fa portatore, anche attraverso un sano sospetto nei confronti di colleghi che godono di troppi benefici e di troppe prerogative per poter lavorare in maniera circostanziata – è stata una delle migliori cose che è successa all'interno della riforma della psichiatria europea, perché nel momento in cui noi avevamo le culture totalizzanti, i manicomi e i nosocomi in cui prendevamo delle persone e le buttavamo, ai tempi del Basaglia, in queste strutture in cui qualsiasi cosa dicevano non venivano credute, la cultura dell'indagine riuscì a fare una riforma attraverso la psychothérapie institutionnelle all'interno dei manicomi francesi, mettendo sotto indagine in maniera culturale gli stessi ospedali e aprendo alla comunità, aprendo una discussione in cui i portatori di interessi, i capi, i medici, i responsabili di queste strutture totalizzanti erano i primi a mettersi in discussione. Noi abbiamo avuto bisogno di Basaglia che a un certo punto ha fatto incavolare la cittadinanza italiana, è riuscito a portarsi dietro un po’ di cittadini, ha fatto chiudere delle strutture assolutamente aberranti e chissà quanti, a partire dalla Merini, sono stati là dentro a denunciare fatti e situazioni di potenti che erano assolutamente vergognosi. Quindi un po’ di cultura dell'indagine applicatela prima ai vostri partiti, applicatela prima ai vostri microambiti organizzativi e istituzionali prima di cercare di rendere all'acqua di rosa una proposta di legge che molti Paesi in Europa ci hanno chiesto come urgente, la stessa legge Severino deriva da questo mandato internazionale, nel tentativo di eliminare un po’ di corruzione in questa bistrattata Italia in cui solo nella sanità abbiamo 6 miliardi accertati di corruzione continuativa. Allora cosa si pensa di fare in Commissione ? Si pensa di fare, con grande attenzione ma con finta distrazione, Presidente, di fatto svuotare completamente una legge molto articolata, con degli articoli semplici di tre o quattro righe, e riempirla completamente del testo del PD, che sostanzialmente è il testo Ferranti. Il testo Ferranti, che è arrivato con grandissimo ritardo all'interno della discussione e che adesso, con un incredibile colpo di mano, velocissimo, in cui l'occhio non si è reso conto di quello che è successo perché la mano è stata più veloce, ci ritroviamo a discutere con la facciata del MoVimento 5 Stelle. Noi ovviamente chiedevamo di più, il benchmark che chiedevamo di raggiungere era assolutamente più alto, era un benchmark di tipo europeo. È inutile parlare del fatto che noi vogliamo scimmiottare gli americani quando dobbiamo andare dietro a loro in politiche estere, in decisioni strategiche in cui abbiamo situazioni in cui siamo completamente esclusi, e invece, per cercare di rigenerare uno stato culturale, per cercare anche di creare una situazione in cui non tiriamo dentro come al solito il buono e il bello dei sindacati – in questo momento veramente in tanti qui dentro dovremmo criticare il lavoro dei sindacati, il cui mandato sociale è stato tradito, è stato tradito da anni, perché il loro lavoro di denuncia anche delle istituzioni politiche, dei più forti rispetto ai più deboli, non avviene più – tutto viene messo e liquefatto all'interno di profumo di rose ed è il profumo di rose che ci vuole proporre il PD, mentre noi proviamo anche a responsabilizzare i cittadini attraverso magari una proposta che possa anche far discutere e coinvolgere i cittadini nella manutenzione onesta delle proprie istituzioni, magari attraverso un living learning. Non sarà la proposta migliore sulla faccia di questa terra, perché la proposta migliore ancora deve essere scritta, ma sicuramente è una proposta innovativa, se addirittura Confindustria arriva a dire che è l'anello mancante per cercare di far funzionare un livello industriale, un livello impiegatizio, un livello lavorativo, che possa essere degno del fatto che noi vogliamo escludere l'omertà, vogliamo tentare di dare una premialità, anche come sperimentazione – perché no ? – per vedere magari poi fra due o tre anni. La legge Severino è stata fatta allo stesso identico modo. È la stessa cultura istituzionale che ha portato alla scrittura della legge Severino. Se fosse stato per il PD, se fosse stato per il centrodestra, la legge Severino non sarebbe mai stata scritta. Questa legge viene dall'Europa, ed è una legge che vuole e pretende la trasparenza nelle istituzioni, che chiede un segnalatore. È un whistleblower debole quello all'interno della legge Severino. Noi con questa proposta chiediamo di rafforzarlo. Abbiamo chiesto come mai non c’è stato questo dialogo, questo tentativo di porre degli emendamenti nel merito dell'articolato quando questo articolato è stato completamente stravolto. È stata sostituita una legge con un'altra, non si sa bene mandata da chi. Per entrare nel merito, l'inversione dell'onere della prova è un altro tentativo di scuotere un pochino queste istituzioni e questa politica comunque troppo spesso corrotta, nel momento in cui poi le istituzioni, che sono asservite a una politica collusa, si trovano magari con i sindacati, come diceva prima la mia collega del PD, che vanno a denunciare il fatto che in tutte le ospedalità private del Lazio vengono messi i lavoratori in cassa integrazione oppure vengono messi con contratto di solidarietà, nel momento in cui i bilanci non giustificano questo tipo di passaggio, questo tipo di constatazione istituzionale. Però il sindacato controlla il bilancio, ma non va a vedere che i soldi sono spariti dalla società e se è stata fatta una partita di giro. Allora abbiamo licenziamenti collettivi, abbiamo cassa integrazione, perché c’è il ricatto occupazionale, allora abbiamo dei sindacati più deboli con poca pubblicità che denunciano la triplice, che denunciano le associazioni di categoria, gli stakeholder che difendono questi portatori di interesse da centinaia di milioni di euro. Abbiamo per esempio l'AIOP, l'associazione italiana ospedalità privata, in cui il direttore generale è tale Casanatta che riceve la triplice per quanto riguarda i problemi dei lavoratori con l'ospedalità privata. Questo Casanatta è stato arrestato ed è tuttora il direttore generale ed è lui che accoglie tutte queste segnalazioni, visto che si dice che l'istituzione giuridica italiana già prevede tutte queste belle cose. È lui che accoglie queste segnalazioni da parte della triplice ed è lui che è stato rinviato a giudizio con mister sanità del Lazio per la truffa dell'ex San Raffaele di Velletri di 160 milioni di euro. Il plenipotenziario della Tosinvest, lui, e Angelucci. Allora magari non avremmo potuto intercettare prima se avessimo avuto una legge sul whistleblower potente, forte, sperimentale ? Abbiamo aspettato che si arrivasse a 160 milioni di euro sottratti dalle casse pubbliche, prima che arrivasse la magistratura. Non riusciamo a creare delle istituzioni, dei filtri intermedi, in cui semplicemente si prova a istituire il fatto che ci si controlla anche attraverso delle premialità, anche attraverso l'inversione dell'onere della prova, perché poi alla fine c’è un giudizio. Abbiamo tre gradi di giudizio e, se permettete, non mi basta che al primo grado di giudizio deve fermarsi tutto, perché è facile «buttarla in caciara». Io a un certo punto mi scappa una brutta parola, ho detto un'imperfezione all'interno di una denuncia molto più ampia, e mi becco subito la condanna per diffamazione, magari per un decimo della segnalazione che ho fatto, e il novanta per cento viene buttato a mare ? Allora questo è il modo di «buttarla in caciara» che fanno gli studi legali dei potenti, che riescono a mettersi lì a spendere molti soldi e chi sta indietro rispetto a tutele giuridiche, economiche e sociali, si trova sempre col cerino in mano. Io vi posso dire che in un ente pubblico non economico c’è stata una segnalazione potentissima in merito a un conflitto di interessi di un presidente di un ordine professionale e una grande casa sanitaria di prodotti che sta sponsorizzando questa persona, e il responsabile anticorruzione di questo ente pubblico non economico, mi perdoni Presidente, è nella merda fino al collo.	
ROBERTO GIACHETTI	PRESIDENTE	Non la perdono e se ripete questo termine le tolgo la parola.	
MASSIMO ENRICO BARONI		Benissimo, era per rendere l'idea, Presidente.	
ROBERTO GIACHETTI	PRESIDENTE	Oltre l'idea, ha reso anche un linguaggio che qui dentro non si usa, almeno quando presiedo io. Quindi, la prego di andare avanti, usando un linguaggio consono a quest'Aula. Può riuscirci !	
MASSIMO ENRICO BARONI		Benissimo, quindi queste sono solo alcune delle constatazioni che vengono fatte del mancato dibattito in Commissione. Ogni tanto bisogna anche dire una parolaccia per risvegliare il fatto che ci sono delle altre vie, che c’è un'altra possibilità di fare le cose. Io ho una cittadinanza americana e so benissimo che, in alcune situazioni, la legge americana funziona meglio che le leggi di tipo latino, perché sono rimaste vecchie, obsolete e non riusciamo a fare questi innesti. Dobbiamo fare arrivare Monti, con la Bocconi, per fare delle cose semplici come queste ? Allora la discussione che è stata chiusa all'interno della Commissione volete liquefarla all'interno di una discussione anche più ampia ? Noi non ve lo permetteremo. Voi state levando una possibilità ai cittadini, state levando una possibilità alle istituzioni di avvicinarsi ai cittadini, semplicemente indebolendo una proposta di legge molto forte, levando il meccanismo della premialità, rendendolo generico, come se parlassimo a dei bambini: «sì, poi dopo vi daremo una premialità non meglio specificata». Questa persona si sta giocando tutto, magari per una questione di principio, però noi alle questioni di principio qua dentro, Presidente, chissà come mai, proprio qua dentro, non ci crediamo.	
ROBERTO GIACHETTI	PRESIDENTE	iscritto a parlare l'onorevole Vazio. Ne ha facoltà.	
FRANCO VAZIO		Grazie, Presidente, se fossimo all'esame di avvocati o di magistratura questo intervento lo bollerebbero come non giudicabile, perché fuori tema. Più che un intervento, una discussione generale, mi pare un comizio afferente cose che non c'entrano proprio nulla con questa legge. La corruzione e i fatti illeciti non devono essere repressi perché così è statuito nel codice penale, ma anche, ad oggi, soprattutto, per i riflessi che tali fenomeni producono nell'economia e nelle relazioni internazionali del Paese, e noi lo sappiamo bene, perché in questa direzione ci siamo mossi. Il contesto in cui si fa impresa incide, infatti, in modo sostanziale sulla possibilità di aumentare la produttività, di allocare le risorse, verso comparti e imprese più competitive. È evidente che un sistema efficiente, in cui la legalità assume un significato pregnante e reale, favorisce innovazioni, imprenditorialità, e rimuove rendite di posizione e restrizioni alla concorrenza. Come ha avuto modo di ribadire in più circostanze il Governatore della Banca d'Italia, Ignazio Visco, il rispetto della legalità svolge un ruolo fondamentale. La criminalità organizzata, la corruzione e l'evasione fiscale, non solo indeboliscono la coesione sociale, ma hanno anche effetti deleteri sull'allocazione delle risorse finanziarie, umane e sull'efficacia delle riforme in atto. Noi sappiamo che questi dati e questa situazione trovano conferme e riscontro anche in atti comunitari e non vi è dubbio che per affrontare tutto ciò non siano sufficienti solo norme repressive, ma ad esse devono essere accompagnate politiche di controllo e di prevenzione particolarmente incisive. Servono politiche preventive, forti, che includano norme etiche di sensibilizzazione e che consentano di avere piena ed immediata conoscenza, meccanismi di controllo, sia esterni che interni, cioè una trasparenza vera. Fatta questa premessa mi sento di affermare che in questi ultimi anni, sebbene vi sia ancora molta strada da percorrere, per quanto riguarda il nostro Paese, alcuni passi importanti, nella giusta direzione, sono stati fatti. La legge n. 190 del 2012 rappresenta, infatti, un provvedimento legislativo che contiene in sé principi e norme di contrasto e di indirizzo molto forti, un provvedimento a cui ne sono seguiti altri, che hanno dato ancora maggiore esecuzione a quel principio. Ricordo che è proprio a partire dalla legge n. 190 del 2012 che si è costituita l'Autorità nazionale anticorruzione, che si sono dettate specifiche misure volte alla trasparenza dell'attività amministrativa e che si è prevista una tutela del dipendente pubblico che denuncia e riferisce di condotte illecite apprese in ragione del suo rapporto di lavoro. Ed è con il decreto-legge n. 90 del 2014 che il Governo e il Parlamento hanno definito la funzione dell'Autorità nazionale anticorruzione, oggi guidata da Cantone, ed alla stessa hanno assegnato i poteri già in capo all'Autorità di vigilanza sui contratti pubblici. Il 27 maggio di quest'anno il Parlamento ha poi approvato la legge n. 69, la legge anticorruzione, che prevede strumenti più stringenti contro il crimine, misure più repressive, più efficaci e pene più severe. Nell'animo di chi, come me, ha approvato questi provvedimenti c’è la convinzione di essere andati nella giusta direzione, di avere aumentato da un lato la forza repressiva – pensiamo al patteggiamento condizionato e alla restituzione del maltolto – , di avere adeguato dall'altro lato le pene alla grande disapprovazione sociale di questi fenomeni delittuosi, di avere assegnato all'Autorità nazionale anticorruzione poteri necessari ed importanti per contrastare in via preventiva il fenomeno della corruzione, nonché un potere di intervento più ampio ed integrato per quanto riguarda le funzioni finalizzate ad assicurare un'azione coordinata nell'attività di controllo, di prevenzione e di contrasto. Questo è sufficiente ? Tutto ciò riuscirà a ridurre l'odioso e grave fenomeno della corruzione generale e dell'illegalità ? Sono domande alle quali solo il tempo potrà dare un'efficace risposta. È importante, però, che la politica e le istituzioni non si fermino. È in questo quadro che si inserisce la discussione di questa legge whistleblowing, sulla tutela dei dipendenti che segnalano illeciti. Ebbene sono già quasi 250 anni da quando Benjamin Franklin, il primo whistleblower della storia, denunciò il governatore del Massachusetts per accordi con il Governo inglese contro i coloni americani. Ebbene, dopo 250 anni, a me pare che il nostro Paese abbia fatto dei passi importanti con la legge n. 190 del 2012 e oggi con questa riforma. Io non sono assolutamente d'accordo su quanto ha detto il collega sul lavoro fatto dalla Commissione perché, se noi andiamo a rileggere le audizioni, ci dicono che siamo andati proprio nella direzione giusta, probabilmente migliorabile, ma nella direzione giusta. Cantone, che viene citato anche da chi ha voluto criticare questa proposta di legge, dice che la normativa internazionale, nonché le raccomandazioni autorevoli dei tavoli internazionali ai quali l'Italia partecipa, non distinguono tra sfera pubblica e sfera privata, intendendo che l'istituto del whistleblower debba applicarsi ad entrambe le situazioni. E, ancora, dice che il completamento del sistema normativo andrebbe realizzato attraverso una modifica della legge n. 190 del 2012, eventualmente anche in raccordo con la disciplina di cui al decreto legislativo 8 giugno 2001 n. 231, cioè recante responsabilità amministrative da reato, e quindi non attraverso una legge asistematica e non interna ad un piano normativo già previsto. E, ancora, è la Confindustria che ci dice nell'audizione che noi abbiamo fatto nelle varie Commissioni, che è l'occasione per raccordare la nuova disciplina con la responsabilità amministrativa degli enti e sarebbe opportuno prevedere che il sistema di tutela del segnalante adottato venga valutato ai fini del giudizio di idoneità del modello organizzativo del decreto legislativo n. 231. Ma ci dicono anche degli aspetti di criticità delle quali la Commissione doveva e non poteva non tenere conto, perché altrimenti non si fanno le audizioni: non si fa nulla, si fa autonomamente un processo legislativo. Ma, quando si fanno le audizioni, di queste bisogna tenere conto. E ci dice che il concetto di buona fede, così com'era introdotto nella legge, era un concetto molto opaco, non specificato. E ci dice ancora in queste audizioni che le garanzie di protezione del segnalante devono essere equilibrate, anche con una deterrenza rispetto a denunce non fondate e soprattutto considera essenziale realizzare un contemperamento, appunto, tra l'esigenza di introdurre un'efficace tutela dei whistleblower e quella di salvaguardare l'autonomia degli operatori economici. Quello che viene portato oggi all'esame è un testo che certamente è coordinato ed inserito nel sistema ed è certamente una norma di cui parla il decreto legislativo n. 231. Ed è certamente un testo, questo sì, più equilibrato, nel quale vi sono garanzie e contrappesi tra whistleblower e denunce temerarie. Certo, c’è un concetto maggiormente specificato di buona fede da parte di chi denuncia, ma io credo che, sotto questo profilo, l'Aula con una discussione attenta potrà ulteriormente migliorare questo testo. Infatti dobbiamo andare in una direzione di maggiore tutela, ma anche di maggiore attenzione. Credo che gli emendamenti che sono stati presentati e che hanno, a dire del MoVimento 5 Stelle, stravolto questa proposta di legge – che poi in realtà è un alto progetto di legge che mi vede anche cofirmatario –, abbiano fatto un buon lavoro, proprio nella direzione che ci è stata enunciata da coloro che sono venuti in Commissione a darci un'indicazione. Non voglio ripercorrere gli articoli di legge, perché bene ha fatto il relatore. Cosa si può fare ? Io credo che la discussione, se è una discussione vera, potrà migliorare questo testo. Non dobbiamo fare dei comizi in quest'Aula: dobbiamo cercare di fare i legislatori per migliorare i testi che ci vengono portati all'esame. Noi abbiamo una disponibilità a valutare proposte emendative per migliorare questo testo. E cosa non si deve fare ? Presidente, noi non dobbiamo riempirci gli occhi di demagogia. Penso a quello che la relatrice Businarolo ha lanciato alla stampa, che il Partito Democratico è dalla parte dei corrotti. Io ricordo al Movimento, al quale appartiene questa collega, che, quando si è votato in quest'Aula sull'anticorruzione, quando si è votato il voto di scambio politico mafioso, quando si è deciso di introdurre il reato di autoriciclaggio e di falso in bilancio, il Partito Democratico ha votato a favore e il MoVimento 5 Stelle ha votato invece contro questi provvedimenti. Quindi, quando si parla di trasparenza e di decisione nell'indicazione della direzione delle leggi, si deve tenere conto che poi queste passano attraverso le scelte in quest'Aula. Noi eravamo a favore di queste cose, voi eravate contro, come sempre lo siete stati. E allora, quando si antepone la pubblicità e la progressione personale rispetto agli interessi del Paese, si commette uno sbaglio. Così come è uno sbaglio pensare sempre di avere in tasca la verità. Faccio un riferimento e faccio un esempio ai colleghi del MoVimento 5 Stelle: poche settimane fa plaudivano e irridevano il Parlamento, dicendo che l'introduzione del falso in bilancio è stata una cattiva norma, perché era una norma che prendeva in giro la magistratura, perché la magistratura aveva sconquassato quella norma realizzata e approvata dal Parlamento. Ricordo a questi colleghi che bisogna essere pazienti e pensare che la verità non è sempre nelle proprie tasche. È proprio di queste ore – parlo di qualche giorno fa – una sentenza nuova della Corte di cassazione, della V sezione, proprio la stessa a cui facevano riferimento questi colleghi, che dice: sul falso in bilancio avete fatto bene, quella norma si applica anche quando non si riferiscono solamente i fatti materiali, ma anche quando si parla di elementi valutativi. Quindi, bisogna avere più prudenza e sapere che, a volte, la pazienza e l'attenzione delle norme fanno fare dei passi in avanti. Il PD ha imboccato una strada di vero cambiamento, per quanto riguarda le leggi sulla giustizia contro i corrotti, per rimuovere una profonda illegalità, che nel Paese sussisteva e della quale noi credo ci dobbiamo fare carico, come una colpa collettiva, non come una colpa di partito, perché questa non ci appartiene. Credo che, sotto questo profilo, il PD ha imboccato una strada vera, una strada forte, perché parlano gli atti approvati, non sono comizi nelle piazze. Ebbene, io credo che governare questo Paese significa assumersi le responsabilità delle scelte, proprio quello che noi abbiamo fatto, quello che stiamo facendo e che faremo anche con questo provvedimento di legge. Noi ci assumiamo le responsabilità, noi non fuggiamo di fronte a fatti incresciosi che sono accaduti e ce ne assumiamo la responsabilità, cercando di cambiare le leggi che non funzionano. Questo il MoVimento 5 Stelle non lo ha fatto, non lo ha fatto ieri, non l'ha fatto oggi e presumo che, con gli interventi di quest'oggi, ci dica anche che non lo farà neanche domani (Applausi dei deputati del gruppo Partito Democratico).	
			(Repliche delle relatrici e del Governo – A.C. 3365-A)
ROBERTO GIACHETTI	PRESIDENTE	Non vi sono altri iscritti a parlare e pertanto dichiaro chiusa la discussione sulle linee generali.	
ROBERTO GIACHETTI	PRESIDENTE	Ancorché abbia terminato il tempo, concedo qualche ulteriore minuto per replicare alla relatrice Francesca Businarolo.	
FRANCESCA BUSINAROLO	Relatrice per la II Commissione	Grazie Presidente, visto che ho pochi minuti volevo solo replicare a qualche questione che è stata sollevata durante la discussione. La prima che mi ha colpito riguarda soprattutto la questione culturale, perché l'Italia sembra che per alcuni, che purtroppo non sono più presenti in Aula, non sia abbastanza matura per un provvedimento del genere. Addirittura ho sentito parlare di Germania Est ! Io voglio ricordare a chi ha fatto questa citazione infausta che questi tipi di provvedimenti, con questi tipi di tutele, sono applicati nei più evoluti sistemi giuridici internazionali, partendo dall'America, che lo applica dal 1986, alla Gran Bretagna, alla Francia, alla Germania, addirittura alla Romania ! Quindi altro che Germania Est ! Per quanto riguarda poi il provvedimento nel merito, io mi sono sentita veramente presa in giro in queste ultime dichiarazioni perché mi si dice che noi votiamo contro e non facciamo le proposte ! Ecco, continua il monologo legislativo del Partito Democratico, perché democratico non è in quanto questa proposta, che ripeto era in quota minoranza, è stata completamente svuotata di qualsiasi requisito di iniziativa del MoVimento 5 Stelle, quindi trovo che sia veramente inappropriato additarci come quelli che non vogliono far qualcosa, anzi vi dirò che questo provvedimento sarà il primo che faremo quando andremo al governo, così vi togliete anche lo sfizio di andarlo a dire in giro. L'ultima cosa e concludo, io trovo che la vostra proposta, che non va in nessuna maniera a innestarsi, non ha neanche provato a guardare la proposta del MoVimento 5 Stelle, che è a mia prima firma, sia gravemente deterrente. Ostacolate troppo, ponete troppi limiti ai dipendenti, di conseguenza non ci sarà quella rivoluzione che serve, che l'Italia chiede, che i dipendenti pubblici chiedono, perché ne ho incontrati tanti e tanti mi scrivono e tanti li conosco, che vogliono segnalare; segnalano, però poi restano bloccati, non riescono ad avere un avanzamento di carriera e anzi sono continuamente monitorati e non hanno quel riconoscimento di valore che la loro scelta coraggiosa meriterebbe. Presidente concludo e la ringrazio ancora.	
ROBERTO GIACHETTI	PRESIDENTE	Ha facoltà di replicare l'onorevole Casellato.	
