speaker	role	text	extra
ANTONIO LEONE	PRESIDENTE	L'ordine del giorno reca la votazione per schede per l'elezione del Presidente della Camera. Avverto che, a norma dell'articolo 4, comma 2, del Regolamento, trattandosi del primo scrutinio è richiesta per l'elezione la maggioranza dei due terzi dei componenti la Camera. Conformemente alla prassi relativa alle votazioni per schede la chiama sarà effettuata secondo l'ordine alfabetico. Avverto altresì che ciascun deputato, dopo essere stato chiamato, all'atto di accedere al corridoio di votazione, riceverà dagli assistenti parlamentari una scheda sulla quale potrà indicare un solo nominativo. Le schede recanti più di un nominativo saranno dichiarate nulle. Avverto inoltre che, avendo taluni deputati lo stesso cognome, ove si intenda votare per uno di essi, occorrerà indicare sulla scheda, ai fini dell'attribuzione del voto, sia il cognome sia il nome dell'interessato. In mancanza dell'indicazione del nome il voto sarà considerato nullo (in questo senso vi è un precedente della seduta del 28 aprile 2006). Per agevolare le operazioni di voto, invito i deputati ad avvicinarsi al banco della Presidenza, seguendo il proprio turno di votazione che è evidenziato sul tabellone elettronico, evitando quindi di stazionare nell'emiciclo e di rendere così più difficoltosa l'espressione del voto. Indico la votazione per schede per l'elezione del Presidente della Camera e invito i deputati segretari a procedere alla chiama dei deputati. (Segue la votazione). Dichiaro chiusa la votazione. A norma dell'articolo 6, comma 1, del Regolamento, procederò, coadiuvato dai deputati segretari, allo spoglio delle schede. Vorrei avvisare i colleghi sull'ordine dei lavori, nell'attesa che arrivino le urne: all'esito dello spoglio, la seduta sarà sospesa per circa un quarto d'ora-venti minuti, per riprendere poi con il secondo scrutinio che dovrebbe durare ancora due ore e mezza circa. Si riprenderà con il terzo scrutinio forse intorno alle 18, per poi completare i tre scrutini previsti dal timing dato a questa seduta per arrivare sino alle 20,30 circa per chiudere il terzo scrutinio. Così ognuno si può regolare. (Segue lo spoglio delle schede). Comunico il risultato della votazione: Presenti e votanti 618 Maggioranza dei due terzi dei componenti l'Assemblea 420 Hanno ottenuto voti: Roberto Fico 108; Daniele Marantelli 6. Voti dispersi 21 Schede bianche 459 Schede nulle 24 Poiché nessun deputato ha riportato la maggioranza dei due terzi dei componenti la Camera, prescritta dall'articolo 4, comma 2, del Regolamento, sarà necessario procedere ad una nuova votazione che avrà luogo alle ore 14,45. Hanno preso parte alla votazione: Abrignani Ignazio Adornato Ferdinando Agostinelli Donatella Agostini Luciano Agostini Roberta Aiello Ferdinando Airaudo Giorgio Albanella Luisella Alberti Dino Alfano Angelino Alfano Gioacchino Alfreider Daniel Alli Paolo Amato Maria Amendola Vincenzo Amici Sesa Antezza Maria Anzaldi Michele Archi Bruno Argentin Ileana Arlotti Tiziano Artini Massimo Ascani Anna Attaguile Angelo Baldassarre Marco Baldelli Simone Balduzzi Renato Barbanti Sebastiano Baretta Pier Paolo Bargero Cristina Baroni Massimo Enrico Baruffi Davide Basilio Tatiana Basso Lorenzo Battaglia Demetrio Battelli Sergio Bazoli Alfredo Bechis Eleonora Bellanova Teresa Benamati Gianluca Benedetti Silvia Beni Paolo Bergamini Deborah Berlinghieri Marina Bernardo Maurizio Bernini Massimiliano Bernini Paolo Berretta Giuseppe Bersani Pier Luigi Bianchi Dorina Bianchi Mariastella Bianchi Nicola Biancofiore Michaela Bianconi Maurizio Biasotti Sandro Biffoni Matteo Bindi Rosy Binetti Paola Bini Caterina Biondelli Franca Blazina Tamara Bobba Luigi Bocci Gianpiero Boccia Francesco Boccuzzi Antonio Boldrini Laura Bolognesi Paolo Bombassei Alberto Bonaccorsi Lorenza Bonafè Simona Bonafede Alfonso Bonavitacola Fulvio Bonifazi Francesco Bonomo Francesca Bordo Franco Bordo Michele Borghese Mario Borghesi Stefano Borghi Enrico Borletti Dell'Acqua Buitoni Ilaria Carla Anna Boschi Maria Elena Bosco Antonino Bossa Luisa Braga Chiara Bragantini Matteo Bragantini Paola Brambilla Michela Vittoria Brandolin Giorgio Bratti Alessandro Bray Massimo Brescia Giuseppe Bressa Gianclaudio Brugnerotto Marco Brunetta Renato Bruno Franco Bruno Bossio Vincenza Bueno Renata Buonanno Gianluca Burtone Giovanni Mario Salvino Busin Filippo Businarolo Francesca Busto Mirko Buttiglione Rocco Calabria Annagrazia Calabrò Raffaele Campana Micaela Cancelleri Azzurra Pia Maria Cani Emanuele Caon Roberto Caparini Davide Capelli Roberto Capezzone Daniele Capodicasa Angelo Capone Salvatore Capozzolo Sabrina Capua Ilaria Carbone Ernesto Cardinale Daniela Carella Renzo Carfagna Maria Rosaria Cariello Francesco Carinelli Paola Carnevali Elena Carocci Mara Carra Marco Carrescia Piergiorgio Carrozza Maria Chiara Caruso Mario Casati Ezio Primo Casellato Floriana Casero Luigi Caso Vincenzo Cassano Franco Castelli Laura Castiello Giuseppina Castiglione Giuseppe Castricone Antonio Catalano Ivan Catania Mario Catanoso Genoese Francesco detto Basilio Catanoso Causi Marco Causin Andrea Cecconi Andrea Cenni Susanna Censore Bruno Centemero Elena Cera Angelo Cesa Lorenzo Cesaro Antimo Cesaro Luigi Chaouki Khalid Chiarelli Gianfranco Giovanni Chimienti Silvia Cicchitto Fabrizio Cicu Salvatore Cimbro Eleonora Cimmino Luciano Ciprini Tiziana Cirielli Edmondo Civati Giuseppe Coccia Laura Colaninno Matteo Colletti Andrea Colonnese Vega Cominardi Claudio Cominelli Miriam Coppola Paolo Corda Emanuela Corsaro Massimo Enrico Coscia Maria Costa Enrico Costantino Celeste Cota Roberto Cova Paolo Covello Stefania Cozzolino Emanuele Crimì Filippo Crimi Rocco Crippa Davide Crivellari Diego Culotta Magda Cuperlo Giovanni Currò Tommaso Dadone Fabiana Daga Federica D'Agostino Angelo Antonio D'Alessandro Luca D'Alia Giampiero Dallai Luigi Dall'Osso Matteo Dal Moro Gian Pietro D'Ambrosio Giuseppe Dambruoso Stefano D'Arienzo Vincenzo D'Attorre Alfredo Da Villa Marco Decaro Antonio De Girolamo Nunzia Del Basso De Caro Umberto Del Grosso Daniele Dellai Lorenzo Dell'Aringa Carlo Della Valle Ivan Dell'Orco Michele De Lorenzis Diego De Maria Andrea De Menech Roger De Micheli Paola De Rosa Massimo Felice Di Battista Alessandro Di Benedetto Chiara Dieni Federica Di Gioia Lello Di Lello Marco Di Maio Luigi Di Maio Marco D'Incà Federico D'Incecco Vittoria Di Salvo Titti Distaso Antonio Di Stefano Fabrizio Di Stefano Manlio Di Vita Giulia Donati Marco D'Ottavio Umberto Duranti Donatella D'Uva Francesco Epifani Ettore Guglielmo Ermini David Fabbri Marilena Faenzi Monica Famiglietti Luigi Fantinati Mattia Fanucci Edoardo Faraone Davide Farina Daniele Farina Gianni Fassina Stefano Fauttilli Federico Fava Claudio Fava Giovanni Fedi Marco Fedriga Massimiliano Ferranti Donatella Ferrara Ciccio Ferraresi Vittorio Ferrari Alan Ferro Andrea Fiano Emanuele Fico Roberto Fiorio Massimo Fioroni Giuseppe Fitto Raffaele Folino Vincenzo Fontana Cinzia Maria Fontana Gregorio Fontanelli Paolo Formisano Aniello Fossati Filippo Fraccaro Riccardo Fragomeli Gian Mario Franceschini Dario Fratoianni Nicola Fregolent Silvia Frusone Luca Fucci Benedetto Francesco Furnari Alessandro Gadda Maria Chiara Gagnarli Chiara Galan Giancarlo Galati Giuseppe Galgano Adriana Galli Carlo Galli Giampaolo Gallinella Filippo Gallo Luigi Gallo Afflitto Riccardo Antonio Galperti Guido Gandolfi Paolo Garavini Laura Garnero Santanchè Daniela Garofalo Vincenzo Garofani Francesco Saverio Gasbarra Enrico Gasparini Daniela Matilde Maria Gebhard Renate Gelli Federico Gelmini Mariastella Genovese Francantonio Gentiloni Silveri Paolo Ghizzoni Manuela Giachetti Roberto Giacobbe Anna Giacomelli Antonello Giacomoni Sestino Giammanco Gabriella Gigli Gian Luigi Ginato Federico Ginefra Dario Ginoble Tommaso Giordano Giancarlo Giordano Silvia Giorgetti Alberto Giorgetti Giancarlo Giorgis Andrea Gitti Gregorio Giuliani Fabrizia Giulietti Giampiero Gnecchi Marialuisa Gozi Sandro Grande Marta Grassi Gero Gregori Monica Gribaudo Chiara Grillo Giulia Grimoldi Paolo Guerini Giuseppe Guerini Lorenzo Guerra Mauro Gullo Maria Tindara Gutgeld Itzhak Yoram Iannuzzi Cristian Iannuzzi Tino Impegno Leonardo Incerti Antonella Invernizzi Cristian Iori Vanna Kronbichler Florian Kyenge Cecile L'Abbate Giuseppe Labriola Vincenza Lacquaniti Luigi Laffranco Pietro Laforgia Francesco Lainati Giorgio La Marca Francesca La Russa Ignazio Latronico Cosimo Lattuca Enzo Lauricella Giuseppe Lavagno Fabio Legnini Giovanni Lenzi Donata Leonori Marta Letta Enrico Leva Danilo Librandi Gianfranco Liuzzi Mirella Locatelli Pia Elda Lodolini Emanuele Lombardi Roberta Lo Monte Carmelo Longo Piero Lorefice Marialucia Lorenzin Beatrice Losacco Alberto Lupi Maurizio Lupo Loredana Madia Maria Anna Maestri Patrizia Magorno Ernesto Maietta Pasquale Malisani Gianna Malpezzi Simona Flavia Manciulli Andrea Manfredi Massimiliano Mannino Claudia Mantero Matteo Manzi Irene Marantelli Daniele Marazziti Mario Marchetti Marco Marchi Maino Marcolin Marco Marcon Giulio Marguerettaz Rudi Franco Mariani Raffaella Mariano Elisa Marotta Antonio Marrocu Siro Marroni Umberto Martella Andrea Martelli Giovanna Marti Roberto Martinelli Marco Martino Antonio Martino Pierdomenico Marzana Maria Marzano Michela Matarrelli Toni Matarrese Salvatore Mattiello Davide Mauri Matteo Mazziotti Di Celso Andrea Mazzoli Alessandro Melilla Generoso Melilli Fabio Meloni Giorgia Meloni Marco Merlo Ricardo Antonio Meta Michele Pompeo Miccoli Marco Micillo Salvatore Migliore Gennaro Milanato Lorena Minardo Antonino Miotto Anna Margherita Misiani Antonio Misuraca Dore Mogherini Federica Mognato Michele Molea Bruno Molteni Nicola Monaco Francesco Monchiero Giovanni Mongiello Colomba Montroni Daniele Morani Alessia Morassut Roberto Moretti Alessandra Moretto Sara Mosca Alessia Maria Moscatt Antonino Mottola Giovanni Carlo Francesco Mucci Mara Mura Romina Murer Delia Naccarato Alessandro Nardella Dario Nardi Martina Narduolo Giulia Nastri Gaetano Nesci Dalila Nesi Edoardo Nicchi Marisa Nicoletti Michele Nissoli Fucsia Nuti Riccardo Oliaro Roberta Oliverio Nicodemo Nazzareno Orfini Matteo Orlando Andrea Ottobre Mauro Pagani Alberto Pagano Alessandro Paglia Giovanni Palazzotto Erasmo Palese Rocco Palma Giovanna Palmieri Antonio Palmizio Elio Massimo Pannarale Annalisa Paolucci Massimo Parentela Paolo Paris Valentina Parisi Massimo Parrini Dario Pastorelli Oreste Pastorino Luca Patriarca Edoardo Pelillo Michele Pellegrino Serena Peluffo Vinicio Giuseppe Guido Pes Caterina Pesco Daniele Petitti Emma Petraroli Cosimo Petrenga Giovanna Petrini Paolo Piazzoni Ileana Cathia Picchi Guglielmo Piccione Teresa Piccoli Nardelli Flavia Piccolo Giorgio Piccolo Salvatore Piccone Filippo Picierno Pina Piepoli Gaetano Pili Mauro Pilozzi Nazzareno Pini Gianluca Pini Giuditta Pinna Paola Piras Michele Pisano Girolamo Pisicchio Pino Piso Vincenzo Pistelli Lapo Pizzolante Sergio Placido Antonio Plangger Albrecht Polidori Catia Pollastrini Barbara Polverini Renata Porta Fabio Portas Giacomo Antonio Prataviera Emanuele Prestigiacomo Stefania Preziosi Ernesto Prodani Aris Quaranta Stefano Quartapelle Procopio Lia Quintarelli Giuseppe Stefano Rabino Mariano Raciti Fausto Ragosta Michele Rampelli Fabio Rampi Roberto Ravetto Laura Realacci Ermete Ribaudo Francesco Ricciatti Lara Richetti Matteo Rigoni Andrea Rizzetto Walter Rizzo Gianluca Roccella Eugenia Rocchi Maria Grazia Romano Andrea Romano Francesco Saverio Romano Paolo Nicolò Romele Giuseppe Rondini Marco Rosato Ettore Rossi Domenico Rossomando Anna Rostan Michela Rostellato Gessica Rotondi Gianfranco Rotta Alessia Rubinato Simonetta Rughetti Angelo Ruocco Carla Russo Paolo Saltamartini Barbara Sammarco Gianfranco Sanga Giovanni Sani Luca Sanna Francesco Sanna Giovanna Santelli Jole Santerini Milena Sarro Carlo Sarti Giulia Savino Elvira Savino Sandra Sberna Mario Sbrollini Daniela Scagliusi Emanuele Scalfarotto Ivan Scanu Gian Piero Schirò Planeta Gea Schullian Manfred Scopelliti Rosanna Scotto Arturo Scuvera Chiara Segoni Samuele Senaldi Angelo Sereni Marina Sibilia Carlo Sisto Francesco Paolo Smeriglio Massimiliano Sorial Girgis Giorgio Sottanelli Giulio Cesare Spadoni Maria Edera Speranza Roberto Spessotto Arianna Squeri Luca Stumpo Nicola Tabacci Bruno Tacconi Alessio Tancredi Paolo Taranto Luigi Taricco Mino Tartaglione Assunta Tentori Veronica Terrosi Alessandra Terzoni Patrizia Tidei Marietta Tinagli Irene Tofalo Angelo Toninelli Danilo Totaro Achille Tripiedi Davide Tullo Mario Turco Tancredi Vacca Gianluca Vaccaro Guglielmo Valente Simone Valente Valeria Valentini Valentino Valiante Simone Vallascas Andrea Vargiu Pierpaolo Vazio Franco Vecchio Andrea Vella Paolo Velo Silvia Vendola Nichi Venittelli Laura Ventricelli Liliana Verini Walter Vezzali Maria Valentina Vignali Raffaello Vignaroli Stefano Villarosa Alessio Villecco Calipari Rosa Maria Vitelli Paolo Vito Elio Zaccagnini Adriano Zampa Sandra Zan Alessandro Zanetti Enrico Zanin Giorgio Zappulla Giuseppe Zardini Diego Zoggia Davide Zolezzi Alberto	
			La seduta, sospesa alle 14, è ripresa alle 14,50.
ANTONIO LEONE	PRESIDENTE	Sospendo, pertanto, la seduta, che riprenderà alle 14,45.	
			(Secondo scrutinio)
ANTONIO LEONE	PRESIDENTE	Colleghi, prima di indire il secondo scrutinio, ho il piacere di annunciare che nella giornata di ieri è nata Bianca, figlia della nostra collega Elisa Simoni, e che oggi è venuto alla luce Gherardo, figlio del nostro collega Luca Lotti (Applausi). Ha partorito la moglie naturalmente..., non il collega Luca Lotti. Sono certo di interpretare il sentimento di tutta l'Assemblea inviando un augurio caloroso ad entrambi i colleghi.	
