speaker	role	text	extra
BEATRICE LORENZIN		Ministra della salute. Grazie, Presidente. Il fenomeno dei cosiddetti «aborti fai da te» rientra in quello più generale degli aborti clandestini, la cui ultima stima risale al 2012. Nella relazione presentata al Parlamento, nel mese di ottobre 2014, le stime sugli aborti clandestini, effettuate dall'Istituto superiore di sanità e riferite al 2012, indicano una stabilizzazione del fenomeno negli ultimi anni, almeno per quanto riguarda le donne italiane. Quindicimila erano gli aborti clandestini stimati per le italiane nel 2015 e tra i 12 mila e i 15 mila casi nel 2012, con una notevole diminuzione rispetto agli anni Ottanta e Novanta: 100 mila erano i casi stimati nel 1983, 72 mila nel 1990, 43.500 nel 1995. Nel 2012, per la prima volta, si è effettuata una stima anche per le donne straniere, che è risultata compresa tra i 3 mila e i 5 mila aborti clandestini l'anno. È pertanto evidente che il fenomeno degli aborti clandestini è molto diminuito nel tempo e si è stabilizzato negli ultimi anni, anche se ovviamente continua a destare preoccupazione. Per quanto riguarda l'aborto spontaneo, i dati ISTAT, relativi agli anni 2010-2012, mostrano un andamento sostanzialmente stabile: 73.722 nel 2010, 76.334 nel 2011 e 73.810 nel 2012. In particolare, per la fascia di età compresa tra i 15 e i 19 anni, le dimissioni per aborto spontaneo sono: 1.221 nel 2010, 1.321 nel 2012 e 1.194 nel 2013, corrispondenti a percentuali che vanno dall'1,6 per cento all'1,7 per cento. In un articolo dell'Istituto superiore di sanità e dell'ISTAT sul rapporto «Osservasalute» del 2013 è riportato, attraverso una dettagliata analisi dei dati, che l'abortività spontanea è un fenomeno fortemente connesso all'età della donna e che il rapporto di abortività spontanea standardizzato conferma una sostanziale stabilità negli anni (più 9,4 per cento fra il 1998 e il 2011, per rispondere ai quesiti che ci sono stati rivolti per iscritto). Nello stesso articolo è richiamata l'indagine ISTAT sui tassi di abortività, sia volontaria sia spontanea, per classi di età e cittadinanza, che conferma che, a fronte di un calo generale in tutte le classi di età del ricorso all'interruzione volontaria di gravidanza, sia da parte di donne italiane sia da parte di donne straniere, non si è assistito ad un incremento diffuso dei tassi di aborto spontaneo. In sintesi, non ci sono evidenze dell'aumento di aborti spontanei tra le giovanissime e neppure dell'aumento, in tutte le classi di età, degli aborti spontanei connessi al cosiddetto «aborto fai da te». Per quanto riguarda i siti che vendono medicinali online, sottolineo che, in base al recente decreto legislativo n. 17 del 2014, le farmacie online autorizzate devono essere riconoscibili e, quindi, distinguibili da quelle illegali attraverso il logo comune, un bollino di sicurezza condiviso e coerente a livello europeo, rilasciato a cura del Ministero della salute. Inoltre, sempre in tema di contrasto della vendita online di medicinali senza controllo a rischio per la salute, ricordo il mio particolare impegno perché la normativa del 2014 contemplasse anche l'oscuramento dei siti non autorizzati ovvero di quelli che vendono online medicinali che richiedono la prescrizione medica.	
MARINA SERENI	PRESIDENTE	Il deputato Gigli, cofirmatario dell'interrogazione, ha facoltà di replicare per due minuti.	
GIAN LUIGI GIGLI		Grazie, Presidente, grazie, Ministro. Io non so come vengano effettuate queste stime; dubito, però, che esse possano cogliere tutta l'ampiezza e la gravità del fenomeno. Il mio sospetto, cioè, è che gran parte di questa compravendita di farmaci online, non permessa in quelle forme – come lei ha giustamente ricordato – dal nostro ordinamento, in realtà poi sfugga all'osservazione, e cioè che il fenomeno «fai da te» sia molto più consistente di quello che noi immaginiamo. E potrei metterci altri ambiti, dei quali pure abbiamo fatto oggetto di interrogazione il Ministero della salute, come lei ricorda: mi riferisco alla cosiddetta finta donazione di gameti, acquistati dalle nostre regioni all'estero su quelle che ritengo essere finte donatrici, pagate; mi riferisco al fenomeno delle maternità surrogate o uteri in affitto, che dir si voglia. Tutta questa roba continua ad essere presente sui siti del nostro Paese, senza che la polizia postale sia stata in alcun modo allertata e senza che nessuno di essi sia stato oscurato. Quindi, potrei – ma non è il caso certamente adesso – rifarle la domanda: ma, su azione del Ministero, quanti di questi siti sono stati spenti ? Ecco, questo sarebbe un tema interessante. Credo che la polizia postale andrebbe attivata in generale per il rispetto della vita umana, ma ancora di più, se vogliamo, per quanto riguarda l'evitare forme di sfruttamento, ma, nel caso specifico, segnalato dal collega Sberna, anche per la tutela della salute delle donne, sulla quale mi permetto solo di dare un suggerimento.	
MARINA SERENI	PRESIDENTE	Concluda.	
GIAN LUIGI GIGLI		Noi abbiamo molto apprezzato, nella relazione che lei ha fatto quest'anno sui dati del 2013, che, per la prima volta, si sia cominciato ad entrare nel meccanismo di funzionamento dei consultori. Credo che, se noi non arriviamo effettivamente a sapere in quanti casi sia stata, da parte dei consultori...	
MARINA SERENI	PRESIDENTE	Concluda.	
GIAN LUIGI GIGLI		proposta un'alternativa all'aborto, almeno per quelli di natura economica, che pure ci sono, e se non arriviamo quindi...	
MARINA SERENI	PRESIDENTE	Deve concludere.	
			(Orientamenti ed iniziative di competenza in relazione alla cosiddetta sindrome di Pandas – n. 3-01781)
GIAN LUIGI GIGLI		a separare, poi, la parte del colloquio da quella della certificazione, noi, le donne, continueremo a non aiutarle e gran parte di esse finirà per rifugiarsi nel «fai da te», nelle farmacie online e nell'acquisto a buon mercato di pillole dannose per la vita umana e per la loro salute.	
MARINA SERENI	PRESIDENTE	Il deputato Palese ha facoltà di illustrare la sua interrogazione n. 3-01781, concernente orientamenti ed iniziative di competenza in relazione alla cosiddetta sindrome di Pandas (Vedi l'allegato A – Interrogazioni a risposta immediata), per un minuto.	
ROCCO PALESE		Signora Presidente, signor Ministro, onorevoli colleghi, nel mese di settembre 2015, alla presenza dei delegati di oltre 25 Paesi, si è svolto a Como il primo convegno europeo sulla sindrome di Pandas, ovvero il «disordine autoimmune pediatrico associato allo streptococco beta-emolitico di gruppo A», sigla coniata nel 1997 dalla dottoressa americana Susan Swedo. Tale patologia consiste in un disturbo connesso ad una reazione autoimmune scatenata da malattie infettive dell'infanzia, determinando sintomi quali: assunzione di cibo altamente restrittiva, ansia, depressione, tic motori e vocali, difficoltà nella scrittura, sintomi neurologici, disturbi nel sonno e della frequenza urinaria e altri sintomi psichiatrici. Secondo numerosi neurologi dell'infanzia e dell'adolescenza, che hanno partecipato al convegno di Como, la Pandas è considerata attualmente una tragedia, non perché manchino le opzioni terapeutiche, ma perché non si è in grado di riconoscerla e, inoltre, l'assenza di una comune ammissione dell'esistenza rischia di accrescere le difficoltà per i pazienti colpiti. Pertanto, si chiede quali orientamenti intenda esprimere il Ministro interrogato nei riguardi della citata sindrome di Pandas e se...	
MARINA SERENI	PRESIDENTE	Concluda.	
ROCCO PALESE		in considerazione della diffusione di tale patologia, non ancora riconosciuta ufficialmente e diagnosticata, purtroppo, in maniera confusa e non univoca dalla medicina e dalla comunità scientifica, non ritenga di assumere iniziative intanto rispetto...	
MARINA SERENI	PRESIDENTE	Ha concluso il suo tempo, onorevole Palese.	
ROCCO PALESE		a quelle che sono le competenze del Ministero sul problema del riconoscimento scientifico e anche rispetto ad una corretta informazione.	
MARINA SERENI	PRESIDENTE	La Ministra della salute, Beatrice Lorenzin, ha facoltà di rispondere per tre minuti.	
BEATRICE LORENZIN	Ministra della salute	Il disturbo pediatrico autoimmune noto come sindrome di Pandas, ovvero disordine autoimmune pediatrico associato allo streptococco beta-emolitico di gruppo A, può essere associato ad infezioni da streptococco beta-emolitico streptococcus pyogenes, che, come noto, è la principale causa di faringotonsillite batterica in età pediatrica. L'insorgenza della patologia è subdola e difficile da diagnosticare, anche in considerazione del fatto che non sono al momento disponibili biomarcatori validati a supporto delle valutazioni psicomotorie da parte dei medici pediatri e dei neuropsichiatri infantili. Tale incertezza diagnostica ha determinato ondivaghi atteggiamenti circa l'esistenza stessa della sindrome, dando vita a tentativi terapeutici difficilmente giudicabili e ad un abuso di trattamenti antibiotici e immunomodulanti, con intuibile impatto sulla salute individuale. L'ipotesi che alcuni casi di disturbi neuropsichiatrici dell'infanzia e dell'adolescenza possano essere causati o accentuati da meccanismi autoimmunitari legati alle infezioni da streptococco è tuttavia plausibile e costituisce oggetto di apposite ricerche. A tale proposito menziono una serie di recenti importanti iniziative della comunità scientifica nazionale ed europea, volte ad accrescere la conoscenza di base clinica per la prevenzione e cura della sindrome di Pandas, quali la conferenza sulla sindrome di Tourette e sui disturbi ticcosi, svoltasi a Londra nel giugno 2015, il convegno su Pandas, tenutosi recentemente a Como, ma soprattutto il progetto multicentrico finanziato dalla comunità europea, che, potendo sfruttare le potenzialità che solo una casistica a livello europeo può garantire, si propone di indagare il possibile coinvolgimento dell'infezione da streptococco nell'insorgenza della sintomatologia ticcosa in età pediatrica. Esperti in microbiologia, neuropsichiatria infantile e modellistica animale dell'Istituto superiore di sanità e dell'università degli studi «La Sapienza» di Roma sono coinvolti nel progetto multicentrico, che terminerà i suoi lavori nel 2017. Concludo evidenziando come solo all'esito degli studi epidemiologici e sperimentali, volti ad accrescere le conoscenze sulla diffusione della patologia e la possibile identificazione di biomarcatori utili per una diagnosi efficace ai fini di interventi terapeutici mirati, potranno essere avviate adeguate iniziative di informazione, volte ad una maggiore sensibilizzazione sul tema dei pediatri di base e dei neuropsichiatri infantili.	
MARINA SERENI	PRESIDENTE	Il deputato Palese ha facoltà di replicare, per due minuti.	
			(Iniziative urgenti volte a garantire la copertura vaccinale della popolazione italiana, anche tramite adeguate campagne informative – n. 3-01782)
ROCCO PALESE		Signora Presidente, con soddisfazione apprendo dalla Ministra che la comunità europea ha attivato un progetto importante di ricerca, anche con una data in cui è auspicabile che si venga a capo di questa sindrome, che è veramente insidiosa così com’è stata descritta. Per rendere pregnante, soprattutto per chi ci ascolta, è significativo questo titolo: «Non è la schizofrenia: dodicenne guarisce con antibiotico». La mamma scopre che è Pandas e promuove un convegno mondiale a Como. Per Federico, dodici anni, terza media, la diagnosi era di quelle che gettano nello sconforto una famiglia: schizofrenia. Ma la mamma non si è arresa. In quella diagnosi c'era qualcosa che non la convinceva. Ha tirato fuori la sua mentalità da scienziata (è stata in passato ricercatrice alla NASA) e si è messa a leggere tutti i più recenti articoli scientifici su sintomi che suo figlio mostrava. E lo ha salvato, scoprendo che Federico, nome di fantasia, aveva una rara sindrome dal nome buffo, Pandas. La vicenda è alla base del convegno internazionale e del perché, poi, la Comunità europea ha intrapreso e finanziato questa importante iniziativa. Quindi, è auspicabile che quanto prima si addivenga ad un punto fermo rispetto a questa patologia anche da parte della comunità scientifica. Comunque sono soddisfatto anche dell'iniziativa che il Ministro ha annunziato per i pediatri e i medici di medicina generale in riferimento a quella che deve essere una corretta informazione, attesa la grave situazione per una malattia subdola e sfuggente rispetto a quello che riguarda in particolare questa sindrome.	
MARINA SERENI	PRESIDENTE	La deputata D'Incecco ha facoltà di illustrare, per un minuto, l'interrogazione Lenzi ed altri n. 3-01782, concernente iniziative urgenti volte a garantire la copertura vaccinale della popolazione italiana, anche tramite adeguate campagne informative (Vedi l'allegato A – Interrogazioni a risposta immediata), di cui è cofirmataria.	
VITTORIA D'INCECCO		Grazie Presidente. Signor Ministro, il calo ormai ben noto delle coperture vaccinali rispetto agli obiettivi di un piano delle importanti malattie esantematiche – che sono contenute nella nostra interrogazione, ma che io non cito per esigenze di tempo – desta ormai grande preoccupazione e ha acceso il dibattito sull'obbligatorietà o meno delle vaccinazioni. Le implicazioni derivanti da una riduzione significativa delle coperture lei ben sa che, oltre al rischio epidemico, possono causare l'insorgenza di gravi malattie – di queste gravi malattie –, che ormai erano state debellate e può anche accadere, purtroppo, che esse non siano riconosciute in tempo e trattate in modo mirato dagli operatori sanitari, con conseguenze anche letali, come già è successo. È importante, quindi, una corretta ed inequivocabile informazione nei confronti degli operatori sanitari e delle famiglie ed è necessario migliorare l'organizzazione nelle sedi che erogano l'offerta. Quindi, le chiediamo quali misure urgenti e concrete intenda adottare per un'adeguata copertura vaccinale che tuteli, senza differenze geografiche, tutta la popolazione e se non ritenga necessario predisporre nell'immediato una campagna...	
MARINA SERENI	PRESIDENTE	Concluda, onorevole D'Incecco.	
VITTORIA D'INCECCO		una campagna – arrivo alla conclusione – informativa sui rischi o i benefici che la profilassi comporta e se risponde al vero, signor Ministro, che si prevedono sanzioni per gli operatori sanitari contrari alla somministrazione o l'impedimento ai bambini di frequentare la scuola se non vaccinati.	
MARINA SERENI	PRESIDENTE	La ringrazio. La Ministra della salute, Beatrice Lorenzin, ha facoltà di rispondere per tre minuti.	
BEATRICE LORENZIN		Ministra della salute. Grazie, Presidente. Ringrazio veramente gli onorevoli interroganti per aver sollevato la questione in esame, in quanto mi consente, in questo autorevole consesso, di porre alcuni chiarimenti su questa questione. Vaccinare vuol dire investire sul benessere, soprattutto dei giovani e dei bambini, rafforzare il patrimonio della prevenzione a valenza nazionale e proteggere le persone più fragili. Siamo tutti consapevoli che l'introduzione dei vaccini costituisce l'intervento di sanità pubblica più importante per l'umanità, nel senso non solo dell'evidenza del ruolo sociale ed etico a cui assolve, ma anche perché ha determinato una svolta nella storia dell'uomo in termini di riduzione della suscettibilità alle infezioni, riduzione dei costi sanitari e sociali legati alle malattie infettive e degli eventuali esiti invalidanti e possiamo dire riduzione delle tante morti che hanno flagellato i secoli scorsi. Ad oggi, la vaccinazione è la misura di prevenzione più efficace ed innocua. Infatti, se confrontata con l'immunoprofilassi passiva, essa comporta meno rischi, dalle reazioni allergiche allo shock anafilattico. Svolte queste considerazioni di carattere generale, non posso non sottolineare che il successo dei programmi nazionali vaccinali si fonda sul raggiungimento e il mantenimento delle coperture di cicli vaccinali completi, a livelli tali da prevenire e controllare efficacemente la diffusione delle malattie infettive prevenibili con il vaccino. Gli ultimi due piani nazionali, quello del 2005-2007 e quello del 2012-2014, frutto di intesa in Conferenza Stato-regioni, hanno fornito indirizzi per le strategie vaccinali da applicare su tutto il territorio, improntate a criteri di equità e standardizzazione dell'offerta vaccinale. Ciononostante, i dati recentemente forniti dall'Istituto superiore di sanità descrivono una situazione che non può che destare preoccupazione ed è proprio per porre rimedio a tali criticità che ho voluto fosse elaborato il nuovo piano nazionale di prevenzione vaccinale, attualmente all'esame della commissione salute della Conferenza delle regioni, che, oltre ad ampliare l'offerta vaccinale da parte del Servizio sanitario nazionale, al fine di recuperare la cultura delle vaccinazioni, prevede l'adozione di un piano di comunicazione istituzionale recante iniziative volte a fornire alla popolazione le informazioni dettagliate sui rischi delle complicanze delle malattie prevenibili con i vaccini e i benefici della vaccinazione, nonché la condivisione dei contenuti informativo-educativi sul tema nei programmi delle scuole e dei corsi universitari. Quanto, poi, alle specifiche questioni poste dagli interroganti, mi limito a ricordare che l'ordinamento vigente attribuisce ai soli ordini professionali il potere di disciplinare i suoi medici e, pertanto, spetta agli stessi ordini valutare se e quando una mancata prestazione sanitaria possa tradursi in un comportamento deontologicamente non corretto. Quanto, invece, alla possibilità che sia previsto il divieto per i bambini non vaccinati di frequentare la scuola dell'obbligo, ricordo che la normativa vigente prevede, nei casi di mancata presentazione della certificazione comprovante l'avvenuta vaccinazione, che il dirigente scolastico comunichi, entro cinque giorni, il nominativo alla ASL di competenza, affinché la stessa intervenga per i tempestivi adempimenti. Il sistema vigente è pertanto finalizzato a far scattare l'allerta e consentire alle ASL, informate tempestivamente, di intervenire, senza tuttavia pregiudicare il diritto all'istruzione dei bambini, proprio per evitare che gli stessi siano doppiamente penalizzati. Ogni eventuale modifica al predetto sistema, finalizzata a rendere maggiormente effettiva la copertura vaccinale, non può pertanto che essere rimessa ad una decisione del Parlamento.	
MARINA SERENI	PRESIDENTE	La deputata Sbrollini, cofirmataria dell'interrogazione, ha facoltà di replicare.	
			(Iniziative volte a garantire la soglia di sicurezza della copertura vaccinale nel nostro Paese – n. 3-01783)
DANIELA SBROLLINI		Grazie, signora Presidente, grazie signora Ministro, per la sua puntuale risposta. Guardi, lei ha usato parole giuste, così come ha fatto la mia collega D'Incecco prima. Vaccinare vuol dire appunto proteggere, prevenire, proprio perché in questi anni abbiamo visto quante malattie sono state debellate. Noi siamo ovviamente favorevoli a questo nuovo piano nazionale che adesso è al vaglio appunto della Conferenza Stato-regioni che, se non sbaglio, è convocata per il 5 novembre. Le chiediamo ovviamente di adottare strumenti sempre più forti, più efficaci e capillari su tutto il territorio nazionale, perché appunto i dati cominciano ad essere davvero preoccupanti. Sappiamo che in alcune regioni ci sono delle situazioni sicuramente più gravi rispetto ad altre, come purtroppo accade molto spesso nel nostro Paese. Quindi, c’è la necessità di un monitoraggio costante, di vigilare attentamente, come sta già facendo il Ministero, ma io chiedo ancora di più: informare, informare, informare le famiglie, nelle scuole, gli stessi pediatri, cioè mettere davvero un piano di azione talmente forte da far comprendere soprattutto alle giovani coppie, perché purtroppo spesso i social, che sono così immediati nella comunicazione, fanno una cattiva informazione. E noi come legislatori, come parlamentari e rappresentanti dei territori dobbiamo assolutamente spiegare bene quello che potrebbe accadere, se ci fossero casi di bambini non vaccinati nelle nostre scuole, nei luoghi frequentati dalle famiglie, anche perché l'Italia – e concludo –, come tutti sapete, dal settembre 2014, è stata anche designata come capofila, a livello europeo e internazionale, di una campagna di strategie e vaccinazioni nel mondo. Quindi noi abbiamo ancora di più – colleghe e colleghi – una responsabilità maggiore anche rispetto a quello che ci chiede l'Europa (Applausi dei deputati del gruppo Partito Democratico).	
MARINA SERENI	PRESIDENTE	Il deputato Calabrò ha facoltà di illustrare la sua interrogazione n. 3-01783, concernente iniziative volte a garantire la soglia di sicurezza della copertura vaccinale nel nostro Paese, per un minuto (Vedi l'allegato A – Interrogazioni a risposta immediata).	
RAFFAELE CALABRÒ		Signor Presidente, signor Ministro, ritorno sul tema delle vaccinazioni. Piano nazionale prevenzione vaccinale: i dati recenti dell'Istituto superiore di sanità ci dicono che la copertura vaccinale nel nostro Paese ormai è al limite della sicurezza. Il tasso di vaccinazione è arrivato al di sotto degli obiettivi minimi che ci si era proposti nel piano vaccinale del 2012-2014, quello a cui faceva lei riferimento un attimo fa. Per sottolineare alcuni dati: siamo al di sotto del 95 per cento per polio, tetano, difterite, epatite B; siamo al di sotto dell'86 per cento per morbillo, parotite e rosolia. Cioè, siamo al di sotto dei valori soglia di sicurezza della nostra popolazione. Che vuol dire questo ? Che le conseguenze sono non solo sul piano individuale del singolo bambino, che può incorrere in queste patologie, ma le conseguenze possono essere sul piano collettivo molto importanti, interessando l'intera popolazione e annullando anni di lavoro che è stato fatto per prevenire malattie di questa entità. Signor Ministro, cosa intende fare il Governo su questo grave problema ?	
MARINA SERENI	PRESIDENTE	La Ministra della salute Beatrice Lorenzin, ha facoltà di rispondere.	
BEATRICE LORENZIN		Ministra della salute. Signor Presidente, approfitto di questa interrogazione perché appunto l'onorevole Calabrò ha fornito i dati. I dati sono veramente allarmanti, ma vorrei tradurre questi dati poi in cosa accade realmente sui nostri territori. Quando una bambina di 40 giorni muore per la pertosse, pertosse, una malattia che era di fatto scomparsa, perché quella bambina muore ? Perché il virus ha viaggiato attraverso persone non vaccinate e ha raggiunto una bambina troppo piccola per essere vaccinata. Quella famiglia lì come potrà mai essere risarcita da una perdita del genere ? Questo è l'effetto gregge; per la pertosse, per la poliomielite, per la meningite, per il morbillo, per malattie che erano state debellate dal nostro territorio e che possono provocare la morte dei nostri figli se non menomazioni irreparabili, irrimediabili per tutta la loro vita. Allora, che nel 2015 i Paesi occidentali si trovino a dover riaffrontare questa emergenza è un problema grandissimo, grandissimo. Abbiamo dati di percentuali su sondaggi fatti tra i genitori che purtroppo si sono legati a credenze, a falsi miti, a leggende metropolitane, che girano sul web, che girano su riviste non autorizzate, non validate dalla comunità scientifica internazionale e mondiale, che collegano il tema delle vaccinazioni alla comparsa di malattie come l'autismo o come l'epilessia. Non esiste alcuna correlazione con queste malattie. Questo è stato sancito chiaramente da decine e decine di studi dei più importanti centri scientifici al mondo: centri indipendenti, studi indipendenti, cluster fatti su migliaia di casi, come l'ultimo effettuato negli Stati Uniti. Questa è una questione di sicurezza nazionale e di salute pubblica. Come Ministero noi ce ne stiamo occupando in modo molto forte, ormai da anni. Abbiamo presentato questo nuovo piano di vaccinazione, questo nuovo piano vaccini, che – come ho già detto – è all'esame della Conferenza Stato-regioni. Io spero che possa passare al più presto. Ritengo che il tema delle risorse non possa essere il tema da affrontare in questo caso. Infatti, le risorse per una copertura vaccinale totale del nostro territorio devono essere trovate. Si devono trovare e si possono trovare. Cominciamo a fare campagne di informazione e di copertura, anche su nuove patologie che possono riemergere o emergere in modo diverso sul nostro territorio. Noi assistiamo ad un paradosso e concludo così. Il paradosso è che abbiamo i Paesi del terzo e del quarto mondo che ci chiedono aiuto per vaccinare i loro figli e noi rinunciamo a vaccinare i nostri. In un mondo globale, dove più di 4 milioni di persone al giorno prendono l'aeroplano, dove viaggiano le merci, le persone sui treni, in un mondo in cui non ci sono più confini, credo che riappropriarci di una cultura scientifica, che faccia perno sull'evidenza scientifica e non su falsi miti che circolano in luoghi non autorizzati, sia un dovere anche di questo Parlamento, che può fare tanto in materia di formazione, informazione e divulgazione.	
MARINA SERENI	PRESIDENTE	L'onorevole Calabrò ha facoltà di replicare.	
			(Iniziative per contrastare la diffusione della meningite, anche attraverso campagne di sensibilizzazione volte ad incrementare la somministrazione di vaccini, con particolare attenzione alla situazione della Toscana – n. 3-01784)
