speaker	role	text	extra
MARINA SERENI	PRESIDENTE	Passiamo ai voti. Indìco la votazione nominale, mediante procedimento elettronico, sull'emendamento Pannarale 10.29, con il parere contrario della Commissione e del Governo ed il parere favorevole delle relatrici di minoranza dei gruppi di Sinistra Ecologia Libertà e del MoVimento 5 Stelle. Dichiaro aperta la votazione. (Segue la votazione). Sberna, Nardi, Nicchi... Dichiaro chiusa la votazione. Comunico il risultato della votazione: la Camera respinge (Vedi votazioni). (Presenti e votanti 352 Maggioranza 177 Hanno votato sì 96 Hanno votato no 256). Indìco la votazione nominale, mediante procedimento elettronico, sull'emendamento Polverini 10.34, con il parere contrario della Commissione e del Governo, il parere favorevole della relatrice di minoranza del gruppo di Sinistra Ecologia Libertà, mentre la relatrice di minoranza del gruppo del MoVimento 5 Stelle si rimette all'Assemblea. Dichiaro aperta la votazione. (Segue la votazione). Giuliani, Malpezzi, Magorno, Sanga... Dichiaro chiusa la votazione. Comunico il risultato della votazione: la Camera respinge (Vedi votazioni). (Presenti 356 Votanti 310 Astenuti 46 Maggioranza 156 Hanno votato sì 58 Hanno votato no 252). (La deputata Gribaudo ha segnalato che non è riuscita ad esprimere voto contrario). Indìco la votazione nominale, mediante procedimento elettronico, sull'emendamento Simonetti 10.39, con il parere contrario della Commissione e del Governo, il parere favorevole della relatrice di minoranza del gruppo di Sinistra Ecologia Libertà, mentre la relatrice di minoranza del gruppo del MoVimento 5 Stelle si rimette all'Assemblea. Dichiaro aperta la votazione. (Segue la votazione). Lodolini, Bruno Bossio, Rotta, Magorno, Lainati, Ghizzoni... Dichiaro chiusa la votazione. Comunico il risultato della votazione: la Camera respinge (Vedi votazioni). (Presenti 356 Votanti 310 Astenuti 46 Maggioranza 156 Hanno votato sì 58 Hanno votato no 252). Indìco la votazione nominale, mediante procedimento elettronico, sull'emendamento Pannarale 10.46, con il parere contrario della Commissione e del Governo ed il parere favorevole delle relatrici di minoranza dei gruppi di Sinistra Ecologia Libertà e del MoVimento 5 Stelle. Dichiaro aperta la votazione. (Segue la votazione). Fanucci, Bossa, Scuvera... Dichiaro chiusa la votazione. Comunico il risultato della votazione: la Camera respinge (Vedi votazioni). (Presenti 355 Votanti 354 Astenuti 1 Maggioranza 178 Hanno votato sì 90 Hanno votato no 264). (Il deputato Busto ha segnalato che non è riuscito ad esprimere voto favorevole). Indìco la votazione nominale, mediante procedimento elettronico, sull'emendamento Fucci 10.49, con il parere contrario della Commissione, del Governo e della relatrice di minoranza del gruppo del MoVimento 5 Stelle ed il parere favorevole della relatrice di minoranza del gruppo di Sinistra Ecologia Libertà. Dichiaro aperta la votazione. (Segue la votazione). Garavini, Palese... Dichiaro chiusa la votazione. Comunico il risultato della votazione: la Camera respinge (Vedi votazioni). (Presenti 356 Votanti 351 Astenuti 5 Maggioranza 176 Hanno votato sì 54 Hanno votato no 297). (La deputata Piccione ha segnalato che non è riuscita ad esprimere voto contrario). Passiamo alla votazione dell'emendamento Marzana 10.51. Ha chiesto di parlare per dichiarazione di voto l'onorevole D'Uva. Ne ha facoltà.	
FRANCESCO D'UVA		Intervengo per dichiarare il voto favorevole del Movimento 5 Stelle.	
MARINA SERENI	PRESIDENTE	Ha chiesto di parlare per dichiarazione di voto, a titolo personale, l'onorevole Marzana. Ne ha facoltà.	
MARIA MARZANA		Grazie, Presidente. La scuola dell'infanzia è stata completamente ignorata da questo provvedimento. Si tratta di un presidio educativo che ha un fondamentale compito nel trasmettere ai bambini le iniziali opportunità formative e di crescita, capaci di rimuovere i gap cognitivi e abbattere i rischi della dispersione scolastica. Di contro, questo disegno di legge non prevede nessun organico funzionale per questo grado di scuola e le 23 mila assunzioni annunciate dal Governo sono rinviate a data da destinarsi. Per di più, si prevede una delega che, anziché potenziare l'istruzione statale da zero a sei anni, ci riporta indietro di quarant'anni con l'affidamento dell'educazione di questi bambini agli enti locali, che continuano a subire però tagli da questo Governo, o peggio ai privati, sancendo così la disparità di opportunità educative sui diversi territori. Come se non bastasse, voglio ricordare che su questo grado di scuola pesano come un macigno su bambini e docenti i tagli della Gelmini, che hanno aumentato il numero degli alunni a carico del singolo docente e mortificato la compresenza che a questa età è indispensabile. Sorgono a questo punto spontanee due domande: perché tenere congelati in GAE 23 mila docenti e non rispondere al fabbisogno delle scuole dell'infanzia sin da subito ? E perché il Governo riforma un delicato settore come questo (Applausi dei deputati del gruppo MoVimento 5 Stelle)... ?	
MARINA SERENI	PRESIDENTE	Grazie. Ha chiesto di parlare per dichiarazione di voto l'onorevole Malpezzi. Ne ha facoltà.	
SIMONA FLAVIA MALPEZZI		Signor Presidente, intervengo soltanto perché rimanga agli atti. Mi fa piacere sapere che il modello di Reggio Children che ci invidiano in tutto il mondo e sul quale si basa la proposta che il Governo presenta in legge delega sulla base di una proposta di legge depositata in Senato a prima firma Puglisi, venga considerato un modello antiquato che non funziona. Noi in questo modo faremo sì invece che il modello di Reggio Children possa diffondersi sul tutto il territorio nazionale.	
MARINA SERENI	PRESIDENTE	Nessun altro chiedendo di parlare, passiamo ai voti. Indìco la votazione nominale, mediante procedimento elettronico, sull'emendamento Marzana 10.51, con il parere contrario della Commissione e del Governo e con il parere favorevole delle Relatrici di minoranza. Dichiaro aperta la votazione. (Segue la votazione). Tidei, Dell'Aringa, aspettiamo l'onorevole Saltamartini che arriva, Marco Di Maio. Alberti. Dichiaro chiusa la votazione. Comunico il risultato della votazione: la Camera respinge (Vedi votazioni). (Presenti e votanti 354 Maggioranza 178 Hanno votato sì 80 Hanno votato no 274) Indìco la votazione nominale, mediante procedimento elettronico, sull'emendamento Rampelli 10.56, con il parere contrario della Commissione e del Governo e con il parere favorevole della relatrice del Movimento 5 Stelle, mentre si rimette all'aula la relatrice di minoranza di SEL. Dichiaro aperta la votazione. (Segue la votazione). Bragantini Matteo. Altri che non votano ? Dichiaro chiusa la votazione. Comunico il risultato della votazione: la Camera respinge (Vedi votazioni). (Presenti 356 Votanti 342 Astenuti 14 Maggioranza 172 Hanno votato sì 43 Hanno votato no 299) (I deputati Cassano e Covello hanno segnalato che non sono riusciti ad esprimere voto contrario). Indìco la votazione nominale, mediante procedimento elettronico, sull'emendamento Bossi 10.58, con il parere contrario della Commissione, del Governo e della relatrice del Movimento 5 Stelle, mentre si rimette all'aula la relatrice di minoranza di SEL. Dichiaro aperta la votazione. (Segue la votazione). Ghizzoni. Dell'Aringa. Dichiaro chiusa la votazione. Comunico il risultato della votazione: la Camera respinge (Vedi votazioni). (Presenti 346 Votanti 327 Astenuti 19 Maggioranza 164 Hanno votato sì 36 Hanno votato no 291) (La deputata Covello ha segnalato che non è riuscita ad esprimere voto contrario). Indìco la votazione nominale, mediante procedimento elettronico, sull'emendamento Chimienti 10.60, con il parere contrario della Commissione e del Governo e con il parere favorevole delle Relatrici di minoranza. Dichiaro aperta la votazione. (Segue la votazione). Colonnese. Colletti. Ferraresi, Tancredi, Berlinghieri, Bossa. Dichiaro chiusa la votazione. Comunico il risultato della votazione: la Camera respinge (Vedi votazioni). (Presenti 356 Votanti 354 Astenuti 2 Maggioranza 178 Hanno votato sì 82 Hanno votato no 272) (La deputata Covello ha segnalato che non è riuscita ad esprimere voto contrario). Indìco la votazione nominale, mediante procedimento elettronico, sull'emendamento Altieri 10.67, con il parere contrario della Commissione e del Governo e con il parere favorevole delle relatrici di minoranza. Dichiaro aperta la votazione. (Segue la votazione). Camani. Dichiaro chiusa la votazione. Comunico il risultato della votazione: la Camera respinge (Vedi votazioni). (Presenti e votanti 361 Maggioranza 181 Hanno votato sì 96 Hanno votato no 265) (Il deputato Cariello ha segnalato che non è riuscito ad esprimere voto favorevole). Passiamo alla votazione dell'emendamento Cuperlo 10.72, a pagina 46 del fascicolo. Ha chiesto di parlare per dichiarazione di voto il deputato Cuperlo. Ne ha facoltà.	
GIOVANNI CUPERLO		Grazie Presidente, la giornata è stata molto lunga e non è ancora conclusa, quindi a me spiace tornare su un punto già sollevato. Però mi permetto e vorrei invitare i colleghi e naturalmente il Governo ad una fatica in più e a considerare davvero il merito di questo emendamento. Considero un fatto importante che il disegno di legge stabilizzi oltre 100 mila insegnanti, ma qui parliamo di una categoria di docenti precari rappresentata da migliaia di insegnanti abilitati di seconda fascia per i quali le porte della stabilizzazione oggi sono precluse nel senso che per questi docenti iscritti nelle graduatorie di istituto la sola speranza di un ingresso stabile nella scuola è ripartire dal «via», ignorando anni di insegnamento, l'abilitazione da parte dello Stato e, come è stato ricordato pochi minuti fa, anche lunghi percorsi di formazione affrontati con sacrifici e con costi pesanti. Si sostiene che la strada dei soli concorsi per titoli ed esami sia obbligata dalla Costituzione, precisamente da quel comma 3 dell'articolo 97 dove si prevede che agli impieghi nelle pubbliche amministrazioni si accede mediante concorso, ma è un comma che trova il suo completamento nelle parole «salvo i casi stabiliti dalla legge». E il punto è esattamente qui: «salvo i casi stabiliti dalla legge». Cari colleghi, lo sapete meglio di me di cosa stiamo parlando: di insegnanti abilitati che per otto, dieci, dodici anni hanno formato un paio di generazioni dei nostri figli e lo hanno fatto con professionalità, accettando condizioni di lavoro penalizzanti, mal retribuiti, senza scatti di anzianità e senza che lo Stato concedesse loro non una corsia privilegiata ma il semplice diritto di sostenere un concorso. Oggi questi insegnanti, condannati per anni ad una precarietà come destino e che nel frattempo sono diventati padri e madri di famiglia, si sentono dire da quello Stato che li ha precarizzati: accettate la realtà. Lo Stato adesso vuole affermare il merito, le capacità: se volete entrare nella scuola, accettate la via di un concorso regolare. Però vedete – concludo, Presidente – è quell'aggettivo – lo dico con profondo rispetto e comprensione delle ragioni di chi ha scritto questo testo – è quell'aggettivo «regolare» che stona come argomento: non c’è una parola scritta in questo senso ma un argomento che pare un temporale fuori stagione perché noi abbiamo consegnato quelle migliaia di donne e di uomini ad una vita irregolare e nonostante questo la maggior parte di loro ha manifestato lealtà e senso di appartenenza ad una comunità che hanno servito nel modo più generoso formando migliaia di ragazzi al primato del sapere e della cultura. Ecco perché questa non è una battaglia corporativa e nemmeno solo – mi permetto di dirlo – una sfida di buon senso. Questa è una prova di giustizia verso chi lo Stato lo ha rispettato, nonostante gli ostacoli e le difficoltà che ha incontrato lungo la strada. Potrei citare la sentenza europea del novembre 2014 e autorevoli pareri legali a supporto di questa tesi, ma sono certo che li conoscete quanto e più di me. Mi permetto questo appello, fuori dalle appartenenze, per dire che un errore drammatico che la politica e le istituzioni non dovrebbero compiere mai è dimenticarsi che, dietro una norma o il comma di una legge, spesso, molto spesso c’è la vita delle persone. Per anni lo Stato sbagliando ha creato un problema che ha condizionato l'esistenza di migliaia di persone – ho concluso – non è colpa di chi adesso è al Governo. Io lo voglio riconoscere per onestà politica ed intellettuale: non è colpa di chi oggi siede ai banchi del Governo però, vi prego, evitiamo di dire a questi professionisti di quaranta o cinquant'anni che oggi il loro problema sono loro stessi perché questo sì violerebbe la loro dignità, prima ancora che la loro carriera o il loro stipendio. Tullio De Mauro ha raccontato, alcuni giorni fa, un aneddoto su Guido Calogero, che è stato uno tra i più grandi intellettuali del nostro Novecento. Diceva Calogero: «Se per la strada incontro un mio collega lo saluto; ma se incontro un insegnante mi fermo, mi cavo di capo il cappello e mi inchino». Erano gli anni Cinquanta. Lui conosceva i limiti di quella scuola, che pure stava portando l'alfabeto dove prima non c'era, ma comunque esprimeva così la sua stima per quella missione. Noi non possediamo la forza di pensiero di Calogero, ma io mi permetto di chiedere, a ciascuno di voi, in coscienza, di votare a favore di questo emendamento, perché al fondo è uno dei pochi modi che ci sono dati di toglierci il cappello e, così facendo, di migliorare questa riforma (Applausi dei deputati del gruppo Sinistra Ecologia Libertà e di deputati del gruppo Partito Democratico).	
MARINA SERENI	PRESIDENTE	Ha chiesto di parlare per dichiarazione di voto l'onorevole Zaratti. Ne ha facoltà.	
FILIBERTO ZARATTI		Presidente, preannunzio il nostro favorevole su questo emendamento.	
MARINA SERENI	PRESIDENTE	Ha chiesto di parlare per dichiarazione di voto, a titolo personale, l'onorevole Malpezzi. Ne ha facoltà.	
SIMONA FLAVIA MALPEZZI		Presidente, è difficile intervenire dopo un intervento appassionato di cui nessuno può non condividere i principi, se non per un punto, però. Noi non diciamo che questi insegnanti devono rimanere fuori. A loro riconosciamo il percorso che hanno fatto, sia nell'ambito delle abilitazioni selettive dei TFA sia nei duri percorsi dei PAS perché – li ricordiamo – questi erano insegnanti che lavoravano ed erano in classe a sostenere quello che uno Stato non aveva consentito loro di sostenere, perché non aveva mai bandito dei concorsi. È proprio per questo motivo che noi, cercando di riorganizzare tutta questa materia, diciamo anche una cosa molto chiara: che il concorso deve essere solo per loro, cioè per gli abilitati, e che all'interno di questo concorso ci penserà poi il bando a definire come e quando. Ma intanto noi cerchiamo di dare un'indicazione già molto chiara, che è quella di riconoscere tutti i titoli e, quindi, le qualifiche che loro hanno, proprio perché non è nostra idea lasciare indietro nessuno. Concludo solo su una cosa: la sentenza del 2014, che è del novembre...	
MARINA SERENI	PRESIDENTE	Deve concludere.	
SIMONA FLAVIA MALPEZZI		condannava lo Stato italiano per i concorsi non fatti e sostanzialmente diceva di riconoscere coloro che erano per anni, per più di 36 mesi, su posti vacanti e disponibili. Sono 4 mila.	
MARINA SERENI	PRESIDENTE	Ha chiesto di parlare per dichiarazione di voto, a titolo personale, l'onorevole Giancarlo Giordano. Ne ha facoltà.	
GIANCARLO GIORDANO		Presidente, ho apprezzato molto i toni, anche quelli della collega Malpezzi, che rischia di passare per la gendarme di questa riforma, ma il momento è questo cioè, che non si può rinviare sempre. Non si può rinviare sempre la giustizia, un gesto che ripari un torto, e non lo si può fare soprattutto perché in questo DDL si riorganizza la scuola ma si organizzano anche le esclusioni dalla scuola, se non si mette riparo subito. Non ci possiamo accontentare di una promessa: «vedremo, faremo». Vogliamo – e dovreste volerlo anche voi visto che siete anche voi, per l'ennesima volta, il Governo del fare – qualche certezza. Perciò, sosteniamo con convinzione l'emendamento proposto dal collega Cuperlo, anche perché si muove nel solco di emendamenti che abbiamo proposto anche noi.	
MARINA SERENI	PRESIDENTE	Passiamo ai voti. Indìco la votazione nominale, mediante procedimento elettronico, sull'emendamento Cuperlo 10.72, con il parere contrario della Commissione e del Governo e con il parere favorevole delle relatrici di minoranza. Dichiaro aperta la votazione. (Segue la votazione). Sberna, Battaglia. Ci siamo ? Dichiaro chiusa la votazione. Comunico il risultato della votazione: la Camera respinge (Vedi votazioni). (Presenti 355 Votanti 352 Astenuti 3 Maggioranza 177 Hanno votato sì 147 Hanno votato no 205). (Il deputato Zan ha segnalato che non è riuscito ad esprimere voto contrario). Passiamo alla votazione degli identici emendamenti Vezzali 10.73 e Vacca 10.77.	
MARIA VALENTINA VEZZALI		Chiedo di parlare.	
MARINA SERENI	PRESIDENTE	Ne ha facoltà.	
MARIA VALENTINA VEZZALI		Presidente, ritiro il mio emendamento 10.73.	
MARINA SERENI	PRESIDENTE	Sta bene. Passiamo ai voti. Indìco la votazione nominale, mediante procedimento elettronico, sull'emendamento Vacca 10.77, con il parere contrario della Commissione e del Governo e il parere favorevole delle relatrici di minoranza dei gruppi Sinistra Ecologia Libertà e MoVimento 5 Stelle. Dichiaro aperta la votazione. (Segue la votazione). Galperti, Fanucci... Dichiaro chiusa la votazione. Comunico il risultato della votazione: la Camera respinge (Vedi votazioni). (Presenti 357 Votanti 353 Astenuti 4 Maggioranza 177 Hanno votato sì 94 Hanno votato no 259). (Il deputato Kronbichler ha segnalato che non è riuscito ad esprimere voto favorevole). Indìco la votazione nominale, mediante procedimento elettronico, sull'emendamento Centemero 10.79, con il parere contrario della Commissione, del Governo e delle relatrici di minoranza dei gruppi Sinistra Ecologia Libertà e MoVimento 5 Stelle. Dichiaro aperta la votazione. (Segue la votazione). Dell'Aringa... Dichiaro chiusa la votazione. Comunico il risultato della votazione: la Camera respinge (Vedi votazioni). (Presenti e votanti 364 Maggioranza 183 Hanno votato sì 56 Hanno votato no 308). A pagina 47, la relatrice ha proposto una riformulazione dell'emendamento D'Ottavio 10.80. Il proponente la accetta, quindi questo emendamento viene ricollocato a pagina 127, perché rimane solo la parte relativa al comma 18 dell'articolo 10. Quindi, lo riprendiamo più tardi. Passiamo alla votazione dell'emendamento Gelmini 10.128. Passiamo ai voti. Indìco la votazione nominale, mediante procedimento elettronico, sull'emendamento Gelmini 10.128, con il parere contrario della Commissione, del Governo e della relatrice di minoranza del gruppo MoVimento 5 Stelle, mentre la relatrice di minoranza del gruppo Sinistra Ecologia Libertà si rimette all'Assemblea. Dichiaro aperta la votazione. (Segue la votazione). Dichiaro chiusa la votazione. Comunico il risultato della votazione: la Camera respinge (Vedi votazioni). (Presenti 361 Votanti 344 Astenuti 17 Maggioranza 173 Hanno votato sì 39 Hanno votato no 78). (Il deputato Nuti ha segnalato che non è riuscito ad esprimere voto contrario). Indìco la votazione nominale, mediante procedimento elettronico, sull'emendamento Rampelli 10.95, con il parere contrario della Commissione e del Governo e il parere favorevole delle relatrici di minoranza dei gruppi Sinistra Ecologia Libertà e MoVimento 5 Stelle. Dichiaro aperta la votazione. (Segue la votazione). Sgambato, Kronbichler... Onorevole, il cambio del posto non l'ha avvantaggiata... Dichiaro chiusa la votazione. Scusate, ho chiuso la votazione e non credo che abbiamo fatto in tempo. Mi dispiace. Comunico il risultato della votazione: la Camera respinge (Vedi votazioni). (Presenti e votanti 359 Maggioranza 180 Hanno votato sì 92 Hanno votato no 267). Indìco la votazione nominale, mediante procedimento elettronico, sull'emendamento Luigi Gallo 10.91, con il parere contrario della Commissione e del Governo e il parere favorevole delle relatrici di minoranza dei gruppi Sinistra Ecologia Libertà e MoVimento 5 Stelle. Dichiaro aperta la votazione. (Segue la votazione). Paola Bragantini... Aspettiamo i colleghi che stanno salendo. Onorevole Baldassarre, funziona la sua postazione, visto che prima le ho fatto perdere la votazione ? Luciano Agostini... Dichiaro chiusa la votazione. Comunico il risultato della votazione: la Camera respinge (Vedi votazioni). (Presenti e votanti 367 Maggioranza 184 Hanno votato sì 105 Hanno votato no 262). Indìco la votazione nominale, mediante procedimento elettronico, sull'emendamento Luigi Gallo 10.94, con il parere contrario della Commissione e del Governo e il parere favorevole delle relatrici di minoranza dei gruppi Sinistra Ecologia Libertà e MoVimento 5 Stelle. Dichiaro aperta la votazione. (Segue la votazione). Melilla, Montroni... Dichiaro chiusa la votazione. Comunico il risultato della votazione: la Camera respinge (Vedi votazioni). (Presenti e votanti 358 Maggioranza 180 Hanno votato sì 100 Hanno votato no 258). Indìco la votazione nominale, mediante procedimento elettronico, sull'emendamento Centemero 10.92, con il parere contrario della Commissione e del Governo, con il parere favorevole della relatrice di minoranza di Sinistra Ecologia Libertà e sul quale la relatrice di minoranza del MoVimento 5 Stelle si è rimesso all'Aula. Dichiaro aperta la votazione. (Segue la votazione). Bossa, Taricco, Berlinghieri... Dichiaro chiusa la votazione. Comunico il risultato della votazione: la Camera respinge (Vedi votazioni). (Presenti 367 Votanti 317 Astenuti 50 Maggioranza 159 Hanno votato sì 58 Hanno votato no 259). Indìco la votazione nominale, mediante procedimento elettronico, sull'emendamento Centemero 10.99, con il parere contrario della Commissione e del Governo, con il parere favorevole della relatrice di minoranza di Sinistra Ecologia Libertà e sul quale la relatrice di minoranza del MoVimento 5 Stelle si è rimessa all'Aula. Dichiaro aperta la votazione. (Segue la votazione). Currò... Dichiaro chiusa la votazione. Comunico il risultato della votazione: la Camera respinge (Vedi votazioni). (Presenti 365 Votanti 316 Astenuti 49 Maggioranza 159 Hanno votato sì 60 Hanno votato no 256). (Il deputato Busto ha segnalato che non è riuscito ad esprimere voto favorevole). Passiamo alla votazione dell'emendamento Di Lello 10.102. Ha chiesto di parlare per dichiarazione di voto l'onorevole Di Lello. Ne ha facoltà.	
MARCO DI LELLO		Grazie, Presidente. Vorrei approfittare davvero della presenza del Governo, qui, perché ho il sospetto che al MIUR vi sia un chissà quale strano legame con l'ordine degli avvocati, a cui mi fregio di appartenere, al Consiglio nazionale, perché spingono in ogni modo a far funzionare la giustizia amministrativa, pur a fronte di un consolidato e un giudicato assolutamente evidente. Stiamo parlando – lo dico ai colleghi che non sono addentro alla materia – sempre dei famosi idonei che, forse, trovano una prima parziale soluzione anche con l'emendamento D'Ottavio – così almeno, sotto questo profilo, ci risparmieremo qualche ricorso, pure fondato – e, invece, non si vogliono accogliere all'interno della categoria degli idonei i cosiddetti riservisti, cioè quelli che sono entrati con una riserva. Ora, a partire dal 2013 vi sono due sentenze del TAR Trento definitive, nove sentenze del TAR Lazio per quello che riguarda il 2014, di cui la maggioranza non appellate, e undici sentenze del TAR Lazio del 2015 tutte conformi, tutte costanti, a cui il MIUR si sta adeguando. Ogni settimana vi sono direzioni regionali che si adeguano e sciolgono la riserva. Quello che proprio non riesco a capire è qual è il motivo per cui noi dobbiamo costringere questi docenti a fare ricorso al TAR, a spendere soldi e foraggiare gli avvocati, senza che, poi, vi sia un vero motivo. Credo che noi abbiamo il dovere – lo dico al Ministro – di tenere conto delle esigenze di economicità; dopodiché, per quanto mi riguarda, credo che ciascun pubblico ufficiale, a fronte di un atteggiamento doloso di questa natura, abbia il dovere di mandare le carte alla Corte dei conti, perché, siccome ci si costringe – ovviamente, si costringe anche il Ministero – a costituirsi, con un aggravio di spese, voglio sperare che qualcuno di queste spese debba rispondere. Allora, o la risolviamo in questa sede legislativamente – qui davvero lo dico ai colleghi: non vi è maggioranza o opposizione, vi è solo buonsenso, stiamo parlando di qualche centinaia di riservisti che sono già nelle graduatorie, che non hanno bisogno di copertura economica – oppure si va avanti così, però penso che qualcuno, almeno in sede erariale, poi ne dovrà rispondere.	
