speaker	role	text	extra
MARIALUISA GNECCHI		Grazie, Presidente. Ovviamente non ricalco quello che ha già detto la relatrice, la mia collega Casellato. Per quanto riguarda la Commissione lavoro, questa proposta di legge ha avuto una discussione e un ambito di approfondimento molto legato solo ed esclusivamente al ruolo del segnalante e alla sua protezione, proprio perché è evidente che venire a conoscenza di qualcosa che lede l'Amministrazione nella quale si lavora o l'azienda, o comunque il datore di lavoro, ma anche i colleghi, è chiaro che diventa una situazione per la quale si rischia di rovinarsi i rapporti fra colleghi ovviamente, ma anche di perdere la fiducia o mettersi in difficoltà col datore di lavoro o con i propri superiori. È ovvio che tutti ci auguriamo che si riesca nel nostro Paese a creare una cultura della legalità e della correttezza, che va al di là di quelli che sono gli obblighi scritti in termini contrattuali o in termini formali da proposte di legge. Noi ci auguriamo e vorremmo vivere in un Paese nel quale, quando vieni a conoscenza di qualcosa che è contrario a quelli che sono i diritti normali di altri cittadini o le situazioni normali da correggere, ci sia una segnalazione perché questi fatti vengano a cessare. Noi sappiamo ovviamente che la Commissione europea nella relazione sulla lotta alla corruzione presentata il 3 febbraio del 2014 ha delineato lo stato dell'arte delle azioni adottate dal nostro Paese per contrastare il fenomeno corruttivo. Al netto delle criticità evidenziate sui diversi fronti di intervento, la strategia italiana era stata per lungo tempo esclusivamente imperniata su un approccio repressivo alla corruzione, che necessita oggi di essere integrato con il ricorso a strumenti di prevenzione che abbiano l'obiettivo di promuovere un cambiamento culturale in grado di sollecitare lo spirito civico individuale, il rispetto delle regole e l'impegno di tutti i consociati a favore del bene comune. È triste quindi la necessità di dover rafforzare la tutela del dipendente pubblico e privato che segnali illeciti; a noi sembrerebbe che debba essere comunque un encomio riconosciuto da tutti il fatto di segnalare delle situazioni di corruzione o di illecito. La materia è già stata in parte regolata – come è già stato detto – dalla legge n. 190 del 2012, nota come «legge Severino», che ha introdotto nell'articolo 54-bis del decreto legislativo n. 165 del 2001, quindi proprio nel testo unico sui pubblici dipendenti, una normativa per la tutela del dipendente pubblico che segnala illeciti. Tale normativa interviene nel solo settore pubblico, peraltro con esclusione degli enti di diritto privato sotto controllo pubblico e degli enti pubblici economici, introducendo per la prima volta disposizioni sulla tutela del dipendente pubblico che segnala illeciti. Le disposizioni si applicano ai pubblici dipendenti che segnalano condotte illecite (fuori dei casi di calunnia, di diffamazione o di violazione nella vita privata) al superiore gerarchico, all'autorità giudiziaria o alla Corte dei conti. Nulla invece è previsto nel settore privato, ma noi ci rendiamo anche conto che ovviamente nel settore privato i lavoratori e le lavoratrici hanno anche uno stato giuridico diverso rispetto ai dipendenti pubblici che rispondono direttamente ai cittadini, oltre che all'amministrazione dalla quale dipendono. È proprio anche strutturalmente il senso stesso del rapporto di lavoro pubblico rispetto al rapporto di lavoro privato. Va apprezzato il sistema di tutele del dipendente o del collaboratore che segnala illeciti nel settore privato, così come da articolo 2, con particolare riferimento all'introduzione di misure idonee a tutelare l'identità del segnalante e a mantenere la riservatezza dell'informazione in ogni contesto successivo alla segnalazione, nei limiti in cui l'anonimato e la riservatezza siano opponibili per legge, e alla previsione della nullità del licenziamento ritorsivo o discriminatorio del soggetto segnalante, così come del mutamento di mansioni, ai sensi dell'articolo 2103 del codice civile, nonché di qualsiasi altra misura ritorsiva o discriminatoria adottata nei confronti del segnalante. Su questo tema però va anche detto che le organizzazioni sindacali hanno sempre svolto questa funzione, nel senso che da sempre i lavoratori e le lavoratrici che venivano a conoscenza di un fatto da segnalare come fatto illecito era buon uso e normale che si rivolgessero al sindacato. Il rappresentante sindacale che riceveva la segnalazione normalmente si faceva dare una dichiarazione scritta e sottoscritta dal lavoratore o dalla lavoratrice – perché ovviamente anche il responsabile sindacale doveva tutelare se stesso dal rischio di dire delle cose non vere o che non rispettassero la realtà dei fatti – e ovviamente poi il sindacato agiva per conto del lavoratore o della lavoratrice in forma praticamente indiretta. Questa era la normale prassi che si utilizzava in termini di tutela dell'anonimato – lo dico tra virgolette – «anonimato» reale perché era solo il sindacalista o la sindacalista che conosceva la persona che aveva segnalato, però, nonostante l'anonimato della persona, poteva andare avanti rispetto a risolvere o tentare di risolvere quella che era la situazione sulla quale si dovesse agire. Noi ci rendiamo conto che questo periodo è un periodo nel quale molte delle istituzioni e dei corpi intermedi hanno perso credibilità e fiducia nei confronti dei cittadini, però bisogna ovviamente mirare a ricreare questa fiducia, sia nelle istituzioni, che nello Stato, che nei corpi intermedi e, quindi, ovviamente mirare anche a riconoscere il ruolo delle organizzazioni sindacali. Vale la pena ricordare, visto che abbiamo anche in legge di stabilità dei tagli ai CAF e ai patronati, che sono comunque dei soggetti utili ai cittadini, che il lavoratore e la lavoratrice hanno una trattenuta mensile sulla propria busta paga per aderire ad una organizzazione sindacale e, quindi, è normale che abbiano anche delle forme di tutela e siano aiutati e supportati anche in situazioni di questo tipo, nel settore pubblico e, ovviamente, nel settore privato. Va apprezzata la previsione che in tali casi, quando risultano elementi di prova della natura ritorsiva e discriminatoria delle misure adottate, spetta al datore di lavoro l'onere della prova della sussistenza di legittime ragioni a fondamento della stessa. La discussione sull'onere della prova o sull'inversione dell'onere della prova è una discussione che nel diritto del lavoro ha avuto dei percorsi molto significativi. Quindi, è chiaro che definire che l'onere della prova sta in capo al datore di lavoro è sicuramente una cosa importante. Chiudo, Presidente, segnalando comunque che vediamo una forzatura nel meccanismo previsto dalla cosiddetta premialità, che dovrebbe rappresentare l'essenza stessa del pubblico dipendente e, quindi, non si deve essere premiati se si svolge il proprio lavoro. E rimane da definire un punto di equilibrio tra il diritto alla segretezza del segnalante e il diritto di conoscenza delle contestazioni rivoltegli per il segnalato, anche al fine di un pieno esercizio del diritto di difesa. Quindi, con queste situazioni, che probabilmente il dibattito e la discussione in Aula serviranno comunque a chiarire, noi abbiamo affrontato questa discussione solo tenendo conto della parte del lavoratore e della lavoratrice in queste situazioni.	
ROBERTO GIACHETTI	PRESIDENTE	iscritto a parlare l'onorevole Occhiuto. Ne ha facoltà.	
ROBERTO OCCHIUTO		Grazie Presidente, onorevoli colleghi, oggi iniziamo l'esame di un provvedimento che ha finalità sicuramente importanti: la tutela degli autori di segnalazioni di reati, il cosiddetto whistleblowing. Come si dice sempre più spesso, anche in questi casi, ce lo chiede l'Europa. La Commissione europea, infatti, nella relazione del 2014 ha invitato il nostro Paese a rafforzare gli strumenti anticorruzione, anche attraverso la piena funzionalità del dispositivo di tutela dei segnalanti previsti nel settore pubblico. L'intento da perseguire, l'obiettivo appena richiamato, può risultare un intento, un obiettivo condivisibile. Noi stessi lo condividiamo, ma non condividiamo il modo in cui questo obiettivo si voglia perseguire attraverso questa proposta di legge. Ci piacerebbe che si facesse leva, sì sulla necessita di reprimere i comportamenti patologicamente corruttivi nelle imprese pubbliche e anche in quelle private, ma ci piacerebbe ancor di più che si mettessero in cantiere meccanismi per affermare davvero la promozione della cultura della legalità in positivo, attraverso percorsi che rendano la pubblica amministrazione più meritocratica e con possibilità di progressioni di carriera e di meccanismi di premialità maggiormente imperniati sulla meritocrazia. Io non faccio parte delle Commissioni giustizia e lavoro che hanno esaminato questo testo, ma so che, come è stato rilevato anche dai colleghi che mi hanno preceduto, queste Commissioni hanno approfondito un'indagine conoscitiva nel corso della quale diversi stakeholder auditi, tra i quali Confindustria, hanno rappresentato alcune perplessità. Il provvedimento che esaminiamo oggi è il risultato di modifiche pressoché integrali. Lo diceva l'onorevole Businarolo: non è più il testo presentato dalla minoranza, dal MoVimento 5 Stelle, perché, a causa delle modifiche apportate nelle Commissioni, questo testo è stato profondamente modificato. Nonostante queste modifiche, però, il provvedimento che arriva oggi in Aula non risponde realmente alla tanto invocata logica della prevenzione, quanto piuttosto ad una logica di mera delazione, costituendo in verità un sistema che, se da un lato non garantisce compiutamente chi denuncia fenomeni corruttivi nelle aziende pubbliche o private, dall'altro crea anche una condizione di instabilità in queste amministrazioni. La proposta di legge alimenta una dannosissima cultura del sospetto. La cultura del sospetto, infatti, signor Presidente, ancor più applicata al diritto, trasforma un fatto giuridicamente rilevante in una possibile e del tutto teorica condotta delittuosa, sia per quanto riguarda il pubblico impiego, che per il settore privato. Per l'uno e per l'altro il rischio concreto è di arrivare ad una condizione di totale instabilità e di incertezza. Il testo risultante dall'esame nelle Commissioni contiene, infatti, troppe ambiguità e misure molto vaghe che non contribuiscono, come dicevo prima, né a tutelare in modo concreto il segnalante, né costituiscono un efficace deterrente contro denunce false e pretestuose. Si fa riferimento, ad esempio, al concetto di buona fede rispetto al quale il segnalante dovrebbe essere tutelato; concetto che risulta altamente discrezionale, se non pericoloso, perché potenzialmente applicabile ad una serie infinita di fattispecie. Diversamente da quanto affermato, la proposta di legge in esame non rappresenta una sistematizzazione giuridica della materia, ma, al contrario, comporta proprio la destabilizzazione del sistema, tanto nel settore pubblico, dove già esiste una disciplina legislativa, quanto in quello privato. Vorrei ricordare che l'articolo 1 della legge 6 novembre 2012, n. 190, recante disposizioni per la prevenzione e la repressione della corruzione e dell'illegalità nella pubblica amministrazione, l'articolo, cioè, che ha istituito l'Autorità nazionale anticorruzione e ha disciplinato per la prima volta nella legislazione italiana la figura del cosiddetto whistleblower, con particolare riferimento al dipendente pubblico che segnala illeciti, è un articolo che già c’è, è una norma che già è vigente nel nostro ordinamento. È vero, viene offerta una parziale forma di tutela, ma è una norma che era già presente nel nostro ordinamento. Questa disposizione è oggi nuovamente oggetto di modifica da parte del provvedimento che ci accingiamo ad esaminare e rispetto al quale la Commissione affari costituzionali, nell'esprimere il proprio parere, ha osservato l'opportunità di specificare meglio la condotta di abuso che può essere oggetto di segnalazione. In altre parole, la I Commissione ha sottolineato il fatto che le disposizioni in tema di segnalazione del reato sono per l'appunto troppo vaghe, ampie e, perciò, ambigue, rendendo di fatto questo provvedimento, da un lato troppo esposto alla possibilità di false denunce e dall'altro probabilmente inutile. Forza Italia ha presentato numerose proposte emendative già nelle Commissioni e poi in Aula, raccogliendo le diverse istanze rappresentate, anche in sede di indagine conoscitiva. Lo ha fatto per circoscrivere, innanzitutto al settore pubblico, la tutela per gli autori di segnalazione dei reati. Il nostro timore è che il provvedimento promuova una cultura della delazione sistematizzata, che comporti la destabilizzazione della pubblica amministrazione e delle imprese private, consegnate di fatto alla giurisdizione dell'Autorità nazionale anticorruzione. A margine di un convegno sul tema, pochi mesi fa, Raffaele Cantone, che è il presidente dell'ANAC, dichiarò che la delazione non è una brutta parola e che quindi serve più coraggio da parte del legislatore ed è forse necessario sporcarsi un po’ le mani ed avere il coraggio di dare maggiore tutela e riservatezza al denunciante. Bene, ma per chiarire lo scenario che si verrebbe a creare, ritengo utile, anzi importante, richiamare il parere espresso dall'Unione delle camere penali, in termini di whistleblowing, dopo le affermazioni di Cantone che ho appena richiamato. Dice l'Unione delle camere penali – leggo testualmente –: il problema non è tanto quello di spiegare quali diverse e non del tutto riprovevoli condizioni etiche e culturali giustificherebbero una qualche avversione ad un uso eccessivamente disinvolto dello strumento ma quali rischi di sviamento possa comportare un troppo semplicistico trasferimento da un contesto aziendale a quello puramente penale processuale; questi meccanismi, calati nella realtà del nostro sistema processuale, se utilizzati come fonte di prova, entrerebbero in rotta di collisione con la copertura della fonte medesima, e se, al contrario, utilizzati come semplice ed anonima notizia di reato, potrebbero avallare i peggiori comportamenti (vendette, invidie, atti di sciacallaggio) di un'impresa ai danni di un altro, fornendo all'autorità giudiziaria una quantità di materiali informativi e di spunti investigativi tutti astrattamente suscettibili di accertamenti e di attenzionamenti, come si dice in questi casi, ma tutti al tempo stesso suscettibili di trasformarsi in un'autentica ed inesauribile macchina del fango istituzionalizzata. In ultimo, chi denuncia l'illecito fa il proprio dovere di cittadino, apprezzabile, in quanto si assume la responsabilità della propria scelta e perché abbandona la mentalità omertosa. Compie un atto che è apprezzabile, perché è per l'appunto un atto esemplare del quale essere orgogliosi davanti alla collettività. E una simile idea non ha bisogno certo né di tutela né di riservatezza. Questo è quello che in sostanza ha scritto e ha dichiarato l'Unione delle camere penali; questo, però, è anche quello che noi riteniamo si debba affermare per valorizzare l'atteggiamento di chi denuncia eventi corruttivi abbandonando appunto una mentalità omertosa. Ci preoccupa, invece, il fatto che quando si discute di questo tema a volte la nostra mente va ad un riuscito film di pochi anni fa intitolato «Le vite degli altri», nel quale si descrivevano in modo puntuale i metodi invasivi utilizzati dalla Stasi per spiare comportamenti dei cittadini tedeschi nella Germania dell'Est. Non vorremmo assistere, signor Presidente, ad una vera e propria inaugurazione di un nuovo Stato di polizia. Quando il presidente dell'ANAC, Cantone, ha dichiarato che la delazione non è una brutta parola, in quella circostanza si riferiva in modo particolare alla delazione di tipo fiscale, ma poco importa. Si tratta della diffusione di un vero e proprio clima da Stato di polizia che ci fa rabbrividire; che fa rabbrividire noi, ma che, siamo sicuri, farebbe rabbrividire anche molti cittadini, se solo fossero compiutamente informati su questo.	
ROBERTO GIACHETTI	PRESIDENTE	iscritto a parlare l'onorevole Vignali. Ne ha facoltà.	
RAFFAELLO VIGNALI		Grazie, signor Presidente. Mi rincresce dovere esprimere la nostra più assoluta contrarietà, come gruppo, a questo provvedimento. Siamo contrari a questo provvedimento da diversi punti di vista; innanzitutto da un punto di vista culturale. Noi abbiamo bisogno di un Paese normale e un Paese normale è fondato sulla coesione e sulla fiducia, non sul sospetto. Il sospetto disgrega la società e mina la convivenza. E noi partiamo dal fatto che la stragrande maggioranza, la quasi totalità, la normalità statistica della nostra pubblica amministrazione e delle nostre imprese siano fatte da persone perbene. Altri, invece – capisco culturalmente, anche se non condivido nel modo più assoluto –, cercano il male ovunque, anche dove non c’è. E questo è un provvedimento veramente di natura hobbesiana, con l'idea che l'uomo è lupo all'uomo. Su questo, francamente, non possiamo condividere. Non possiamo condividere questa concezione della persona, della società e dello Stato in alcun modo. Diceva giustamente prima il collega Occhiuto: questo è un provvedimento da Germania dell'Est, ma prima della caduta del muro. Avrebbe potuto partorirlo la Stasi e far venire in mente il film «Le vite degli altri». Non è una questione che manchino in questo Paese, intensificati anche da questo Governo, gli strumenti di lotta alla corruzione, che si stanno facendo ! Non è vero che non si sta facendo, però dobbiamo anche stare attenti alle norme che facciamo. Provo a entrare un po’ nel merito anche dal punto di vista dei contenuti. Peraltro, anche dall'intervento della collega Gnecchi, purtroppo ho avuto delle conferme. Primo: abbiamo già norme per prevenire e segnalare reati e irregolarità – reati e irregolarità, che sono fatti, non sono sospetti ! – e denunciarle, giustamente, è stato detto dai colleghi che mi hanno preceduto, è dovere dei cittadini, di tutti, nessuno escluso. Nel provvedimento si parla di buona fede: chi è in buona fede oggi già denuncia ed è già tutelato. Non vorremmo, invece, che questa diventasse una norma che tutela chi non è in buona fede, chi attraverso questa norma penserà a tutelare se stesso, non la pubblica amministrazione o le imprese. Ad esempio, in entrambi gli articoli, il primo e il secondo: cosa significa che il denunciante ritiene altamente probabile che la condotta illecita o l'abuso si sia verificato ? Anche in quest'Aula tante volte sentiamo appunto colleghi che pensano esattamente che sia altamente probabile, salvo il fatto che poi magari non è assolutamente vero. Secondo: con questo provvedimento si crea un forte squilibrio tra chi accusa e chi si trova costretto a difendersi, lo diceva prima anche la collega Gnecchi. È stato fatto soltanto dal punto di vista del dipendente o di alcuni dipendenti, e già questo dovrebbe dire che non è un buon provvedimento, perché quando semplicemente si interviene a tutelare o favorire – come vedremo – una parte, evidentemente c’è uno squilibrio. Con questo provvedimento si mettono nelle mani di chi accusa armi imponenti e nuove; chi viene accusato può ricorrere solo con gli strumenti del codice penale e civile: ci sembra un po’ asimmetrica la cosa. Chi è accusato non sa di esserlo e non sa di che cosa è accusato, non è solo questione di anonimato di chi accusa ! Io non so se questo sia conforme a uno Stato di diritto, per non parlare della premialità. Se denunciare è un dovere, perché chi lo fa deve essere premiato ? E per chi è accusato, se venisse poi prosciolto, che premio c’è ? A parte le prime pagine, magari per un mese, sui giornali viene macchiato come corrotto, poi magari un trafiletto, alla fine, a pagina 57. Non c’è bisogno di ricorrere alla storia di questo Paese per sapere che queste cose succedono normalmente. La segretezza, perché non vale anche per chi è accusato, che magari si trova appunto sulle prime pagine ? Per non parlare della parte sulle imprese: vi rendete conto di che oneri stiamo mettendo anche sulle microimprese ? A parte un'aberrazione giuridica (l'inversione dell'onere della prova), nell'antica Roma i delatori – perché questa è la traduzione di whistleblower: delatore; sicofante in greco), dovevano fornire le prove dell'accusa, non un sospetto che avesse una parvenza di verosimiglianza. Giustamente, diceva fra l'altro la collega Gnecchi: attenzione perché – lo dico soprattutto ai colleghi del PD – si esautora completamente il ruolo del sindacato. Invito anche ad andare a vedere cosa succede in giro per il mondo; c’è un bellissimo sito – forse magari chi ha proposto la proposta di legge si ispirava a quello cinese, dello Stato cinese – dove si invita alla delazione. C’è stato un picco esponenziale dei suicidi e non si sa se quelli accusati erano accusati di illeciti o erano semplicemente nemici politici di chi governa quel Paese. Ma la storia italica conosce molto bene questa figura appunto, ripeto, del delatore. Non vorrei andare alle citazioni dotte, ma forse magari qualcuno dovrebbe rileggersi cosa diceva Tacito di queste persone: «così i delatori, razza di uomini inventati per la pubblica rovina, non abbastanza tenuti a freno neppure dalle pene, venivano ora incoraggiati con la prospettiva dei premi». Sono 2 mila anni che queste cose succedono in Italia, ripeto, con la differenza che però nell'antica Roma c'era l'obbligo di fornire la prova da parte di chi accusava. Seneca diceva che i delatori alimentano e fomentano solo la rabbia pubblica; non so se è quello di cui abbiamo bisogno in questo Paese. Costantino e Teodosio addirittura punirono pesantemente i delatori con la riduzione in schiavitù o con la condanna a morte, forse perché erano imperatori cristiani e si ricordavano che c'era stato un delatore qualche secolo prima che si chiamava Giuda, che è stato premiato con 30 denari. Chiudo veramente con una bellissima citazione, però da Aristofane, «Le rane». C’è un personaggio a cui va il delatore, il Sicofante, per chiedergli che gli faccia delle ali perché lui fa di mestiere il delatore e chiede le ali perché vuole andare a volare sulle isole per poter fare le sue denunce, e chi costruisce le ali, Pistetero, dice: questo è dunque il tuo lavoro, giovane come sei non trovi di meglio che denunciare gli stranieri ? Che posso farci, dice Sicofante, non so zappare. E Pistetero risponde: ma ci sono tanti mestieri dignitosi con cui un uomo robusto come te può guadagnarsi onestamente da vivere, piuttosto che intrigare in tribunale. E il Sicofante dice: ti ho chiesto ali, non consigli. Chiudo, Presidente. Noi siamo a favore del contrasto pesante agli illeciti nella pubblica amministrazione, ai reati nella pubblica amministrazione, comportamenti scorretti ovunque ci siano, istituire per legge la delazione col premio francamente la riteniamo una cosa non appena non utile, ma assolutamente nociva per la società, per l'economia e per tutto il Paese.	
ROBERTO GIACHETTI	PRESIDENTE	iscritto a parlare l'onorevole Baroni. Ne ha facoltà.	
