speaker	role	text	extra
FLORIANA CASELLATO	Relatrice per l'XI Commissione	Grazie Presidente, dopo l'intervento del collega Vazio io mi riservo di intervenire nel prosieguo della discussione.	
			Ordine del giorno della seduta di domani.
ROBERTO GIACHETTI	PRESIDENTE	Prendo atto che il rappresentante del Governo, il sottosegretario di Stato per la giustizia, Cosimo Maria Ferri, rinunzia alla replica. Il seguito del dibattito è rinviato ad altra seduta.	
			La seduta termina alle 17,25.
			TESTO INTEGRALE DELLA RELAZIONE DELLA DEPUTATA FLORIANA CASELLATO IN SEDE DI DISCUSSIONE SULLE LINEE GENERALI DELLA PROPOSTA DI LEGGE N. 3365-A ED ABB.
ROBERTO GIACHETTI	PRESIDENTE	Comunico l'ordine del giorno della seduta di domani. Martedì 24 novembre 2015, alle 10: 1. – Seguito della discussione del disegno di legge costituzionale (previo esame e votazione delle questioni pregiudiziali di costituzionalità e delle questioni pregiudiziali di merito presentate): S. 1429-B – Disposizioni per il superamento del bicameralismo paritario, la riduzione del numero dei parlamentari, il contenimento dei costi di funzionamento delle istituzioni, la soppressione del CNEL e la revisione del titolo V della parte II della Costituzione (Approvato, in prima deliberazione, dal Senato, modificato, in prima deliberazione, dalla Camera e nuovamente modificato, in prima deliberazione, dal Senato) (C. 2613-B) — Relatori: Fiano, per la maggioranza; Toninelli, Quaranta, Invernizzi e La Russa, di minoranza. 2. – Seguito della discussione della proposta di legge: BUSINAROLO ed altri: Disposizioni per la tutela degli autori di segnalazioni di reati o irregolarità di cui siano venuti a conoscenza nell'ambito di un rapporto di lavoro pubblico o privato (C. 3365-A) e delle abbinate proposte di legge: BUSINAROLO ed altri; FERRANTI ed altri (C. 1751-3433) — Relatrici: Businarolo, per la II Commissione; Casellato, per l'XI Commissione.	
