speaker	role	text	extra
FABIO RAMPELLI		Grazie, Presidente, colleghi deputati, rappresentanti del Governo, abbiamo avuto modo già di anticipare la nostra contrarietà rispetto a questo DDL per ragioni molteplici che, se ci facciamo attenzione, un po'emergono da molti gruppi che hanno preso la parola in queste ore. Talvolta, anche interventi critici, provenienti dalla stessa maggioranza, nel senso interventi di perplessità, di insoddisfazione latente, ma, comunque, pur sempre, interventi che lasciano capire che si sta di fronte ad un provvedimento che non entra nel merito delle esigenze di riforma radicale della RAI, del Servizio pubblico radiotelevisivo. Vedendo quel che è accaduto in questi anni, in questa sorta di tentativo di mettere insieme un disegno neocentrista che ha minimizzato le forze dell'opposizione, che erano entrate robuste – praticamente un pari e patta – nelle elezioni politiche più recenti, l'acquisizione prima del Nuovo Centro-destra di Alfano al Governo, qualche pezzo che si è staccato persino da SEL, qualche pezzo che è confluito nel gruppo Misto e si è parcheggiato, nell'attesa di trovare asilo politico all'interno della grande «balena bianca» del Partito democratico, poi, più di recente, l'operazione fatta, prima con il senatore Bondi e poi con Verdini e il suo gruppo, ci domandiamo, dopo aver assistito ad una serie di tentativi, di prove tecniche di trasmissione sulla flessibilità del lavoro, sul jobs act, sull'abolizione dell'articolo 18, più di recente sull'abolizione dell'IMU sulla prima casa, dell'abolizione dell'IMU agricola e dell'IRAP agricola, la legge di stabilità, che sta per atterrare con questi 26 miliardi di spesa ed una copertura per soli 15 miliardi (un inno al deficit, ad una nuova stagione di deficit che implementerà inevitabilmente il debito pubblico e continuerà a mettere polvere sotto il tappeto per le future generazioni che dovranno provare a toglierla), l'abolizione per metà del Senato, alla renziana maniera, l'abolizione per metà delle province (in realtà, si abolisce soltanto il diritto di cittadini a votare e a partecipare democraticamente a queste istituzioni), la nuova legge elettorale, ecco, se comprendiamo le ragioni di un disegno neo-centrista, quasi della realizzazione di un nuovo partito unico, per affrontare, nella maniera maldestra che abbiamo riassunto qui, i temi cardine che ci hanno accompagnato in questi due anni, non capiamo la ragione per la quale non si abbia avuto il coraggio di affrontare di petto la materia della RAI. Questa riforma non è una riforma, è una leggina; è una leggina di circostanza che si preoccupa solo e soltanto paradossalmente di dare altri strumenti di propaganda a chi governa. È una legge, come hanno detto altri colleghi, come abbiamo già detto noi nella giornata di ieri, quando abbiamo illustrato dalla parte di Fratelli d'Italia, le pregiudiziali di costituzionalità, che interviene soltanto sugli organigrammi, sulla governance della RAI, togliendo peso ai partiti. Noi abbiamo chiesto che fossero spazzati via i partiti dalla RAI, ma certo non per dare più spazio al Governo, perché quando il Governo entra a gamba tesa, come fanno altri Governi europei, richiamati dall'Europa alle proprie responsabilità e al dovere del pluralismo nell'informazione, quando lo si fa, sostituendo ai partiti, al Parlamento, alla politica in quanto tale il Governo, si scivola verso il rischio regime; quello che accade con il nuovo Consiglio di amministrazione, che passa da 9 a 7 componenti, come si è detto. Ma io vorrei sottolineare il fatto che se si aumenta il peso del Governo e si diminuiscono i consiglieri di amministrazione, significa che si aumenta ancor di più in maniera esponenziale il peso specifico di Governo nel Consiglio di amministrazione. Sono due i componenti su sette, sono due poi quelli designati dal Senato, sono due quelli designati dalla Camera, con un voto che comunque non garantisce la certezza matematica della presenza dell'opposizione all'interno del Consiglio di amministrazione. Poi c’è la trasformazione della figura del direttore generale in amministratore delegato; una trasformazione che prevede, in buona sostanza, un altro pezzo saliente – si cala l'asso da parte della Presidenza del Consiglio – vale a dire la nomina è ancora una volta del Governo. Siamo molto preoccupati per questa deriva. Non ci vuole molto – basta osservare i dati dell'Agcom piuttosto che quelli dell'Osservatorio di Pavia – per capire come oggi si distribuisce nell'informazione la presenza delle varie sensibilità politiche in campo. C’è una netta trasbordante prevalenza sia del Governo sia della maggioranza, mentre tutte le opposizioni insieme non raggiungono il 25-30 per cento di presenza televisiva. E parliamo non già di un pericoloso magnate che detiene la proprietà dei network televisivi privati, ma parliamo di quella radiotelevisione pubblica che ha le concessioni da parte dello Stato e che dovrebbe per definizione essere titolata ad agire in maniera sobria e nel rispetto di tutte le opinioni. Abbiamo citato ieri, nel corso della discussione sulla pregiudiziale, interventi monumentali fatti in quest'Aula sull'esigenza di una maggiore democratizzazione del servizio radiotelevisivo da parte di Marco Pannella piuttosto che di Giorgio Almirante. Mi pare che, purtroppo, nonostante quelle denunce, per quel che riguarda Marco Pannella denunce ancora attuali, invece che migliorare questo servizio lo si va peggiorando. Avrebbe un senso mettere le mani sulla governance del servizio radiotelevisivo pubblico se si decidesse una volta per tutte di cambiare verso, segno e direzione alla Tv di Stato, se si decidesse di fare accettare alla Tv pubblica la sfida del mercato, della competitività: se si decidesse viceversa anche di agire sul canone cioè sulla tassazione: sradicando il fenomeno della evasione oppure semplicemente abolendo il canone e dichiarando la Tv di Stato una divisione commerciale capace, quindi, di stare in piedi con i soli introiti provenienti dal circuito commerciale, cioè dal circuito della pubblicità. Il Governo chiede deleghe su questo disegno di legge, deleghe in particolare sul canone e immagino che, da qui a qualche settimana, ne parleremo ancora quando discuteremo in Aula della legge di stabilità che prevede anche un diverso regime di tassazione da parte dello Stato sulla RAI. Deleghe che comunque non vengono esercitate o che non sono chiare nei loro indirizzi su diverse altre questioni. Ricordo che quando fu istituita Raitre fu immaginata una vocazione importante della RAI proprio in quanto servizio pubblico nel suo rapporto con i territori e le regioni. Non c’è uno straccio di disegno, non c’è una visione per provare a far diventare le regioni e, quindi, le reti regionali, un motore per una RAI capace di occupare e di saturare il mercato facendo riferimento alle tipicità regionali, alle eccellenze, alle peculiarità, alle identità, alle vocazioni, alle attività socio-economiche e produttive che possono trasformarsi in contributi, in inserzionisti, in sponsorizzazioni. Anche da questo punto di vista stiamo parlando a vanvera, perché niente di tutto ciò compare né nel DDL né nelle intenzioni di questo Governo. Queste sono le ragioni fondamentali che ci vedono dalla parte opposta rispetto a coloro i quali sosterranno questo provvedimento, animati da preoccupazione rispetto alla minaccia di totalitarismo mediatico attraverso una gestione malsana della televisione di Stato (Applausi dei deputati del gruppo Fratelli d'Italia – Alleanza Nazionale).	
LAURA BOLDRINI	PRESIDENTE	Ha chiesto di parlare per dichiarazione di voto il deputato Fratoianni. Ne ha facoltà.	
NICOLA FRATOIANNI		Grazie signora Presidente, Sinistra Ecologia Libertà voterà contro questa legge. Per la verità, quando il Governo e Matteo Renzi annunciarono la volontà assai ambiziosa di riformare la RAI, il sistema radiotelevisivo, questa grande infrastrutturazione culturale del Paese, avevamo preso per buona questa ambizione. Ci eravamo disposti a partecipare e, forse con qualche eccesso di presunzione, anche a contribuire ad alimentare una discussione che potesse in qualche modo aprire, non solo le porte del Parlamento, ma coinvolgere il Paese su una questione che consideriamo una questione centrale per la democrazia nel nostro tempo. Vedete, dentro la società della comunicazione, un'infrastruttura come la RAI svolge obiettivamente una funzione decisiva sul terreno innanzitutto della formazione e della qualità della democrazia nel nostro Paese. Quando il servizio pubblico entra, come entra ancora oggi, nelle case della stragrande maggioranza degli italiani e svolge lì una funzione decisiva di informazione e di orientamento culturale, mettere le mani su quell'infrastruttura richiede, o meglio avrebbe richiesto, appunto una grande discussione capace di guardare a quello che produce quell'azienda, ai suoi contenuti, perfino ai suoi linguaggi, agli strumenti, alle piattaforme, alle nuove domande che l'innovazione tecnologica pone in un settore così strategico e decisivo. Avevamo per questo proposto una legge che aveva alcuni capisaldi. Il primo, considerare la RAI, per queste ragioni che ho appena detto, un bene comune, cioè una struttura fondamentale per garantire a tutti l'accesso all'informazione e alla formazione in un tempo come quello che viviamo dove, appunto, la comunicazione svolge un ruolo sempre più decisivo. In secondo luogo, avevamo immaginato un sistema duale che potesse in qualche modo, da un lato mettere al riparo le necessità gestionali di quella che resta pur sempre una grande azienda e, dall'altro, però, che potesse, con il comitato di indirizzo e valutazione, attraverso un meccanismo largo di coinvolgimento delle forze sociali e culturali del Paese, perfino dei cittadini e dei lavoratori, determinare alcuni elementi di controllo sugli indirizzi generali, capaci di determinare un riequilibrio dei poteri e degli interessi. Avevamo proposto, nella nostra legge, di affrontare il tema del canone, oggi tornato agli onori della cronaca – ci avete detto che lo metterete in bolletta – a partire da una parola e da un concetto che, come abbiamo visto anche in questa finanziaria, è sempre più sconosciuto a questo Governo, ossia quello di progressività. Inoltre, volevamo dire anche per il canone «facciamo in modo che venga pagato sulla base delle diverse condizioni di possibilità e di disponibilità economica». A tutto questo è stato risposto, come spesso accade, senza una risposta. Quella che doveva essere una grande riforma è diventata una piccola opera di manutenzione. Avete scelto di concentrare tutti i vostri sforzi sull'unico punto di vero interesse di questo Governo e del Presidente del Consiglio: la governance. Avete messo mano, con piccoli ritocchi, alla Gasparri, quella legge tante volte definita, non solo da voi, ma da tante parti del Paese democratico e progressista, come un obbrobrio, come un attentato alla libertà di informazione. Ecco, ve lo voglio dire, siete riusciti a fare perfino peggio. Avete, in nome della necessità di liberare la RAI dal giogo e dal peso dei partiti, peraltro condivisa da un'ampia trasversalità in questo Parlamento e nel Paese, con un capolavoro trasformato questo slogan nel suo contrario. Avete liberato la RAI dal Parlamento, dal pluralismo, dal dibattito generale e l'avete consegnata al Governo, all'Esecutivo cioè proprio a chi dovrebbe avere poco a che fare con una struttura come la RAI che svolge la funzione di cui ho detto poco fa. Lo avete fatto in nome di un'idea, quella di tenere sotto controllo l'informazione, di escludere ogni elemento di equilibrio dei poteri. Lo avete fatto dentro quel filo rosso che caratterizza tanta parte della vostra agenda. Avete dato i superpoteri a un manager che potrà da solo determinare le scelte di nomina dei direttori, che potrà da solo determinare gli indirizzi nei quali si muoverà l'azienda, potrà entrare per primo nella scelta del personale. Avete assegnato questi superpoteri anche in questo caso con un ulteriore capolavoro: lo avete fatto con una norma transitoria perché, siccome avevate dovuto rinominare il consiglio di amministrazione con quella legge Gasparri tanto odiata, avete trovato il modo di dire: vabbe’, sta lì con la legge Gasparri ma intanto il direttore generale assume i poteri dell'amministratore delegato come se fosse stato nominato con la nuova normativa. Insomma l'avete costruita bene questa operazione: avete ottenuto tutto e subito, il massimo della spartizione e contemporaneamente il massimo del controllo da parte dell'Esecutivo. Noi non ci stiamo: per questo voteremo contro questa riforma, per questo continueremo a vigilare non solo nelle Commissioni deputate ma a vigilare nel Paese e nel Parlamento per denunciare tutte le volte in cui la cultura politica che sta dietro a questa piccola e pessima legge produrrà concretamente i suoi effetti. Li abbiamo già visti del resto. Abbiamo visto subito che cosa significa per voi riformare la RAI. L'abbiamo visto quando i deputati del partito di maggioranza hanno chiesto che venisse il direttore di Raitre in Commissione a rispondere di un fatto scandaloso dal loro punto di vista: la scelta di invitare qualcun altro che non fossero solo loro nei principali talk show. Lo abbiamo visto quando qualche altro esponente di quella Commissione ha dichiarato, sempre riferendosi a quella rete e, in particolare, alla sua testata giornalistica, il Tg3: non avete capito chi ha vinto, non avete capito che l'aria è cambiata. Noi contro quella cultura politica ci siamo sempre battuti. Vorrei ricordarlo fino ad un po’ di tempo fa ci siamo battuti persino insieme a voi, cari colleghi e care colleghe del Partito Democratico. Noi non abbiamo cambiato idea. Continueremo ad opporci. Non capiamo perché l'avete cambiata voi o forse lo capiamo troppo bene ma è una cosa che non ci fa piacere (Applausi dei deputati del gruppo Sinistra Ecologia Libertà).	
LAURA BOLDRINI	PRESIDENTE	Ha chiesto di parlare per dichiarazione di voto il deputato Caparini. Ne ha facoltà.	
DAVIDE CAPARINI		Poca roba, veramente poca roba questa presunta riforma non è altro che un'opera di maquillage della tanto vituperata, odiata, osteggiata, legge Gasparri che, grazie all'accordo evidente che avete fatto con il partito di presunta opposizione ovvero Forza Italia, ci ha consegnato, consegnerà al Paese poco altro che un ritorno al passato. Noi ci aspettavamo una riforma vera, una riforma con tutto ciò che una riforma comporta ovvero la definizione del servizio pubblico cioè cosa bisogna finanziare e come deve essere finanziato, chi poi è in grado di espletare tale servizio pubblico e noi abbiamo pensato e abbiamo avanzato proposte nei moltissimi emendamenti, che non siamo neanche riusciti ad illustrare né a votare in aula perché il dibattito su quella che poi in effetti una riforma non era è durato troppo poco ed è stato anche in alcune parti necessariamente troppo superficiale. Tuttavia noi abbiamo suggerito che il servizio pubblico, così come la stessa Corte costituzionale ha più volte ribadito, non è chi lo eroga ma è cosa il soggetto eroga. Quindi svincolare la concessione dalla RAI, secondo noi, era il primo passo per fare un'opera realmente riformatrice. Dopodiché la questione del controllo: noi ormai abbiamo una latitanza costante sul controllo dell'operato della RAI. Nessuno ha la possibilità, se non alcune parti, come l'AGCOM, di poter intervenire, al punto tale che la commissione di vigilanza, lo abbiamo detto e ribadito, è diventata un club di retorica in cui si audiscono i direttori, in cui si viene addirittura presi in giro dai dirigenti, dai manager strapagati della RAI; si viene umiliati, alcune volte, da risposte che sono una presa in giro. È una commissione di vigilanza che non riesce, quindi, ad arrivare al punto della questione, ovvero, c’è un contratto di servizio, ovvero il patto tra lo Stato e l'erogatore del servizio pubblico, che viene puntualmente disatteso. Allora, da qui, la necessità, l'impellenza, l'urgenza, in alcuni casi, da parte di molti colleghi e da parte anche della Lega Nord, di proporre, in legge, alcune parti ampiamente disattese negli anni da parte della RAI, da parte della concessionaria del servizio pubblico. Anche qui, purtroppo, la maggioranza ha completamente latitato, anzi, si è girata dall'altra parte. L'unica cosa di portata di questo provvedimento è il fatto che avete dato corpo allo slogan: la RAI, la mamma degli italiani; visto che la mamma è per sempre, anche la RAI sarà per sempre, vita natural durante. La RAI non si discuterà più, la RAI rimarrà per sempre il concessionario pubblico del servizio radiotelevisivo. Vedete voi come siamo messi. Dopodiché, proprio perché partite da questo principio per cui la RAI è per sempre, ne mutuate anche le vecchie, pessime abitudini, ovvero la lottizzazione, voi vi ricordate, lo sapete, questa parola è stata inventata da Ronchey proprio parlando dell'occupazione manu militari, da parte dell'allora Partito comunista, della RAI. Non so se ve lo ricordate: un democristiano, un comunista e uno bravo, questo era il criterio di assunzione, allora, in RAI. Poco siamo distanti da questa logica, perché dal berlusconismo, quindi dalla legge Gasparri, siamo passati al renzismo e quindi alla legge Gasparri al quadrato, ovvero, all'intervento diretto, massiccio da parte del Governo, attraverso un amministratore delegato che si fa bellamente i cavoli suoi, senza alcun controllo. Ormai, è chiaro, la politica, lo sappiamo, conta come il due di briscole, ma il problema vero è che, oltre a non contare niente, la politica continua a recedere, passo dopo passo, lasciando spazio a tutti gli altri. In questo caso lo spazio lo abbiamo lasciato al Governo, abbiamo abdicato al controllo che avevamo – parziale, marginale, ma che c'era – attraverso la nomina nel consiglio di amministrazione; il controllo della politica, ovvero del Parlamento, dei rappresentanti dei cittadini, a meno che non vogliate dirmi che noi abdichiamo anche a questo ruolo, dopo di che, una volta che lo abbiamo deciso, possiamo andarcene anche tutti in vacanza e dare le dimissioni così non pesiamo sulle tasche dei cittadini, ma finché vogliamo o ambiamo a svolgere questo ruolo, il punto fondamentale è che qui, voi avete deciso, la maggioranza ha deciso di abdicare completamente al Governo. Quindi, quelle telefonate che abbiamo sentito anche in passato, le intercettazioni o le anticipazioni sui libri di Vespa o le ricostruzioni delle varie lottizzazioni della RAI con i cambi di Governo oggi sono state istituzionalizzate. La telefonata, se intercettata, comunque sarà nell'ambito di quella che è la nuova legge, quindi, vi siete anche messi al riparo dalle future indagini della procura. Detto questo, veniamo alle proposte; le proposte quali sono ? Noi, ovviamente, prendendo atto che la mamma è per sempre e quindi la RAI sarà per sempre, abbiamo detto: ve bene, allora, è roba pubblica ? Perfetto, trattiamola come se fosse un'azienda pubblica, ma con tutti i crismi, con tutti i doveri. Allora, c’è un tetto per gli stipendi ? Applichiamolo, non facciamoci prendere per i fondelli, e guardo il Governo. Ma, caspita, c’è una norma, e voi lo sapete, fatta dal Governo Monti, che dà la possibilità di superare questo tetto per i manager nel momento in cui vengono emessi dei bond e, guarda caso, si insedia il nuovo direttore generale, che adesso diventerà amministratore delegato, e sottoscrive 350 milioni di obbligazioni e, quindi, si può aumentare lo stipendio. Dopodiché, il presidente cosa fa ? Io sono già direttrice di Rai News: mi becco 300 mila euro lordi – 300 mila euro lordi, direttrice Rai News ! – e allora cosa faccio ? Sono gentile, carina e anche generosa, opto per l'emolumento di consigliere di amministrazione (66 mila euro), per un totale di 366 mila euro. Ho capito, ma, signori, vogliamo continuare a farci prendere per il culo così ? Perché questo è il risultato ! Questa è la cifra di chi noi, anzi voi avete nominato in RAI. Caspita, ma se li nominate, almeno fate come ha fatto Monti e dategli un mandato nel rispetto dei tetti salariali che lo stesso Governo nominante aveva dato ! Infatti, plauso alla Tarantola, che allora si tagliò, si decurtò della metà lo stipendio. La trasparenza, la trasparenza ! Noi non sappiamo ancora quanto ci costano ! Dobbiamo attenerci a comunicati ufficiali della RAI per sapere quanto costano i direttori, quanto costano i programmi, dopo che la Commissione di vigilanza – e qui non è una questione di destra, sinistra, alto, basso, magro o grasso, ma è proprio un problema di capacità della politica di farsi ascoltare e soprattutto di incidere – ha fatto decine di documenti, ha approvato delibere affinché il cittadino, il contribuente, possa sapere quanto costano questi programmi, quanto costa quel conduttore, ma tutto è rimasto lettera morta. Abbiamo proposto delle norme per quanto riguarda una questione etica: può un concessionario pubblico fare pubblicità ai giochi (di Stato) ? Noi siamo convinti di no. Perlomeno, lo deve fare con dei criteri massimi di serietà e di rispetto di uno di quei cancri della nostra società, ovvero della ludopatia dilagante, ma anche qui assolutamente lettera morta. Abbiamo chiesto di promuovere e valorizzare le produzioni italiane, di utilizzare il servizio pubblico per quello che è stato nel passato e per quello che dovrebbe essere, ovvero la vetrina del Paese, ovvero il soggetto che valorizza il made in Italy, che valorizza la cultura, che valorizza l'identità; quello che dovrebbe fare il servizio pubblico ! Ma è possibile che io debba guardare la BBC per vedere un documentario decente sulla storia di questo Paese ? È possibile che ci si debba abbonare a Sky e guardare le emittenti e i produttori americani per guardare un servizio decente sulle nostre città ? Detto questo, chiudo, Presidente, con il canone: 1.730 milioni di euro ! Questo è quello che noi ogni anno diamo al baraccone RAI. Dreniamo tutte le risorse per quello che dovrebbe essere il servizio pubblico nella sua più ampia accezione multimediale, quindi dall'editoria, alla carta stampata, a Internet e al web. Tutto questo non può andare ad un solo concessionario, lo continuiamo a ribadire.	
LAURA BOLDRINI	PRESIDENTE	La ringrazio, deputato Caparini.	
DAVIDE CAPARINI		Il canone RAI non va pagato e noi faremo la nostra battaglia per quanto riguarda (Applausi dei deputati del gruppo Lega Nord e Autonomie-Lega dei Popoli-Noi con Salvini). ..	
LAURA BOLDRINI	PRESIDENTE	Grazie. Ha chiesto di parlare per dichiarazione di voto il deputato Bruno Molea. Ne ha facoltà.	
