speaker	role	text	extra
PAOLO TANCREDI		Relatore per la maggioranza. Presidente, io inizierò e farò una sintesi della relazione sul bilancio, che è già stata illustrata nel corso della seduta della V Commissione, ma mi sembra opportuno riprendere alcuni titoli e anche, in realtà, dare conto delle piccole modifiche fatte nel lavoro in Commissione. Il lavoro in Commissione non ha modificato sostanzialmente l'assetto di bilancio, se non per alcune questioni tecniche. È importante guardare il bilancio a norma vigente, a legislazione vigente, perché è testimone degli interventi svolti durante il 2015 che sul bilancio 2016 a legislazione vigente portano degli effetti che danno la concretezza delle misure svolte. Il disegno di legge recante il bilancio di previsione dello Stato per l'anno 2016 e il bilancio pluriennale 2016-2018 è predisposto sulla base, appunto, del criterio a legislazione vigente, ai sensi dell'articolo 21, comma 1, della legge di contabilità pubblica e sulla base delle indicazioni fornite con la circolare del Ministero dell'economia e delle finanze n. 19 del 7 maggio 2015. Esso è impostato sulla struttura contabile per missioni e programmi. Ricordo che questo non è cambiato: sono 181 programmi di spesa, che afferiscono alle 34 missioni. Come evidenziato nella relazione illustrativa, il disegno di legge di bilancio 2016 è coerente con lo scenario macroeconomico illustrato nella Nota di aggiornamento al DEF 2015, presentata a settembre 2015, scenario che testimonia un contenimento forte e un consolidamento del quadro di finanza pubblica operato negli anni scorsi – si può dire –, con una dinamica che è andata in questo senso negli ultimi sette anni. Ma nonostante questo, relativamente alle misure adottate nel 2015 con effetti rilevanti sulle previsioni per il triennio 2016-2018, la relazione illustrativa del disegno di legge evidenzia, in particolare, gli interventi a favore dell'istruzione scolastica della «Buona scuola» (lo leggerò, perché è una delle missioni che ha avuto più incremento). Tale norma ha specificato l'utilizzo del Fondo, già istituito con la legge di stabilità 2015, destinando la quota più rilevante all'assunzione del personale docente e alla sua formazione e valutazione professionale. Si tratta di un inedito nella dinamica degli ultimi anni dell'andamento della spesa. Veniamo alle misure a sostegno agli enti territoriali. La relazione illustrativa ricorda, in particolare, le risorse stanziate per fronteggiare le spese derivanti da eventi calamitosi, per l'impiego del personale militare appartenente alle Forze armate per fare fronte a fenomeni straordinari nonché per contrastare l'emergenza sanitaria. Poi, ci sono le misure per l'ottimizzazione dell'amministrazione giudiziaria (il decreto-legge n. 83 del 2015). In particolare, si sottolineano le risorse stanziate per favorire l'organizzazione e il funzionamento dell'amministrazione giudiziaria nonché la revisione del sistema di deducibilità delle perdite e delle svalutazioni degli enti creditizi. In particolare, per il 2016 il termine di competenza, al netto delle regolazioni contabili e dei rimborsi IVA, prevedeva entrate fiscali finali per circa 550 miliardi di euro e spese finali per 561 miliardi di euro. Il saldo netto da finanziare quindi, corrispondente alla differenza tra le due quantità, cioè tra le entrate finali e le spese finali, risultava pari, nel 2016, a circa 11,4 miliardi di euro, in miglioramento rispetto al 2015, sia nella previsione del bilancio 2015 sia rispetto al dato assestato 2015 (meno 52,3 miliardi di euro). L'avanzo primario – insomma, sto facendo una sintesi delle grandezze più importanti risultanti dal bilancio 2016 – che, come è noto, costituisce un indicatore essenziale e fondamentale ai fini della sostenibilità della dinamica del debito pubblico, presenta valori positivi e crescenti nel triennio, passando dai 72,7 miliardi nel 2016, ai 91 miliardi nel 2017 e ai 101 miliardi nel 2018, in corrispondenza di una spesa per interessi – da cui il saldo primario è notoriamente nettizzato – da 84 miliardi nel 2016 a 87 nel 2018, con un netto miglioramento rispetto all'anno 2015. In termini di composizione di bilancio, come dicevo poco fa, si evidenzia come poco meno del 75 per cento della spesa complessiva dello Stato, calcolata al netto della missione debito pubblico naturalmente, è allocata su 6 missioni fondamentali. In ordine decrescente vi sono: la missione n. 3, relazioni finanziarie con le autonomie territoriali; la n. 25, politiche previdenziali; la n. 29, politica economica e finanziaria e di bilancio; la n. 22, istruzione scolastica; la n. 24, diritti sociali; la n. 4, l'Italia in Europa e nel mondo. Come abbiamo detto, queste missioni occupano il 75 per cento dell'intero ammontare del bilancio. Al netto sempre della missione debito pubblico, faccio presenti, rispetto all'assestamento 2015, le missioni di spesa che, a parità di struttura del disegno di legge di bilancio 2016-2018, registrano nel 2016 il maggior incremento in termini assoluti (e questi credo che siano i dati che ci diano conto delle politiche portate in questo anno, in questo esercizio). Al primo posto c’è proprio l'istruzione scolastica, che ha un incremento di 2,8 miliardi di euro, passando da 42 a 44,8 miliardi di euro, pari a un più 6,7 per cento. Credo che non ci siano precedenti, nella storia recente, di un incremento così forte di questa missione. I fondi da ripartire, che sono più 1,8 miliardi, passano da 7,6 a 9,56 (più 23 per cento). L'Italia in Europa e nel mondo registra più 529 milioni, pari a più 2,1 per cento (da 25,7 a 26,2). Competitività e sviluppo delle imprese registra più 478 milioni e passa da 16,7 a 16,75 miliardi di euro (più 2,9 per cento). Tra le missioni che, invece, presentano variazioni in diminuzione in valore assoluto, si segnalano le seguenti: politiche previdenziali, a testimonianza di dinamiche che conosciamo alla luce degli interventi legislativi numerosi; politica economica, finanziaria e di bilancio; sviluppo e riequilibrio territoriale; relazioni autonomie territoriali. Si evidenzia, quindi, che con l'approvazione da parte del Senato del disegno di legge di stabilità il Governo naturalmente ha presentato una Nota di variazione al bilancio con la quale vengono scontati, nel disegno di legge di bilancio, gli effetti contabili determinati dal disegno di legge di stabilità. Cioè parliamo del bilancio che è arrivato qui a seguito della Nota di variazione che ha tenuto conto degli effetti degli interventi normativi introdotti al Senato. In particolare, in termini di competenza, la Nota di variazione al bilancio evidenzia, rispetto alla legislazione vigente, al netto delle regolazioni contabili e dei rimborsi IVA, un aumento delle spese finali di circa 6 miliardi di euro nel 2016 e una diminuzione delle entrate finali di oltre 14 miliardi. Questo testimonia, naturalmente molto grossolanamente, una politica e un intervento espansivo della Camera rispetto alla lettura che ci ha preceduto. Di conseguenza il saldo netto da finanziare per il 2016, pari a 31,7 miliardi di euro, risulta peggiorato rispetto a quanto previsto a legislazione vigente, come avevo detto all'inizio, di 11,4 miliardi, quindi oltre 20 miliardi. Il peggioramento dei saldi di bilancio rispetto ai valori indicati a legislazione vigente è da mettere in relazione appunto alla natura espansiva del disegno di legge di stabilità 2016, che opera una manovra parzialmente in disavanzo, volta, nel rispetto degli obiettivi di bilancio stabiliti nella Nota di aggiornamento al DEF 2015, al sostegno della crescita operando sia sul versante del contenimento del carico fiscale – abbiamo visto, meno entrate – sia sul lato dell'aumento della domanda aggregata e del miglioramento della competitività del sistema. Questo è quindi quello che volevo sintetizzare sul disegno di legge di bilancio, Presidente, naturalmente rimando alla relazione per una lettura più dettagliata delle grandezze esposte nel disegno di legge di bilancio, che però potranno confermare il trend che ho appena descritto. Voglio dire qualcosa in anticipo – ma poi lascio al correlatore Melilli la trattazione più ampia del disegno di legge di stabilità – e soffermarmi su un paio di punti che riguardano la lettura alla Camera del disegno di legge di stabilità e il testo che è arrivato dal Senato. Di rilievo, quanto alla riduzione del carico fiscale che ne consegue, è poi l'intervento sulla fiscalità immobiliare, che – è conosciuto, se ne parla da parecchio – è l'esenzione totale dell'IMU sui terreni agricoli e sui cosiddetti macchinari imbullonati e l'esenzione sulla tassa per l'abitazione principale. Nella lettura alla Camera si sono introdotte alcune misure che vado velocemente a elencare per titoli. In merito agli immobili dati in comodato d'uso a figli o a genitori, si introduce una riduzione del 50 per cento della base imponibile IMU in luogo dell'esenzione disposta dal Senato; la riduzione dell'IMU è prevista per la seconda abitazione data in comodato al figlio nel territorio ricompreso all'interno del comune di residenza anche del genitore; si dispone l'applicazione dell'imposta di registro in misura fissa e l'esenzione dalle imposte ipotecarie e catastali per gli atti di trasferimento dalle aree che rientrano negli interventi di edilizia convenzionata; si prevede una detrazione dall'IRPEF del 50 per cento dell'importo corrisposto per il pagamento dell'IVA sull'acquisto effettuato entro il 2016 di abitazioni di classe energetica A e B cedute dalle imprese costruttrici, in questo senso si tende a equiparare la cessione da privati, che ha un'IVA ridotta alla metà, non potendosi intervenire sull'IVA si trasferisce sostanzialmente sull'esenzione IRPEF. Si estende il credito d'imposta per la riqualificazione degli alberghi presente nel tax credit 2015, si chiarisce che la misura del canone di locazione dovuto dai conduttori che avevano beneficiato della determinazione di legge per mancata o parziale registrazione del contratto è pari al triplo della rendita catastale. Dico l'ultima misura sulla casa che mi sembra di rilevanza: la norma per favorire la locazione finanziaria degli immobili adibiti a uso abitativo, sostanzialmente la rata è deducibile ai fini IRPEF nella misura del 19 per cento per le giovani coppie sotto i trentacinque anni e invece per la metà per le persone al di sopra dei 35 anni. Volevo fare una rapida – ma non c’è tempo – relazione sull'intervento sulle banche, lascio per quanto possibile – ma poi magari nella replica interverrò – e non voglio mancare di dire le misure che sono contenute nel disegno di legge di stabilità per le imprese. Sono tante, a partire dal super-ammortamento al 140 per cento per gli acquisti di beni con forte concentrazione appunto sull'incentivazione agli investimenti, ma sono destinati 300 milioni di euro per l'attività di credito all'esportazione e internalizzazione dell'intero sistema produttivo così come ci sono tante altre misure ma in quello che abbiamo chiamato «pacchetto sud» c’è un'ulteriore credito d'imposta per l'acquisto di beni strumentali nuovi, destinati a strutture produttive nelle zone assistite o ubicate nelle regioni del Mezzogiorno. Poi, cosa che io ritengo anche molto importante, diamo certezza fin da oggi, fin dal 1o gennaio, per il 2017 alle imprese del sud di poter beneficiare della decontribuzione, cosa che invece per le imprese di tutto il resto del Paese si fermerà al 31 dicembre 2016. Anche questa ritengo sia una misura importante.	
MARINA SERENI	PRESIDENTE	Ha facoltà di intervenire il relatore per la maggioranza, deputato Melilli.	
FABIO MELILLI		Relatore per la maggioranza. Signora Presidente, non è semplicissimo per un intervento normativo di portata così ampia ridurre a un intervento breve le nostre valutazioni, ha iniziato già il collega Tancredi, proverò naturalmente a fare un esercizio di sintesi, non so quanto mi riuscirà e naturalmente sarà il dibattito poi a colmare le lacune della nostra relazione stretta nei dodici minuti. Come è noto a tutti, la Nota di aggiornamento del Documento di economia e finanza ha costruito un sistema che poi ha dato luogo al disegno di legge di stabilità che opera naturalmente su due versanti: da una parte sul sostegno alla crescita, operando sia sul versante del contenimento del carico fiscale che sull'aumento della domanda aggregata e sul miglioramento della competitività del sistema. È noto a tutti che il Governo nel corso della discussione del disegno di legge di stabilità ha deciso di utilizzare tutte le clausole di salvaguardia con un'operazione che ha consentito margini di intervento più ampi che sono stati destinati, come è noto, agli interventi diversificati che hanno spaziato in ambiti molto vasti e rilevanti del sistema finanziario e delle scelte politiche che sono state operate. È stata fatta un'operazione nota a tutti che ha occupato l'attenzione della stampa in questi giorni che è stata quella relativa al sistema bancario e alle vicende che si sono susseguite, così come un intervento di portata sistemica è stato fatto sul versante dei giochi e sulle politiche fiscali che si legavano ai giochi. Sorvolo naturalmente la parte della sezione immobiliare che il collega Tancredi ha descritto necessariamente in modo molto sommario, ma mi pare che gli elementi più significativi possano essere riassunti nell'operazione di riduzione dell'IMU sia sul versante dei cittadini di abolizione dell'IMU sulla prima casa e di abolizione dell'IMU sul versante dei cittadini e delle imprese, anche nel settore agricolo. Di grande significato mi pare l'intervento sull'IRES che a partire dal 2017 rappresenta l'operazione forse di maggiore rilevanza sul versante del sistema delle imprese: se a questo leghiamo le scelte che abbiamo fatto in relazione alle norme relative al sud del Paese credo che l'intervento in termini di decontribuzione, in termini di credito d'imposta sia uno dei più significativi degli ultimi anni. Si è lavorato, Presidente, con grande attenzione anche da parte della Camera dei deputati, della Commissione bilancio e di tutti i colleghi che hanno partecipato ai lavori di costruzione del disegno di legge di stabilità, si è lavorato su molti fronti. Vorrei avere il tempo, ma non ce l'ho e credo che sia compito anche dei gruppi parlamentari che interverranno in Aula, di descrivere le operazioni che la Commissione bilancio ha compiuto anche per sfatare questo mito per cui il Parlamento si dedicherebbe, secondo qualche interpretazione malevola, soltanto ad operazioni di basso profilo, perché invece gli interventi della Camera di modifica e integrazione del disegno di legge di stabilità sono stati invece di grande significato, toccando comparti importanti che riguardano sia il sistema delle imprese che il sistema degli enti locali, tutto quello che la stabilità aveva messo in campo nei giorni precedenti, dal momento della presentazione da parte del Governo della legge stabilità, alla conseguente approvazione del Senato. Sul sistema degli enti locali in particolare, come voi sapete, siamo partiti da una condizione di grande difficoltà per la presenza, anche dovuta alle leggi di stabilità dei periodi precedenti, di tagli di grande significato nel comparto degli enti locali. Forse i comuni potevano dirsi soddisfatti dell'intervento che per la prima volta riconosce ad essi il ristoro completo dell'abolizione dell'IMU, cosa che non era avvenuta nel passato. E di significato più rilevante è sicuramente l'intervento che è stato compiuto sul versante del Patto di stabilità che ha per anni in qualche modo costretto i comuni ad un'operazione di restrizione della disponibilità delle risorse finanziarie, invertendo una tendenza che lo aveva inasprito negli anni in maniera sempre più significativa e arrivando ad una forma di sostanziale equilibrio di bilancio che credo sia stata apprezzata dal sistema dei comuni e che è la novità di maggiore rilevanza di quest'anno. Sul versante delle province, abbiamo provato ad attenuare i tagli e ci siamo mi pare riusciti con grande soddisfazione del comparto degli enti di area vasta. Abbiamo attenuato i tagli che erano stati operati nelle precedenti norme con il rischio di impattare sull'erogazione dei servizi sul versante della manutenzione delle scuole e sul versante della manutenzione delle strade. Abbiamo fatto interventi nei confronti delle regioni sostanzialmente in linea con l'accordo che il Governo ha costruito con le stesse regioni. Sapete meglio di me quanto siamo partiti da un intervento di grande rilevanza sul versante della diminuzione delle risorse alle regioni. Su questo credo con gli ultimi interventi, a partire dalla chiusura di un'annosa questione che riguarda la regione Sicilia che si trascinava da anni e da alcuni interventi correttivi che liberano risorse finanziarie di importante rilevanza, anche le regioni possano dirsi soddisfatte. Si tratta di interventi, sia nella legge di stabilità, nella sua versione originaria, sia nelle modifiche che sono state operate, prima dal Senato e poi dalla Commissione bilancio della Camera dei deputati. Un lavoro minuzioso è stato compiuto sul versante della tutela ambientale. Un'operazione rilevante sul tema della bonifica e, quindi, delle operazioni che debbono essere condotte, speriamo con un'accelerazione maggiore rispetto al passato, sui siti di bonifica. Siamo partiti naturalmente dallo stanziamento del Governo alla Terra dei fuochi e siamo arrivati a concentrare le risorse del Ministero dell'ambiente e della tutela del territorio e del mare su alcuni luoghi che hanno bisogno di interventi necessari e che compromettono la salubrità, non soltanto degli ambienti, ma anche la salute dei cittadini. E credo che questo possa essere riconosciuto all'impegno della Commissione bilancio e al lavoro molto intenso che abbiamo fatto in questi giorni, forse come non era mai stato fatto nel passato, proprio per la dimensione ampia della legge di stabilità che ha voluto, per scelta del Governo naturalmente, incidere su ambiti di attività molto diversificati e molto significativi. È noto a tutti il lavoro compiuto sul versante del canone RAI. Il maggior gettito che potrà derivare dall'operazione compiuta sul versante del canone è stato destinato ad alcune importanti politiche del settore, così come quello dei giochi, dove si è inasprita in qualche modo la fiscalità, è stato destinato alla lotta alla ludopatia e ad un intervento che garantisce gli enti di area vasta nella fornitura dei servizi alla disabilità. Quindi, si è posto attenzione al sociale con molta cura da parte delle Commissioni competenti. Sul versante della sanità, sono stati fatti interventi di significato che hanno inciso su un ritorno ad equità sulla norma che consente alle strutture private accreditate di poter investire nel territorio nazionale nella stessa misura, senza più diversificazioni, almeno per l'alta specialità, tra regioni e regioni, a seconda che esse avessero fatto piani di rientro oppure fossero in condizioni di normalità di bilancio. Interventi che non credo possano essere definiti settoriali o microsettoriali, come si è voluto far credere, ma sono in fondo, se li leggiamo tutti insieme, interventi di sistema, come sono stati fatti sul versante dell'agricoltura, dove si è posto attenzione al settore della pesca; si è posto attenzione al settore delle carni; si è posto attenzione soprattutto alla necessità che ha il nostro Paese di avanzare nella competitività con gli altri Paesi europei sul versante della ricerca tecnologica da applicare all'agricoltura. Quindi, si è fatta un'operazione che grazie alla sensibilità dei deputati è stata costruita con un utilizzo di risorse che sicuramente renderanno quel comparto molto più competitivo. Norme di un certo significato sono state chiuse, a volte anche con il consenso delle opposizioni, pure sul versante del pubblico impiego, soprattutto sul versante, però, delle politiche sociali e della famiglia. Si è lavorato sul tema della lotta alla povertà, sull'integrazione e sulla specificazione del fondo iniziale che il Governo aveva stanziato di 600 milioni di euro, sul Fondo per la lotta alla povertà e all'esclusione sociale. E, quindi, andiamo verso l'attuazione di un piano nazionale della lotta alla povertà. Ci sono interventi perché abbiamo istituito presso il Ministero del lavoro e delle politiche sociali un fondo con una dotazione di 90 milioni di euro che decorre dal 2016, che è destinato alla copertura finanziaria di interventi legislativi che recano misure di sostegno di persone con disabilità grave, soprattutto per le persone prive di legami familiari alle quali dobbiamo sicuramente una particolare attenzione. Ed abbiamo incrementato con un impegno serio di 150 milioni di euro a decorrere dal 2016 lo stanziamento del Fondo per le non autosufficienze, anche ai fini del finanziamento degli interventi a sostegno delle persone affette da sclerosi laterale amiotrofica perché la legge di stabilità aveva fissato quel fondo in 250 milioni di euro ed è stato portato con il 2016 a 400 milioni di euro. Abbiamo lavorato per potenziare i progetti riguardanti tutte le misure per rendere effettivamente indipendente la vita delle persone con disabilità grave. Abbiamo costruito anche altri interventi che riguardano risorse e strumenti per la politica estera, che riguardano il concorso di accesso alla carriera diplomatica; politiche a favore delle collettività italiane all'estero, che non abbiamo dimenticato. Interventi, quindi, per colmare alcune disattenzioni, alcuni limiti che nella normativa nazionale erano costruiti, anche in relazione alla disponibilità scarsa di risorse che abbiamo avuto a disposizione. Abbiamo cercato di fare, ripeto, un intervento di sistema. Il più significativo su iniziativa del Governo è stato quello relativo alla sicurezza e alla cultura. Com’è noto, un intervento di grande significato, che è pari a 2 miliardi di euro, che sul versante della sicurezza – e chiudo, Presidente – ha coperto importanti investimenti sul versante delle dotazioni delle forze di polizia e ha coperto, com’è noto, i 960 euro annui che vengono riconosciuti a chi opera nel comparto della sicurezza. Abbiamo deciso, su iniziativa del Premier, di immaginare che ad esso venisse affiancato un intervento sulla cultura. Su questo si è esercitata la Commissione bilancio e si è esercitata in modo significativo integrando le scelte che il Governo, con la presentazione di un emendamento sistemico, ha compiuto. Abbiamo lavorato sull'incremento di risorse nel comparto della cultura, sulla ristrutturazione necessaria ancora del Ministero dei beni e delle attività culturali e del turismo, sull'attenzione che abbiamo dato a cose che forse possono essere considerate anche piccole, ma sono di sensibilità, come, ad esempio, su iniziativa parlamentare, il bonus che viene dato ai ragazzi che vogliono studiare e che spesso non hanno la possibilità di acquistare strumenti musicali. Si è fatta un'operazione, nei limiti naturalmente del tempo che ci è stato concesso e dell'intensità della manovra. Con questo naturalmente chiudo, consapevole di aver saltato, Presidente, qualche tema.	
MARINA SERENI	PRESIDENTE	Ha finito il tempo.	
FABIO MELILLI	Relatore per la maggioranza	Ma sono convinto che il dibattito parlamentare li riprenderà.	
MARINA SERENI	PRESIDENTE	Ha facoltà di intervenire la relatrice di minoranza, deputata Polverini.	
