speaker	role	text	extra
ANTONELLO GIACOMELLI		Sottosegretario di Stato per lo sviluppo economico. Signora Presidente, in merito alla questione posta relativa alla procedura di mobilità per i 400 dipendenti, rappresento preliminarmente, qualora non fosse noto, che in data 4 agosto il Viceministro Bellanova ha dichiarato che l'azienda aveva comunicato di aver raccolto l'invito del Governo al ritiro della mobilità per i 400 lavoratori interessati. Il rappresentante di vertice del Mise, appena appresa la notizia, a nome di tutto il Governo ha rivolto un appello alla società affinché revocasse la procedura di mobilità, impegnandosi contestualmente, nell'ambito delle proprie prerogative, ad attivare ogni utile iniziativa al fine di scongiurare ulteriori situazioni traumatiche per il tessuto sociale ed economico. A tal fine, oltre ad aver attivato una utile interlocuzione con alcuni parlamentari dei territori, si è provveduto in data 3 agosto ad incontrare il presidente della regione Marche, il vicepresidente della giunta regionale dell'Umbria, i sindaci delle città interessate. Nell'incontro si è stabilito un percorso di supporto istituzionale, volto in primo luogo alla tutela dei posti di lavoro coinvolti nelle procedure di mobilità, parallelamente ad attivare un confronto con istituti di credito interessati alla vicenda. Relativamente al programma di investimenti produttivi e di ricerca proposti dall'azienda, finalizzati alla sua riqualificazione produttiva e all'ampliamento della sua gamma di prodotti, si ricorda che il medesimo è stato valutato dal Mise coerente con la strumentazione agevolativa di riferimento. Il Ministero dello sviluppo economico ha quindi confermato la propria disponibilità a formalizzare un accordo di programma con le regioni Marche ed Umbria, allo scopo di promuovere il progetto con le risorse finanziarie pubbliche per 24 milioni di euro, fatta salva la dimostrazione della disponibilità da parte dell'acquirente delle ulteriori risorse finanziarie private necessarie per la realizzazione del progetto. Infine, circa le iniziative messe a punto per il rilancio dello sviluppo economico, come è noto, è stato presentato a Milano pochi giorni fa il Piano nazionale industria 4.0, che raccoglie i principali provvedimenti a sostegno di investimenti. Il contesto sollecita il Governo a mettere a punto, in fase di attuazione, una serie di iniziative e misure per rendere stabile la ripresa economica: in particolare, intendiamo prorogare per il 2017 il super-ammortamento al 140 per cento introdotto lo scorso anno. Il Governo, con le precedenti manovre già intervenuto sulla tassazione delle imprese, farà un ulteriore passo avanti riducendo le imposte sui redditi di impresa; a completamento del nuovo regime di tassazione, si prevede il passaggio, per le società soggette ad IRI, dalla contabilità finanziaria ad una per cassa. Interverremo inoltre con l'ampliamento del perimetro di detassazione del salario legato alla produttività. Sull'energia verrà varato un nuovo provvedimento energivori, che aiuterà le imprese manifatturiere a contenere i costi relativi. Essendo l'innovazione uno dei pilastri della politica del Governo, potenzieremo il credito d'imposta per investimenti in ricerca, sviluppo ed innovazione, portando l'aliquota al 50 per cento. Secondariamente saranno introdotte agevolazioni fiscali mediante detassazione del capital gain su investimenti a medio-lungo termine. Inoltre, il prossimo riassetto del fondo di garanzia porterà la concentrazione dell'intervento pubblico a favore degli investimenti: sarà rifinanziata la nuova Sabatini, che ha già riscosso grande successo. Infine, la crescente globalizzazione ha reso più centrale il ruolo dei beni immateriali nella creazione di valore aggiunto: questi presupposti portano il Governo ad introdurre il patent box, un regime opzionale di tassazione per redditi derivanti dall'utilizzo diretto e indiretto di alcuni beni immateriali.	
MARINA SERENI	PRESIDENTE	La deputata Galgano ha facoltà di dichiarare se sia soddisfatta per la risposta alla sua interpellanza.	
			(Iniziative volte alla soluzione della questione del passaggio delle «grandi navi» a Venezia – n. 2-01472)
ADRIANA GALGANO		Signora Presidente, sottosegretario Giacomelli, grazie: siamo soddisfatti di quanto sta facendo il Governo. Noi però chiediamo al Governo di convocare davvero urgentemente una nuova riunione del tavolo presso il Mise, per verificare se l'imprenditore intende metterci le risorse finanziarie, perché questo è il nodo dall'inizio della vicenda. Io credo che tutte le misure di cui lei ha parlato, che noi alla Camera condividiamo fortemente, dal momento che siamo stati noi i primi a produrre un documento sull'innovazione e sull'industria 4.0, non servano a niente se poi l'imprenditore che deve far partire l'azienda non dimostra di avere le risorse finanziarie; e siccome questo è un già visto nelle vertenze che ho seguito in Umbria, credo che da parte del Governo un punto di attenzione su questo aspetto ci debba essere, perché altrimenti rischiamo che delle vicende si trascinino per anni, costando alla collettività in termini di incertezza dei lavoratori, in termini di contributo che lo Stato deve versare, e senza produrre nessuna ricchezza.	
MARINA SERENI	PRESIDENTE	Passiamo all'interpellanza urgente Marcon ed altri n. 2-01472 (Vedi l'allegato A – Interpellanze urgenti). Chiedo al deputato Marcon se intenda illustrare la sua interpellanza o se si riservi di intervenire in sede di replica.	
GIULIO MARCON		Presidente, si tratta di una questione ormai annosa, perché la questione del passaggio delle grandi navi nella laguna di Venezia ormai è un problema che ci portiamo avanti almeno dal 2012, quando con il decreto cosiddetto Clini-Passera era stato previsto il divieto di passaggio delle grandi navi oltre le 40 mila tonnellate di stazza, con una disposizione transitoria che lasciava in realtà tutto come prima, perché si diceva «in attesa di trovare misure alternative». Queste misure alternative, queste soluzioni alternative non sono state trovate: sono passati ormai quattro anni, le grandi navi continuano a passare per il canale della Giudecca, continuano a passare per la laguna, provocando una serie di conseguenze molto serie, molto gravi per essa. C’è un problema di manomissione dell'ecosistema lagunare, ed in particolare dei canali per i quali passano queste grandi navi; c’è un problema di emissioni, acustiche e legate all'inquinamento atmosferico; c’è un problema anche di violazione di un paesaggio, come quello della città di Venezia, che andrebbe preservato. Ricordo che lo scorso 13 luglio l'UNESCO ha minacciato di togliere Venezia dai siti del Patrimonio dell'umanità, qualora non ci sia entro il 1o febbraio 2017 un intervento deciso per salvaguardare il patrimonio artistico e paesaggistico di Venezia, per preservare l'ecosistema lagunare e per risolvere – viene citato dalla risoluzione UNESCO – il problema delle grandi navi. Ricordo che dopo il decreto Clini-Passera ci fu un altro provvedimento nel 2013 del Governo Letta, che riduceva a 96 mila tonnellate di stazza la misura limite per le grandi navi, le navi da crociera che passano per la laguna, con una riduzione anche in percentuale del loro passaggio, rispetto al numero che possibilmente ogni anno dovrebbe essere rispettato. Continuiamo come prima, nel senso che attualmente le vie alternative non sono state individuate: una serie di procedimenti avviati presso la commissione VIA al Ministero dell'ambiente e della tutela del territorio e del mare hanno dato esito negativo su alcune di queste soluzioni. Ce ne sono diverse, ricordo: il canale Contorta, il canale Vittorio Emanuele, la possibilità di avere un avamposto galleggiante alle bocche del Lido; un'altra soluzione è stata individuata sempre alle bocche del Lido; poi il canale dei Petroli con lo stazionamento al porto di Marghera. Sono diverse soluzioni: noi non vogliamo prendere posizione a favore di una anziché dell'altra. Riteniamo che vadano salvaguardati alcuni principi: il primo principio, appunto, «no» alla manomissione dell'ecosistema lagunare, quindi «no» allo scavo di ulteriori canali o all'approfondimento e all'ulteriore scavo di canali già esistenti, perché questo provocherebbe una grave conseguenza su tutto il patrimonio ambientale e della laguna di Venezia. Diciamo «no» a misure che non riducano le emissioni, quindi non salvaguardino i limiti imposti per legge; e diciamo «no» a tutte le misure che non salvaguardino il rispetto del patrimonio del paesaggio di questa città. Ci sono delle illustrazioni e delle foto, fatte da fotografi famosi come Berengo Gardin, che ci mostrano quale scempio le grandi navi abbiano comportato rispetto, appunto, al paesaggio e alla tutela del patrimonio di questa città. Ricordo poi che il Governo ha anche le idee un po’ confuse, perché il Ministro dei beni e delle attività culturali e del turismo, Franceschini, aveva detto che a questo punto era meglio spostare le navi al porto di Trieste; invece, il sottosegretario Baretta, che è veneziano e che è sottosegretario al MEF – e quindi è un po’ una cosa anomala, diciamo, che un Ministro venga smentito da un sottosegretario – ha detto: «Ma anche i Ministri si sbagliano». Renzi parla un giorno sì e un giorno no delle Olimpiadi; ha parlato di Expo in questi mesi, ma non sentiamo mai pronunciare alcuna parola su Venezia, che è, appunto, un patrimonio inestimabile non del nostro Paese ma dell'intera umanità. Nessuna parola per salvaguardare una città fragilissima, perché ricordo che negli ultimi anni siamo passati da pochi milioni di turisti a decine di milioni di turisti che ogni anno conoscono e apprezzano questa città. Quindi, c’è un problema di gestione del flusso turistico, c’è un problema nella gestione di navi che, ripeto, sono sempre molto più numerose. Infatti, abbiamo degli aumenti esponenziali: abbiamo avuto circa l'80 per cento di aumento del traffico crocieristico a Venezia nell'arco di dieci anni e ormai siamo a quasi seicento grandi navi e ad un milione e mezzo di passeggeri. Ovviamente tutto questo ha un impatto molto forte dal punto di vista ambientale; c’è sicuramente un vantaggio dal punto di vista economico, ma noi riteniamo sempre che il vantaggio economico vada commisurato alla salvaguardia del patrimonio ambientale e proprio per salvaguardare anche l'impatto economico bisognerebbe trovare delle soluzioni alternative. Quindi, con la nostra interpellanza chiediamo al Governo che cosa intenda fare, quali siano le soluzioni che intenda percorrere, quali siano i tempi con le quali queste soluzioni vanno esperite e vanno trovate. Riteniamo appunto gravissimo che ormai in quattro anni dal «decreto Clini-Passera» non sia stata trovata nessuna soluzione e che tutto continui ad andare come prima. Noi proponiamo e chiediamo al Governo se non ritenga utile a questo punto, finché non si trovino delle misure e delle vie alternative, tornare all'ispirazione del «decreto Clini-Passera», però con una piccola modifica che è un'importante modifica, cioè vietare a tutte le navi oltre le 40 mila tonnellate di stazza di passare per il canale della Giudecca, per il bacino San Marco e per la laguna in senso più ampio. Inoltre, chiediamo un'altra cosa: il numero chiuso. Cioè, pensiamo che sia ora, come posso dire, di determinarlo da questo punto di vista e ricordo che già il Ministro Orlando, Ministro dell'ambiente del precedente Governo Letta, aveva parlato di numero chiuso. Quindi, non è una proposta che viene semplicemente dai comitati contro le grandi navi o dall'opposizione, ma un Ministro del precedente Governo, che è anche Ministro di questo Governo ma ha un'altra responsabilità, aveva parlato di numero chiuso. Diversi Ministri, quali Orlando e lo stesso Franceschini, hanno detto «Basta: non bisogna più permettere il passaggio delle navi per il canale della Giudecca e per la laguna». Quindi, noi crediamo che a questi impegni, che sono impegni verbali, che sono dichiarazioni più che impegni verbali, debbano seguire degli impegni concreti. Quindi, noi chiediamo al Governo, finché non si trova una soluzione alternativa per il passaggio delle navi nella laguna di Venezia, che ci sia il divieto, come diceva il «decreto Clini-Passera», per le navi sopra le 40 mila tonnellate e che ci sia il numero chiuso. Ricordo che anche per questo motivo il prossimo 25 settembre, domenica alle tre e mezza, alle Zattere ci sarà una manifestazione dei comitati e delle associazioni dei movimenti ambientalisti per dire no alle grandi navi e per chiedere al Governo di intervenire subito.	
MARINA SERENI	PRESIDENTE	Il sottosegretario di Stato Antonello Giacomelli, ha facoltà di rispondere.	
ANTONELLO GIACOMELLI	Sottosegretario di Stato per lo sviluppo economico	Presidente, con riferimento alle questioni poste, relative al transito delle grandi navi nei canali di San Marco e Giudecca di Venezia, sulla base degli elementi acquisiti per quanto di competenza, si rappresenta quanto segue. Come è noto, il decreto interministeriale 2 marzo 2012, il cosiddetto «decreto rotte», all'articolo 2, comma 1, prevede, per motivi di protezione dell'ambiente marino, ulteriori misure di protezione per zone particolarmente vulnerabili, tra cui il canale di San Marco e della Giudecca nella laguna di Venezia, battuti dalle navi facenti ingresso e uscenti dalle bocche del Lido, con divieto di transito per quelle unità superiori alle 40 mila tonnellate di stazza lorda. Lo stesso decreto, all'articolo 3, prevede disposizioni transitorie subordinanti l'applicazione del divieto, di cui al richiamato articolo 2, alla disponibilità di vie di navigazione alternative a quelle vietate, così come individuate con specifica ordinanza n. 153 del 2013 dalla capitaneria di porto di Venezia. Per la verità la predetta ordinanza è stata oggetto di annullamento da parte del giudice amministrativo; ciononostante l'allora misura temporanea di mitigazione del rischio della soglia limite delle 96 mila tonnellate, secondo quanto appreso dalla capitaneria di porto di Venezia, di fatto è stata autonomamente mantenuta fino ad oggi dagli agenti raccomandatari marittimi del programma degli scali crocieristici presentati, a seguito degli impegni assunti dall'autorità portuale nelle diverse riunioni interministeriali. Inoltre, a seguito dell'operatività del nuovo terminal di Fusina, raggiungibile tra le opposte bocche di Malamocco con il percorso in direzione Marghera zona industriale, tutte le navi traghetto non percorrono più i canali di San Marco e della Giudecca, oggetto di divieto. Si precisa, al riguardo, che anche le navi adibite al traffico merci in atto transitano attraverso le stesse bocche di Malamocco. Peraltro, sulla base delle informazioni fornite dal Ministero delle infrastrutture e dei trasporti, si segnala che le compagnie di navigazione hanno già operato una programmazione di riduzione del traffico. La tematica in argomento viene affrontata anche nell'ambito di valutazione d'impatto ambientale. Sono all'esame istruttorio della commissione tecnica di verifica VIA e VAS le procedure relative ai progetti di adeguamento della via acquea di accesso alla stazione marittima di Venezia, riqualificazione delle aree limitrofe e del nuovo terminal crociere di Bocca di Lido. Detti progetti hanno la finalità di rispondere a quanto previsto dal citato decreto interministeriale. Nel corso delle suddette istruttorie tecniche verranno tenuti in debita considerazione i problemi relativi all'impatto del transito delle grandi navi in laguna e degli scavi di nuovi canali per realizzare vie d'acqua d'accesso alternative a quelle del canale di San Marco e della Giudecca. Saranno opportunamente valutate tutte le opzioni alternative per il passaggio delle grandi navi in laguna. Fermi restando gli aggiornamenti sullo stato di avanzamento delle valutazioni di impatto ambientale, sull'attuale situazione è intervenuta anche l'UNESCO chiedendo, tra l'altro, che entro il 1o febbraio l'Italia sottoponga al comitato una relazione dettagliata sullo stato di conservazione di Venezia e della sua laguna. Alla luce delle informazioni esposte, si evidenzia che i temi in esame sono all'attenzione del Ministero dell'ambiente e della tutela del territorio e del mare, il quale sta valutando di attivare i necessari contatti per organizzare un apposito incontro con il Ministero delle infrastrutture e dei trasporti e il Ministero dei beni e delle attività culturali e del turismo, per un esame congiunto e complessivo della problematica per dare attuazione al «decreto Clini-Passera».	
MARINA SERENI	PRESIDENTE	Il deputato Marcon ha facoltà di dichiarare se sia soddisfatto per la risposta alla sua interpellanza.	
			(Iniziative di competenza volte a scongiurare la prospettata chiusura del punto nascita di Vipiteno, in provincia di Bolzano – n. 2-01448)
GIULIO MARCON		Grazie, Presidente. Non sono soddisfatto né siamo soddisfatti per alcuni motivi: in primo luogo, perché il sottosegretario ci ha raccontato un po’ cosa è successo in questi anni, ma questo già lo sapevamo. Insomma, ha ricostruito, come posso dire, i passaggi di una vicenda che è nota e che noi davamo per acquisita e per scontata. Quindi, non avevamo bisogno di sentircela nuovamente raccontare. Il secondo elemento per cui non siamo soddisfatti è che dalla dichiarazione e dall'intervento del sottosegretario non si esclude, se ho capito bene, lo scavo di nuovi canali. Noi siamo fermamente contrari a quest'ipotesi; lo sono i veneziani e lo sono le associazioni e i comitati. Riteniamo che vada escluso, appunto, lo scavo di nuovi canali, perché questo comporterebbe, come molti scienziati, ricercatori, ambientalisti e studi di ricerca hanno detto, un peggioramento della situazione dell'ecosistema lagunare. Non siamo soddisfatti, inoltre, perché secondo noi c’è un'imprecisione nella esposizione del sottosegretario, che dice che non passano più le navi per il canale della Giudecca. Ebbene, la devo smentire, perché io due settimane fa ero a Venezia con mio figlio e stavamo alle Zattere; passavo per il canale della Giudecca e, visto che era la prima volta che mio figlio veniva con me a Venezia, cercavo di fargli vedere le Zattere quando all'improvviso accanto al vaporetto si è palesato un «mostro» di non so quanti metri, 30 o 40 metri, che ci ha impedito di vedere le Zattere; abbiamo visto solamente questa nave, con i turisti che salutavano. Tra l'altro, ho le foto; quindi, chiedo se posso mandarle ai suoi uffici, così potranno verificare il fatto che purtroppo le grandi navi passano ancora per il canale della Giudecca (questo solamente due settimane fa). L'ultimo punto per il quale noi non siamo soddisfatti è che non ci sono impegni né ci sono iniziative, a parte quella di un incontro dell'UNESCO con i Ministeri competenti e, ovviamente, un incontro è sempre una cosa importante, che non si nega mai. Però non ci sono iniziative che impegnano il Governo, anche temporalmente, a trovare una soluzione. Il fatto che non ci sia un impegno temporalmente definito, ci lascia molto preoccupati e ci conferma nell'opinione che purtroppo questo Governo non vuole raggiungere in tempi brevi una soluzione di un problema così grave. E anche per questo, lo ripeto, domenica prossima saremo alle Zattere a Venezia a manifestare contro le grandi navi.	
MARINA SERENI	PRESIDENTE	Passiamo all'interpellanza urgente Zaccagnini ed altri n. 2-01448 (Vedi l'allegato A – Interpellanze urgenti). Chiedo al deputato Kronbichler se intenda illustrare l'interpellanza di cui è cofirmatario o se si riservi di intervenire in sede di replica.	
FLORIAN KRONBICHLER		Questa interpellanza urgente riguarda appunto la salvaguardia del punto nascita di Vipiteno, per impedire la chiusura deliberata dalla provincia autonoma di Bolzano. Si chiama urgente, però fa un po’ a pugni con questo nome. Per diverse cose, anche per le ferie estive e poi per la sua indisponibilità, signor sottosegretario, che però ha avuto ovviamente il mio assenso, arriva un po’ fuori tempo, con molto, molto ritardo. Devo dire però, insomma, che non tutti i mali vengono a danneggiare e considero una felice, anche se un po’ cinica, coincidenza che la Ministra, attraverso di lei sottosegretario, debba rispondere su un argomento come quello della salvaguardia di un punto nascita proprio nel giorno del cosiddetto «Fertility day»; tutto ciò dovrebbe o potrebbe anche far riflettere per rimediare ad un male che io vedo in questo. Sono intervenuti dei cambiamenti nel frattempo, perché risale a due mesi fa la presentazione dell'interpellanza e nel frattempo ovviamente si è fatto di tutto lì, sul luogo che è il punto nascita più a nord della Repubblica. È uno stillicidio di smontaggi, vengono tolti già dei servizi, e tutto quanto proprio in vista della chiusura voluta dalla provincia per la fine di ottobre. C’è questa decisione con la delibera della giunta, e il senso di questa mia interpellanza sarebbe proprio il seguente: quando si fanno delle cose spiacevoli o non popolari si ottiene un'opposizione forte, da parte di tutta la popolazione, come avviene nell'Alta Val d'Isarco e in tutto il comprensorio. È di questa settimana la decisione di tutti i sindaci del comprensorio di fare ricorso nei confronti della delibera della provincia al tribunale amministrativo. La provincia ovviamente è arrivata a questa chiusura sempre rimandando a degli impegni che ci sarebbero verso lo Stato: è Roma che ce lo impone. Questo è un modo un po’ comodo. Sempre, anche nella provincia più autonoma, quando qualcosa va diversamente da quanto noi vogliamo, si dice: la chiusura è motivata soprattutto dai costi. Quindi vorrei estorcere proprio al sottosegretario la conferma di quanto la Ministra Lorenzin, così off record, ci ha spiegato ad alcuni di noi consiglieri, non soltanto del mio gruppo ma anche del MoVimento 5 Stelle e del gruppo dell'autonomia, ovvero che è di competenza della provincia. Adesso ci sono state delle manifestazioni, c’è stato questo intervento dei sindaci. Il nucleo dell'interpellanza è sapere se c’è la volontà o la disponibilità del Ministero di tenere – diciamo così – vivo questo punto nascita, che è noto in tutta l'Italia per essere un punto nascita di eccellenza, dove ci sono delle tecniche che non sto ad elencare, ma che sono tutte elencate nella mia interpellanza. Signor sottosegretario, lei mi potrà dire qual è la posizione dello Stato e qual è la pressione che il Ministero avrebbe fatto sull'assessorato alla sanità della provincia di Bolzano o se ci dobbiamo rivolgere del tutto, solo ed esclusivamente, alla giunta provinciale di Bolzano, se vogliamo salvare questo punto nascita, questa struttura che non ha soltanto una valenza di politica della salute. Non è soltanto un servizio, è proprio una struttura che valorizza il territorio. Questa chiusura va in controtendenza a una politica che si è dimostrata molto efficace e felice, quella che ha impedito lo spopolamento, a differenza di tante altre zone dell'Italia, della periferia, delle valli. Un comprensorio così periferico come l'alta Val d'Isarco, senza una struttura così essenziale come quella dell'ospedale, è un'altra cosa. Se non ci saranno medici, non ci saranno ostetriche, tutto cambia. Il servizio, certo, lo si può spostare in un altro posto, però cambiando si svalorizza il territorio.	
MARINA SERENI	PRESIDENTE	Il sottosegretario di Stato per la salute, De Filippo, ha facoltà di rispondere.	
