speaker	role	text	extra
NAZZARENO PILOZZI		Signor Presidente, Governo, colleghi, torniamo oggi in seconda lettura sul decreto-legge «del fare». Io credo che noi, come Sinistra Ecologia Libertà, quando abbiamo votato qualche settimana fa sul decreto del fare, abbiamo spiegato bene il perché. Questo decreto è un decreto che in realtà è stato ribattezzato in tanti modi, decreto del disfare, decreto del nulla, proprio perché è un decreto che è servito esclusivamente a far fare un po’ di pubblicità al Governo e soprattutto ad inserire sia alla Camera in prima lettura, ma soprattutto adesso al Senato, alcune norme che – spiegherò nel dettaglio – servono più a fare gli interessi di qualcuno che non a fare il bene del nostro Paese. Ma prima di entrare nel merito di questa discussione e delle nostre proposte emendative, anche noi come Sinistra Ecologia Libertà abbiamo presentato pochi emendamenti e abbiamo tentato di stare nel merito della discussione. Infatti, come abbiamo visto oggi in Commissioni riunite affari costituzionali e bilancio, alla fine tutti i gruppi hanno deciso di non proseguire in una discussione stucchevole in cui in realtà non si voleva entrare nel merito del provvedimento. E quindi anche i gruppi di maggioranza hanno detto: rimettiamoci all'Aula. Noi abbiamo ripresentato in Aula alcuni emendamenti che riteniamo quantomeno necessari a mitigare quelle cose che sono state inserite nell’iter legislativo di questo decreto e che in realtà vanno a sistemare gli interessi di qualcuno. Ma io ricordo – su questo vorrei che il Governo facesse un po’ di attenzione – il Ministro Franceschini, quando il decreto è arrivato in Aula, che ci ha detto, in pompa magna, mettendoci il petto: guardate, noi non metteremo mai la fiducia su un maxiemendamento che va a cambiare quello che è il risultato della Commissione e di tutti gli emendamenti presentati. Non metteremo mai la fiducia su un testo diverso da quello presentato dalle Commissioni all'Aula. Quanto è durata questa promessa del Ministro Franceschini ? Che cosa è avvenuto, in realtà ? Che si è utilizzato il Senato per cambiare quel testo e per proporre o far proporre od aiutare il Senato ad inserire norme diverse da quelle su cui era stata messa la fiducia alla Camera. Questa è una mancanza di rispetto per tutti noi, soprattutto per le Commissioni e per quei colleghi che vi hanno lavorato. Bene, poi sentiamo qui che ci si dice che il problema è il bicameralismo, il problema sono i Regolamenti parlamentari. Io capisco che siamo in una fase in cui vogliamo cambiare le istituzioni repubblicane, magari pensiamo ad un altro assetto della nostra Repubblica...	
ROBERTO GIACHETTI	PRESIDENTE	I banchi del Governo devono sempre essere lasciati liberi.	
NAZZARENO PILOZZI		ma qui c'entra poco l'assetto istituzionale, c'entra poco il parlamentarismo, c'entra poco il bicameralismo. Qui c'entra un modo di comportarsi assolutamente non rispettoso delle istituzioni, ed è grave che, dopo tante nottate passate in Commissione e tante ore passate in quest'Aula a discutere degli emendamenti e del decreto «del fare», qualcuno, approfittando dell'altro ramo del Parlamento, abbia modificato alcuni aspetti importanti che erano stati già sviscerati e decisi precedentemente. I nostri emendamenti su cosa vanno ad incidere ? Su qualche punto fondamentale. Noi avevamo discusso in prima lettura riguardo a quell'anticipo del 10 per cento che si vuole dare alle imprese quando queste vincono una gara di appalto. In un Paese in cui vi sono imprese che aspettano da due anni di riscuotere, si dà la possibilità a chi solo vince una gara di appalto di potere riscuotere il 10 per cento. Noi, a forza di discutere, avevamo previsto due cose in un articolo del provvedimento: avevamo previsto che, intanto, questo 10 per cento dovesse essere scritto nel bando di gara, in modo da non lasciare troppa discrezionalità alle stazioni appaltanti, e avevamo scritto che questa decisione dovesse essere facoltativa. Oggi, per fortuna, resta almeno il fatto della previsione nel bando della gara d'appalto, ma da facoltativa viene resa obbligatoria. Quindi, che cosa accadrà ? Che tutti quei comuni, quelle stazioni appaltanti, quegli enti amministrativi che non hanno cash, non hanno in cassa quel 10 per cento, non potranno fare le gare di appalto ! Magari avranno il 5 per cento da poter anticipare alle aziende, non il 10 per cento, e quindi noi chiudiamo gli appalti pubblici in questo Paese. Andate a vedere come stanno i comuni, come stanno le regioni, come stanno gli enti pubblici in questo Paese: vedrete che questa è una norma che, magari, vi fa fare bella figura con qualche amico, con qualche azienda, con qualche associazione, ma poi, in realtà, servirà solamente a bloccare, rischia di bloccare gli appalti pubblici nel nostro Paese. E poi, che cosa è avvenuto ? Noi avevamo discusso in Commissione sulla questione delle incompatibilità e del decreto legislativo n. 39 del 2013, un decreto che avete voluto voi. Pochi giorni prima delle elezioni, avete voluto questo decreto n. 39 per potervi aprire a una campagna elettorale sulla moralizzazione del Paese. Passate le elezioni, in questo decreto si prevede che, per quanto riguarda le incompatibilità precedenti al decreto n. 39, quelle, diciamo così, sopravvenute, esse non valgono. Quindi, praticamente, noi, per tutti quegli amministratori di enti pubblici che sono in regime di incompatibilità, facciamo una sanatoria e diciamo che, fino al prossimo rinnovo, e quindi, probabilmente, fino al prossimo decreto, il decreto n. 39 non vale. Questo stiamo facendo, questo stiamo votando. Io credo che sia il caso che noi queste cose ce le diciamo. Poi c’è la questione dell'articolo 30, che riguarda, appunto, una rinormazione dell'urbanistica in questo Paese, che tanto ci ha fatto discutere, che ha visto i colleghi del Partito Democratico molto attivi nelle Commissioni competenti, ma anche nella Commissione ambiente. Ebbene, ora all'articolo 30 si fanno nuove modifiche, si interviene addirittura sulle distanze dei fabbricati, una legge del 1968. Perché si interviene sulle distanze dei fabbricati ? Forse perché qualche importante regione del Nord nel suo piano casa aveva ammesso la possibilità di derogare alle distanze tra fabbricati. In un Paese in cui il rischio sismico è quello che è, noi andiamo a derogare anche alle distanze fra i fabbricati. Io credo che veramente abbiamo bisogno, forse, di riconnetterci, ma non tanto con il nostro Paese, quanto con il buonsenso, perché oggettivamente noi siamo fuori da qualsiasi regola di buonsenso. Ebbene, andiamo a derogare. Noi presentiamo un emendamento semplice con il quale abroghiamo la lettera a) del comma 1 dell'articolo 30 che deroga, appunto, alla distanza tra fabbricati e che dice che i comuni, le regioni e le province (a seconda di come poi si declina l'urbanistica nel nostro Paese come è stata pensata negli ultimi trent'anni) possono derogare al decreto del 1968. In questo articolo 30, diciamo pure che, così, ex lege, con un decreto approvato nottetempo, tutte le lottizzazioni in scadenza sono prorogate di tre anni. Quindi, chi stava facendo delle opere di urbanizzazione (magari aveva già costruito gli appartamenti, ma doveva solo finire le opere di urbanizzazione), siccome noi nel decreto avevamo già previsto la possibilità di fare i collaudi parziali di quelle palazzine, quel lottizzatore potrà vendere anche gli appartamenti finiti di palazzine ancora in corso di costruzione, a questo punto, anche senza opere di urbanizzazione. Con un salto solo torniamo indietro di cinquant'anni, in questo Paese. È questo quello che stiamo facendo. Ma questo poi incide – come sanno bene anche altri colleghi – anche sui soldi, sulle casse degli enti locali, i quali magari avevano fatto dei conti per quelle lottizzazioni, magari per lo scorporo, e adesso si trovano calato sulla testa un decreto che rilancia per tre anni e stabilisce una proroga su tutti quei contratti firmati. Abbiamo poi un'altra questione – ne hanno parlato diversi colleghi – assolutamente poco comprensibile, quella degli stipendi per i manager delle aziende pubbliche, che noi dividiamo tra aziende quotate, aziende non quotate, tra quello che debbono fare le une, le altre. Però, c’è un punto e io credo che dobbiamo dircelo fra di noi e semplificare anche la discussione: noi diciamo che ci sarà una decurtazione del 25 per cento delle retribuzioni precedenti, senza però parlare dei benefit, che noi sappiamo essere un aspetto fondamentale di quei contratti. Io, da sindaco di un piccolo comune, mi sono trovato a votare contro un contratto di una azienda partecipata, in cui il mio comune aveva una partecipazione irrisoria, nel quale si prevedeva per quel manager una macchina del valore di una Audi A6 o equipollente, il telefonino aperto per sé e per i membri della sua famiglia, una macchina che accompagnasse i figli a scuola, piuttosto che una assicurazione sulla vita. Tutto questo ovviamente è fuori dalle retribuzioni, che noi non consideriamo onnicomprensive. Noi diciamo che quei manager possono prendere una retribuzione diminuita del 25 per cento, ma a questa poi aggiungerci una marea di benefit. Io credo che noi dobbiamo essere onesti e dire chiaramente ai cittadini quanto e come dobbiamo pagare quei manager e quanto e come quei manager, se magari si sentono sottopagati dall'azienda di Stato, possono mettersi sul mercato e andarsi a prendere stipendi più alti magari da qualche azienda privata. Ma io, di manager pubblici che fanno queste scelte coraggiose, diciamo così, non è che ne ho visti molti negli ultimi anni. Chiudo questo mio intervento chiedendo all'Aula, ai relatori e a tutti coloro che hanno seguito la discussione anche questa mattina per lungo tempo in Commissione, di ragionare bene e di evitare che oggi, anche senza la fiducia, ci ritroviamo quella sorta di fiducia fantasma che ormai aleggia dentro quest'Aula e che non ci fa approvare nessun emendamento, perché non si discute più nel merito degli emendamenti, ma per scelte pregresse si decide che il testo uscito dal Senato non può essere assolutamente modificato. C’è tempo, il decreto scade il 20 agosto, e credo che un'opera di manutenzione sulle poche cose che ho detto, ma ce ne sono altre, dobbiamo avere non solo il coraggio ma anche la forza di farla. Dobbiamo dire a questo Paese che noi siamo in grado, anche a ridosso di Ferragosto, di mitigare una legge già partita con il piede sbagliato e che oggi a noi di Sinistra Ecologia e Libertà sembra sempre più un «decreto del fare favori» piuttosto che un «decreto del fare per l'Italia e per il nostro Paese» (Applausi dei deputati del gruppo Sinistra Ecologia Libertà).	
ROBERTO GIACHETTI	PRESIDENTE	Nessun altro chiedendo di parlare, invito i relatori e il rappresentante del Governo ad esprimere i rispettivi pareri.	
FRANCESCO PAOLO SISTO		Relatore per la I Commissione. Signor Presidente, prima di esprimere formalmente i pareri, come sono stati esaminati dal Comitato dei diciotto, rappresento brevemente all'Assemblea l’iter che ci ha condotto all'esame degli emendamenti e come siamo giunti all'Aula. Dopo che il Senato ci ha inviato in data di ieri gli atti, l'esame è iniziato alle 9,30 di oggi, il termine è stato fissato alle 10,30. Gli emendamenti presentati in Commissione erano 40 più 7 irricevibili, perché riferiti a parti non modificate dal Senato. Al termine della discussione generale vi è stata la sospensione della seduta per esaminare i profili di ammissibilità degli emendamenti. Alla ripresa è stato comunicato che il Senato ha inviato una correzione al messaggio inviato alla Camera nel quale non risultava la soppressione della comma 12 dell'articolo 73. Alla luce di tale correzione è stato quindi dato un tempo ulteriore per presentare emendamenti ripristinatori del comma soppresso al Senato; sono stati presentati due identici emendamenti. Sono quindi iniziate le votazioni sugli emendamenti che si sono svolte regolarmente. Riguardo all'emendamento Crippa 5.1, in qualità di presidente ho provveduto a ripetere la votazione per verificarne l'esito. Sono state scrupolosamente controllate le sostituzioni presentate dai rappresentati di gruppo. Nel corso della votazione ho ritenuto, rifacendomi a una prassi consolidata di cui darò testimonianza di qui ad un attimo, di dover esprimere il mio voto contrario all'emendamento. Sottolineo che il mio voto non è stato determinante ai fini del risultato della votazione. Analogo atteggiamento è stato tenuto dal presidente Boccia in altra votazione. Voglio sottolineare, Presidente, perché sia ben chiaro, che la prassi del voto del presidente relatore della Commissione, anche non relatore, è riconosciuta dalla Camera dei deputati in più episodi. Segnalo in particolare quanto realizzato dal presidente Castagnetti nella Giunta delle autorizzazioni a procedere nella XVI legislatura, di cui era presidente, ma soprattutto quanto riportato dal Presidente Bertinotti in una nota del 25 luglio 2006 di cui do lettura rapida: «Quanto al fatto che il presidente della Commissione intervenga nel merito dei dibattiti come esponente del gruppo di appartenenza, pur mantenendo la presidenza della seduta, devo osservare che non sussiste per i presidenti delle Commissioni alcun divieto, né sul piano regolamentare né in via di prassi, di partecipare alle votazioni ed ai dibattiti delle Commissioni medesime. Richiamo, a questo proposito, i principi enunciati in una lettera del Presidente della Camera del 14 novembre 1973 nella quale si afferma espressamente che è pienamente consentito ai presidenti di Commissione partecipare attivamente ai lavori legislativi esprimendo la propria opinione e il proprio voto. Se così non fosse potrebbero derivarne rilevanti alterazioni al principio di proporzionale rappresentanza dei gruppi nelle Commissioni. Questa conclusione» – prosegue il Presidente Bertinotti – «appare tra l'altro pienamente coerente con il frequente esercizio da parte dei presidenti delle Commissioni della funzione di relatore sui progetti di legge, ai sensi dell'articolo 79, comma 3, del Regolamento, il che manifestamente comporta la necessità di pronunciarsi sul merito dei provvedimenti in esame». Pertanto, mi sembra che le critiche che vengono mosse ai presidenti delle Commissioni vadano respinte al mittente, segnalando – Presidente, ho terminato prima di passare al parere sugli emendamenti – che il Presidente Francesco Crispi, anziché il 23 novembre 1976, ha pronunciato quel discorso qualche anno prima, esattamente cento. Passo quindi al parere sugli emendamenti. Le Commissioni formulano un invito al ritiro, altrimenti il parere è contrario, su tutti gli emendamenti presentati in Aula.	
ROBERTO GIACHETTI	PRESIDENTE	Il Governo ?	
ALBERTO GIORGETTI	Sottosegretario di Stato per l'economia e le finanze	Signor Presidente, il parere del Governo è conforme a quello espresso dal relatore.	
			Modifica nella composizione di un gruppo parlamentare.
ROBERTO GIACHETTI	PRESIDENTE	Avverto che gli emendamenti Pilozzi 14.1 e 14.2 nonché l'emendamento Bragantini 84-ter.2 sono stati ritirati dai presentatori.	
			Si riprende la discussione.
			(Ripresa esame dell'articolo unico – A.C. 1248-B)
ROBERTO GIACHETTI	PRESIDENTE	Comunico che il deputato Marco Di Stefano, proclamato in data odierna, ha dichiarato di aderire al gruppo parlamentare Partito Democratico.	
ROBERTO GIACHETTI	PRESIDENTE	Siccome abbiamo un problema tecnico da risolvere rapidamente per l'inserimento nelle votazioni dell'onorevole Di Stefano, che ha testé aderito al gruppo, ove vi fosse anche una breve dichiarazione di voto sul primo emendamento eviteremmo di sospendere i lavori per qualche minuto. Passiamo alla votazione dell'emendamento Crippa 5.1. Ha chiesto di parlare per dichiarazione di voto l'onorevole Fiano. Ne ha facoltà.	
EMANUELE FIANO		Io esprimo parere conforme a quanto già espresso dai relatori. Potrei dire, con una battuta, che noi, al contrario di altro ramo del Parlamento, confermeremo il testo così come ci è pervenuto, anche se, in occasione della discussione generale e sul complesso degli emendamenti, avrei voluto dire qual era il mio pensiero con riferimento ad un altro argomento, che è quello riguardante le modifiche intervenute all'articolo 46, comma 1-quinquies, che riguarda interventi a favore dell'utilizzo dei fondi derivanti dalla tassa di soggiorno per il comune di Milano e i comuni della provincia di Milano, riguardanti la possibilità di utilizzare, al di fuori del Patto di stabilità, quei fondi per la realizzazione di Expo 2015. Uso questo esempio per dire che, nel rispetto del senso politico e istituzionale di approvare così come ci è pervenuto il testo dal Senato, insieme a moltissimi altri colleghi parlamentari, ho trasformato la necessità che avrei visto di presentare un emendamento al testo, per provvedere a quanto soppresso dal Senato – cioè quella possibilità che prima ho citato –, presentando invece insieme a moltissimi colleghi, come dicevo, un ordine del giorno. Anche per questa ragione, cioè per il senso politico e istituzionale che noi diamo al fatto di dover confermare il testo così come ci è pervenuto, pur sapendo e conoscendo, e anche in parte condividendo, alcune delle critiche che ho sentito in discussione generale o negli interventi sul complesso degli emendamenti, critiche al fatto che un testo qui approvato, in questa Camera dei deputati, con un voto di fiducia al Governo venga poi modificato da altro ramo del Parlamento dopo il voto di fiducia, anche condividendo in parte critiche di principio, devo dire che le modifiche intervenute al Senato in alcuni casi hanno portato dei miglioramenti. E questa è anche la ragione per la quale noi condividiamo il parere negativo su questo emendamento 5.1 a prima firma Crippa, così come confermiamo il parere conforme a quello già espresso dal relatore.	
ROBERTO GIACHETTI	PRESIDENTE	Ha chiesto di parlare per dichiarazione di voto l'onorevole Crippa. Ne ha facoltà.	
			PRESIDENZA DEL VICEPRESIDENTE LUIGI DI MAIO (ore 17,35)
DAVIDE CRIPPA		Signor Presidente, le motivazioni dell'onorevole Fiano ovviamente non fanno altro che farci proseguire nella nostra intenzione di porre all'attenzione dell'Aula questo emendamento in maniera chiara. Questa è l'ultima spiaggia, l'ultima spiaggia per far sì che la riduzione dell'incentivo dei CIP 6 sia estesa anche ai termovalorizzatori, dopo anni per evitare gli ennesimi favori ai proprietari di questi impianti che per anni hanno goduto e godono di sistemi di incentivazione degli inceneritori, che nulla hanno a che fare con il sistema di incentivazione da rinnovabili. Però, casualmente, tali incentivi vengono caricati sulla componente tariffaria A3 che riguarda le componenti «rinnovabili» della bolletta. Qui non si tratta di cancellare, come qualcuno ha detto, l'incentivo del CIP 6 – purtroppo, noi aggiungiamo – ma di diminuire significativamente il suo valore portandolo a quello che è un paniere del gas su cui da anni, da anni e da anni chi gestisce questi impianti ha lucrato soprattutto grazie al fatto che, da anni, rimane basato sul paniere del petrolio. Oggi, invece, assistiamo finalmente a un cambio e di questo dobbiamo dare un leggerissimo merito finalmente al Governo di essersi accorto che da dieci anni il paniere del gas è più favorevole di quello del petrolio, però non capiamo a chi state facendo un piacere o, meglio, lo sappiamo benissimo. A questo punto, chi state difendendo (Applausi dei deputati del gruppo MoVimento 5 Stelle) ? Infatti vorrei citare alcuni commenti di alcuni esponenti di questa – diciamo – maggioranza trasversale. Cito, 3 dicembre 2009, l'onorevole Realacci, presidente della Commissione ambiente, affermava: «Bene, fine incentivi CIP 6, un trucco pagato in bolletta dai cittadini». Quindi, ci aspettiamo che sicuramente il PD in qualche modo tenda a supportare la tesi del proprio presidente di Commissione ambiente, perché evidentemente, altrimenti, si pone una questione di incoerenza che probabilmente vorremmo magari non vedere oggi (Applausi dei deputati del gruppo MoVimento 5 Stelle). L'altra faccenda, vi cito l'onorevole Tabacci, che ha spesso combattuto contro gli incentivi CIP 6. E vi cito un episodio del giugno 2008, direttamente dal suo blog: «Poco fa sono intervento in Aula alla Camera per denunciare la decisione del Governo e della maggioranza di utilizzare la scandalosa deriva dei CIP 6 anche per gli impianti di termovalorizzazione che si stanno costruendo in Campania». A questo punto, oggi noi chiediamo, stiamo chiedendo di diminuire l'incentivazione dei CIP 6 anche per i termovalorizzatori. Allora, a questo punto ci chiediamo come mai (Applausi dei deputati del gruppo MoVimento 5 Stelle) visto che, ribadisco, sempre d'accordo con l'onorevole Tabacci, era espresso, sempre in quel momento, «il sostegno a tali impianti dunque non va a carico della fiscalità generale ma direttamente della bolletta a carico delle famiglie». Ci ritroviamo perfettamente in queste sue affermazioni. Allora, concludendo riportava, inoltre, una questione: «Allora non solo gli si dà i soldi per gli impianti, ma gli si garantisce una rendita a prescindere dalla qualità dell'energia che si produce negli impianti di termovalorizzazione».	
DAVIDE CRIPPA		Ci troviamo perfettamente d'accordo con l'onorevole Tabacci e per questo noi oggi ci aspettiamo che una parte consistente della maggioranza, in qualche modo, accetti questa limitazione dei termovalorizzatori perché, altrimenti, veramente la coerenza non esiste e non c’è la scusa che il Senato può lavorare: il decreto scade dopo il 20 (Applausi dei deputati del gruppo MoVimento 5 Stelle).	
LUIGI DI MAIO	PRESIDENTE	Ha chiesto di parlare per dichiarazione di voto, a titolo personale, il deputato Marchi. Ne ha facoltà.	
MAINO MARCHI		Signor Presidente, credo che questa sia stata un'occasione persa per il MoVimento 5 Stelle. Abbiamo profondamente cambiato questa parte del decreto. Partendo anche dalle loro osservazioni, abbiamo introdotto delle gradualità, diversificate anche a seconda del fatto che gli inceneritori servano effettivamente per situazioni di emergenza oppure no. E credo che questo emendamento, a questo punto, invece vuol dire azzerare completamente queste gradualità. Quindi, il segno del cambiamento rispetto a com'era originariamente il decreto-legge l'abbiamo già dato. Il Senato ha ulteriormente migliorato e, quindi, credo che su questo punto il merito ci sia, nel senso che concordiamo fino in fondo con quello che è scritto nel decreto-legge come è uscito dal Senato (Applausi dei deputati del gruppo Partito Democratico).	
LUIGI DI MAIO	PRESIDENTE	Passiamo ai voti. Avverto che è stata chiesta la votazione nominale mediante procedimento elettronico. Indìco la votazione nominale, mediante procedimento elettronico, sull'emendamento Crippa 5.1, con il parere contrario delle Commissioni e del Governo. Dichiaro aperta la votazione. (Segue la votazione). Mazzoli, Catania, Ferro, Oliaro, Villarosa, Ruocco, Giachetti... Dichiaro chiusa la votazione. Comunico il risultato della votazione: Presenti e votanti 467 Maggioranza 234 Hanno votato sì 122 Hanno votato no 345. La Camera respinge (Vedi votazioni). Ricordo che gli emendamenti Pilozzi 14.1 e 14.2 sono stati ritirati. Passiamo alla votazione dell'emendamento Luigi Gallo 18.50. Ha chiesto di parlare per dichiarazione di voto il deputato Luigi Gallo. Ne ha facoltà.	
LUIGI GALLO		Signor Presidente, Governo, colleghi, in questo emendamento si parla di priorità. Il MoVimento 5 Stelle ha chiaro quali sono le priorità per il Paese. Noi vogliamo il reddito di cittadinanza, sostegno alle piccole e medie imprese, sostegno alla scuola e alla sanità. Il Governo, però, non ha chiaro quali sono le sue priorità, e neanche la maggioranza. Tira un po’ a campare, cerca di superare questo momento di difficoltà, questo scossone che ha ricevuto, dalle elezioni in poi, dal MoVimento 5 Stelle e da tutti i cittadini italiani. Anche qui è una questione di priorità. Abbiamo pochissimi soldi, 350 milioni di euro da spendere nel mondo dell'edilizia scolastica. Cosa facciamo ? Li spendiamo per garantire la sicurezza degli edifici esistenti, sicurezza messa a rischio, che mette a rischio i nostri ragazzi che frequentano le scuole ? O decidiamo di costruire nuovi edifici scolastici, di investire questi soldi in nuovi edifici scolastici, quando c’è bisogno di edifici scolastici che prevedano anche strutture che si adeguino ad una nuova didattica, una didattica innovativa, una didattica che non chiuda i nostri ragazzi in celle, in banchi e con modalità di apprendimento che non sono più adeguate ? Ma è una questione di priorità: con questi pochi fondi, il MoVimento 5 Stelle sceglierebbe di investire in sicurezza e salvare da pericoli i nostri ragazzi (Applausi dei deputati del gruppo MoVimento 5 Stelle).	
