speaker	role	text	extra
MARIA ROSARIA CARFAGNA		Presidente, colleghi, anche quest'anno, in occasione della Giornata internazionale contro la violenza sulle donne, sono numerose le manifestazioni e le iniziative di sensibilizzazione promosse su tutto il territorio nazionale da partiti, associazioni, organizzazioni. E questo, devo dire, ci conforta. Ci conforta molto perché sappiamo quanto sia importante sensibilizzare l'opinione pubblica riguardo alla vastità e alla drammaticità del fenomeno di cui stiamo parlando. Ci conforta un po’ meno, onestamente, pensare che quest'oggi, in quest'Aula, si possa consumare l'ennesimo esercizio retorico quando si richiama l'attenzione dell'Assemblea su di un fenomeno che dovrebbe essere sempre, tutti i giorni, sotto i riflettori delle istituzioni e del Governo, e che ogni anno rende schiave della paura e della violenza milioni e milioni di donne in Italia e nel mondo e che miete più vittime di quante non ne lasci sul campo, per esempio, la mafia. Negli ultimi giorni sono stati pubblicati numerosi studi e statistiche, cui lei stessa ha fatto riferimento, che ci aggiornano sull'evoluzione e sulle dimensioni di questo fenomeno. Tutti i numeri che abbiamo a disposizione ci dicono una sola cosa e cioè che è sbagliato pensare di interrompere un percorso che era stato virtuosamente avviato, anche con grande fatica e con tante difficoltà, con l'aiuto e la collaborazione di tutte le forze politiche presenti in Parlamento e col sostegno e l'aiuto prezioso dei membri del mondo dell'associazionismo dei centri anti-violenza e che aveva portato il contrasto alla violenza sulle donne ad essere una priorità assoluta nella agenda politica nazionale ed internazionale, portando a promuovere e a realizzare strumenti utili per prevenire, contrastare e aggredire questo fenomeno sotto tutti i punti di vista. Sotto il punto di vista della prevenzione, attraverso azioni e campagne di comunicazione e di sensibilizzazione anche nelle scuole italiane; sotto il profilo della protezione delle vittime, attraverso il finanziamento ai centri anti-violenza reperendo fondi importanti e significativi in una fase drammatica della nostra crisi economica e finanziaria; sotto il profilo della persecuzione dei reati attraverso il varo di leggi importanti come ad esempio quella sulla stalking. Ecco perché in una giornata come questa, in una giornata così importante, non ci interessano le celebrazioni fini a se stesse, non ci interessa la retorica, non ci interessano gli annunci, le promesse, le buone intenzioni. Ci interessa sapere cosa realmente sta facendo il Governo, o meglio: cosa sta aspettando il Governo a considerare questa come una priorità per mettere in campo azioni, strumenti e soldi per assicurare alle donne italiane libertà, dignità e sicurezza ? Cosa si aspetta a dare attuazione, attuazione concreta non formale, alla Convenzione di Istanbul ? Stiamo ancora attendendo di conoscere lo stato dell'arte della task force interministeriale, un organo elefantiaco composto da dieci ministeri, da rappresentanti degli enti territoriali, dal mondo dell'associazionismo. È più di un anno che questa task force sta lavorando per attuare il piano di azione straordinario. Come dice la stessa collega del Partito Democratico, dai giornali, noi oggi, dai giornali, ripeto, apprendiamo che forse, probabilmente, questo piano di azione straordinario che dovrebbe contrastare in maniera sinergica e coordinata questo grave e drammatico fenomeno, vedrà la luce a gennaio. Non lo sappiamo qui in Parlamento o nelle Commissioni parlamentari, lo apprendiamo dai giornali e questo è indicativo dell'importanza che il Governo dà a questo fenomeno. È più di un anno che aspettiamo, Presidente, e non vorremmo sinceramente, visto il malcostume di questo Governo, trovarci di fronte ad un'altra data disattesa e di fronte ad un'altra promessa non mantenuta perché in questo caso si tratterebbe di un gioco fatto sulla pelle delle donne italiane, una pelle che porta già troppe cicatrici, alcune delle quali difficilmente rimarginabili. Tutto questo mentre i centri anti-violenza rischiano di chiudere, lamentano la carenza di fondi; è di oggi un articolo pubblicato su Il Corriere della sera in cui si descrive come sia drammatica la situazione dei centri anti-violenza e tutto questo mentre la legge di stabilità per il 2015 non prevede il rifinanziamento delle politiche di genere, tutto questo mentre il Governo voleva far passare una norma per abolire la carcerazione preventiva per il reato di stalking. Tutto questo mentre ancora langue senza risposta la richiesta pressante, fatta da Forza Italia, affinché questo Governo si doti di un interlocutore istituzionale per affrontare questo problema e cioè di un Ministro per le pari opportunità. E allora, Presidente, e concludo, in questo giorno così importante, noi chiediamo risposte concrete, non annunci e neanche promesse di consultazioni on line; chiediamo che il Governo non prenda più in giro le donne italiane, chiediamo che il Governo non prenda più in giro il mondo dell'associazionismo, chiediamo che siano rifinanziati i centri anti-violenza, che oggi costituiscono l'unico presidio a tutela della sicurezza e della libertà delle donne italiane. Ma soprattutto chiediamo rispetto per le tante vittime di questo Paese, non solo nelle ricorrenze come quelle di oggi, ma tutti i giorni con fatti concreti e non con promesse slide (Applausi dei deputati del gruppo Forza Italia – Il Popolo della Libertà – Berlusconi Presidente).	
LAURA BOLDRINI	PRESIDENTE	Grazie deputata Carfagna. Adesso do di nuovo la parola alla deputata Mara Mucci che aveva chiesto di parlare. Prego, ne ha facoltà.	
MARA MUCCI		Grazie signora Presidente. Grazie anche per averci concesso questo spazio oggi, in questa Aula, per ribadire tutto il nostro lavoro attorno al tema del femminicidio. Purtroppo però lei ha parlato giustamente di azioni portate avanti da questo Parlamento, in realtà però le azioni che maggiormente noi attendevamo erano quelle del Governo, ovvero quelle relative all'emanazione del piano anti-violenza e alle linee guida. Dall'altra parte noi oggi potevamo utilizzare questo spazio per parlare anche dei risultati ottenuti, se questo fosse stato fatto ai tempi; quindi è grave che ancora si sia in ritardo su temi che comunque vediamo che anche da parte dell'opinione pubblica in questo momento siamo riusciti ad attenzionare e che prima effettivamente erano per lo più sconosciuti. Per cui l'impegno qui oggi è sì di ribadire alcuni concetti e alcune questioni che noi vorremmo fossero davvero compiute da questo Governo, però ciò non deve rimanere una mera lettera morta, ma dovrà essere un nuovo inizio. Quindi, da oggi fattivamente azioni concrete da parte di questo Governo, altrimenti veramente siamo qui a commemorare una giornata che è sì mondiale, alla quale va veramente tutta la nostra concentrazione, la nostra attenzione; i nostri sforzi possono essere messi su questo tema, ma se effettivamente non ci sono azioni concrete sono tutti sforzi inutili. La questione del femminicidio, lei lo ha detto giustamente, concerne un problema strutturale che ha determinate cause che partono ad esempio dal lavoro, dal gender gap, dal fatto che comunque una persona che non è indipendente dal punto di vista lavorativo chiaramente rimane incastrata in una situazione di violenza da cui invece si vorrebbe divincolare. È una situazione altresì culturale, perché ancora la donna stessa pensa addirittura di non subire violenza perché si ritrova nell'ambito del rapporto familiare, affettivo, una situazione in cui dovrebbe essere al sicuro, e quindi spesso si sente anche sbagliata. Dal punto di vista culturale è oltremodo l'immagine, lo stereotipo cattivo che continua a perdurare in questo Paese e che vede addirittura un esempio concreto: lo IAP, l'Istituto di autodisciplina pubblicitaria, impiega, colleghi, due settimane di tempo per bloccare le campagne sessiste e che sviliscono la figura femminile. Due settimane sono un tempo eccessivo, perché in quelle due settimane un'azienda comunque ha fatto passare un messaggio, è comunque un messaggio che arriva alla collettività e che tu non riesci a modificare. Queste sono cose che possono sembrare piccole ma che in realtà vanno a cambiare e vanno a sradicare quel concetto che culturalmente è sbagliato e che comunque è all'interno di questa società ed esiste ancora, una politica che è poco rappresentativa e la situazione emblematica è davanti agli occhi di tutti adesso, in seno a queste elezioni regionali: in Calabria un consigliere regionale donna. Questo non è accettabile. Se non ci sono figure femminili che rappresentano la parte femminile di questo Paese, è chiaro che anche le politiche che si nascondono dietro la voglia di cambiare questo Paese, anche da questo punto di vista, non verranno mai alla luce. Queste sono cose che vanno modificate. Lei ha parlato di numeri, perché i numeri sono emblematici e sono numeri che nascono da una situazione che è strutturale: 179 femminicidi nel 2013, 100 in questo anno, sono quasi 1 ogni due giorni. Questa è una situazione che è emergenziale, che è strutturale e da risolvere. È un tema di cui ultimamente abbiamo parlato, da un anno a questa parte, ma è un tema che probabilmente andava discusso anche nelle sessioni precedenti e che effettivamente non è stato risolto con il decreto sul femminicidio, che era un decreto piuttosto punitivo. È stato detto che bisognava fare questo piano anti-violenza. Non a caso il piano anti-violenza è la cellula base da cui si risolve questo problema, perché dà dei finanziamenti ai centri anti-violenza, che lavorano sul territorio e che devono essere messi in rete. Tutta l'azione parte però da un serio monitoraggio. Noi abbiamo una rappresentanza in Consiglio d'Europa, la collega Spadoni, che ha portato una risoluzione che impone ai Paesi membri dell'Unione europea un costante monitoraggio rispetto a questo fenomeno. Se noi non sappiamo esattamente i numeri e non capiamo l'entità di questa emergenza è chiaro che anche le soluzioni che possiamo portare per risolverla saranno sempre inadeguate. Quindi, conoscere per deliberare, non è una cosa detta a caso, ma è una cosa concreta e fattiva per migliorare questo problema. Sono stati stanziati dei fondi, 2 milioni e mezzo per le case rifugio e i centri anti-violenza. A quanto ne sappiamo noi, questi fondi sono arrivati effettivamente alle regioni questo settembre, ma questi fondi dalle regioni sono arrivati ai centri anti-violenza ? Queste sono le domande che noi ci poniamo, altrimenti stiamo parlando di nulla. Abbiamo depositato una proposta di legge per l'educazione all'affettività, so che anche altre colleghe l'hanno fatto; questa è la base, perché se non si lavora dal punto di vista culturale è chiaro che questo Paese non lo si cambia. Abbiamo chiesto a gran voce – e anche altre forze politiche l'hanno fatto – un Ministro per le pari opportunità. Non è una poltrona data in più senza un significato, noi vogliamo capire di chi sono le responsabilità per una mancata attuazione e un mancato interesse esecutivo. Questa figura chiaramente dovrà lavorare di concerto con gli altri Ministeri, perché sarà poi senza portafoglio. Adesso sarà in discussione una mozione in Aula, però è chiaro che, se non lo fa l'Esecutivo, se Renzi non nomina questa figura, come al solito il Parlamento fa un'azione che però non porta a niente. Per quanto riguarda le linee-guida, a quanto ci dicono, la collega Martelli le avrebbe predisposte, ma noi non ne siamo a conoscenza. Soprattutto – concludo – sappiamo che sono in atto dei tavoli interministeriali sul tema del femminicidio: ebbene, perché non vengono coinvolti anche i parlamentari su questo tema, ma soprattutto che risultati stanno dando questi tavoli interministeriali ? La Convenzione Sidao aveva detto esplicitamente – si tratta di una convenzione ratificata – che il contrasto al femminicidio e le azioni...	
LAURA BOLDRINI	PRESIDENTE	Concluda, per favore.	
MARA MUCCI		di contrasto – e concludo – devono essere fatte di concerto con tutti gli attori che ruotano attorno a questo tema. Quindi, coinvolgeteci e fateci sapere a che punto stanno i lavori.	
LAURA BOLDRINI	PRESIDENTE	Ha chiesto di parlare la deputata Scopelliti. Ne ha facoltà.	
ROSANNA SCOPELLITI		Grazie, Presidente, colleghi, quello della violenza sulle donne è un fenomeno drammatico, che ha segnato e segna la nostra società in termini tali da costituire, senza ombra di dubbio, una vera e propria piaga sociale. Oggi che ricordiamo questa Giornata, istituzionalizzata nel 1999 dall'Assemblea generale delle Nazione Unite, desidero sottolineare un elemento importante, ma purtroppo difficile da ravvisare nella nostra quotidiana attività politica e parlamentare, cioè la grande comunione di intenti e di spirito, l'avvertita sensibilità delle donne e degli uomini di questo Parlamento nell'affrontare, finalmente uniti, un tema così complesso e rilevante. Un fatto concreto e positivo che ha già portato il Paese a compiere significativi passi in avanti su un terreno così delicato, complesso e determinante per lo sviluppo della nostra società. Mi riferisco, in particolare, all'approvazione della Convenzione di Istanbul da parte di questo Parlamento, il 28 maggio 2013, un atto ratificato dalle Camere in una discussione approfondita e appassionata, che ha portato alla conclusione del suo iter in tempi brevissimi e con la convergenza di tutti i gruppi parlamentari e, ancora, ad altri atti adottati, come quello dell'introduzione nel nostro ordinamento del reato di stalking e provvedimenti che arricchiscono il panorama degli strumenti utili per tutelare le donne contro qualsiasi forma di violenza. Uno sforzo unitario, senza distinzioni politiche o di genere, che ha iniziato con coraggio la lunga e dura battaglia contro un fenomeno odioso e drammatico che presenta dati allarmanti. In Europa, una donna su tre ha subito una qualche forma di violenza fisica, sessuale, psicologica o economica. Nel nostro Paese, ogni tre giorni, una donna viene uccisa da un marito o un fidanzato, spesso compagno o ex compagno di anni di vita e padre di figli cresciuti insieme. L'anno 2013, ad esempio, con 179 donne uccise è stato l'anno nero per il femminicidio in Italia, il più cruento degli ultimi sette, con un incremento del 14 per cento rispetto al 2012. Il fenomeno sta diventando, quindi, ogni giorno più grave e consistente e occorre risalire alle sue radici per meglio comprenderlo ed affrontarlo con maggiore consapevolezza e maggiore vigore. È necessario, infatti, indagare sugli stili di vita della nostra società, sui rapporti tra donne e uomini, sugli ambiti familiari e sulla stessa educazione genitoriale, per meglio comprendere le radici di tale drammatica e odiosa violenza, una violenza che va debellata e che incide pesantemente sulla nostra società, che troppo spesso sembra incapace di reagire a tali situazioni. Sicuramente, oltre all'intervento delle istituzioni, c’è bisogno che i cittadini, gli uomini e le donne cambino i loro comportamenti e i loro atteggiamenti spesso superficiali o scettici nei confronti di questo fenomeno. È, infatti, indispensabile che la violenza sulle donne venga riconosciuta e sopratutto contrastata nel vivere quotidiano. Solo così le leggi, le politiche e le attività relative alla prevenzione e al contrasto potranno prendere forma e diventare realtà sino a cancellare quei numeri allarmanti che le statistiche ci propongo in termini sempre più pesanti. La violenza sulle donne è un dramma, un dramma che investe ogni Paese e lo fa in modo sistematico, strutturale e profondo ed è per questo che richiede misure adeguate, coordinate e profonde per essere finalmente fermato. Mi viene in mente una questione che di sicuro non rappresenta interamente il problema, certo, ma costituisce un elemento emblematico da tenere sempre presente: troppo spesso, infatti, si sottovaluta la violenza domestica e si ritiene che gli abusi debbano essere risolti in famiglia, un dato che indica chiaramente come debba essere cambiato l'approccio culturale a un problema tanto grave e complesso. Ed oggi abbiamo i migliori strumenti per intervenire sulla questione: non è più il momento del silenzio. Una questione che richiede tempo, pazienza, ma anche immensa e determinata volontà da parte delle istituzioni; istituzioni che, ancora prima di reprimere, punire e varare leggi, debbono intervenire in termini più profondi e complessi, partendo dalla scuola, proponendo campagne di sensibilizzazione e sostenendo in ogni campo la parità di genere, a partire soprattutto dal mondo del lavoro, il lavoro che assicura dignità, attribuisce maggior vigore e favorisce il superamento delle fragilità. La partita, dobbiamo ricordarlo, si gioca soprattutto sul terreno delle pari opportunità: è questo il punto su cui dobbiamo insistere e lavorare con il massimo impegno, e le istituzioni debbono fare ancora di più e ancora meglio. In questa circostanza, oggi, non desidero citare le statistiche, che pure segnano e danno corpo alla gravità del fenomeno. I numeri sono spaventosi, terribili, e purtroppo sono in progressivo aumento. È evidente, pertanto, che le istituzioni debbano intervenire per reprimere e punire i colpevoli, e il nostro Paese ha approntato leggi che sono risultate molto utili sotto questo profilo. A un anno dall'approvazione del decreto contro il femminicidio sono stati ottenuti risultati positivi: sono aumentati in maniera esponenziale gli interventi delle forze dell'ordine, arrestati i colpevoli, aumentate le denunce e sono state accresciute le tutele per chi denuncia gli autori di questi tipi di reato. Dati positivi che incoraggiano a continuare su questa strada, ma sollecitano anche altre riflessioni. Sul tema della protezione e assistenza delle vittime, per esempio...	
LAURA BOLDRINI	PRESIDENTE	Deputata, la prego di concludere.	
ROSANNA SCOPELLITI		dovrebbero essere concentrati maggiori investimenti. Ci rendiamo conto delle difficoltà che oggi segnano la vita del nostro Paese, ma è necessario uno sforzo maggiore per reperire risorse che consentano un'estensione e un finanziamento della rete dei centri antiviolenza, che svolgono un lavoro estremamente utile sul territorio. Per concludere, Presidente, colleghi, auspico che la battaglia contro la violenza sulle donne continui e coinvolga sempre di più, con l'unità di spirito e di intenti che registriamo oggi in quest'Aula, istituzioni e cittadini. Presidente, auspico che le donne, prime fra tutti, abbiano il coraggio e siano supportate ad avere il coraggio di denunciare e di ricominciare a vivere, perché da oggi non si parli più solo delle donne uccise, ma anche di chi ha avuto la forza e il coraggio di ribellarsi e di vincere sulla paura e sulla violenza, e l'esempio di Lucia Annibali...	
LAURA BOLDRINI	PRESIDENTE	Concluda.	
ROSANNA SCOPELLITI		segna la strada a tutti quanti noi. Il suo volto è il volto della forza che ogni donna ha dentro di sé, è la forza di reagire e di essere finalmente libera (Applausi dei deputati del gruppo Nuovo Centrodestra).	
LAURA BOLDRINI	PRESIDENTE	Ha chiesto di parlare la deputata Celeste Costantino. Ne ha facoltà.	
CELESTE COSTANTINO		Signora Presidente, grazie per la sensibilità che esprime ogni giorno su questo tema e grazie per averci dato la possibilità di poter discutere in questa giornata. Cinque minuti sono pochi, ed è anche questo il motivo per cui preferiamo occupare questo spazio per non perderci in retoriche autoassolutorie, ma dovremmo, invece, provare a fare un bilancio di quello che è stato un anno e mezzo di questo Governo; un Governo che più volte ha anche ricordato in quest'Aula il «bollettino di guerra» che si consuma e rispetto al quale bisogna, però, essere conseguenti, cercare di dare delle risposte e assumersi delle responsabilità. Non siamo qui a fare delle commemorazioni. Per noi, questo terreno, quello della violenza maschile sulle donne, è un terreno di battaglia politica, ed è così che lo vogliamo affrontare anche in questa giornata. Il Governo Renzi è stato un Governo degli slogan, e purtroppo lo ha fatto anche sul corpo delle donne. Lo ha fatto nel momento in cui ha deciso di non dare la delega alle pari opportunità. Lo ha fatto quando, nel momento in cui questo Parlamento si era contraddistinto perché aveva votato all'unanimità la ratifica della Convenzione di Istanbul – dal 1o agosto, lo vorrei ricordare perché sembra che qualcuno lo abbia dimenticato, questa Convenzione si deve applicare, deve essere attuata, perché anche gli altri Paesi europei lo hanno fatto, l'hanno ratificata –, rispetto agli impegni che ci siamo assunti in quella Convenzione di Istanbul, non vi è, allo stato attuale, un solo provvedimento che tenga conto di quella Carta europea. Lo dico anche perché – visto che è stato citato, perché è molto facile esprimere delle belle intenzioni –, rispetto all'educazione da inserire all'interno delle scuole e degli istituti scolastici, come è stato detto anche dalla collega del Partito Democratico in quest'Aula, e quindi l'educazione di genere, l'educazione all'affettività, articolo 14 della Convenzione di Istanbul, vi è una nostra proposta di legge, che è stata depositata più di un anno fa, sull'educazione sentimentale. Non abbiamo avuto l'opportunità, nonostante le numerose pressioni, nemmeno di riuscire a calendarizzarla, cioè di riuscire almeno ad aprire una discussione dentro quest'Aula parlamentare, in cui ci avreste potuto dire che era carta straccia, che era scritta male, che andava modificata, che questo Paese non ne aveva bisogno. Però, guardate – giusto per curiosità, ve lo dico – che l'Italia, insieme alla Grecia, è l'unico Paese europeo a non avere una forma di educazione sessuale o all'affettività all'interno del proprio ordinamento scolastico. Ma andiamo avanti. Come si fa a citare minimamente quello che è successo nelle elezioni calabresi, quando qui abbiamo fatto una battaglia sulla legge elettorale, chiedendo che almeno venisse rispettata la percentuale antidiscriminatoria all'interno della legge elettorale ? E ora ci stupiamo e magari cerchiamo anche di dare lezioni alle regioni, quando qui non si è stati capaci di assumersi una responsabilità a livello nazionale, sulla legge che impone a noi di avere un'apertura e un'attenzione nei confronti delle donne. E andiamo avanti. Quello che voi continuate a sbandierare come uno strumento di vittoria, cioè quello che avete chiamato «legge contro il femminicidio», il pacchetto sicurezza, quello che conteneva in sé dalla TAV al furto di rame alla violenza negli stadi, perché noi non l'abbiamo dimenticato, forse quel provvedimento solo una cosa aveva di positivo ed era il fatto che si individuavano dei finanziamenti da dare ai centri anti-violenza. Allora, stamattina – perché, appunto, le giornate non sono neutre e, dunque, quando si tratta di fare propaganda cerchiamo di raccontare e di dire anche la questione dei finanziamenti – io sono andata a guardare quella tabella. Avevamo chiesto che almeno fossero individuati dei criteri di trasparenza nell'individuare i centri a cui dare i finanziamenti, quei pochi finanziamenti che sono inseriti all'interno di quel pacchetto sicurezza. Io i calcoli sono andata a farli e non solo ho notato che «fioccano» centri anti-violenza che non sono mai esistiti, mai esistiti che, però, in quelle tabelle risultano, ma, dovendo fare un calcolo, quello che verrà dato da questo Governo ai centri anti-violenza è 5.000 euro all'anno. Ma non vi vergognate ? Ma di quale contrasto alla violenza sulle donne state parlando ? Ma di che cosa state parlando, con 5.000 euro all'anno (Applausi dei deputati del gruppo Sinistra Ecologia Libertà) ? Non si pagano le operatrici, i centri stanno chiudendo e voi ci venite a raccontare che sono i passi in avanti che ha fatto questo Governo ! Allora, concludo. Io penso che le responsabilità siano molteplici, però mi rivolgo soprattutto alle donne del Partito Democratico perché, secondo me, voi avete una responsabilità in più e ce l'avete perché quei centri anti-violenza li conoscete, come li conosco io, perché in questi anni li avete attraversati, avete parlato con quelle operatrici e l'idea che in questo momento li state abbandonando e guardate così, ferme e immobili, magari per una disciplina di partito, al fatto della loro chiusura io la considero veramente drammatica. Noi oggi non indossiamo giacche rosse e anche questo è un segno. È il segno di chi quotidianamente si occupa di questi temi e che ha deciso, anche in questo caso, di rimanere da una parte. Spero che vi rendiate conto che la parte in cui state adesso è quella sbagliata (Applausi dei deputati del gruppo Sinistra Ecologia Libertà – Congratulazioni).	
LAURA BOLDRINI	PRESIDENTE	Ha chiesto di parlare la deputata Valentina Vezzali. Ne ha facoltà.	
