speaker	role	text	extra
			PRESIDENZA DEL VICEPRESIDENTE SIMONE BALDELLI
			La seduta comincia alle 10,30.
SIMONE BALDELLI	PRESIDENTE	La seduta è aperta. Invito la deputata segretaria a dare lettura del processo verbale della seduta precedente.	
CATERINA PES	Segretaria	legge il processo verbale della seduta di ieri.	
			Missioni.
SIMONE BALDELLI	PRESIDENTE	Se non vi sono osservazioni, il processo verbale si intende approvato. (È approvato).	
			Trasmissione dal Senato di un disegno di legge di conversione e sua assegnazione a Commissione in sede referente (ore 10,35).
SIMONE BALDELLI	PRESIDENTE	Comunico che, ai sensi dell'articolo 46, comma 2, del Regolamento, i deputati D'Incà e Rossomando sono in missione a decorrere dalla seduta odierna. I deputati in missione sono complessivamente novantasette, come risulta dall'elenco depositato presso la Presidenza e che sarà pubblicato nell’allegato A al resoconto della seduta odierna (Ulteriori comunicazioni all'Assemblea saranno pubblicate nell'allegato A al resoconto della seduta odierna).	
			Discussione del disegno di legge: Disposizioni in materia ambientale per promuovere misure di green economy e per il contenimento dell'uso eccessivo di risorse naturali (Approvato dalla Camera e modificato dal Senato) (A.C. 2093-B) (ore 10,37).
SIMONE BALDELLI	PRESIDENTE	Il Presidente del Senato ha trasmesso alla Presidenza, con lettera in data 16 dicembre 2015, il seguente disegno di legge, che è stato assegnato ai sensi dell'articolo 96-bis, comma 1, del Regolamento, in sede referente, alla V Commissione (Bilancio): S. 2145 – Conversione in legge, con modificazioni, del decreto-legge 25 novembre 2015, n. 185, recante misure urgenti per interventi nel territorio. Proroga del termine per l'esercizio delle deleghe per la revisione della struttura del bilancio dello Stato, nonché per il riordino della disciplina per la gestione del bilancio e il potenziamento della funzione del bilancio di cassa (Approvato dal Senato) (3495) – Parere delle Commissioni I, IV, VI, VII, VIII (ex articolo 73, comma 1-bis, del Regolamento), IX, X, XI (ex articolo 73, comma 1-bis, del Regolamento relativamente alle disposizioni in materia previdenziale), XII e XIV e della Commissione parlamentare per le questioni regionali. Il suddetto disegno di legge, ai fini dell'espressione del parere previsto dal comma 1 del predetto articolo 96-bis, è stato altresì assegnato al Comitato per la legislazione di cui all'articolo 16-bis del Regolamento.	
			(Discussione sulle linee generali – A.C. 2093-B)
SIMONE BALDELLI	PRESIDENTE	L'ordine del giorno reca la discussione del disegno di legge n. 2093-B, già approvato dalla Camera e modificato dal Senato: Disposizioni in materia ambientale per promuovere misure di green economy e per il contenimento dell'uso eccessivo di risorse naturali. Avverto che lo schema recante la ripartizione dei tempi è pubblicato in calce al resoconto stenografico della seduta del 16 dicembre 2015.	
SIMONE BALDELLI	PRESIDENTE	Dichiaro aperta la discussione sulle linee generali. Avverto che i presidenti dei gruppi parlamentari del MoVimento 5 Stelle e Partito Democratico ne hanno chiesto l'ampliamento senza limitazioni nelle iscrizioni a parlare, ai sensi dell'articolo 83, comma 2, del Regolamento. Avverto, altresì, che la VIII Commissione (Ambiente) si intende autorizzata a riferire oralmente. Ha facoltà di intervenire il relatore, onorevole Bratti.	
ALESSANDRO BRATTI		Relatore. Signor Presidente, onorevoli colleghi, oggi discutiamo questo provvedimento, a nostro avviso importante, che tra l'altro è sottoposto al nostro esame in un momento particolarmente interessante perché arriva dopo un'approvazione storica che c’è stata negli scorsi giorni alla COP21 a Parigi di un accordo crediamo importante ed epocale, per quanto come tutti gli accordi di questo natura non abbia elementi di cogenza. Tuttavia gli obiettivi che vengono fissati in merito alla difesa del clima sono obiettivi molto sfidanti che comportano modifiche profonde della nostra economia. È un provvedimento che viene esaminato anche quasi in maniera contemporanea – poi ci ritornerò sopra – all'emanazione da parte della Commissione europea di un pacchetto di proposte che riguardano la cosiddetta economia circolare e moltissimi elementi che ritroviamo in questo pacchetto sono presenti anche nelle disposizioni del disegno di legge, che ricordo per la prima volta nel suo titolo introduce due parole importanti che, possiamo dire, rappresentano quasi un elemento di novità storica cioè il termine green economy entra di fatto per la prima volta in una legge dello Stato. Riteniamo che questa sia una novità di grandissima rilevanza. Il provvedimento in esame, inoltre, fa parte di una serie di provvedimenti legislativi che abbiamo affrontato in questa legislatura. Uno di essi, che abbiamo approvato con grande successo, è la legge n. 68 del 2015 sugli ecoreati. Altri che siamo in attesa che vengano approvati dalle Camere: uno per tutti la legge sulle agenzie ambientali. Ma è in discussione proprio in questa Camera la legge sul consumo di suolo cioè un pacchetto di norme che riteniamo fondamentali per avviarci proprio verso l'economia circolare che l'Europa di fatto ci chiede di seguire. Al Senato sul provvedimento in esame sono state fatte importanti modifiche – infatti in questa sede siamo alla terza lettura – arricchendo sicuramente l'articolato sia nel merito sia nel numero degli articoli. Non è stato stravolto l'impianto su cui noi avevamo lavorato in precedenza, al di là del tema dei cosiddetti consorzi obbligatori, riguardo ai quali il corrispondente pacchetto di norme è stato stralciato e su cui tuttavia c’è un impegno del Governo ad affrontare il tema in un provvedimento più omogeneo e più uniforme; e al di là della introduzione di alcune questioni molto importanti che forse avrebbero meritato una discussione a parte. Di esse ne ricordo una per tutte: l'introduzione dello statuto dell'ENEA, un istituto di ricerca molto importante per il nostro Paese che qui vede di fatto introdotto lo statuto con un emendamento al Senato e che forse – ripeto – meritava una discussione a parte. Inoltre sono stati introdotti alcuni elementi che riguardano l'attività, consentitemi di dire così, venatoria anche se in realtà non è molto specificamente legata alla caccia ma che comunque riguarda il contenimento delle popolazioni dei cinghiali o altre specie animali. Ripeto tuttavia che si tratta di una serie di modifiche che non hanno stravolto, anzi non hanno assolutamente spostato l'impianto che noi avevamo dato qui alla Camera. E mi sento di dividere in alcuni capitoli i contenuti di questo provvedimento. Tra tutti ne intitolerei uno: il pacchetto di norme che va verso l'economia circolare, che comprende una serie di articoli che riguardano la regolamentazione degli appalti pubblici indirizzandoli verso i cosiddetti appalti verdi (GPP). Si introducono i criteri ambientali minimi per tutta una serie di prodotti e anche di procedure; si introduce la possibilità per le aziende e ditte che possiedono certificazioni ambientali – EMAS su tutti ma anche ISO 14001 – di poter accedere con dei punteggi ulteriori nelle gare pubbliche. Si introducono anche sperimentazioni che riguardano il cosiddetto made in Italy sempre per quanto riguarda il tema degli appalti. Ancora nell'ottica dell'economia circolare vi sono una serie di definizioni di criteri e di modalità che vengono indirizzate ai comuni per definire aree e attività collegate al cosiddetto mercato dell'usato. Ne abbiamo discusso molto: è un tema molto importante perché più un bene rimane su un mercato prima di essere, per così dire, catalogato come rifiuto più questo bene ha vita lunga e meno rifiuti si producono. Pertanto lo consideriamo un provvedimento molto importante in termini di prevenzione. Vi sono tutta una serie di incentivi che riguardano l'uso dei sottoprodotti agricoli che possono essere utilizzati anche nella cosiddetta produzione bio-based da cui poi deriva in parte la cosiddetta chimica verde: abbiamo introdotto qualche articolo che ha importanza da questo punto di vista. Abbiamo introdotto anche la possibilità di utilizzare questi materiali assorbenti come materiale compostabile. Un elemento importante è costituito dagli accordi di programma tra istituzioni e impresa per favorire il materiale da recupero. C’è un copioso articolato che indica in maniera analitica quelli che sono questi beni e quelle che sono le possibilità di accordo relative. Ci sono aspetti che potrebbero essere considerati magari di nicchia ma che per noi, invece, sono molto importanti perché costituiscono sperimentazioni di grandissimo interesse che potrebbero anche favorire sempre di più il riciclo e il recupero del materiale. Penso alla sperimentazione del vuoto a rendere per vetro, birra e acque minerali che al momento rimane una sperimentazione ma che forse nel futuro potrebbe essere inserita in maniera stabile nel nostro ordinamento legislativo. Penso anche agli incentivi per i comuni che raggiungono e superano la percentuale di raccolta differenziata stabilita per legge. Anche in questo caso abbiamo voluto avere un approccio più propositivo che punitivo: in realtà esiste anche un articolo, aggiunto al Senato, che prevede un po’ un allungamento dei tempi per i comuni per raggiungere obiettivi di raccolta differenziata e che può sembrare stridere un poco con tutto il resto. In realtà abbiamo introdotto una serie di elementi importanti e propositivi per favorire questi comuni virtuosi: l'introduzione dell'ecotassa per gli impianti di incenerimento senza recupero energetico (consideriamo anche questa una disposizione positiva); il compostaggio aerobico di quartiere e di comunità, che può essere scomputato poi dalla TARI, dalla tariffa puntuale che noi incoraggiamo anche attraverso alcuni elementi di principio; poi c’è un tema che riguarda la lotta all'abbandono dei rifiuti, quello cosiddetto dei «piccoli rifiuti», con particolare riferimento alle cicche di sigarette. Abbiamo introdotto poi un pacchetto di misure che riteniamo importantissimo perché era da tempo che non se ne parlava e che riguarda la mobilità sostenibile, 35 milioni di euro sono stati confermati per la mobilità dolce e sono stati anche aggiunti finanziamenti importanti per quanto riguarda il tema degli itinerari cicloturistici, così come crediamo anche questo sia un risultato che io ritengo storico che è stato il riconoscimento dell'incidente in itinere, che era una questione su cui avevamo provato varie volte a chiedere questo riconoscimento per il lavoratore che usa la bicicletta per andare al lavoro e questa volta ci siamo riusciti. Vi sono poi una serie di provvedimenti molto importanti che riguardano le bonifiche, mi riferisco ai siti contaminati, soprattutto i siti di interesse nazionale, dove si propone uno schema di transazione più semplificato, più snello ma anche più trasparente e che può consentire, se non altro in quei siti dove ci sono attività imprenditoriali in essere o c’è interesse da parte di attività imprenditoriali, di accelerare questi processi di industrializzazione attraverso però la messa in sicurezza e la bonifica del territorio, così come abbiamo definito dei criteri più semplici per l'utilizzo dei materiali dei dragaggi. Sappiamo che questo è un tema molto delicato che riguarda numerosi porti italiani e crediamo sia importante. Abbiamo introdotto inoltre un credito di imposta interessante per le imprese quando la cifra supera i 20 mila euro per sostituire i tetti contenenti amianto, il cosiddetto eternit, e anche questo lo riteniamo importante. C’è poi un altro capitolo che riguarda il tema delle risorse idriche e la governance del sistema. È stato introdotto un fondo – è una discussione che avevamo già fatto anche qui alla Camera – di garanzia per gli investimenti; sappiamo che purtroppo abbiamo un sistema di depurazione del Paese che ha delle criticità enormi, che necessita di investimenti importanti, un sistema di depurazione delle acque che ci vede purtroppo in infrazione comunitaria e quindi l'aver costituito un fondo di garanzia, che significa di fatto poi caricare anche sulle bollette una percentuale di questi finanziamenti, però in maniera assolutamente trasparente, crediamo sia una cosa molto importante, così come l'introduzione del contratto di fiume, così come aver introdotto dei criteri che consentano ai clienti morosi una quota minima di acqua da poter utilizzare, ma nello stesso tempo anche di capire come risolvere le questioni della morosità che purtroppo, in una situazione di crisi, sono molto molto forti. Poi c’è il tema importantissimo, che abbiamo discusso molto qui alla Camera e che al Senato è stato di fatto pochissimo ritoccato ma che è importante, che è la governance dei distretti idrografici, quindi c’è un recepimento finalmente completo delle indicazioni a livello europeo. C’è poi tutta un'altra serie di piccoli ma importanti provvedimenti – piccoli fino a un certo punto perché ci sono circa 800 mila euro – per l'istituzione di nuove aree protette dei parchi marini, si definiscono in maniera più specifica i criteri per le cosiddette «green community», si parla oil free zone, tutti concetti che avevamo già affrontato nella discussione in precedenza. Insomma, noi riteniamo... mi avvio alla conclusione, poi le chiederei Presidente di allegare, perché il tempo è quello che è, una nota specifica con le variazioni che nella relazione sono riportate e che sono state fatte dal Senato rispetto al provvedimento che noi abbiamo mandato come Camera...	
SIMONE BALDELLI	PRESIDENTE	Diciamo che più che una nota specifica, ci consegna la parte restante dell'intervento per la pubblicazione in calce al resoconto stenografico, perché non si possono consegnare allegati.	
ALESSANDRO BRATTI	Relatore	un errore mio...	
SIMONE BALDELLI	PRESIDENTE	Lo dico con chiarezza, affinché non si crei un precedente.	
ALESSANDRO BRATTI	Relatore	Mi sono espresso male, volevo significare appunto un prosieguo della relazione che affrontava in maniera più analitica le variazioni, chiedo scusa, Presidente. Concludo, io credo che questo sia un ulteriore tassello importante – lo diciamo sempre, almeno noi che ci occupiamo di questioni ambientali ma non solo, perché qui il tema travalica molto quello che è il tema ambientale, qui parliamo di economia, di sviluppo di nuovi indirizzi per lo sviluppo del Paese – insieme agli altri che ho citato all'inizio per poter dare davvero quel quadro dal punto di vista legislativo di cui le imprese virtuose e innovative hanno bisogno in questo Paese per affermarsi sempre di più sul mercato (Applausi dei deputati dei gruppi Partito Democratico e Scelta Civica per l'Italia).	
SIMONE BALDELLI	PRESIDENTE	Ha facoltà di intervenire il rappresentante del Governo. Prendo atto che si riserva di intervenire in sede di replica. È iscritto a parlare l'onorevole Realacci. Ne ha facoltà.	
ERMETE REALACCI		Signor Presidente, il collega Bratti che ha seguito assieme al collega Borghi come relatore il provvedimento ha già illustrato per linee generali un provvedimento che è molto esteso, perché stiamo parlando di 79 articoli che affrontano molti temi su cui abbiamo lavorato a lungo trasversalmente in Commissione, introducendo molti miglioramenti. Qualcosa forse si poteva fare di meglio ma, insomma, la perfezione è nemica del bene. Credo che ai cittadini questo provvedimento arriverà, come ha ricordato il collega Bratti, per delle cose che erano sentite fortemente in alcuni mondi, ne ha già nominati alcuni il collega Bratti: l'infortunio in itinere, le cicche di sigaretta. Insomma, spesso l'informazione si concentrerà sulle cose un po’ più particolari ma ci sono cose anche altrettanto importanti, penso al credito di imposta sulle bonifiche di amianto, al fondo per l'abbattimento dell'abusivismo edilizio, alle misure per contrastare le cosiddette «carrette del mare», cioè l'inquinamento marino prodotto da vecchi vascelli che rischiano di danneggiare le nostre acque, alla norma che finalmente viene introdotta sulla impignorabilità degli animali di affezione. Il cuore del provvedimento – sono di nuovo d'accordo con il collega Bratti – è il tema dell'economia circolare, io aggiungo della sharing economy, che si incrociano in molte misure di questo provvedimento. Ricordo che siamo all'indomani di Parigi, siamo in un momento in cui il Po è in secca, nelle montagne non c’è neve e le nostre città hanno una situazione di sofferenza fortissima dal punto di vista dell'inquinamento. La spinta che viene da Parigi – non solo per l'accordo impensabile qualche anno fa che ovviamente non è risolutivo rispetto al rischio dei mutamenti climatici ma rappresenta una inversione di rotta formidabile per tutto il mondo – è ragionare su una nuova economia. Questa nuova economia sarà basata sull'innovazione, sulla ricerca, sulla conoscenza e, per quanto riguarda il nostro Paese, anche sulla qualità e sulla bellezza, ma richiede la mobilitazione delle istituzioni, della società, delle imprese ma molte delle misure che sono presenti in questo provvedimento (che non è risolutivo, è chiaro che per capirci, per affrontare il tema della green economy dovremmo agire a trecentosessanta gradi, dai meccanismi fiscali alla stessa legge di stabilità; a me piacerebbe che la legge di stabilità l'anno prossimo avesse il segno di una sfida su una nuova economia, un'economia a misura d'uomo; ci sono anche in questa legge di stabilità delle cose ma si può fare di più anche sul campo della riforma fiscale) hanno questo segno: danno un segnale forte sull'economia circolare, ad esempio con il recupero dei materiali. Adesso molte volte siamo in una situazione contraddittoria in cui il recupero del materiale è scoraggiato non solo dal basso prezzo del petrolio per alcuni aspetti ma anche dall'incenerimento perché diventa più conveniente bruciare alcuni materiali anziché recuperarli. Per quanto riguarda lo spazio al protagonismo dei cittadini, il collega Borghi in particolare si è battuto sulla green community, cioè la possibilità per comunità che vivono in montagna e in aree minori di organizzarsi per liberarsi dai fossili e fare politiche ambientali avanzate; vi sono poi i contratti di fiume, i sistemi efficienti di utenza. Nella legge c’è a tal proposito un passaggio importante. Infatti, si allarga la possibilità per le imprese di autoprodursi l'energia con maggiore efficienza e, quindi, dando una mano all'avanzamento di un sistema elettrico che deve allontanarsi sempre più dallo spreco e dalle energie fossili. Il compostaggio è – da non sottovalutare – una finestra che si apre sullo scambio di beni. Nelle Marche, il collega Carrescia, nella sua vita precedente, ha lavorato a un'esperienza, che io trovo bellissima – il progetto si chiama «Secondlife» –, ossia il recupero di elettrodomestici che andavano in rottamazione e che adesso vengono rimessi al consumo e addirittura, a volte, con delle innovazioni tecnologiche rispetto a quando erano stati prodotti. Questo insieme di economia è una grande opportunità per l'Italia, perché abbiamo, nei cromosomi, la capacità di produrre con maggiore efficienza. Siamo un Paese povero di materie prime. Pochi lo sanno, ma, nonostante l'arretratezza di tante parti del nostro Paese, nonostante la Terra dei fuochi, nonostante le raccolte differenziate che non esistono in alcune aree d'Italia, come la Sicilia, noi siamo i primi in Europa nel recupero di materiali. Recuperiamo più materie prime dei tedeschi: 25 milioni di tonnellate all'anno. I tedeschi ne recuperano 23 milioni, nonostante abbiano un'economia più forte della nostra. Questo significa anche un fortissimo risparmio in termini di energia e di emissioni di CO2. C’è una bellissima frase di Victor Hugo, che dice: «C’è una cosa più forte di tutti gli eserciti del mondo e questa è un'idea il cui momento è giunto». Io penso che sia giunto il momento di una nuova economia, di un'economia in cui l'Italia può affermare, con forza, il suo punto di vista (Applausi dei deputati del gruppo Partito Democratico).	
SIMONE BALDELLI	PRESIDENTE	iscritto a parlare l'onorevole Paolo Russo. Ne ha facoltà.	
