speaker	role	text	extra
COSIMO LATRONICO		Signor Presidente, rappresentante del Governo, colleghi, l'attuale disegno di legge di stabilità per il 2016, anche tenuto conto delle diverse modifiche apportate al testo originario, sia nel corso dell'esame in Senato che dell'esame alla Camera, presenta rilevanti criticità. In particolare: la decisione relativa all'ennesimo differimento del conseguimento del pareggio di bilancio, l'assenza pressoché totale di misure volte a realizzare un'efficace politica di spending review nonché il sistematico ricorso alle clausole di salvaguardia, attraverso le quali si procede, sia pure surrettiziamente, al finanziamento di ulteriori interventi di spesa. Il nostro gruppo dei Conservatori e Riformisti ha presentato una sua proposta di manovra, una proposta di legge di stabilità alternativa. Coerentemente con quell'impostazione, abbiamo presentato i nostri emendamenti generali alla legge di stabilità, tutti dichiarati ammissibili, qualcosa che dimostra che poderosi tagli di tasse abbinati a poderosi tagli di spesa improduttiva sono possibili. Il punto è naturalmente avere o non avere la volontà di procedere secondo questa strada coraggiosa, ma necessaria. Gli emendamenti sono stati anche segnalati dal nostro gruppo – proprio perché le cose si fanno sul serio – per essere messi ai voti in Commissione bilancio. Naturalmente, in Commissione, il Governo e la maggioranza hanno purtroppo detto di no. Colleghi, il Paese ha bisogno di risposte chiare. L'Italia è inchiodata allo «zero virgola» di crescita, nonostante gli auspici. Occorre sfidare il Governo – questo è il nostro punto di vista – con responsabilità; occorre sfidare il Governo in positivo, perché i tagli di tasse ci siano (la pressione fiscale è quella che tutti purtroppo lamentiamo), perché la spesa improduttiva si aggredisca, altro elemento di cui spesso, a parole, ci occupiamo. Il rischio del Governo Renzi è di fare lo stesso errore – per carità, noi lo riconosciamo – che hanno fatto altri Governi precedenti (in questo caso la storia non insegna): fare troppo poco su tasse e su spesa e sciupare l'occasione, anche quella della congiuntura che abbiamo davanti, per una vera, stabile e forte ripresa. Colleghi, il quadro mondiale è incerto, naturalmente, e molto non dipende da noi. La situazione che c’è riguardo l'ordine pubblico e la minaccia terroristica sono elementi che non aiutano ovviamente il quadro economico e non aiutano la ripresa mondiale, europea e nazionale. Noi abbiamo proposto la nostra linea di uno shock fiscale di 48 miliardi di euro di tasse in meno, 24 già dal primo anno, con tagli alla spesa in eccesso, aggredendo tre fronti di spesa: le municipalizzate, delle quali non sentiamo parlare e che eppure sono all'attenzione della cronaca, purtroppo molte volte sgradevole cronaca; gli acquisti di beni e servizi della pubblica amministrazione, un settore sul quale si può manovrare; la necessità di introdurre dei costi standard (per molto tempo abbiamo ascoltato che stesse spese hanno costi differenti in molte parti d'Italia). Si può fare dunque, solo così potremmo conquistare una crescita poderosa, importante, di due punti percentuali, come abbiamo osato dire. Ecco alcuni degli emendamenti chiave che descrivo velocemente: via tutte le tasse sugli immobili per le imprese, i cosiddetti immobili strumentali (capannoni, negozi, botteghe, studi professionali). È una massa di tassazione insostenibile, che l'ufficio studi della Confcommercio ha stimato nel valore di 7 miliardi all'anno. Giù l'Ires subito. Con il livello di tassazione che grava sull'impresa italiana, un intervento fortissimo di alleggerimento metterebbe il sistema produttivo in condizione di guardare avanti. Rovesciamento delle clausole di salvaguardia: se scatta una clausola, questa deve determinare non aumenti di tasse, ma tagli di spesa. Compensazioni pro-imprese tra crediti vantati verso la pubblica amministrazione e tasse da pagare. Sulle banche abbiamo proposto una linea di responsabilità e di trasparenza, che avesse come preoccupazione dominante la tutela dei risparmiatori e la tenuta del sistema bancario da qui la nostra proposta: ricorrere al Fondo interbancario a tutela dei depositi, quindi non utilizzando le risorse dei contribuenti. Incardinare un negoziato reale, risolutivo, con le autorità europee. Avviare una capillare e tempestiva campagna di informazione a favore dei risparmiatori sui rischi del sistema del credito italiano. Chiarire la catena delle responsabilità, perché gli incresciosi fatti accaduti non si possono cancellare. Ora, una valutazione su alcuni punti, diciamo sistemici, non abbiamo molto tempo, sulla cultura. Si è detto di volere investire in cultura. Siamo d'accordo, ma segnaliamo delle criticità. La card giovani con circa 300 milioni rischia di alimentare un ciclo di consumi in nome della cultura senza investimenti strutturali che restino nel tempo. Anche qui avremmo bisogno di interventi che abbiano una visione nel settore culturale. Un solo esempio, discusso questa mattina alla Commissione cultura della Camera. Le biblioteche provinciali rischiano lo smantellamento, collega Palese, per mancanza di risorse, milioni di volumi, che sono patrimonio della nazione, rischiano di restare senza tutela e senza valorizzazione. Matera capitale della Cultura, da vergogna nazionale a frontiera dello sviluppo. Noi abbiamo contribuito affinché vi fosse una presenza di questo grande tema nella legge di stabilità. È stato compiuto, lo ammettiamo, un primo passo, che il Governo ha il dovere però di integrare, se si vuole che le emergenze culturali ed ambientali del Mezzogiorno diventino una leva per lo sviluppo dell'intero Paese. Sul Mezzogiorno, un tema noto, il collega Capezzone e il collega Palese ne hanno parlato e ne parleranno, restano aperte le questioni del cofinanziamento per rendere effettivo l'impiego delle risorse comunitarie destinate a progetti di coesione, è il tema rilevante della aggiuntività delle risorse finanziarie. Il Governo in questa manovra usa le risorse comunitarie destinate al Sud per finanziare la decontribuzione e il reddito d'imposta; se il Governo vuole mettere al centro, colleghi, il Mezzogiorno, deve trovare risorse aggiuntive. In questo senso, noi abbiamo fatto delle proposte di copertura che attingono dal taglio di risorse ministeriali e dai fondi speciali di sviluppo, proprio per preservare le risorse comunitarie per piani aggiuntivi di sviluppo. Una manovra, signor Presidente, che sfonda, per un giudizio di sintesi, i saldi e realizza in deficit una serie, anche polverizzata, di micro misure, dai festival ai cori, dai cori alle bande. Spese che aggraveranno le condizioni della finanza pubblica senza una rigorosa programmazione ed una revisione della spesa pubblica. Una manovra, collega Tancredi, in sintesi, a debito, che ammonta a 38 miliardi. Non sappiamo ancora se le clausole di flessibilità otterranno il consenso dalla Commissione europea. Una manovra che ha scelto una traiettoria inseguendo ragioni di consenso, come è stato con gli 80 euro, senza vere finalizzazioni, che rischiano di non aiutare la ripresa economica e strutturale del Paese, ma di spostare il debito sulle generazioni future. Le riforme strutturali restano nell'orbita degli annunci, sconfessati dalla dura realtà della vita delle famiglie e delle imprese italiane. Signor Presidente, signori rappresentanti del Governo, che ringrazio per la tenace e impegnativa azione che pure avete fatto in Commissione insieme ai relatori, il nostro timore è che ancora una volta, e concludo Presidente, la tattica prevalga sulla strategia, mentre questo Paese, il nostro Paese, mai come ora avrebbe bisogno di visione e di lungimiranza ! Colleghi, il Presidente De Gasperi, in un momento altrettanto drammatico del nostro Paese, usava una frase eloquente, non era la sua, ma di un predicatore statunitense: un politico pensa alle prossime elezioni, uno statista alla prossima generazione, un politico cerca il successo del suo partito, uno statista quello del suo Paese. È la stella polare che dovremmo usare tutti (Applausi dei deputati del gruppo Misto-Conservatori e Riformisti).	
MARINA SERENI	PRESIDENTE	iscritto a parlare il deputato Giampiero Giulietti. Ne ha facoltà.	
			PRESIDENZA DEL VICEPRESIDENTE SIMONE BALDELLI (ore 16,35)
GIAMPIERO GIULIETTI		Grazie, Presidente. La legge di stabilità, che oggi approda in Aula, è il frutto di una discussione seria, approfondita e articolata, che ha coinvolto la Commissione bilancio per oltre dieci giorni, migliorando ed arricchendo, in questo modo, il disegno di legge stesso. Una legge di stabilità che reca in sé un intervento volto a sostegno della crescita, operando sia nel versante del contenimento del carico fiscale, sia sul lato dell'aumento della domanda aggregata e del miglioramento della competitività del sistema. Si tratta di un orientamento di politica fiscale di carattere espansivo secondo quanto esposto nel documento programmatico di bilancio alle istituzioni europee, dove il Governo, nel confermare la revisione al rialzo della crescita del PIL esposta nella nota di aggiornamento al DEF 2015, dichiarava anche la necessità di un ritorno a tassi sostenuti di crescita, avvalendosi a tale scopo del pieno utilizzo dei margini di flessibilità consentiti in sede europea. Con riguardo all'impatto finanziario delle disposizioni recate nel provvedimento, il Governo disattiva per il 2016 la clausola di salvaguardia, cioè gli aumenti di IVA e accise previste a garanzia del processo di avvicinamento al pareggio di bilancio. Il beneficio, in termini di mancato inasprimento fiscale, è di 16,8 miliardi. Di straordinario rilievo, inoltre, alla riduzione del carico fiscale che ne consegue, pari a 4,5 miliardi annui, è l'intervento sulla fiscalità immobiliare. Vengono eliminate le tasse su tutte le prime case, eccetto ville, castelli e immobili di pregio artistico e storico, la TASI e l'IMU sono dimezzate nel caso di seconde case date in comodato a figli e genitori, come pure per i macchinari fissi, cosiddetti imbullonati, che non saranno più conteggiati per il calcolo delle imposte immobiliari. È una scelta importante, che voglio sottolineare per l'importanza che riveste per tutti gli italiani. La casa per molti nostri concittadini è il risultato di una vita di sacrifici e lavoro, e detassare la prima casa, oltre che uno sgravio economico notevole, è un profondo segnale di rispetto per chi ha lavorato una vita, per chi è riuscito a costruire una propria tranquillità, per chi spesso ha sacrificato vacanze e viaggi pur di costruire un'abitazione per la propria famiglia. Tutto questo senza che vengano meno le risorse per i comuni, dove anzi si è prevista per i comuni più virtuosi, che non avevano cioè aumentato nel 2015 la TASI, una sorta di fondo di compensazione. Anche nel versante degli enti locali l'atteggiamento è profondamente mutato, nessun taglio. Ad onor del vero i Governi che si sono succeduti negli ultimi dieci anni non hanno di certo scherzato con gli enti locali, ma anzi l'eliminazione del patto di stabilità, poter utilizzare gli oneri di urbanizzazione per manutenzioni su strade e verdi pubblici, premialità per chi si associa o avvia un processo di aggregazione. Insomma, si abbassano le tasse senza toccare i servizi, senza che vengano meno i presupposti di garanzia dei servizi, in particolar modo alle fasce più deboli del nostro Paese. In quest'ottica si inserisce l'aumento di un miliardo del Fondo sanitario alle regioni per il 2016. Anche in questo campo tante polemiche abbiamo sentito, spesso a sproposito, il Governo ed il Parlamento mettono risorse, ma è certo necessario che vada avanti un processo di razionalizzazione e di risparmio che premi le regioni virtuose e che garantisca il diritto alla cura e alla salute per tutti. Il miliardo in più per la sanità non fa parte del pacchetto sicurezza, ma è, a mio avviso, un altro tassello importante di una scelta politica di fondo. Si decide di investire 2,6 miliardi su sicurezza e cultura, perché questo Paese ha bisogno di sicurezza e tranquillità delle città, recupero delle periferie, investimento su cultura e sociale. Dopo anni di governo della destra abbiamo ereditato un Paese più povero, più impaurito e di certo più insicuro. Ora si inverte la rotta, prevedendo risorse per le forze dell'ordine, una misura strutturale di 80 euro mensili per gli addetti alla nostra sicurezza, un credito di imposta di 15 milioni per le spese sostenute dai cittadini per l'installazione di impianti di videosorveglianza e allarmi, 150 milioni per il contrasto con mezzi informatici ai crimini di matrice terroristica, 500 milioni per la riqualificazione urbana e la sicurezza delle periferie. Ancora, perché sia chiaro che per combattere la paura e le insicurezze si fa una scelta strategica e non uno spot o una misura una tantum, si investono 500 milioni per l'edilizia scolastica, che si aggiungono a quelli investiti sino ad oggi, 50 milioni per le borse di studio, e a tutti i ragazzi che compiono diciott'anni nel 2016 viene data una carta elettronica del valore di 500 euro per libri, musei, mostre, cinema eccetera. Non una mancia, ma una scelta di politica culturale e della sicurezza. Giovanni Paolo II diceva che non dobbiamo avere paura, per non avere paura un Governo deve investire nella cultura, nel sapere, nelle intelligenze, e a chi specula sui morti la cultura fa paura, un po’ perché è cosa estranea da sé, ma soprattutto perché la cultura aiuta a conoscere meglio e valutare alcune prese di posizioni politiche barbare e incivili. Ancora altre scelte importanti. Penso alle risorse per il «dopo di noi» e all'aumento del fondo per le non autosufficienze, che è stato rifinanziato dall'anno scorso e che i Governi della destra avevano azzerato, più fondi per il servizio civile, per la prima volta una misura organica contro la povertà. A ciò si aggiunga l'aumento della «no tax area» per i soggetti sopra i 75 anni da 7.750 a 8.000 e il fatto che il regime sperimentale per le donne, la cosiddetta opzione donna, è esteso alle lavoratrici che maturano i requisiti entro il 2015. Ma mi piace ricordare altri due elementi. Uno sono le risorse per il sud, che non sono soltanto le questioni che riempiono le cronache legate a proroghe dei forestali o dei LSU, ma penso soprattutto ai 450 milioni per la Terra dei fuochi, alle risorse per lo sblocco di Bagnoli, al finanziamento finale per la Salerno-Reggio Calabria, al finanziamento ponte per fare fronte alle esigenze di Ilva. Se chi assumerà nel 2016 potrà a livello nazionale beneficiare di una riduzione dei contributi al 40 per cento per 24 mesi, al sud il beneficio è esteso anche al 2017. Sempre a favore del Mezzogiorno è previsto un credito d'imposta per l'acquisto di beni strumentali, a seconda delle dimensioni aziendali, dal 2016 al 31 dicembre 2019. Anche queste sono scelte che per troppo tempo chi ci ha preceduto ha colpevolmente rimandato. Il secondo elemento è la discussione inserita in legge di stabilità del cosiddetto decreto banche. Troppe speculazioni politiche, toni incivili e meschine falsificazioni abbiamo sentito in questi giorni, ma resta il fatto che senza l'intervento del Governo quelle banche non ci sarebbero state più, sarebbero stati licenziati 7 mila dipendenti e le imprese e le famiglie titolari di fidi avrebbero ricevuta immediata richiesta di rientro. Avremmo visto sì famiglie e imprese sul lastrico. Oggi, invece, si tutelano i lavoratori correntisti e con il fondo da 100 milioni, introdotto in legge, vengono salvaguardate le situazioni più delicate. Insomma, chi è stato truffato recupererà i soldi e la Commissione d'inchiesta stabilirà le responsabilità. La violenza di questi giorni da parte di alcuni non mi è sembrata di sentirla in altre vicende, dove le responsabilità erano chiare ed accertate e dove i cittadini hanno perso rovinosamente i loro risparmi. Penso a Credieuronord e penso ad altre situazioni analoghe, dove, anziché il fondo di solidarietà, era sufficiente utilizzare gli investimenti in diamanti fatti da qualche partito, il cui leader oggi specula sulle disgrazie con i soldi pubblici. Ma tant’è ! Questa è la nostra legge di stabilità, che genera aiuti alle imprese, aumentando le detrazioni ai fini Ires e Irpef al 140 per cento, investimenti alle famiglie, capacità di potere investire nelle ristrutturazioni edilizie con il 50 per cento di detrazioni e la conferma del 65 per cento di ecobonus. È una legge di stabilità che restituisce a noi parlamentari l'orgoglio del nostro lavoro e la passione per una politica, che è servizio, ma che è capacità di dare risposte al Paese e prospettiva di crescita, una legge di stabilità che si inserisce in un corposo progetto di riforme strutturali e anche costituzionali del Paese. In molti sembrano dimenticarsi dell'Italia solo di cinque anni fa, sfibrata, sfiduciata, lumicino di coda dell'Europa, in preda ad attacchi speculativi, disoccupazione in aumento e spread alle stelle.	
GIAMPIERO GIULIETTI		Oggi la tendenza è invertita. Dobbiamo consolidare la crescita e restituire la fiducia alle famiglie, ma ha ragione il nostro Presidente del Consiglio Renzi: dobbiamo combattere le paure, scommettere su noi stessi e sulla nostra straordinaria capacità di guardare avanti (Applausi dei deputati del gruppo Partito Democratico).	
SIMONE BALDELLI	PRESIDENTE	iscritta a parlare l'onorevole Milanato. Ne ha facoltà.	
