speaker	role	text	extra
VITO DE FILIPPO		Sottosegretario di Stato per la salute. Grazie, Presidente. Mi preme innanzitutto inquadrare velocemente la questione nel più generale quadro della normativa, anche dei provvedimenti e dei programmi regionali e nazionali. Come è noto all'onorevole interpellante, la riorganizzazione dei punti nascita scaturisce innanzitutto da un accordo che è stato firmato il 16 dicembre 2010 tra il Governo, le regioni e le province autonome di Trento e Bolzano, le province, i comuni e le comunità montane, sul documento che portava il titolo «Linee di indirizzo per la promozione e il miglioramento della qualità, della sicurezza e dell'appropriatezza degli interventi assistenziali del percorso nascita e per la riduzione del taglio cesareo»; quello dell'utilizzo inappropriato proprio di questa metodica del taglio cesareo è uno dei dati più negativi nel contesto europeo e anche nel nostro Paese. Quell'accordo, come è noto, impegnava tutte le regioni, comprese quelle che erano anche in piano di rientro dal deficit sanitario, ad attuare 10 linee di azione per la ridefinizione del percorso nascita, al fine di implementare misure fondamentali per garantire livelli elevati di qualità e di sicurezza, sia per il nascituro e sia per la madre, e i casi di cronaca che sentiamo tutti i giorni ci obbligano a stare molto rigorosamente su questo fronte. L'obiettivo è infatti quello di promuovere e migliorare la qualità, la sicurezza, in gravidanza e durante il parto, nonché di garantire l'appropriatezza degli interventi assistenziali nel percorso nascita per la riduzione – come dicevo prima – del taglio cesareo. Di particolare importanza in questo senso è la definizione del volume minimo di parti, che in quell'accordo veniva previsto, che secondo una consolidata, devo dire abbondante, molto abbondante letteratura, e le esperienze che si hanno in materia, è fondamentale per configurare – il numero di parti – le condizioni organizzative e le competenze, e quindi anche tutte quelle tecniche, gli expertise necessari, per la sicurezza di tutto il percorso nascita. Il decreto ministeriale successivo, quello sulla riorganizzazione dalla rete ospedaliera che definisce gli standard, il n. 70 del 2015, per quanto attiene al percorso nascita, ha sancito che, relativamente alla classificazione delle strutture ospedaliere, i presidi ospedalieri di primo livello con bacino di utenza compreso tra 150 mila e 300 mila abitanti sono strutture e sedi dipartimento di emergenza-urgenza di primo livello dotati delle seguenti specialità, tra cui ostetricia e ginecologia, se prevista per numero di parti per l'anno. Relativamente ai volumi di attività, ai volumi e agli esiti di maternità, si applicano le soglie di volume e di attività di cui all'accordo che ho citato, quello del 2010. Quindi, il decreto ministeriale n. 70 riconferma quella prospettiva descritta nel provvedimento e nell'accordo del 2010. Quell'accordo citato prevede la presenza di punti nascita in deroga al volume minimo di 500 parti all'anno esclusivamente in caso di situazioni orografiche critiche, ovvero in presenza di aree geografiche notevolmente disagiate, ad esempio zone montane non adeguatamente fornite di un sistema viario atto a permettere alla donna in gravidanza il raggiungimento in tempi brevi di ospedali; alle aree insulari, zone fortemente disagiate dal punto di vista della viabilità, eccetera, esclusivamente a condizione che però in queste strutture siano comunque garantiti tutti gli standard organizzativi, tecnologici e di sicurezza previsti dall'accordo per le unità operative di ostetricia e di neonatologia e di più pediatria di primo livello, e che siano attivi il servizio di trasporto di emergenza della mamma e del neonato, indicati in quei provvedimenti con due acronimi che si chiamano STAM e STEN. Secondo i dati forniti dalla provincia autonoma di Bolzano sulla base delle schede Cedap, presso il punto nascita di Vipiteno, nel 2015, sono stati effettuati 460 parti, al di sotto pertanto del cut-off di 500 parti all'anno previsti dal citato accordo del 16 dicembre 2010 quale condizione per il mantenimento in attività dei punti nascita. Il confronto con il numero dei parti effettuati nel 2014, che era pari a 488, mostra anche un trend in diminuzione delle nascite presso questo punto nascita, in linea, peraltro – l'ha citato lei –, anche con il tema della denatalità, che è in atto purtroppo in tutto il Paese. Inoltre, la medesima provincia di Bolzano ha evidenziato che il punto nascita di Vipiteno, oltre a non aver raggiunto la quota minima di nascite annue, fissata in 500 unità, risulta carente dei requisiti previsti nell'ambito della definizione di struttura sanitaria di area disagiata. Ciò è quello che dichiara testualmente la provincia di Bolzano. Nel merito della situazione orografica di Vipiteno, non sembrano – secondo la provincia – ricorrere le condizioni per definire il comune ed il suo bacino di utenza come area disagiata, in quanto serviti dall'autostrada del Brennero, con Bressanone, sede di punto nascita, a meno di trenta minuti. Questo garantisce, al netto della distanza, la percorribilità stradale anche in condizioni atmosferiche invernali ed in presenza anche di abbondanti nevicate, che lì ovviamente – come sa meglio di me l'onorevole interrogante – sono abbastanza costanti. La dimostrata facilità dei collegamenti è fornita in modo inequivocabile – continua la provincia – dai dati del volume di attività del punto nascita riferita all'anno 2015, da cui risulta evidente come il 25 per cento delle donne che partoriscono all'ospedale di Vipiteno provenga da altri distretti della provincia autonoma di Bolzano e circa il 22 per cento addirittura da regioni limitrofe. Inoltre, sempre esaminando i dati di attività, si rileva come nel 2015 circa il 20 per cento delle donne residenti nel comune di Vipiteno hanno scelto di partorire presso altri punti nascita. In ultimo, si sottolinea come, nonostante venga dichiarato che presso il punto nascita di Vipiteno venga erogata un'assistenza rispettosa della fisiologia della gravidanza, nel 2015 la percentuale dei parti con taglio cesareo è stata del 21,1 per cento, al di sopra pertanto di quanto previsto dal decreto ministeriale n. 70 che ho citato, proporzioni di tagli cesari primari in maternità di primo livello, e comunque con parti massimo il 15 per cento ogni mille. Qualsiasi richiesta di deroga comunque riguardante il punto nascita di Vipiteno, secondo la provincia non appare coerente con la indispensabile condizione di «orograficamente disagiato», che è la dizione che viene utilizzata nei casi delle deroghe dal decreto ministeriale n. 70 del 2015, a cui il protocollo per le richieste di deroga fa chiaro riferimento, perché esiste anche un decreto ministeriale che indica una procedura per questa richiesta di deroga. Va sottolineato che la chiusura di alcuni punti nascita sotto gli standard, come quello di Vipiteno, si riferisce però esclusivamente alla fase di espletamento del parto, pertanto rimarranno – spero come è noto – operativi tutti i servizi e le attività assistenziali rese alla popolazione sia nella fase dei pre partum, ai fini del controllo della gravidanza, che nella fase di post partum, ai fini dell'assistenza del bambino e della donna. Il raccomandato potenziamento dell'attività consultoriale e di assistenza territoriale, come previsto dall'accordo del 2010, dovrebbe permettere un attento monitoraggio dell'insorgenza, durante la gravidanza, di eventuali fattori di rischio che rendono essenziale il conferimento della donna in gravidanza verso i centri hub individuati dalla provincia autonoma di Bolzano. Colgo l'occasione per segnalare che la chiusura del punto nascita di Vipiteno ha comunque favorito lo stanziamento di risorse – continua ancora la provincia –, specie per quanto riguarda il personale sanitario, necessarie alla sopravvivenza del punto nascita dell'ospedale di Silandro, le cui caratteristiche, secondo quanto riportato dalla provincia, rispondono invece maggiormente alla definizione di struttura sanitaria di area disagiata. Infine, ritengo doveroso rammentare che, a seguito delle modifiche del Titolo V della Costituzione introdotte nel 2001, spetta esclusivamente alle regioni o alle province autonome la competenza legislativa in termini di organizzazione e di realizzazione di risposte efficaci ai bisogni di salute di tutti i gruppi di popolazione, mentre compito dello Stato è quello di svolgere il ruolo di garante del diritto della salute e di assicurare l'equità dell'attuazione di questo diritto sancito dalla Costituzione. Pertanto, le scelte programmatorie e organizzative e gestionali in tema di sanità sono ancora totalmente – dico «ancora» perché ci sono prospettive costituzionali sulle quali ovviamente non mi soffermo – totalmente in capo alle regioni, mentre rimane in capo al Ministero della salute verificare che l'erogazione dei livelli essenziali di assistenza avvenga nel rispetto delle condizioni di appropriatezza e di efficacia nell'utilizzo delle risorse, nonché di accertare che vi sia una congruità tra le prestazioni da erogare e le risorse messe a disposizione del Servizio sanitario nazionale. Per tale motivo, il Ministero della salute non può oggettivamente fare un'invasione indebita nel merito delle scelte strategiche adottate dalle regioni e dalle province autonome per ridefinire e razionalizzare il percorso nascita in base a quell'accordo a cui mi sono riferito, che è quello del 16 dicembre 2010. Ciò nonostante, il Ministero della salute comunque verifica costantemente che le strategie di riorganizzazione dei punti nascita siano coerenti con le politiche convenute in quell'accordo, anche avvalendosi del Comitato percorso nascita nazionale, che ha proprio una funzione di verifica e di monitoraggio. Questa è la risposta che possiamo dare tecnicamente ed istituzionalmente in questa circostanza.	
MARINA SERENI	PRESIDENTE	Il deputato Kronbichler ha facoltà di dichiarare se sia soddisfatto per la risposta alla sua interpellanza.	
FLORIAN KRONBICHLER		Grazie, Presidente. Sottosegretario, la ringrazio veramente, è stato molto esaustivo. Non possiedo le capacità retoriche del collega Brunetta, che ha risposto su un altro campo, molto più spinoso, definendo la risposta molto evasiva. Lei ha risposto in modo contrario, insomma è entrato molto nel merito, nella seconda parte della sua risposta, per cui la ringrazio. Però, mi è sembrato di sentire l'assessora provinciale o il suo difensore, non d'ufficio ma di fiducia. Tuttavia, lei non ha toccato il nucleo centrale della domanda, certe cose sono contraddittorie: quando esamina tutte le prerogative dell'ospedale o di questo reparto di Vipiteno, esso non sarebbe considerato, addirittura da istanze ufficiali, insomma statali, un punto nascita di eccellenza. Che la zona non sia una zona disagiata in generale, in confronto ad altre zone disagiate dello Stato, sarà vero. Però volevo anche dire che in altri posti non si è stati così fiscali, quando lei parla di 470, 488 parti. Quest'anno, se non c’è panico, questa prospettiva non è certo incoraggiante, non è incoraggiante per le gestanti, per le madri future, che già si preparano o si dovevano preparare ad andare in un altro posto. Però, dovrebbero raggiungere i 500, quindi siamo a livello di 500 parti. Se lo Stato impone alla provincia di Bolzano la decisione di chiudere questo posto (questo esplicitamente non l'ha detto), almeno politicamente questa è la spada di Damocle che sarebbe sopra le teste di tutti i sudtirolesi, i quali dicono: «Roma ci taglia i fondi». Ogni madre potrebbe far causa alla amministrazione provinciale perché non ha chiuso questo reparto. Mi sembra che lei non abbia detto questo. Comunque, prendo atto; ovviamente sono insoddisfatto in merito, però la ringrazio ancora della sua risposta.	
			Sui lavori dell'Assemblea (ore 10,58)
MARINA SERENI	PRESIDENTE	così esaurito lo svolgimento delle interpellanze urgenti all'ordine del giorno.	
			Ordine del giorno della prossima seduta.
MARINA SERENI	PRESIDENTE	Avverto che, con lettera trasmessa in data 22 settembre, il presidente della Commissione lavoro, anche a nome del presidente della Commissione affari costituzionali, ha comunicato che, nella riunione dell'ufficio di presidenza delle Commissioni riunite, integrato dai rappresentanti dei rappresentanti dei gruppi, si è concordato, con il consenso, in particolare, dei rappresentanti dei gruppi Forza Italia e Lega Nord, di chiedere un rinvio al prossimo 13 ottobre dell'esame delle proposte di legge recanti norme in materia di videosorveglianza negli asili nido e nelle scuole dell'infanzia nonché presso le strutture socio-assistenziali per anziani, disabili e minori in situazione di disagio e altre disposizioni per garantire la sicurezza presso le medesime strutture, previsto nel vigente calendario dei lavori a partire da mercoledì prossimo, 28 settembre. L'esame di tale provvedimento non sarà pertanto iscritto all'ordine del giorno delle sedute della prossima settimana.	
			La seduta termina alle 11.
