speaker	role	text	extra
LUIGI DI MAIO	PRESIDENTE	Passiamo ai voti. Indìco la votazione nominale, mediante procedimento elettronico, sull'emendamento D'Ambrosio 54-ter.1, con il parere contrario delle Commissioni e del Governo. Dichiaro aperta la votazione. (Segue la votazione). Bazoli, Grassi, Caso, Bini, Giuliani... Hanno votato tutti ? Dichiaro chiusa la votazione. Comunico il risultato della votazione: Presenti 466 Votanti 454 Astenuti 12 Maggioranza 228 Hanno votato sì 123 Hanno votato no 331. La Camera respinge (Vedi votazioni). (Il deputato Allasia ha segnalato che avrebbe voluto astenersi). Indìco la votazione nominale, mediante procedimento elettronico, sull'emendamento Borghesi 56-bis.1, con il parere contrario delle Commissioni e del Governo. Dichiaro aperta la votazione. (Segue la votazione). Luigi Gallo, Capua, Roberta Agostini... Dichiaro chiusa la votazione. Comunico il risultato della votazione: Presenti 470 Votanti 469 Astenuti 1 Maggioranza 235 Hanno votato sì 108 Hanno votato no 361 La Camera respinge (Vedi votazioni). Indìco la votazione nominale, mediante procedimento elettronico, sull'emendamento Vacca 60.1, con il parere contrario delle Commissioni e del Governo. Dichiaro aperta la votazione. (Segue la votazione). Paris, Grassi, Capodicasa, Boccuzzi... Dichiaro chiusa la votazione. Comunico il risultato della votazione: Presenti e votanti 470 Maggioranza 236 Hanno votato sì 123 Hanno votato no 347 La Camera respinge (Vedi votazioni). Passiamo alla votazione dell'emendamento Bonafede 73.50. Ha chiesto di parlare per dichiarazione di voto il deputato Bonafede. Ne ha facoltà.	
ALFONSO BONAFEDE		Signor Presidente, l'emendamento in questione vuole ripristinare la norma così com'era stata approvata alla Camera all'articolo 73. Chiariamo subito che la modifica apportata al Senato chiude il cerchio di una norma che non solo è illogica e, da un punto di vista giuridico, altamente censurabile, ma è una norma assolutamente immorale e vado a spiegare perché, perché oggi, qui, ci dobbiamo prendere la responsabilità di quello che stiamo approvando con questa norma. Facciamo il punto dell'articolo 73. Praticamente, il Governo si trova di fronte ad una situazione di eccessivo carico di giudizi nei tribunali. Ovviamente cosa fa ? Cerca di acquisire nuovo personale tramite concorso come si farebbe in qualsiasi Stato normale ? Assolutamente no, consapevole della situazione di disoccupazione giovanile, consapevole del fatto che i giovani in questo Paese non hanno più una prospettiva, il Governo decide di assumere giovani a costo zero. Praticamente la logica è questa: io chiamo i giovani, per 18 mesi li faccio lavorare nei tribunali, cerco di farmi aiutare a smaltire il carico dei contenziosi e non li pago. Per 18 mesi ! Io mi chiedo con quale faccia questo Parlamento può andare a censurare un datore di lavoro che per 18 mesi sfrutta manodopera giovanile sottopagandola, oppure pagandola a nero quando poi noi facciamo la stessa cosa per smaltire i contenziosi del tribunale (Applausi dei deputati del gruppo MoVimento 5 Stelle) ! Abbiamo ovviamente proposto che venisse inserita una borsa di studio e ci è stato posto un «no» chiaro. Abbiamo proposto un'indennità, abbiamo proposto una forma di assicurazione, assolutamente nulla; come al solito si è alzato un muro che non è più, nemmeno, un muro di gomma, ormai è un muro di cemento armato contro cui si scontrano tutti i sogni delle nuove generazioni in Italia e di questo muro siete voi i costruttori ! Perché dopo che le nostre proposte sulla possibilità di pagare e di dare almeno un rimborso spese a questi giovani, dopo che queste proposte erano state ovviamente non accettate e rigettate al mittente, la norma va al Senato. Al Senato cosa succede ? Succede che l'unico vantaggio che avevano questi giovani era quello di poter accedere al concorso in magistratura dopo aver fatto questo di tirocinio. Adesso, dopo la modifica apportata dal Senato, i giovani, dopo aver fatto diciotto mesi di stage, devono fare un anno di scuola di specializzazione per accedere al concorso in magistratura. Ovviamente qual è la motivazione ? Lo sappiamo tutti: le scuole di specializzazione, nel passaggio dalla Camera al Senato, hanno pressato le forze politiche perché inserissero questa modifica, perché è ovvio che a quel punto tutti i ragazzi sarebbero andati nei tribunali e non sarebbero andati più a pagare soldi nelle scuole di specializzazione (Applausi dei deputati del gruppo MoVimento 5 Stelle). Ma noi no ! Figuriamoci ! E abbiamo introdotto questa norma. A parte che, ovviamente, in Commissione siamo tutti d'accordo sul fatto che questa modifica non doveva essere approvata, ma vorrei capire, da chi sta in Parlamento da tanto tempo, perché – se il MoVimento 5 Stelle, il PD, il PdL e anche il Governo su questo emendamento sono d'accordo, cioè sul fatto che la modifica al Senato non dovesse essere approvata – il tabellone dell'emiciclo si colorerà di due colori diversi e non sarà tutto di un unico colore. Non lo capisco, spero un giorno di capirlo (Applausi dei deputati del gruppo MoVimento 5 Stelle). Poiché il rischio, quando si entra qua dentro, è di rimanere alienati da una realtà che poi non si può più migliorare – perché dal monte Olimpo non si può più migliorare la realtà – vi chiedo per un attimo di immaginare un ragazzo di ventiquattr'anni che finisce gli studi, che è neo-laureato, che non ha nessuna prospettiva, ma che ama questo Paese, vuole rimanere a lavorare e decide di andare in tribunale, decide di passare diciotto mesi della sua vita senza nessuna garanzia per aiutare i tribunali nello smaltimento del lavoro e che dopo diciotto mesi deve fare un anno di scuola di specializzazione pagando per poter accedere al concorso in magistratura, a questo punto, dopo che avete immaginato quel ragazzo, immaginate per un solo istante che sia vostro figlio e poi votate (Applausi dei deputati del gruppo MoVimento 5 Stelle).	
			(Esame degli ordini del giorno – A.C. 1248-B)
LUIGI DI MAIO	PRESIDENTE	Passiamo ai voti. Indìco la votazione nominale, mediante procedimento elettronico, sull'emendamento Bonafede 73.50, con il parere contrario delle Commissioni e del Governo. Dichiaro aperta la votazione. (Segue la votazione). Gitti, Guerini Giuseppe, Fossati, Rossi... Dichiaro chiusa la votazione. Comunico il risultato della votazione: Presenti 457 Votanti 431 Astenuti 26 Maggioranza 216 Hanno votato sì 151 Hanno votato no 280 La Camera respinge (Vedi votazioni). Indìco la votazione nominale, mediante procedimento elettronico, sull'emendamento Bonafede 73.3, con il parere contrario delle Commissioni e del Governo. Dichiaro aperta la votazione. (Segue la votazione). Brandolin, Stumpo, Giammanco, Vacca... Dichiaro chiusa la votazione. Comunico il risultato della votazione: Presenti 459 Votanti 444 Astenuti 15 Maggioranza 223 Hanno votato sì 136 Hanno votato no 308 La Camera respinge (Vedi votazioni). Indìco la votazione nominale, mediante procedimento elettronico, sull'emendamento Matteo Bragantini 84-ter.3, con il parere contrario delle Commissioni e del Governo. Dichiaro aperta la votazione. (Segue la votazione). Totaro, Cancelleri, Carinelli, Lavagno... Dichiaro chiusa la votazione. Comunico il risultato della votazione: Presenti 461 Votanti 432 Astenuti 29 Maggioranza 217 Hanno votato sì 115 Hanno votato no 317. La Camera respinge (Vedi votazioni). (Il deputato Donati ha segnalato che non è riuscito ad esprimere voto contrario). Ricordo che l'emendamento Matteo Bragantini 84-ter.2 è stato ritirato. Per dare ordine ai nostri lavori, desidero informare l'Assemblea che mi risulta sia stata raggiunta un'intesa tra i rappresentanti di tutti gruppi, nel senso di esaurire questa sera, intorno alle 19,20, tutte le votazioni relative agli emendamenti e agli ordini del giorno; e di proseguire l'esame del provvedimento nella seduta di domani, a partire dalle 9,30, per lo svolgimento con ripresa televisiva diretta delle dichiarazioni di voto finale e successivamente della votazione finale.	
LUIGI DI MAIO	PRESIDENTE	Passiamo all'esame degli ordini del giorno presentati (Vedi l'allegato A – A.C. 1248-B).	
GUIDO GUIDESI		Chiedo di parlare.	
LUIGI DI MAIO	PRESIDENTE	Ne ha facoltà.	
GUIDO GUIDESI		Signor Presidente, intervengo solo per dirle che sarebbe opportuno avere i testi...	
LUIGI DI MAIO	PRESIDENTE	I testi sono in distribuzione. Qual è il parere del Governo ? Chiedo di liberare i banchi del Governo, per favore. Prego.	
ALBERTO GIORGETTI		Sottosegretario di Stato per l'economia e le finanze. Signor Presidente, per l'ordine del giorno Rostan n. 9/1248-B/1, vorrei proporre una riformulazione: «impegna il Governo ad assumere tutte le iniziative che garantiscano l'attuazione di una complessiva strategia di contrasto al fenomeno», eccetera eccetera. Se così riformulato, il parere è favorevole. L'ordine del giorno Laffranco n. 9/1248-B/2 è accolto come raccomandazione. L'ordine del giorno Coppola n. 9/1248-B/3 viene accettato. Sull'ordine del giorno Prataviera n. 9/1248-B/4 propongo la seguente riformulazione: «a prevedere, nell'ambito del disegno di legge delega di riforma fiscale, regimi agevolati per l'acquisto di carburanti impiegati per l'alimentazione di macchine utilizzate», e così via. Se così riformulato, il parere è favorevole, viene accolto. Sull'ordine del giorno Molteni n. 9/1248-B/5 propongo la seguente riformulazione: «impegna il Governo a valutare l'adozione di un provvedimento normativo correttivo», e così via. Se così riformulato, il parere è favorevole, viene accolto. Gli ordini del giorno Carrescia n. 9/1248-B/6, Dal Moro n. 9/1248-B/7 e Centemero n. 9/1248-B/8 sono accettati. Sull'ordine del giorno Biasotti n. 9/1248-B/9 propongo la seguente riformulazione: «impegna il Governo ad individuare indirizzi operativi che impegnino le autorità portuali», e così avanti fino alla fine. Se così riformulato, viene accolto. Sull'ordine del giorno Marotta n. 9/1248-B/10 propongo la seguente riformulazione: «impegna il Governo a reperire le risorse per il contributo pubblico necessario alla realizzazione degli impianti di trasporto e distribuzione del gas naturale nel parco del Cilento». Se così riformulato, il parere è favorevole. Per quanto riguarda l'ordine del giorno Pagano n. 9/1248-B/11 dal dispositivo, il Governo propone di espungere «a verificare l'esattezza di quanto esposto in premessa». Tolta questa parte, il parere è favorevole. Sugli ordini del giorno Squeri n. 9/1248-B/12 e Palmieri n. 9/1248-B/13 il parere è favorevole. Sull'ordine del giorno Di Gioia n. 9/1248-B/14 propongo la seguente riformulazione: «impegna il Governo a valutare l'adozione di opportune iniziative volte a chiarire», eccetera. Se così riformulato, il parere è favorevole. Il Governo esprime parere favorevole sull'ordine del giorno Lenzi n. 9/1248-B/15, mentre accoglie come raccomandazione l'ordine del giorno Quartapelle Procopio n. 9/1248-B/16. Il Governo propone per l'ordine del giorno De Menech n. 9/1248-B/17 la seguente riformulazione: «impegna il Governo a valutare la possibilità che, nell'ambito della complessiva riforma della disciplina dell'imposizione fiscale (...)». Se così riformulato, il parere è favorevole. Il Governo esprime parere favorevole sull'ordine del giorno Mauro Guerra n. 9/1248-B/18, purché così riformulato: «impegna il Governo a valutare l'opportunità di definire modalità e criteri per garantire (...)». Il Governo esprime parere favorevole sugli ordini del giorno Bruno Bossio n. 9/1248-B/19, Tullo n. 9/1248-B/20 e Boccuzzi n. 9/1248-B/21, mentre accoglie come raccomandazione l'ordine del giorno Mongiello n. 9/1248-B/22. Il Governo propone la seguente riformulazione per l'ordine del giorno Garofani n. 9/1248-B/23: togliere dal dispositivo le parole «e limitare» e sostituirle con «razionalizzando». Se così riformulato, il parere è favorevole. Il Governo accoglie come raccomandazione l'ordine del giorno Oliaro n. 9/1248-B/24 e accetta l'ordine del giorno Gitti n. 9/1248-B/25. Il Governo propone per l'ordine del giorno Fiano n. 9/1248-B/26 la seguente riformulazione del dispositivo: «a valutare gli effetti della disposizione richiamata in premessa, al fine di prevedere con apposita norma l'eventuale esclusione dal Patto di stabilità delle spese realizzate dal comune di Milano». Se così riformulato, il parere è favorevole. Il Governo esprime parere favorevole sull'ordine del giorno Capodicasa n. 9/1248-B/27 se così riformulato: «impegna il Governo a valutare la predisposizione di un nuovo atto normativo, in considerazione del permanere dello stato di proroga dei termini di sospensione». Il Governo esprime parere favorevole sull'ordine del giorno Iacono n. 9/1248-B/28 se così riformulato: «impegna il Governo a valutare l'emanazione di normative» e così via. Il Governo accoglie come raccomandazione gli ordini del giorno Verini n. 9/1248-B/29 e Chiarelli n. 9/1248-B/30. Ora prosegue la mia collega.	
LUIGI DI MAIO	PRESIDENTE	Prego. Deputati, io vi invito a tenere un po’ di silenzio in Aula e soprattutto a liberare i banchi del Governo, tra l'altro non riusciamo neanche a sentire i pareri per il rumore che si sta facendo. Prego.	
SESA AMICI		Sottosegretario di Stato alla Presidenza del Consiglio dei ministri. Signor Presidente, il Governo accetta l'ordine del giorno Ferranti n. 9/1248-B/31 con questa riformulazione: nel dispositivo, dopo le parole «presso l'Avvocatura dello Stato», aggiungere le parole «e quella forense». Con questa riformulazione sarebbe accolto. Il Governo accoglie come raccomandazione l'ordine del giorno Gregori n. 9/1248-B/32 e accetta gli ordini del giorno Di Salvo n. 9/1248-B/33 e Bratti n. 9/1248-B/34, mentre accoglie, con la seguente riformulazione, l'ordine del giorno Mariani n. 9/1248-B/35: «senza spese a carico dello Stato». Il Governo esprime un invito al ritiro sull'ordine del giorno Malisani n. 9/1248-B/36, altrimenti il parere è contrario, mentre accoglie l'ordine del giorno Pellegrino n. 9/1248-B/37 purché così riformulato: «a valutare la possibilità, nel rispetto dell'equilibrio di bilancio». Il Governo accetta l'ordine del giorno Brandolin n. 9/1248-B/38, con la seguente riformulazione: «a valutare la possibilità, con un proprio intervento normativo», e accoglie l'ordine del giorno Piccoli Nardelli n. 9/1248-B/39, come raccomandazione se nella formulazione: dopo la parola «il rilancio» seguono le parole «delle infrastrutture culturali». Il Governo accetta l'ordine del giorno Zanetti n. 9/1248-B/40 con la seguente riformulazione del dispositivo: «impegna il Governo a valutare la possibilità di (...)» e così via. Il Governo accoglie come raccomandazione l'ordine del giorno Ferro n. 9/1248-B/41. Il Governo accetta l'ordine del giorno Palese n. 9/1248-B/42, con la seguente riformulazione del dispositivo: «impegna il Governo a valutare la possibilità dopo il decreto-legge di applicare i piani di azionariato diffuso». Il Governo accetta l'ordine del giorno Sisto n. 9/1248-B/43. Il Governo accetta l'ordine del giorno Boccia n. 9/1248-B/44, con la seguente riformulazione del dispositivo: «impegna il Governo a valutare la possibilità all'avvocato (...)». Il Governo accoglie come raccomandazione l'ordine del giorno D'Incecco n. 9/1248-B/45. Il Governo invita i presentatori al ritiro dell'ordine del giorno Rubinato n. 9/1248-B/46, altrimenti il parere è contrario. Il Governo accoglie come raccomandazione l'ordine del giorno Braga n. 9/1248-B/47. Il Governo accetta l'ordine del giorno Pizzolante n. 9/1248-B/48, con la seguente riformulazione del dispositivo: «impegna il Governo a valutare l'opportunità di (...)». Il Governo accetta l'ordine del giorno Balduzzi n. 9/1248-B/49, con la seguente riformulazione del dispositivo: «impegna il Governo con ulteriori provvedimenti a valutare gli effetti, derivanti dall'applicazione della disposizione introdotta dall'articolo 42-bis, e a verificare se si dovessero rendere necessari ulteriori provvedimenti».	
LUIGI DI MAIO	PRESIDENTE	Un'unica osservazione: la riformulazione dell'ordine del giorno Pizzolante n. 9/1248-B/48 è già contenuta nel testo. Quindi, l'ordine del giorno Pizzolante si considera accettato ?	
SESA AMICI	Sottosegretario di Stato alla Presidenza del Consiglio dei ministri	Sì, signor Presidente.	
ETTORE ROSATO		Chiedo di parlare sull'ordine dei lavori.	
LUIGI DI MAIO	PRESIDENTE	Ne ha facoltà.	
ETTORE ROSATO		Signor Presidente, per dire che, salvo casi eccezionali che le verranno segnalati, noi accettiamo le riformulazioni, le raccomandazioni e non chiediamo la votazione dei nostri ordini del giorno che non hanno pareri difformi da quanto detto.	
LUIGI DI MAIO	PRESIDENTE	Prendo atto che i presentatori accettano la riformulazione e non insistono per la votazione dell'ordine del giorno Rostan n. 9/1248-B/1, accettato dal Governo, purché riformulato. Prendo atto che il presentatore non insiste per la votazione dell'ordine del giorno Laffranco n. 9/1248-B/2, accolto dal Governo come raccomandazione. Prendo atto che il presentatore non insiste per la votazione dell'ordine del giorno Coppola n. 9/1248-B/3, accettato dal Governo. Prendo atto che i presentatori accettano la riformulazione e non insistono per la votazione dell'ordine del giorno Prataviera n. 9/1248-B/4, accettato dal Governo, purché riformulato. Chiedo ai presentatori se accettino la riformulazione dell'ordine del giorno Molteni n. 9/1248-B/5, accettato dal Governo, purché riformulato. Deputati, vi invito ad abbassare il tono della voce.	
NICOLA MOLTENI		Signor Presidente, non accetto la riformulazione proposta dal Governo perché, con questo ordine del giorno, noi chiediamo, da un lato, la riforma della geografia giudiziaria, tanto per intenderci la soppressione di circa mille uffici giudiziari...	
LUIGI DI MAIO	PRESIDENTE	Deputato, mi scusi un attimo. Siccome il problema è stato manifestato anche dal Governo: bisogna liberare i banchi del Governo. Per favore, colleghi, bisogna liberare i banchi del Governo ! Malisani, per favore ! Prego, collega Molteni.	
NICOLA MOLTENI		Grazie Presidente, continuo, dicendo che, con questo ordine del giorno, noi chiediamo, da un lato, che venga corretta la riforma della geografia giudiziaria, tanto per intenderci quella riforma che sopprime e cancella 31 tribunali e, complessivamente, mille uffici giudiziari. Noi chiediamo un decreto correttivo e chiediamo anche la proroga di un anno della riforma medesima, che entra in vigore il 13 settembre del 2013, cioè tra un mese. Voglio ricordare che un ordine del giorno analogo è stato approvato da tutte le forze politiche che siedono in Senato. Quindi, chiedo, o che il Governo modifichi la riformulazione – perché altrimenti abbiamo un Governo che dice una cosa alla Camera e una cosa al Senato – o che comunque accetti anche la proroga. Siccome su questo tema si sta discutendo da molto tempo, io credo che questa sia l'occasione migliore per poter dimostrare che alle parole, ovvero alla volontà manifestata da tutte le forze politiche di chiedere al Ministro Cancellieri la proroga di un anno dell'entrata in vigore delle riforma, seguano anche dei fatti.	
LUIGI DI MAIO	PRESIDENTE	Ha chiesto di parlare per dichiarazione di voto il deputato Zolezzi. Ne ha facoltà. Chiedo al deputato Fiano di allontanarsi dai banchi del Governo. Collega Fiano...Prego, deputato Zolezzi.	
ALBERTO ZOLEZZI		Signor Presidente, volevo solo, se possibile, sottoscrivere questo ordine del giorno.	
LUIGI DI MAIO	PRESIDENTE	Ha chiesto di parlare per dichiarazione di voto il deputato Di Gioia. Ne ha facoltà.	
LELLO DI GIOIA		Signor Presidente, anch'io vorrei sottoscrivere l'ordine del giorno riconfermando, appunto, che al Senato è stato approvato un ordine del giorno di questa natura e noi siamo profondamente convinti che la riforma che si sta attuando è una riforma sbagliata, inorganica e, quindi, vi è la necessità di avere un tempo necessario per riformulare e riguardare meglio la riforma. Pertanto, gradirei apporre la firma a questo ordine del giorno.	
LUIGI DI MAIO	PRESIDENTE	Ha chiesto di parlare per dichiarazione di voto il deputato Verini. Ne ha facoltà.	
WALTER VERINI		Signor Presidente, noi non siamo d'accordo con questo ordine del giorno e abbiamo sottoscritto e presentato, assieme ai capigruppo in Commissione giustizia di PdL e Scelta Civica – e si aggiunta anche la firma del collega Sannicandro di SEL –, un ordine del giorno che noi riteniamo più completo, più efficace, perché invita il Governo ad andare avanti sulla strada delle riforma, che noi consideriamo comunque necessaria, tuttavia con delle correzioni che, ove accolte, certamente potranno contribuire a riformare la geografia giudiziaria, a non rallentarla, ma a correggerne gli errori in essa contenuti. Per questo esprimiamo voto contrario, con queste motivazioni.	
LUIGI DI MAIO	PRESIDENTE	Ha chiesto di parlare per dichiarazione di voto il deputato Costa. Ne ha facoltà.	
ENRICO COSTA		Signor Presidente, io ho letto con attenzione questo ordine del giorno e, anche per coerenza, voterò a favore. Io ho sottoscritto una proposta di legge, già presentata da tempo, che prevede la proroga di un anno della normativa legata alla soppressione dei tribunali. Perché abbiamo chiesto la proroga ? L'abbiamo chiesta perché ci siamo resi conto che in moltissime strutture giudiziarie cosiddette accorpanti non c'erano le condizioni per accorpare alcunché. In buona sostanza, si era previsto l'accorpamento, ma mancavano le stanze, mancavano le ubicazioni per i magistrati, mancavano le sale per le udienze. Questo non è ancora stato realizzato perché, benché questa riforma sia prevista come un risparmio di risorse, è una riforma che necessita di tantissime strutture e, quindi, di tantissime somme da destinare a queste strutture. Io chiederei al sottosegretario, se possibile, di tornare indietro sulla sua valutazione e prevedere l'accoglimento di questo ordine del giorno. Sarà, poi, il Governo a fare le sue valutazioni successivamente.	
LUIGI DI MAIO	PRESIDENTE	Quindi, deputato Molteni, da quanto ho capito non accetta la riformulazione e insiste per la votazione ? Il Governo non interviene. Bene, prendo atto che i presentatori insistono per la votazione dell'ordine del giorno Molteni n. 9/1248-B/5. Passiamo ai voti. Indìco la votazione nominale, mediante procedimento elettronico, sull'ordine del giorno Molteni n. 9/1248-B/5, non accettato dal Governo. Dichiaro aperta la votazione. (Segue la votazione). Malisani, Gadda, Raciti, Nesci...forza, velocemente raggiungete...Nesci ha votato, Gitti ha votato. Bene. Hanno votato tutti ? Dichiaro chiusa la votazione. Comunico il risultato della votazione: Presenti 415 Votanti 407 Astenuti 8 Maggioranza 204 Hanno votato sì 154 Hanno votato no 253. La Camera respinge (Vedi votazioni). (Il deputato Martella ha segnalato che non è riuscito ad esprimere voto contrario). Prendo atto che i presentatori non insistono per la votazione degli ordini del giorno Carrescia n. 9/1248-B/6, Dal Moro n. 9/1248-B/7 e Centemero n. 9/1248-B/8, accettati dal Governo. Prendo atto che i presentatori accettano la riformulazione e non insistono per la votazione degli ordini del giorno Biasotti n. 9/1248-B/9, Marotta n. 9/1248-B/10 e Pagano n. 9/1248-B/11, accettati dal Governo, purché riformulati. Prendo atto che i presentatori non insistono per la votazione degli ordini del giorno Squeri n. 9/1248-B/12 e Palmieri n. 9/1248-B/13, accettati dal Governo. Chiedo ai presentatori se accettino la riformulazione dell'ordine del giorno Di Gioia n. 9/1248-B/14, su cui il Governo ha espresso parere favorevole, purché riformulato.	
LELLO DI GIOIA		Signor Presidente, mi sembra strano che il Governo proponga la riformulazione, per il semplice motivo che l'ordine del giorno che abbiamo presentato esplicita in modo – credo – chiarissimo quello che poi è stato determinato al Senato con l'articolo 29-ter, dove si dice chiaramente che le disposizioni di cui ai capi 5 e 6 del decreto legislativo 8 aprile 2013, n. 39, ossia gli incarichi conferiti e i contratti stipulati prima della data di entrata in vigore del medesimo decreto, verranno ad essere prorogati. Allora, se questo è, significa in buona sostanza che tutti i dirigenti pubblici che sono previsti nell'articolo 12 e nell'articolo 13 dello stesso decreto n. 39 del 2013, in cui sono stati inseriti anche i cosiddetti responsabili di strutture complesse delle ASL, secondo la delibera del Civit, sono automaticamente esclusi dalla incompatibilità. Allora, chiederei al Governo di riguardarsi un attimo la norma e di non proporre la riformulazione, perché questa è una chiara espressione di fare in modo che vi sia chiarezza nell'esposizione e nell'articolato dello stesso articolo 29. Quindi, chiederei al Governo di poter riverificare appunto quella riformulazione.	
LUIGI DI MAIO	PRESIDENTE	Onorevole Di Gioia, il Governo non interviene, quindi le chiedo se accetti la riformulazione o insista per la votazione.	
LELLO DI GIOIA		Signor Presidente, mi sembra quanto mai strano che un provvedimento del Governo... (Commenti).	
LUIGI DI MAIO	PRESIDENTE	Colleghi, per favore. Dal momento che il Governo non interviene, io le chiedo se accetta la riformulazione o insiste per la votazione.	
LELLO DI GIOIA		Signor Presidente, insisto per la votazione.	
