speaker	role	text	extra
LAURA BOLDRINI	PRESIDENTE	Prendo atto che si insiste per la votazione. Passiamo ai voti. Indìco la votazione nominale, mediante procedimento elettronico, sull'emendamento Centemero 9.47. Dichiaro aperta la votazione. (Segue la votazione). Dall'Osso, Spadoni, Gregori. Forza colleghi, che siamo in votazione, per favore. Vezzali e Fitzgerald. Dichiaro chiusa la votazione. Comunico il risultato della votazione: Presenti e votanti 381 Maggioranza 191 Hanno votato sì 34 Hanno votato no 347. La Camera respinge (Vedi votazioni). Indìco la votazione nominale, mediante procedimento elettronico, sull'emendamento Gelmini 9.49, con il parere contrario della Commissione e del Governo e delle relatrici di minoranza di Sinistra Ecologia Libertà e del MoVimento 5 Stelle. Dichiaro aperta la votazione. (Segue la votazione). Tancredi, Romano. Dichiaro chiusa la votazione. Comunico il risultato della votazione: Presenti e votanti 383 Maggioranza 192 Hanno votato sì 42 Hanno votato no 341. La Camera respinge (Vedi votazioni). Indìco la votazione nominale, mediante procedimento elettronico, sull'emendamento Pannarale 9.54, con parere contrario della Commissione e del Governo e con il parere favorevole delle relatrici di minoranza per Sinistra Ecologia Libertà e MoVimento 5 Stelle. Dichiaro aperta la votazione. (Segue la votazione). Gregori, Dall'Osso, Costantino, Capelli, Antimo Cesaro, Falcone... Dichiaro chiusa la votazione. Comunico il risultato della votazione: Presenti 388 Votanti 387 Astenuti 1 Maggioranza 194 Hanno votato sì 77 Hanno votato no 310. La Camera respinge (Vedi votazioni). Passiamo alla votazione dell'emendamento Centemero 9.55, sul quale la Commissione e il Governo hanno formulato un invito al ritiro, altrimenti il parere è contrario, e sul quale anche le relatrici di minoranza per i gruppi di Sinistra Ecologia Libertà e MoVimento 5 Stelle hanno espresso parere contrario. Ha chiesto di parlare per dichiarazione di voto la deputata Centemero. Ne ha facoltà.	
ELENA CENTEMERO		Grazie, Presidente. Io voglio intervenire su questo articolo 3, semplicemente per indicare una cosa: qui viene specificato il fatto che il dirigente scolastico propone l'incarico ai docenti all'interno dell'ambito territoriale sulla base di criteri ed è giusto che ci siano dei criteri, è giusto che ci siano dei criteri uniformi per tutte le scuole italiane. Però mi chiedo, in primo luogo: con riguardo alla durata triennale del contratto – non è assolutamente un incarico, ma un prerequisito – noi abbiamo fatto la proposta di inserire tra i criteri l'analisi dei fabbisogni dell'istituzione scolastica per ciascun insegnamento e di renderla ovviamente chiara, pubblica e trasparente perché molti conoscono la realtà delle scuole. L'analisi del fabbisogno reale è un criterio importante perché si determina all'interno delle scuole la possibilità che, nell'arco del triennio, il numero di cattedre aumenti o diminuisca. Quindi, ci troviamo di fronte alla necessità magari di non rinnovare un contratto e, dunque, io ritengo importante l'analisi dei fabbisogni per quest'aspetto e, in secondo luogo, perché l'organico delle scuole – e questo è un principio che noi abbiamo ribadito in tutto il provvedimento – deve essere strettamente collegato al fabbisogno e il fabbisogno di personale deve essere legato non al mantenimento delle cattedre, non a far sì che un docente che perde una parte del proprio orario rimanga all'interno della scuola, ma, al contrario, deve essere finalizzato alla formazione dei nostri studenti. Questa deve essere la priorità. Quindi, non vorremmo che ci trovassimo di fronte a degli organici eccessivamente consistenti. Questa è la nostra preoccupazione. Inoltre, ritengo che uno dei criteri – e mi riferisco all'emendamento Chimienti 9.67 – da inserire sia quello della continuità didattica. Mi spiegate, infatti, in un contratto triennale se un docente viene assegnato al biennio cosa fa ? Sta due anni, inizia il primo anno del successivo ciclo e poi lascia la classe ? Oppure, se c’è una verticalizzazione delle cattedre cosa fa ? Tre anni e poi gli altri due anni lascia i ragazzi, lascia la classe ? Io credo che il principio della continuità didattica sia un principio importantissimo, tanto è vero che noi avevamo, con il Ministro Gelmini, posto il fatto che nelle scuole i docenti dovevano rimanere per almeno cinque anni, questo sempre in funzione dei nostri studenti perché per noi le priorità sono gli studenti e la loro formazione.	
LAURA BOLDRINI	PRESIDENTE	Passiamo ai voti. Indìco la votazione nominale, mediante procedimento elettronico, sull'emendamento Centemero 9.55. Dichiaro aperta la votazione. (Segue la votazione). Adornato, Spadoni, Carra, Schirò. Ci siamo ? Dichiaro chiusa la votazione. Comunico il risultato della votazione: Presenti e votanti 387 Maggioranza 194 Hanno votato sì 32 Hanno votato no 355. La Camera respinge (Vedi votazioni). Indìco la votazione nominale, mediante procedimento elettronico, sull'emendamento Centemero 9.59, con parere contrario della Commissione, del Governo e parere contrario delle due relatrici di minoranza dei gruppi Sinistra Ecologia Libertà e MoVimento 5 Stelle. Dichiaro aperta la votazione. (Segue la votazione). Quintarelli, Fanucci, Binetti, Oliverio, ha votato. Bene, ci siamo. Binetti ha votato ? Dobbiamo mandare un tecnico ? Da qui non riesco a vedere. Ha la mano alzata, dunque... ecco, ha fatto. Nessun altro deve votare... Dichiaro chiusa la votazione. Comunico il risultato della votazione: Presenti e votanti 392 Maggioranza 197 Hanno votato sì 46 Hanno votato no 346. La Camera respinge (Vedi votazioni). Indìco la votazione nominale, mediante procedimento elettronico, sull'emendamento Luigi Gallo 9.58, con parere contrario della Commissione e del Governo e con il parere favorevole delle due relatrici di minoranza. Dichiaro aperta la votazione. (Segue la votazione). Ascani, Brandolin, Quintarelli di nuovo. Ecco, ha votato. Brandolin a che punto è ? Non riesce. Costantino ha votato. Brandolin ha votato ? Bene... Dichiaro chiusa la votazione. Comunico il risultato della votazione: Presenti 394 Votanti 393 Astenuti 1 Maggioranza 197 Hanno votato sì 95 Hanno votato no 298. La Camera respinge (Vedi votazioni). (Il deputato Gianluca Pini ha segnalato che non è riuscito ad esprimere voto contrario). Passiamo alla votazione dell'emendamento Bruno Bossio 9.56, su cui la Commissione ha formulato un invito al ritiro o parere contrario, il Governo ha espresso parere conforme, le due relatrici di minoranza hanno espresso parere contrario. Ha chiesto di parlare per dichiarazione di voto la deputata Bruno Bossio. Ne ha facoltà.	
VINCENZA BRUNO BOSSIO		Signora Presidente, crediamo nel valore di questa istituzione e nell'attività parlamentare. È stato fatto un lavoro importante da parte della Commissione, soprattutto su questo articolo; molto meno sull'articolo 10, ma questo lo affronteremo dopo. Molta sostanza degli emendamenti presentati in Commissione sono stati accolti, soprattutto sul comma 2. Molte cose dunque sono cambiate, ma non abbastanza nella direzione della valorizzazione e responsabilizzazione di tutte le componenti del mondo della scuola: docenti, organi collegiali; nell'ottica appunto della collaborazione e della costruzione di un clima educativo positivo all'interno delle singole istituzioni scolastiche. Io penso che si debba fare un ulteriore sforzo nella direzione della collegialità e del pieno inserimento di tutti i docenti nell'attività scolastica. L'emendamento Bruno Bossio 9.56, questo emendamento che fa riferimento al comma 3, aggiunge la contrattazione di istituto come elemento ulteriore per limitare la discrezionalità, evitando che si generino fenomeni clientelari, mantenendo i diritti come quello alla mobilità, evitando di ledere il principio costituzionale della libertà di insegnamento, evitando di creare evidenti differenze tra scuola e scuola. Per questo, nella direzione dello sforzo fatto finora, vi chiederei di accogliere e votare questo emendamento.	
LAURA BOLDRINI	PRESIDENTE	Passiamo ai voti. Indìco la votazione nominale, mediante procedimento elettronico, sull'emendamento Bruno Bossio 9.56. Dichiaro aperta la votazione. (Segue la votazione). Palma, Da Villa, Chimienti, Carbone... Dichiaro chiusa la votazione. Comunico il risultato della votazione: Presenti 374 Votanti 372 Astenuti 2 Maggioranza 187 Hanno votato sì 32 Hanno votato no 340. La Camera respinge (Vedi votazioni). Passiamo alla votazione dell'emendamento Rocchi 9.60. Qui vi è una proposta di riformulazione: deputata Rocchi, la accetta ?	
MARIA GRAZIA ROCCHI		Sì, signora Presidente.	
LAURA BOLDRINI	PRESIDENTE	Sta bene. I pareri delle due relatrici di minoranza erano già stati dati con la riformulazione, e sono contrari. Ha chiesto di parlare il deputato Molea. Ne ha facoltà.	
BRUNO MOLEA		Grazie Presidente, intervengo solo per dire che sottoscrivo questo emendamento.	
LAURA BOLDRINI	PRESIDENTE	Ha chiesto di parlare per dichiarazione di voto la deputata Pannarale. Ne ha facoltà.	
ANNALISA PANNARALE		Signora Presidente, intervengo solo per dire che non possiamo che riconfermare il parere contrario, nonostante la riformulazione. Avete provato a riscrivere questo comma, avete reinserito la pubblicità dei criteri adottati: in realtà resta soppressa la relativa motivazione, a fondamento della proposta che era contenuta nella stesura precedente. Ma il punto non è questo: avreste dovuto sopprimere innanzitutto la lettera a), cioè quella che dice «durata triennale rinnovabile», perché è il vero punto. In un rovesciamento di realtà ho sentito prima parlare di continuità didattica e del fatto che essere costretti ad insegnare in classi di concorso per quali si è abilitati sarebbe una costrizione, e addirittura lesivo della continuità didattica. Quello che, invece, non state dicendo è che con questo principio degli ambiti territoriali e degli incarichi triennali, che possono essere eventualmente rinnovati, state istituzionalizzando quel problema che era legato al precariato e che avreste dovuto rimuovere laddove aveste deciso di rimuovere davvero il problema del precariato, cosa che non si fa – ma lo diremo dopo – data l'insufficienza del piano di assunzioni. Sottoporre questi docenti ad un regime che non prevede più la cattedra definitiva, ma che li lega ad incarichi triennali che possono essere rinnovati, significa negare agli studenti, alle studentesse e ai bambini la possibilità di avere docenti stabili e riconosciuti, perché questi docenti, laddove non fossero più riconosciuti, dopo tre anni, dal dirigente, dovranno necessariamente spostarsi o affidarsi all'ufficio scolastico regionale, che andrà a collocarli d'ufficio. Questo significa violare un principio sacrosanto della scuola pubblica. Questo significa violare il principio del diritto allo studio, cioè quello della continuità didattica.	
LAURA BOLDRINI	PRESIDENTE	Passiamo ai voti. Indìco la votazione nominale, mediante procedimento elettronico, sull'emendamento Rocchi 9.60, nel testo riformulato. Dichiaro aperta la votazione. (Segue la votazione). Gregori, Quintarelli, Bolognesi, Albini. Dichiaro chiusa la votazione. Comunico il risultato della votazione: Presenti 381 Votanti 379 Astenuti 2 Maggioranza 190 Hanno votato sì 308 Hanno votato no 71. La Camera approva (Vedi votazioni). A seguito dell'approvazione dell'emendamento Rocchi 9.60 sono preclusi gli emendamenti successivi, fino all'emendamento Chimienti 9.67. Passiamo alla votazione dell'emendamento Chimienti 9.69, sul quale vi è una riformulazione. Deputata Chimienti, accetta la riformulazione ?	
SILVIA CHIMIENTI		Sì, Presidente, ma vorrei sapere se posso intervenire sull'emendamento 9.67.	
LAURA BOLDRINI	PRESIDENTE	No, è precluso. Come ho detto, è precluso. Passiamo ai voti. Indìco la votazione nominale, mediante procedimento elettronico, sull'emendamento Chimienti 9.69, nel testo riformulato, con il parere favorevole delle relatrici di minoranza dei gruppi Sinistra Ecologia Libertà e MoVimento 5 Stelle. Dichiaro aperta la votazione. (Segue la votazione).	
SILVIA CHIMIENTI		Presidente ! Posso parlare ?	
LAURA BOLDRINI	PRESIDENTE	Deputata Chimienti, siamo in votazione, ho dichiarato aperta la votazione... Non l'ho vista, mi dispiace (Commenti dei deputati del gruppo MoVimento 5 Stelle). No, ho aperto la votazione e lei aveva parlato prima per intervenire su un altro emendamento. Lainati, Fossati, Kronbichler... Dichiaro chiusa la votazione. Comunico il risultato della votazione: Presenti 385 Votanti 377 Astenuti 8 Maggioranza 189 Hanno votato sì 366 Hanno votato no 1. La Camera approva (Vedi votazioni). Passiamo alla votazione dell'emendamento Vacca 9.71, sul quale la Commissione ha formulato un invito al ritiro, altrimenti il parere è contrario, e il parere delle relatrici di minoranza dei gruppi Movimento 5 Stelle e Sinistra Ecologia Libertà è favorevole. Se nessuno chiede di intervenire... Colleghi, se volete intervenire, rendetevi visibili ! Ha chiesto di parlare per dichiarazione di voto il deputato Luigi Gallo. Ne ha facoltà.	
LUIGI GALLO		Spero di essere abbastanza visibile. Il giudizio è favorevole.	
LAURA BOLDRINI	PRESIDENTE	La ringrazio, deputato. Ha chiesto di parlare per dichiarazione di voto, a titolo personale, la deputata Chimienti. Ne ha facoltà.	
SILVIA CHIMIENTI		Grazie, Presidente. In merito all'emendamento che è stato appena approvato, volevo dire che l'approvazione dell'emendamento proposto dal Movimento 5 Stelle introduce quanto meno un criterio, un paletto per i dirigenti scolastici, che non potranno assumere personale docente con cui siano in rapporto di parentela o affinità entro il secondo grado. Resta, però, l'impianto della chiamata diretta, a cui noi continuiamo a ribadire la nostra estrema contrarietà, perché siamo certi che alimenterà un sistema clientelare, che l'inserimento di questa correzione del MoVimento 5 Stelle non potrà assolutamente arginare.	
LAURA BOLDRINI	PRESIDENTE	Passiamo ai voti. Indìco la votazione nominale, mediante procedimento elettronico, sull'emendamento Vacca 9.71. Dichiaro aperta la votazione. (Segue la votazione). Palma, Carra, Carloni, Giachetti, Sereni... I Vicepresidenti non riescono a votare. Ferranti, Quartapelle... Dichiaro chiusa la votazione. Comunico il risultato della votazione: Presenti 386 Votanti 385 Astenuti 1 Maggioranza 193 Hanno votato sì 79 Hanno votato no 306. La Camera respinge (Vedi votazioni). (Il deputato Fossati ha segnalato di non essere riuscito ad esprimere voto contrario). Indìco la votazione nominale, mediante procedimento elettronico, sull'emendamento Centemero 9.73, con il parere contrario della Commissione, del Governo e della relatrice di minoranza del MoVimento 5 Stelle e sul quale la relatrice di minoranza di Sinistra Ecologia Libertà si è rimessa all'Aula. Dichiaro aperta la votazione. (Segue la votazione). Murer, Lattuca, La Marca, Massa... Dichiaro chiusa la votazione. Comunico il risultato della votazione: Presenti 387 Votanti 366 Astenuti 21 Maggioranza 184 Hanno votato sì 46 Hanno votato no 320. La Camera respinge (Vedi votazioni). Indìco la votazione nominale, mediante procedimento elettronico, sull'emendamento Chimienti 9.74, con il parere contrario della Commissione e del Governo e con il parere favorevole delle relatrici di minoranza di Sinistra Ecologia Libertà e del MoVimento 5 Stelle. Dichiaro aperta la votazione. (Segue la votazione). Tancredi, Gadda, Verini, Frusone... Dichiaro chiusa la votazione. Comunico il risultato della votazione: Presenti 388 Votanti 387 Astenuti 1 Maggioranza 194 Hanno votato sì 74 Hanno votato no 313. La Camera respinge (Vedi votazioni). (La deputata Gribaudo ha segnalato che non è riuscita ad esprimere voto contrario). Indìco la votazione nominale, mediante procedimento elettronico, sull'emendamento Simonetti 9.76, con il parere contrario della Commissione e del Governo e sul quale le relatrici di minoranza di Sinistra Ecologia Libertà e del MoVimento 5 Stelle si sono rimesse all'Aula. Dichiaro aperta la votazione. (Segue la votazione). Nizzi, Bergonzi, Nardi, Luigi Gallo... Dichiaro chiusa la votazione. Comunico il risultato della votazione: Presenti 388 Votanti 317 Astenuti 71 Maggioranza 159 Hanno votato sì 45 Hanno votato no 272. La Camera respinge (Vedi votazioni). (Il deputato Molea ha segnalato che non è riuscito ad esprimere voto contrario). Chiedo alla presentatrice se acceda all'invito al ritiro del suo emendamento 9.75.	
MILENA SANTERINI		Grazie, Presidente. Noi ritiriamo questo emendamento, preannunziando, però, un ordine del giorno, perché ricordiamo che, in questo momento, in Italia, ci sono ben 1.500 scuole a reggenza, il che vuol dire che mentre per il futuro stiamo potenziando il ruolo e i poteri del dirigente, in questo momento abbiamo troppe scuole che non hanno la presenza fisica continuativa di un responsabile. Abbiamo posto le premesse per risolvere questo aspetto, ma ci sarà sicuramente una fase transitoria e, quindi, mentre con un emendamento abbiamo lasciato il potenziamento, adeguandolo alla situazione attuale, e forse con le norme transitorie all'articolo 24 risolveremmo il problema, noi, nel frattempo, vogliamo sottolineare e ricordare, con molta forza, che i collaboratori che abbiamo previsto nello staff del dirigente devono poter avere l'esonero dall'insegnamento per poter adempiere al meglio alle loro funzioni.	
LAURA BOLDRINI	PRESIDENTE	Passiamo alla votazione dell'emendamento Centemero 9.72. Passiamo ai voti. Indìco la votazione nominale, mediante procedimento elettronico, sull'emendamento Centemero 9.72, con il parere contrario della Commissione e del Governo, con il parere favorevole della relatrice di minoranza del MoVimento 5 Stelle e sul quale la relatrice di minoranza di Sinistra Ecologia Libertà si rimette all'Aula. Dichiaro aperta la votazione. (Segue la votazione). Spadoni, Basilio, Grande... Dichiaro chiusa la votazione. Comunico il risultato della votazione: Presenti 384 Votanti 360 Astenuti 24 Maggioranza 181 Hanno votato sì 89 Hanno votato no 271. La Camera respinge (Vedi votazioni). (Il deputato Busto ha segnalato che non è riuscito ad esprimere voto favorevole). Passiamo alla votazione degli identici emendamenti Altieri 9.78 e Vacca 9.79. Prendo atto che il deputato Altieri ritira il suo emendamento. Passiamo ai voti. Indìco la votazione nominale, mediante procedimento elettronico, sull'emendamento Vacca 9.79, con il parere contrario della Commissione e del Governo, con il parere favorevole delle due relatrici di minoranza. Dichiaro aperta la votazione. (Segue la votazione). Nizzi, Fregolent, Fantinati... Dichiaro chiusa la votazione. Comunico il risultato della votazione: Presenti e votanti 383 Maggioranza 192 Hanno votato sì 105 Hanno votato no 278. La Camera respinge (Vedi votazioni). Indìco la votazione nominale, mediante procedimento elettronico, sull'emendamento Marzana 9.82, con il parere contrario della Commissione e del Governo, con il parere favorevole delle due relatrici di minoranza. Dichiaro aperta la votazione. (Segue la votazione). Palma, Fabbri, Pes, Gelmini... Dichiaro chiusa la votazione. Comunico il risultato della votazione: Presenti e votanti 384 Maggioranza 193 Hanno votato sì 75 Hanno votato no 309. La Camera respinge (Vedi votazioni). Indìco la votazione nominale, mediante procedimento elettronico, sull'emendamento Vacca 9.81, con il parere contrario della Commissione e del Governo e con il parere favorevole delle due relatrici di minoranza dei gruppi Sinistra Ecologia Libertà e MoVimento 5 Stelle. Dichiaro aperta la votazione. (Segue la votazione). Lo Monte, Fitzgerald Nissoli, Pilozzi, Dadone... Dichiaro chiusa la votazione. Comunico il risultato della votazione: Presenti 379 Votanti 378 Astenuti 1 Maggioranza 190 Hanno votato sì 70 Hanno votato no 308. La Camera respinge (Vedi votazioni). Indìco la votazione nominale, mediante procedimento elettronico, sull'emendamento Simonetti 9.86, con il parere contrario della Commissione e del Governo e sul quale le due relatrici di minoranza dei gruppi Sinistra Ecologia Libertà e MoVimento 5 Stelle si rimettono all'Aula. Dichiaro aperta la votazione. (Segue la votazione). Piras, Fregolent... Dichiaro chiusa la votazione. Comunico il risultato della votazione: Presenti 379 Votanti 315 Astenuti 64 Maggioranza 158 Hanno votato sì 13 Hanno votato no 302. La Camera respinge (Vedi votazioni). Indìco la votazione nominale, mediante procedimento elettronico, sull'emendamento Rampelli 9.68, su cui vi è il parere contrario della Commissione e del Governo, sul quale la relatrice di minoranza di Sinistra Ecologia Libertà si rimette all'Aula e con il parere favorevole della relatrice del gruppo MoVimento 5 Stelle. Dichiaro aperta la votazione. (Segue la votazione). Dell'Aringa, Magorno... Dichiaro chiusa la votazione. Comunico il risultato della votazione: Presenti 385 Votanti 371 Astenuti 14 Maggioranza 186 Hanno votato sì 58 Hanno votato no 313. La Camera respinge (Vedi votazioni). Indìco la votazione nominale, mediante procedimento elettronico, sull'emendamento Luigi Gallo 9.89, con il parere contrario della Commissione e del Governo e con il parere favorevole delle due relatrici di minoranza di Sinistra Ecologia Libertà e del MoVimento 5 Stelle. Dichiaro aperta la votazione. (Segue la votazione). Palma... Dichiaro chiusa la votazione. Comunico il risultato della votazione: Presenti 385 Votanti 384 Astenuti 1 Maggioranza 193 Hanno votato sì 68 Hanno votato no 316. La Camera respinge (Vedi votazioni). (Il deputato Vazio ha segnalato che non è riuscito ad esprimere voto contrario). Indìco la votazione nominale, mediante procedimento elettronico, sull'emendamento 9.500 da votare ai sensi dell'articolo 86, comma 4-bis del Regolamento, con il parere favorevole della Commissione e del Governo e con il parere contrario delle due relatrici di minoranza dei gruppi Sinistra Ecologia Libertà e MoVimento 5 Stelle. Dichiaro aperta la votazione. (Segue la votazione). Tutti hanno votato ? Dichiaro chiusa la votazione. Comunico il risultato della votazione: Presenti e votanti 389 Maggioranza 195 Hanno votato sì 298 Hanno votato no 91. La Camera approva (Vedi votazioni). (Il deputato Lattuca ha segnalato che non è riuscito ad esprimere voto favorevole). Indìco la votazione nominale, mediante procedimento elettronico, sull'emendamento Baldassarre 9.102, con il parere contrario della Commissione e del Governo, con il parere favorevole della relatrice di minoranza del MoVimento 5 Stelle e sul quale la relatrice di minoranza di SEL si rimette all'Aula. Dichiaro aperta la votazione. (Segue la votazione). Pilozzi, Calipari. Dichiaro chiusa la votazione. Comunico il risultato della votazione: Presenti 390 Votanti 371 Astenuti 19 Maggioranza 186 Hanno votato sì 67 Hanno votato no 304. La Camera respinge (Vedi votazioni). Indìco la votazione nominale, mediante procedimento elettronico, sull'emendamento Baldassarre 9.99, con il parere contrario della Commissione e del Governo, con il parere favorevole della relatrice di minoranza del MoVimento 5 Stelle e sul quale la relatrice di minoranza di SEL si rimette all'Aula. Dichiaro aperta la votazione. (Segue la votazione). Malpezzi. Dichiaro chiusa la votazione. Comunico il risultato della votazione: Presenti 385 Votanti 366 Astenuti 19 Maggioranza 184 Hanno votato sì 56 Hanno votato no 310. La Camera respinge (Vedi votazioni). (I deputati Pes e Faraone hanno segnalato che non sono riusciti ad esprimere voto contrario). Passiamo alla votazione dell'emendamento Chimienti 9.101, con il parere contrario della Commissione e del Governo e con il parere favorevole delle relatrici di minoranza. Avverto che il gruppo MoVimento 5 Stelle ha esaurito i tempi previsti dal contingentamento. Essendone stata fatta richiesta, la Presidenza concederà a questo gruppo un aumento dei tempi pari ad un terzo di quelli originariamente stabiliti. Ha chiesto di parlare per dichiarazione di voto il deputato Luigi Gallo. Ne ha facoltà.	
LUIGI GALLO		Annuncio il voto favorevole del MoVimento 5 Stelle.	
LAURA BOLDRINI	PRESIDENTE	Ha chiesto di parlare per dichiarazione di voto, a titolo personale, la deputata Chimienti. Ne ha facoltà.	
SILVIA CHIMIENTI		Grazie, Presidente. L'apertura del Governo a una riduzione del numero di alunni per classe risulta purtroppo, come in molti casi all'interno di questo disegno di legge, una mera dichiarazione di principio, che non si tradurrà mai in iniziative concrete. In questo, come in altri casi, mancano, infatti, specifici stanziamenti di risorse per consentire che da un elenco di utopistici desiderata si passi a iniziative tangibili. Un vero passo in avanti sarebbe quello di fissare un arco temporale di tre anni entro cui si possa giungere ad avere un massimo di 22 alunni per classe: una misura di buon senso che renderebbe davvero la nostra scuola migliore e davvero la nostra didattica più efficiente e più personalizzata. Quindi, al taglio epocale di 90 mila cattedre operato dalla Gelmini, che è il principale motivo per cui oggi ci troviamo con classi di 35 alunni, si deve rispondere con un'iniziativa forte e decisa e non con parole generiche e fumose. Per questo, se davvero vogliamo combattere il fenomeno delle «classi pollaio», è necessario approvare questo emendamento (Applausi dei deputati del gruppo MoVimento 5 Stelle).	
