speaker	role	text	extra
LELLO DI GIOIA		Signor Presidente, quello che stiamo attraversando è un momento particolarmente delicato e difficile. I dati sulla disoccupazione credo che debbano far riflettere. In alcune realtà del Mezzogiorno d'Italia abbiamo raggiunto limiti insostenibili, in alcuni casi addirittura il 60 per cento della disoccupazione giovanile. E, quindi, urge di fatto una riforma del mercato del lavoro, una riforma seria, una riforma capace di fare e di intercettare quelli che possono essere i flussi di investimento e di crescita che questo Paese dovrà avere, perché, al di là di quello che può essere la riforma in quanto tale, noi crediamo che, per far crescere l'occupazione, c’è bisogno di investimento, di crescita e quindi di fare in modo che il mercato del lavoro si colleghi al momento di crescita del Paese. Pur tuttavia riteniamo che questa delega, che noi oggi conferiamo al Governo, abbia degli aspetti positivi, come anche degli aspetti sostanzialmente negativi. Vorrei partire dagli aspetti positivi di questa delega che noi concediamo al Governo, partendo dalla cosiddetta riforma della cassa integrazione, dove riteniamo che sia opportuno che si intervenga, si è intervenuto: nella legge di stabilità sono state inserite delle risorse, io direi poche, in virtù di quelle che sono le crisi che noi stiamo vivendo in questo particolare momento. Riteniamo importante che si vada a definire quell'aspetto universale, che crea le condizioni per cui tutti coloro i quali perdono il lavoro, tutti coloro i quali vivono nella precarietà, possono avere questo «sussidio», come esiste in tanti Paesi a democrazia avanzata della nostra Europa. Pur tuttavia, vi sono poche disponibilità finanziarie e nella riforma dei cosiddetti ammortizzatori sociali noi crediamo che non sia opportuno fare in modo che coloro i quali perdono il posto di lavoro, perché vi è una chiusura di un ramo d'azienda o perché vi è una chiusura di un pezzo di azienda, non abbiano la possibilità di poter accedere a questa modifica che riguarda appunto gli ammortizzatori sociali. Come riteniamo che sia importante aver determinato la possibilità per le madri lavoratrici di avere l'estensione delle tutele che riguardano appunto il lavoro e la salute. Il lavoro per ciò che riguarda le madri lavoratrici e per ciò che riguarda la loro possibilità di essere madri, sia per coloro che sono lavoratrici subordinate, sia per coloro che hanno una precarietà. E riteniamo che sia altresì importante il fatto, che già esiste in altri Paesi d'Europa, come per esempio la Francia, che nella stessa attività lavorativa ci sia la possibilità di poter mettere insieme le cosiddette ore che vengono attribuite per un lavoro in più e, quindi, di poterle fare utilizzare a coloro i quali hanno la necessità di dover accudire i propri figli, che hanno difficoltà e che si trovano in difficoltà e in disagio. Quindi, vi sono aspetti importanti in questa delega, come dicevo precedentemente, come, per esempio, la questione di poter inserire a livello legislativo il cosiddetto minimo contrattuale e come, per esempio, in un momento in cui si chiude un'attività lavorativa e quindi se ne apre un'altra, la possibilità che il lavoratore abbia un demansionamento della sua attività e del suo posto di lavoro. Ma vi sono aspetti negativi e io credo sia giusto sottolinearlo con grande determinazione e forza. Prima questione: ma è mai possibile che si possono accentuare i problemi che riguardano (Nelle tribune riservate al pubblico si indossano magliette recanti la scritta: «FIOM» – Applausi dei deputati del gruppo Sinistra Ecologia Libertà)...	
LUIGI DI MAIO	PRESIDENTE	Chiedo ai commessi di allontanare i soggetti che in questo momento sono...	
LELLO DI GIOIA		la vigilanza...	
LUIGI DI MAIO	PRESIDENTE	Aspetti, deputato Di Gioia, aspetti, per favore ! Chiedo ai commessi di allontanare... no, non si possono ostentare simboli, per favore ! Chiedo ai commessi di allontanare...vi ringrazio. Prego deputato Di Gioia, andiamo avanti.	
LELLO DI GIOIA		Al di là adesso di sventolare simboli, mi sembra che abbiano alcune ragioni i lavoratori che rappresentano il mondo del lavoro. Dicevo che mi sembra quanto mai assurdo che si possano accentuare i controlli, anche se sono definiti sugli impianti. E mi sembra quanto mai inopportuno che, in un momento in cui si va a definire la questione della cosiddetta garanzia progressiva, non si vada a chiarire con puntualità quelli che sono in buona sostanza, come tutti quanti abbiamo sempre definito, i problemi del cosiddetto articolo 18. Vede, signor sottosegretario o signora sottosegretaria, non è una questione di poter dire: noi passiamo a garantire i cosiddetti contratti a tempo indeterminato. Certo, è un fatto importante, per carità, nel momento in cui vi è una grande precarietà, ma io le chiedo: è possibile in questo Paese, nel momento in cui vi è mancanza di diritti, diminuire le garanzie per i lavoratori ? Io credo che questo non sia possibile. Io credo che voi dovete rivedere, all'interno della delega, quelle che sono le garanzie progressive per i lavoratori, che vengono ad essere date nel momento in cui il lavoratore oggettivamente può essere vessato all'interno di una realtà lavorativa. Perché, anche quello che è il cosiddetto licenziamento da un punto di vista disciplinare è già previsto dalla legge Fornero, quando ci dice che si può essere licenziati o non si può essere licenziati semplicemente quando il licenziamento è nullo o nel momento in cui vi sono i cosiddetti provvedimenti disciplinari previsti da contratto. Ma come si fa a dire: «vogliamo la delega per quanto riguarda l'articolo 18». quando già vi sono dei parametri definiti ? La mia preoccupazione è che si vanno ancora a diminuire le garanzie per un lavoratore e le cosiddette tutele progressive vengono a determinare comunque dei contratti non a tempo indeterminato ma dei contratti di precarizzazione del mondo del lavoro. Come, d'altronde, anche per quanto riguarda le questioni della discriminazione, credo vi sia bisogno di rinnovare con forza il mercato del lavoro ma dobbiamo costruire le garanzie per i lavoratori in una società che ha sempre meno diritti. Io credo che questo debba essere il presupposto su cui si avvia un ragionamento e su cui vi deve essere una riflessione di fatto da parte del Governo perché, come dicevo in premessa, certo il mercato del lavoro bisogna modificarlo, certo c’è bisogno di adeguare anche lo Statuto dei lavoratori, ma, per far crescere e per avere l'occupazione in questo Paese, c’è bisogno di investimenti, c’è bisogno di una politica industriale che oggi non vediamo all'orizzonte per ciò che riguarda gli impegni del Governo. Il gruppo socialista ha sollevato queste critiche come d'altronde ha esaltato – mi avvio alle conclusioni – le parti positive di questo provvedimento. Noi vogliamo ancora dare fiducia al Governo. Vogliamo dargli fiducia, sapendo ed essendo convinti che vi è bisogno di modificare il mercato del lavoro, sapendo che vi è bisogno di fare investimenti per fare crescita, sapendo che vi è bisogno di una politica industriale che oggi non c’è; ma siamo profondamente convinti che, se il Governo accetta le idee, i progetti, i programmi, le iniziative che il Partito Socialista ha messo in piedi in questi mesi, credo si possa avviare un grande processo di rinnovamento e anche di sviluppo e di occupazione. Vi diamo credito e votiamo a favore di questa delega.	
LUIGI DI MAIO	PRESIDENTE	Ha chiesto di parlare per dichiarazione di voto il deputato Buttiglione. Ne ha facoltà.	
ROCCO BUTTIGLIONE		Signor Presidente, abbiamo ascoltato con grande attenzione il dibattito a tratti appassionato che si è svolto in quest'aula e credo di poter dire di aver capito e anche di condividere molte ragioni dell'opposizione. Vorrei dire ai colleghi della sinistra e anche ai colleghi del MoVimento 5 Stelle: avete molte ragioni ma non avete ragione e cercherò di dirvi perché. L'articolo 18 dello Statuto dei lavoratori è stato a suo tempo una grande conquista di civiltà. Marx ha spiegato già nel 1848 nel Manifesto del Partito Comunista che, nel sistema capitalista, il lavoratore salariato è separato dai mezzi di produzione e la sua esistenza è una variabile dipendente dal sistema di produzione. Se di lui non c’è bisogno, può essere licenziato, emarginato e può anche morire di fame. Al centro del sistema capitalistico non c’è l'uomo con i suoi bisogni ma il capitale con la sua domanda di profitto. T. S. Eliot ha dato un'espressione poetica insuperabile a questa situazione di alienazione nel suo Canto dei disoccupati: con le mani in tasca, le teste abbassate ci aggiriamo nelle piazze o rabbrividiamo in stanze senza luce. Solo il vento si muove sui campi vuoti, incolti, dove l'aratro è fermo, ad angolo con il solco. In questa terra ci sarà una sigaretta per due uomini, per due donne mezza pinta di birra amara. In questa terra nessun uomo ci ha dato un lavoro. Il Corriere della Sera non annuncia la nostra nascita e non dà notizia della nostra morte. È il ritratto dell'alienazione. L'articolo 18 afferma, in qualche modo, una proprietà del lavoratore sul posto di lavoro e ricostruisce quel legame tra il lavoratore e il lavoro che il capitalismo aveva spezzato. È questo il significato simbolico dell'articolo 18 e questo spiega sia la passione con cui è stato difeso, sia l'amarezza con la quale noi ci apprestiamo a votare – perché questa è la sostanza delle cose – la sua abolizione. In un certo senso, in una certa visione simbolica, l'articolo 18 era il centro dello Statuto dei lavoratori: l'affermazione del fatto che il lavoratore non è una merce. Perché, allora, ci apprestiamo a votare questo provvedimento ? Il mondo è cambiato, cari amici, e fondamentalmente per due ragioni. La prima è che si è accelerato drammaticamente il ritmo del cambiamento tecnologico e questo fa scomparire interi mestieri e settori produttivi. La seconda è che sono entrati nel mercato mondiale i popoli poveri, che prima erano rassegnati a morire di fame, al margine del mercato mondiale o fuori di esso. I lavoratori di quei Paesi accettano di lavorare per salari di molto inferiori a ciò che noi consideriamo come accettabile. Se molte cose oggi si fanno con l'alluminio e non con l'acciaio, è inevitabile che molti posti di lavoro dell'acciaio scompaiano: non c’è cassa integrazione che li possa far rivivere. La cassa integrazione serviva ad un'altra cosa: per le oscillazioni periodiche del mercato. Noi abbiamo tanti posti di lavoro che non torneranno, sono scomparsi: il cambiamento tecnologico li ha fatti scomparire. Se i cinesi fanno le magliette a costi molto più bassi dei nostri, la produzione delle magliette si farà in Cina e non in Italia, non c’è nessuno che lo possa impedire. Forse, si potrebbe impedire alle magliette cinesi di essere vendute in Italia, ma non possiamo impedire agli americani, che prima compravano magliette italiane, di comprare adesso magliette cinesi. Il problema, oggi, non si può più porre in termini di difesa del posto di lavoro: il problema è di difendere i lavoratori, accompagnandoli da un posto di lavoro ad un altro posto di lavoro. Per questo serve orientamento professionale per dire dove nascono i posti di lavoro nuovi, formazione professionale per imparare a svolgere nuove mansioni lavorative, un sostegno economico per vivere il tempo di questo passaggio da un posto di lavoro all'altro posto di lavoro. Ecco, mi sembra che il dibattito si sia concentrato, forse, troppo sulla difesa del vecchio sistema di protezione del lavoro e troppo poco su di un'analisi effettiva delle garanzie, delle caratteristiche del nuovo sistema di protezione, che è problematico. Orientamento e formazione costano: saranno sufficienti le risorse dedicate a questo scopo ? È considerato in modo adeguato il nuovo sistema di protezione dei lavoratori e non più del lavoro ? Sapremo gestire la transizione da un sistema all'altro ? C’è del vero nella critica dell'opposizione ad un eccesso di deleghe nel provvedimento che ci accingiamo ad approvare, però, sommessamente, mi permetto di osservare: voi pensate che sia possibile discutere ed approvare in Parlamento un provvedimento complesso, quando l'opposizione fa dell'ostruzionismo non uno strumento estremo, ma il metodo ordinario della sua azione nell'Aula ? Non è possibile. È evidente che questa scelta dell'opposizione forza il Governo all'uso della delega; ed è ancora andata bene che ha usato solo la delega e non il voto di fiducia. Se vogliamo un'altra modalità di fare le leggi, occorre che tutti quanti facciamo un passo l'uno verso l'altro. Adesso non voglio dire se è stato prima il Governo o prima l'opposizione, ma, in ogni caso, se andiamo avanti in questo modo, l'unica possibilità è quella della delega e del voto di fiducia. Un grande economista tedesco-americano Gunther Briefs ha spiegato una volta che ci sono due modi per far crescere la competitività; perché, vedete, la prima questione è quella della competitività, il primo diritto del lavoratore è di lavorare, di avere un lavoro. È inutile rivendicare i diritti del lavoro, i diritti dei lavoratori se i mercati non comprano le merci che il lavoro produce e, perché i mercati comprino le merci che il lavoro produce, dobbiamo essere produttivi. Ci sono due modi di essere produttivi, uno è quello di investire in innovazione, ricerca tecnologica, innovazione di processo, innovazione di prodotto, fare cose che gli altri non sanno fare oppure fare le cose che fanno tutti, ma con metodologie tali che gli altri non le sanno applicare. Allora, non c’è la competizione sul prezzo, chi vuole comprare quelle cose da te deve venire o, almeno, puoi cercare di collocarti in una competizione con i livelli alti del mercato del lavoro mondiale, con gli americani; anche se ti paghiamo un salario un po’ più basso degli americani, si vive bene lo stesso. L'altro modo è quello di diminuire i salari e le protezioni del lavoro, quando finisci col fare la competizione con i cinesi. È ovvio che il primo modello vince sempre, il secondo non dura, il secondo può durare per un po’, può dilazionare la sconfitta, ma alla lunga è un modello perdente. Ecco, ho il sospetto che i Paesi che non investono tempestivamente sull'innovazione possono trovarsi costretti a comprimere i diritti del lavoro. Voglia Dio che non venga quel giorno per l'Italia, voglia Dio che non sia già venuto quel giorno per l'Italia, perché io non nego che alcune cose che voi avete detto non sono sbagliate, nel senso che noi rischiamo di costruire un nuovo sistema di protezione dei lavoratori – che va costruito comunque – ma che potrebbe non dare tutte le garanzie che sarebbero necessarie o potrebbe dare non più, ma meno garanzie del vecchio sistema che comunque non può essere salvato. Ecco, non è possibile discutere in quest'Aula di questi problemi, ignorando la situazione drammatica della nostra economia, invocando più diritti, come se il dare più diritti fosse qualcosa che dipende dalla buona volontà del Governo o non so di chi, dalla buona volontà del Parlamento; votiamo leggi che diano più diritti ma se poi non siamo in grado, con le leggi che danno più diritti, di vendere di più sui mercati mondiali, questi diritti significano più disoccupazione e rimangono scritti sull'acqua. È questo il problema drammatico che sta davanti a noi; non è possibile sottrarsi a questa situazione, aumentando la domanda interna. Rilanciamo la domanda interna; come ? Facendo più debiti ? E non è l'Europa che ci impedisce di fare più debiti. Guardate, gli ammonimenti della Commissione europea sono come i cartelli «attenti al cane» che trovate sul cancello di una casa, di una villetta. Se vi fermate non è perché avete paura del cartello, è perché avete paura del cane, e il cane sono i risparmiatori. Con un debito alto come quello che abbiamo, se andiamo a chiedere ancora più soldi in prestito ai risparmiatori – non ai mercati, i mercati sono i risparmiatori, i mercati siete voi, siamo noi quando andiamo a comprare o non andiamo a comprare i titoli di Stato – se chiediamo ancora più denari, non ce li danno, al di là di qualunque discussione teoretica sul funzionamento dei modelli keynesiani o il non funzionamento dei modelli keynesiani. Il dato di realtà è questo: dato il nostro elevato debito pubblico – e anche per altre ragioni naturalmente, ma anche soltanto per questa – l'unico cammino che ci è aperto davanti è quello del miglioramento della competitività e dell'attrazione di capitali e allora noi votiamo con convinzione, ma anche con una certa amarezza questo provvedimento e attendiamo misure, le quali migliorino la competitività di sistema...	
LUIGI DI MAIO	PRESIDENTE	Collega, dovrebbe concludere.	
ROCCO BUTTIGLIONE		Mi avvio a concludere, Presidente. Attendiamo misure che annuncino investimenti sulla ricerca scientifica, sull'innovazione, sulla logistica, investimenti sull'attrazione di capitali. Saranno sufficienti le risorse che sapremo mobilitare per questo ? Perché indubbiamente non sarà questo provvedimento a riportare il lavoro; il lavoro viene se ci sono investimenti, se ci sono iniziative, se siamo competitivi sui mercati internazionali.	
LUIGI DI MAIO	PRESIDENTE	Collega, deve concludere.	
ROCCO BUTTIGLIONE		Questo provvedimento elimina alcuni ostacoli, offre protezione in un mondo che è cambiato. Per fare tutto questo, occorre uno sforzo corale di tutti e anche un dialogo diverso tra maggioranza e opposizione. Questo mi auguro che possa essere nello sforzo, nelle intenzioni e nell'impegno di tutti noi.	
LUIGI DI MAIO	PRESIDENTE	Ha chiesto di parlare per dichiarazione di voto il collega Prataviera. Ne ha facoltà.	
EMANUELE PRATAVIERA		Signor Presidente, Ministro, sottosegretari, onorevoli colleghi, eccoci finalmente all'esame finale del cosiddetto Jobs Act, così chiacchierato in TV, radio e giornali da diventare di fatto un mantra per le orecchie dei nostri concittadini. Eppure, se chiedessimo cosa c’è veramente scritto all'interno di questo provvedimento, oltre all'articolo 18, che, tra l'altro, non è neppure citato e nemmeno contenuto all'interno di questo disegno di legge delega, nessuno saprebbe rispondere. In realtà, è un assegno in bianco al Governo, questo è sicuro. Un assegno che state per regalare ad un Governo e ad un Ministro, qui presente, che in Aula ha talmente contribuito al confronto parlamentare, senza nemmeno proferire una parola, che si potrebbe definire la sua presenza come quella di una braciola ad una cena di vegani. Quello che è sicuro è che, grazie al Presidente del Consiglio, si è svegliato Frankenstein: si è svegliato il sindacato, proprio quel sindacato che sembrava bell'addormentato tre anni fa, mentre una parte di voi approvava la cosiddetta riforma Fornero. Un sindacato che è tornato forte in piazza, usando anche toni forti, come quelli usati da Landini pochi giorni fa, salvo poi ritrattare e ritornare sui propri passi, perché, certo, in gioco ci sono 150 milioni di euro – che usate proprio come ricatto verso il sindacato – di mancati trasferimenti ai patronati e ai CAF. Perché questo è ormai il mondo in cui viviamo, in cui, grazie anche ad un'opinione pubblica che è stata addomesticata dai media, è più facile credere che, eliminando una norma a garanzia del posto di lavoro, si creino automaticamente centinaia di migliaia di posti di lavoro. Questa è la vera demagogia e questa è la demagogia di Renzi, lo stesso Renzi che, pochi mesi prima di presentare questo provvedimento, aveva affermato che, di fatto, l'articolo 18 non serve a nulla per rilanciare l'occupazione e che i veri problemi sono altri, per chi assume. Eppure, la verità è che l'articolo 18 è di fatto un'arma di distrazione di massa ma anche un grande regalo per Confindustria. Un grande regalo per Confindustria, che però non aiuterà i nostri imprenditori, non aiuterà gli artigiani, non aiuterà i professionisti, e questo perché è mancato il coraggio di cancellare la riforma Fornero, anche se noi ci proveremo comunque, portando la gente a votare il nostro referendum. Non avete voluto liberare le energie dei nostri imprenditori, eliminando gli studi di settore e soprattutto stanando i veri evasori fiscali, che non sono i baristi che non battono lo scontrino del caffè e neppure gli artigiani, sempre più abbandonati a loro stessi. Se Renzi pensa di rilanciare i consumi con questo provvedimento, facendo in modo che vengano assunti dei nuovi giovani a tempo indeterminato con questa famosa clausola delle tutele crescenti, di fatto, diciamo fin da subito che il compromesso del nuovo contratto a tutele crescenti, con questa clausola, non avrà come frutto il rilancio dell'economia, perché, se un giovane verrà assunto con questo contratto e andrà in banca a chiedere un mutuo, questo non gli verrà concesso, perché di fatto si precarizza ancora di più rispetto agli attuali sistemi contrattuali. Per i nuovi ammortizzatori sociali avete bocciato completamente la nostra proposta di dare diritto di accesso prioritario ai nostri concittadini e avete votato anche contro i nostri emendamenti per l'eliminazione delle pensioni d'oro a favore degli esodati, che sono delle persone, persone che voi avete deciso di dimenticare. Altro che giustizia sociale; non avete neppure voluto scrivere nero su bianco che i nuovi ammortizzatori sociali siano almeno pari agli attuali, come importi. E vogliamo parlare dei cinque milioni di famiglie monoreddito, anche pensionati, che rischiano di perdere fino a 1.000 euro all'anno di sgravi fiscali per il coniuge a carico ? Queste sono nuove tasse, però regalate il bonus bebè agli immigrati. Sì, da qualche parte bisogna pur togliere, per dare ai nuovi italiani, e intanto il «polentone» paga. E mentre vediamo cadere in prescrizione le responsabilità verso le oltre tremila vittime dell'amianto dell'Eternit, avete bocciato il nostro emendamento per sostenere economicamente i lavoratori malati di cancro e di tumore, sia dipendenti che autonomi, senza alcuna vergogna. Così come non mostrate vergogna con il compromesso fatto, per cui i nuovi neoassunti avranno di fatto meno tutele di quelli che oggi chiamate precari. Eppure non sono l'unico, ed ero pure sobrio, un anno e mezzo fa, solo un anno e mezzo fa in campagna elettorale, quando eravate voi del PD che dicevate che bisognava eliminare il precariato. Non si creano posti di lavoro mescolando le carte: la tassazione nelle nostre aziende è al 70 per cento. Siamo i primi della classe in questo in Europa ! Come volete che si creino dei posti di lavoro, se chi deve assumere paga il 70 per cento delle tasse rispetto a quello che guadagna ? Ah no, già, beh, voi considerate gli imprenditori inadeguati – come avete avuto modo di dire più di qualche volta anche in incontri pubblici – a competere nel mercato globale. Eppure io ho visto e ho vissuto con persone che con la terza media, non con lauree o master o specializzazioni internazionali, hanno dato lavoro a centinaia di persone. E stiamo assistendo tutti, tutti ad un dramma: imprenditori che piuttosto di lasciare a casa i propri dipendenti si suicidano all'interno delle proprie fabbriche. E la risposta a questi drammi è la campagna elettorale permanente di Renzi ! E così continua a favorire anche la fuga dei cervelli, l'emigrazione di tanti giovani: che uno su due sono a casa, e molti di questi non si svegliano neppure la mattina con la voglia di aggredire la vita, di andare in cerca di un posto di lavoro per realizzarsi, condannati a non potersi realizzare, a non potersi fare una famiglia, a non poter fare figli per i problemi economici. Onorevoli colleghi, che futuro ha una società che permette che i propri figli non generino a loro volta figli ? È una società che non ha futuro, quantomeno non ha futuro così come l'abbiamo conosciuta fino adesso, e come noi della Lega vorremmo continuare a difendere ! 3 milioni 240 mila disoccupati aspettavano risposte concrete. Molti hanno sicuramente votato Renzi; ma hanno aspettato invano e hanno confidato invano, perché in questo provvedimento non troveranno di fatto nessun aiuto alla loro condizione di instabilità. Noi ci avevamo provato, Ministro, Presidente e colleghi: ci avevamo provato con serietà a collaborare e migliorare il testo, sia in Commissione che fuori Commissione, nelle chiacchierate informali, che qui in Aula, con un atteggiamento più che responsabile, perché questo è un tema che merita responsabilità. Ma voi di fatto ce lo avete impedito: ce lo avete impedito perché in questo provvedimento ha prevalso di fatto il senso di onnipotenza di Renzi e del suo Governo, e quello che è ancora più grave, ha prevalso il senso di inciucio, la pratica dell'inciucio, per mantenere il sedere di Alfano bello stretto alla sua sedia di Governo. È stata un'occasione persa, onorevoli colleghi: noi lo denunciamo, lo denunciamo con forza, ed è per questo che voteremo contrario (Applausi dei deputati del gruppo Lega Nord e Autonomie).	
LUIGI DI MAIO	PRESIDENTE	Ha chiesto di parlare per dichiarazione di voto il collega Airaudo. Ne ha facoltà.	
