speaker	role	text	extra
			PRESIDENZA DEL VICEPRESIDENTE ROBERTO GIACHETTI
			La seduta comincia alle 14,05.
			Missioni.
ANNALISA PANNARALE	Segretario	legge il processo verbale della seduta del 17 luglio 2013. (È approvato).	
			Preavviso di votazioni elettroniche (ore 14,07).
ROBERTO GIACHETTI	PRESIDENTE	Comunico che, ai sensi dell'articolo 46, comma 2, del Regolamento, i deputati Abrignani, Alfreider, Boccia, Bonavitacola, Bonifazi, Michele Bordo, Bueno, Caparini, Carbone, Caruso, Dambruoso, Dellai, Ferranti, Fico, Fitzgerald Nissoli, Gregorio Fontana, Fontanelli, Garavini, Ginefra, Giancarlo Giorgetti, Greco, La Russa, Leva, Migliore, Porta, Rostan, Speranza, Tacconi, Venittelli e Vito sono in missione a decorrere dalla seduta odierna. Pertanto i deputati in missione sono complessivamente settantacinque, come risulta dall'elenco depositato presso la Presidenza e che sarà pubblicato nell’allegato A al resoconto della seduta odierna. Ulteriori comunicazioni all'Assemblea saranno pubblicate nell’allegato A al resoconto della seduta odierna.	
			Trasmissione dal Senato di un disegno di legge di conversione e sua assegnazione a Commissioni in sede referente.
ROBERTO GIACHETTI	PRESIDENTE	Poiché nel corso della seduta potranno aver luogo votazioni mediante procedimento elettronico, decorrono da questo momento i termini di preavviso di cinque e venti minuti previsti dall'articolo 49, comma 5, del Regolamento.	
			Per richiami al Regolamento (ore 14,10).
ROBERTO GIACHETTI	PRESIDENTE	Il Presidente del Senato ha trasmesso alla Presidenza il seguente disegno di legge, che è assegnato, ai sensi dell'articolo 96-bis, comma 1, del Regolamento, in sede referente, alle Commissioni riunite I (Affari costituzionali) e V (Bilancio): S. 974. – «Conversione in legge, con modificazioni, del decreto-legge 21 giugno 2013, n. 69, recante disposizioni urgenti per il rilancio dell'economia» (Approvato dalla Camera e modificato dal Senato) (1248-B) – Parere delle Commissioni II (ex articolo 73, comma 1-bis, del Regolamento, per le disposizioni in materia di sanzioni), III, VI (ex articolo 73, comma 1-bis, del Regolamento, per gli aspetti attinenti alla materia tributaria), VII, VIII (ex articolo 73, comma 1-bis, del Regolamento), IX, X (ex articolo 73, comma 1-bis, del Regolamento), XI, XII, XIII e XIV. Il suddetto disegno di legge, ai fini dell'espressione del parere previsto dal comma 1 del predetto articolo 96-bis, è altresì assegnato al Comitato per la legislazione. Poiché il suddetto disegno di legge è iscritto nel calendario dei lavori dell'Assemblea per l'8 agosto 2013, ai sensi del comma 5 dell'articolo 96-bis del Regolamento, i termini di cui ai commi 3 e 4 del medesimo articolo si intendono conseguentemente adeguati.	
MASSIMO ENRICO CORSARO		Chiedo di parlare.	
ROBERTO GIACHETTI	PRESIDENTE	Ne ha facoltà. Se le posso chiedere anche l'articolo del Regolamento, grazie.	
MASSIMO ENRICO CORSARO		Signor Presidente, sostanzialmente a un numero di articoli molteplice, per cominciare gli articoli 86 e 90 del Regolamento...	
ROBERTO GIACHETTI	PRESIDENTE	Bene, grazie.	
MASSIMO ENRICO CORSARO		perché, in realtà, il nostro intervento è volto a denunciare quella che, a nostro avviso, è una grave irregolarità che si è svolta ieri sera in Aula in fase di approvazione del decreto che era discussione e, parallelamente, annunciare pubblicamente quelli che saranno gli atti conseguenti che Fratelli d'Italia intende assumere. Per ricordare gli accadimenti, signor Presidente, ieri sera, per la precisione alle 21,24, quando era sostanzialmente indetta la votazione finale del disegno di legge di conversione del decreto-legge sull'IVA, il Presidente di turno ha annunciato di avere ricevuto una comunicazione dal Presidente del Senato che comunicava come il testo che era stato trasmesso dal Senato alla Camera e sul quale, conseguentemente, i colleghi deputati tutti si erano trovati ad operare, tanto nelle Commissioni quanto in Aula, era differente da quello che era stato votato e validato dall'altro ramo del Parlamento. Segnatamente, signor Presidente, la parte che ci è stata indicata essere esclusa dal testo approvato dal Senato e sul quale, viceversa, aveva lavorato la Camera dei deputati è al comma 16-quinquies dell'articolo 9 del provvedimento che era in approvazione, sulle parole che includono, tra le persone che hanno diritto ad avere il mantenimento della tutela del loro posto di lavoro, coloro che sono stati assunti dagli enti di ricerca, dall'Istituto superiore di sanità, dall'Istituto nazionale per l'assicurazione contro gli infortuni sul lavoro, dall'Agenzia nazionale per i servizi sanitari regionali, dall'Agenzia italiana del farmaco, dall'Agenzia spaziale italiana, dall'Agenzia nazionale per le nuove tecnologie, l'energia e lo sviluppo economico sostenibile, dall'Agenzia per l'Italia digitale, insomma assunti da queste agenzie per progetti finalizzati al miglioramento di servizi, anche didattici per gli studenti. Io non conosco, evidentemente, allo stato, il dimensionamento della platea di cui stiamo parlando, ma, certamente, vi è un numero considerevole di persone che sono state assunte da queste agenzie e che vedono dalla espunzione di questa norma di salvaguardia prevista dal testo sul quale ha lavorato la Camera dei deputati, evidentemente, un pericolo di perdita del posto di lavoro. Al di là di questo, che sarà un elemento di discussione successiva, anche in ordine agli innumerevoli e inevitabili contenziosi che da questa determinazione trarranno spunto, il tema che mi preme, e che ci preme, in questa sede sottolineare è che, di tutta evidenza, questo pezzo di testo che è stato espunto dal Senato – ma che, invece, era, a coscienza di tutti i deputati, parte integrante del provvedimento sul quale abbiamo lavorato e sul quale eravamo in quel momento chiamati ad apporre la votazione finale – non può essere considerato alla stregua di un mero coordinamento formale del testo; elemento che lei, signor Presidente, sa benissimo essere l'unico riferimento previsto dall'articolo 90 del Regolamento, perché, in sede di votazione finale, alla Presidenza sia consentito modificare letteralmente la proposizione del testo sul quale l'Aula ha lavorato. Si tratta, viceversa, di un tema sostanziale, che coinvolge diritti acquisiti.	
ROBERTO GIACHETTI	PRESIDENTE	Scusi, onorevole Corsaro, siccome l'argomento è un argomento delicato, che ci ha anche appassionato tutta la giornata di ieri, pregherei chi non è interessato alla discussione o ad uscire, o a stare in silenzio, perché è utile che ascoltiamo i colleghi che vogliano intervenire su questo tema. Ha ancora un minuto, onorevole Corsaro. Prego.	
MASSIMO ENRICO CORSARO		Signor Presidente, noi abbiamo chiesto ripetutamente che, in ragione di questo, il provvedimento venisse rinviato nelle Commissioni o che, alla peggio, venisse dato tempo alle forze politiche per prendere contezza di quello che era successo. È stato comunque, nonostante la nostra richiesta, deciso di riunire il Comitato dei diciotto, al di là della propria competenza, perché il Comitato dei nove, all'articolo 86, comma 3, del Regolamento, ha tra le sue competenze l'esame di nuovi emendamenti e di articoli aggiuntivi: cosa che non poteva essere considerata tale, atteso che, se di questo si fosse trattato, il provvedimento necessiterebbe di una terza lettura presso l'altro ramo del Parlamento.	
ROBERTO GIACHETTI	PRESIDENTE	La invito a concludere.	
MASSIMO ENRICO CORSARO		Il tema che vogliamo evidenziare, signor Presidente, è che sulla parte espunta – quindi, quella sulla quale la Camera ha lavorato – non era stato presentato alcun emendamento; il che significa che, per tutto l'emiciclo, quel testo era considerato non solo una parte integrante del provvedimento complessivo, ma anche una parte sulla quale non c'era nulla da eccepire. Viceversa, con la decisione che è stata assunta, non è stato possibile a nessuno trattare e discutere, nelle Commissioni o in Aula, emendamenti in materia che, eventualmente, potessero ricostituire quei diritti che venivano espunti alla luce della segnalazione che ci era stata fatta dal Presidente del Senato.	
ROBERTO GIACHETTI	PRESIDENTE	Deve concludere.	
MASSIMO ENRICO CORSARO		Camera e Senato hanno, quindi, lavorato su testi difformi: in ragione di questo, signor Presidente, noi annunciamo la nostra formale richiesta, che presenteremo al Presidente della Repubblica, perché non apponga la sua firma sul decreto di conversione in legge del provvedimento sul quale abbiamo lavorato, perché Camera e Senato hanno lavorato su testi difformi. E, quindi, su questo chiediamo che il Presidente della Repubblica voglia e possa essere garante della ricostituzione della parità di diritti, di dignità, di intervento e di valutazione tra i due rami del Parlamento (Applausi dei deputati del gruppo Fratelli d'Italia).	
ROBERTO GIACHETTI	PRESIDENTE	Hanno chiesto di parlare l'onorevole Chimienti ed anche l'onorevole Guidesi, presumo sullo stesso argomento. Pregherei i colleghi degli altri gruppi che volessero intervenire su questo argomento di iscriversi, in maniera che, poi, la Presidenza, ovviamente, possa rispondere alle considerazioni dell'onorevole Corsaro e di tutti coloro che hanno affrontato questo argomento. Prego, onorevole Chimienti.	
SILVIA CHIMIENTI		Signor Presidente, riteniamo che ieri sera si sia infranto il Regolamento, dal momento che la correzione che è stata trasmessa dal Senato prima del voto finale contiene una modifica sostanziale del decreto, e non una meramente formale. Il testo su cui abbiamo lavorato fino a ieri sera non è quello che è stato approvato e differisce su una questione per noi rilevantissima, quali i fondi per il funzionamento dell'università pubblica. È stata in extremis espunta una frase dall'articolo 9, comma 16-quinques, che salvava dai tagli le assunzioni a tempo determinato di personale impiegato per realizzare progetti finalizzati al miglioramento dei servizi didattici per gli studenti. Nulla di più sostanziale dell'ennesimo intervento di riduzione delle risorse per l'istruzione pubblica, questa volta con ricadute dirette anche sugli studenti. Se ci fosse pervenuto un testo dal Senato già espunto di questa frase, avremmo sicuramente presentato un emendamento per reinserirla e poco importa che il Governo ci venga a dire che per la Ragioneria dello Stato la mancanza di questa frase sia la manna dal cielo, perché alleggerisce ulteriormente l'articolo in questione e la portata dei finanziamenti destinati ai lavoratori e alla scuola. Siamo consci che si sarebbe creato un precedente, ma, come dice il Regolamento, sarebbe stata la Camera a doversi esprimere su questa modifica così sostanziale e non il Comitato dei diciotto, peraltro presieduto in maniera autoritaria, prepotente ed arrogante dalla deputata Polverini (Applausi dei deputati del gruppo MoVimento 5 Stelle), che ha condotto i lavori in maniera sbrigativa e, dopo aver detto che lei non sarebbe uscita dall'Aula se non dopo aver votato il provvedimento, perché non se la sarebbe sentita di andare fuori e dire agli «sfigati disoccupati» che non avremmo dato loro neppure quei quattro soldi stanziati dal decreto-legge, si è permessa di rivolgersi più volte ad un nostro collega, Alessio Villarosa, cacciandolo in malo modo fuori da un'aula, in cui peraltro era autorizzato a stare, e dimostrando, non soltanto un totale disprezzo dei Regolamenti, ma anche dell'educazione e del vivere civile (Applausi dei deputati del gruppo MoVimento 5 Stelle). Chiediamo che la Presidenza intervenga, sanzionando questo comportamento con provvedimenti disciplinari (Applausi dei deputati del gruppo MoVimento 5 Stelle).	
GUIDO GUIDESI		Chiedo di parlare.	
ROBERTO GIACHETTI	PRESIDENTE	Ne ha facoltà, sul medesimo argomento presumo.	
GUIDO GUIDESI		Signor Presidente, sì, l'argomento è il medesimo, condividendo tutto quanto ha detto il collega, onorevole Corsaro, vorrei aggiungere una considerazione che mi sembra alquanto importante e che deve far riflettere, soprattutto i colleghi e l'Aula, anche su quanto sta succedendo ed è successo oggi rispetto al fatto che la correzione di ieri, rispetto al testo di ieri, non solo riguardava una frase che poteva essere a quel punto emendabile, escludendo un settore particolare di una categoria particolare, ma riguardava, soprattutto, lo stesso identico testo e lo stesso identico comma dove la Ragioneria dello Stato aveva espresso un parere di non copertura. La relazione tecnica della Ragioneria dello Stato stabiliva che quel comma, che è quello soggetto a correzione, non aveva la copertura. Proprio per questo sarebbe stato opportuno, richiamando i precedenti, e come avvenuto nei casi precedenti, tornare nelle Commissioni dovute e fare tutte le valutazioni del caso. Aggiungo che oggi ci troviamo in una situazione dove il ritorno del decreto «del fare» dall'Aula del Senato non ha avuto correzioni piccole o correzioni sintetiche o correzioni poco valutabili, ha avuto correzioni importanti, inserendo addirittura dei commi nuovi. Queste correzioni importanti hanno portato, oggi, stamane, la Commissione bilancio e la Commissione affari costituzionali a non avere il tempo di valutarle e a non avere il tempo di fare i dovuti emendamenti, ma soprattutto, visto l'ovvio parere contrario dei relatori di maggioranza e del Governo, non hanno avuto nemmeno il tempo di valutare e discutere i singoli emendamenti presentati. Noi, è un mese che ci troviamo di fronte alla continua litania del bicameralismo perfetto e, non solo, ma, anche, al fatto che il Senato utilizza tempi e modi – qualcuno dice – senza rispettare il lavoro della Camera dei deputati; il decreto-legge oggi rivisto dal Senato, il decreto «del fare» che viene in Aula, è stato oggetto di discussione giorni e notti interi da parte delle Commissioni bilancio e affari costituzionali. Alle Commissioni hanno partecipato i deputati di maggioranza e i deputati dell'opposizione e mi sembra ci sia stato un impegno da parte di tutti rispetto a questo. Oggi, ci troviamo in una situazione nella quale quel lavoro fatto viene, praticamente, azzerato da un colpo di spugna da parte del Senato. Lo dico con tutto il rispetto e la stima nei suoi confronti, Presidente, ma mi spiace che oggi non ci sia la Presidente della Camera. Perché io penso che la Presidenza debba oggi essere investita – e abbiamo chiesto la stessa cosa ai due presidenti di commissione – del fatto che spetta alla Presidenza della Camera tutelare la dignità e il lavoro dei deputati. Tra ieri e oggi questa dignità non è stata tutelata, e noi pensiamo che forse qualche giro di meno in tutto il Paese a tagliare dei nastri e un po’ più di impegno rispetto alla tutela dei deputati sia opportuna (Applausi dei deputati del gruppo Lega Nord e Autonomie).	
ETTORE ROSATO		Chiedo di parlare.	
ROBERTO GIACHETTI	PRESIDENTE	Ne ha facoltà.	
ETTORE ROSATO		Signor Presidente, mi consenta prima di tutto di dire che, a nostro giudizio, la presenza oggi della Presidente Boldrini alla commemorazione a Marcinelle sia una presenza opportuna, giusta, che testimonia la vicinanza delle istituzioni a un fatto significativo, e quindi la ringraziamo per essere andata a rappresentanza di tutta l'Aula (Applausi dei deputati del gruppo Partito Democratico – Commenti dei deputati del gruppo Lega Nord e Autonomie). Nel merito dei fatti accaduti ieri, io ritengo che quest'Aula si sia comportata in maniera corretta. Qui non voglio dire che le osservazioni e le giuste preoccupazioni che i gruppi di opposizione hanno manifestato nel momento in cui è arrivato il messaggio del Presidente Grasso non dovessero avere tutta l'attenzione che pur hanno avuto, ma penso che la riunione del Comitato dei nove, o dei diciotto, si sia svolta con modalità e in un clima, che è giustificabile dalla tensione di un lungo provvedimento e dell’iter che ha avuto. Credo che la discussione che c’è stata è la dimostrazione che il testo che è stato trasmesso dal Senato, con una comunicazione di correzione di tipo assolutamente grafico, come è stato dimostrato dalla lettera del Presidente Grasso, non ha inficiato affatto i lavori, prima delle Commissioni e poi di quest'Aula. Io penso che il percorso che è stato fatto sia stato un percorso lineare e che la disponibilità di dare a tutti i gruppi la possibilità di entrare nel merito sia stata manifestata dalla maggioranza con grande serietà in tutte le sedi, quelle formali e quelle informali, e quindi mi auguro che da una questione che non ha nulla a che vedere con la validità e la credibilità del testo approvato del decreto non ne derivi una polemica inutile. Aggiungo – è sul merito, ma il merito in questo caso è sostanza – che stiamo parlando comunque di un decreto importante, di un decreto su cui ci possono essere anche valutazioni diverse, ma su cui tutti i gruppi hanno seriamente lavorato per apportarvi tutti i miglioramenti possibili, al Senato in particolare, in questo caso. Credo che sia interesse di tutti che questo provvedimento diventi efficace senza nessun problema, perché nessun problema sulla sua efficacia c’è.	
SERGIO PIZZOLANTE		Chiedo di parlare.	
ROBERTO GIACHETTI	PRESIDENTE	Ne ha facoltà.	
SERGIO PIZZOLANTE		Signor Presidente, intervengo per necessità di fare chiarezza rispetto ad accuse gratuite che sono arrivate sulle agenzie nelle passate ore e qui, ancora più grave, in quest'Aula, nei confronti del comportamento del presidente Polverini nella difficile riunione di ieri sera, sia in Aula, che nel Comitato dei diciotto. La presidente Polverini, dopo che il Presidente della Camera ha invitato il Comitato dei diciotto a riunirsi, ha presieduto il Comitato dei diciotto come da fare, con correttezza. Ha messo in evidenza, visto il momento, molto difficile, e anche l'ora, che al Comitato dei diciotto poteva partecipare soltanto chi aveva diritto di partecipare al Comitato dei diciotto. Non era un'assemblea aperta a tutti, e non tutti avevano il diritto di venire lì a disturbare il corretto lavoro del Comitato dei diciotto, come hanno fatto alcuni parlamentari del MoVimento 5 Stelle. Non ha usato espressioni ingiuriose, come è stato detto impropriamente, nei confronti di nessuno: ha soltanto richiamato tutti, e in particolar modo il MoVimento 5 Stelle, ad avere un atteggiamento responsabile. Perché responsabilità vuole che di fronte ad una situazione di questo tipo prevalga l'interesse del Paese e dei cittadini, che aspettano e aspettavano un provvedimento come quello che abbiamo ieri licenziato in Aula, che dà delle opportunità di lavoro in più ai lavoratori e che mette le imprese nelle condizioni di funzionare meglio, di creare nuovo lavoro; anziché attaccarsi ad una questione assolutamente strumentale per creare una situazione di disagio, di difficoltà all'Aula e al lavoro parlamentare: un'occasione qualsiasi per strumentalizzare tutto e per produrre il nulla. Credo allora che bisogna soltanto ringraziare il presidente Polverini per come ha condotto ieri la riunione del Comitato dei nove e i lavori dell'Aula, per quanto le competevano (Applausi dei deputati del gruppo Il Popolo della Libertà-Berlusconi Presidente).	
TITTI DI SALVO		Chiedo di parlare.	
ROBERTO GIACHETTI	PRESIDENTE	Ne ha facoltà.	
TITTI DI SALVO		Signor Presidente, si stanno incrociando più discorsi, più ragionamenti, più piani. Vorrei ribadire a nome del mio gruppo quanto abbiamo già detto ieri sull'argomento: quello che è successo è un fatto grave, che non va naturalmente sminuito. Ieri si è scelta una strada per affrontare il problema che si è verificato, e che abbiamo appreso in corso d'opera. Abbiamo già detto ieri sera che noi abbiamo preso atto di quello che era successo; avremmo voluto rimandare ad oggi il voto, perché l'approfondimento anche sulla congruenza del testo rispetto al quale la Ragioneria aveva dato il suo parere, fosse più seria. Detto questo, la strada scelta è stata un'altra: abbiamo votato; noi consideriamo chiuso l'argomento.	
			Deliberazione in merito alla costituzione in giudizio della Camera dei deputati in relazione ad un conflitto di attribuzione sollevato innanzi alla Corte costituzionale dal Tribunale di Firenze, di cui all'ordinanza della Corte costituzionale n. 129 del 2013.
ROBERTO GIACHETTI	PRESIDENTE	A questo punto, credo che sia doveroso per la Presidenza esprimere alcune considerazioni, che tengono conto – lo dico all'onorevole Corsaro e a tutti i colleghi che sono intervenuti – della situazione nella quale ci siamo trovati ieri, che va indubbiamente analizzata con la serietà del caso. La Presidenza non ha ovviamente colto alcuna strumentalità nelle dichiarazioni e nelle parole che sono state rivolte da tutti i deputati che sono intervenuti, perché ieri ci siamo trovati obiettivamente in una situazione difficile, che è maturata per le ragioni che sono state un po’ da tutti ricostruite. Indubbiamente facciamo quindi riferimento ad una situazione difficile, che ci ha visti tutti coinvolti. Siamo andati avanti col proseguimento della seduta fino ad ora tarda, e questo non perché ci trovavamo in una situazione normale: perché ci siamo trovati obbiettivamente in una situazione difficile. In relazione alla questione come è stata posta, anche circa la irregolarità che deriverebbe dalla correzione del messaggio riferita all'articolo 9, comma 16-quinquies, del provvedimento, trasmessa ieri dal Senato e della quale è stata data tempestiva comunicazione all'Assemblea, occorre inevitabilmente fare delle precisazioni. Al riguardo, come è già stato rilevato dalla Presidenza nella seduta di ieri, anche tenuto conto dei precedenti, preciso che la correzione trasmessa, riguardando atti interni all'altro ramo del Parlamento, è insindacabile da parte della Camera, la quale non ha potuto che prenderne atto. Del resto, proprio per consentire un'adeguata conoscenza del nuovo testo, la Presidenza ha disposto una sospensione per consentire che della modifica prendesse atto il Comitato dei nove, integrato dai gruppi che in esso non erano rappresentati. Infine, la Presidenza ha proceduto ad indire la votazione finale del testo, che ovviamente teneva conto della correzione trasmessa dal Senato. Non sussistono quindi, alla luce dei principi costituzionali in materia di bicameralismo e delle norme del Regolamento, profili di irregolarità nella votazione e non sussistono quindi i presupposti per considerarla in qualche modo irregolare, al netto di tutte le considerazioni politiche e di tutte le valutazioni che sono state fatte e che ovviamente sono agli atti della Camera, sono la realtà con la quale ci siamo misurati, e certo sono una cosa rispetto alla quale non abbiamo né potere né alcun diritto di negarla. Quindi ci siamo trovati in una condizione difficile, posso solo – e devo, come Presidenza – garantire tutti che la procedura di votazione è stata regolare e che ci siamo attenuti anche a quanto previsto dai precedenti dei quali – non noi direttamente, ma magari i nostri colleghi – siamo stati investiti per questioni analoghe in passato. Con questo chiudiamo questo argomento.	
			Dimissioni della deputata Marta Leonori.
ROBERTO GIACHETTI	PRESIDENTE	Comunico che l'Ufficio di Presidenza, nella riunione del 6 agosto 2013, preso atto dell'orientamento espresso dalla Giunta per le autorizzazioni nella seduta del 31 luglio 2013, ha deliberato di proporre alla Camera la costituzione in giudizio dinnanzi alla Corte costituzionale, ai sensi dell'articolo 37 della legge n. 87 del 1953, per resistere al conflitto di attribuzione tra poteri dello Stato sollevato dal tribunale di Firenze di cui all'ordinanza della Corte costituzionale n. 129 del 2013, in relazione alla deliberazione della Camera del 9 maggio 2012, con la quale è stata dichiarata, ai sensi dell'articolo 68, primo comma, della Costituzione, l'insindacabilità delle opinioni espresse dal deputato Lucio Barani nei confronti del dottor Enrico Rossi. Se non vi sono obiezioni, tale deliberazione si intende adottata dall'Assemblea. (Così rimane stabilito).	
ROBERTO GIACHETTI	PRESIDENTE	Comunico che in data 18 luglio 2013 è pervenuta alla Presidenza la seguente lettera dell'onorevole Marta Leonori: «Illustrissima Presidente, con la presente intendo comunicarLe la mia intenzione di rassegnare le dimissioni da deputato della Repubblica, avendo deciso di impegnarmi nell'amministrazione di Roma Capitale come assessore comunale a “Roma produttiva”. Non potendo assicurare l'assiduità di impegno che la Camera dei deputati merita, ritengo giusto e corretto rassegnare le mie dimissioni dalla carica di parlamentare. La ringrazio anticipatamente per l'attenzione che destinerà a questa mia missiva. Con stima sincera, Marta Leonori» (Applausi). Avverto che, ai sensi dell'articolo 49, comma 1, del Regolamento, la votazione sull'accettazione delle dimissioni della deputata Leonori avrà luogo a scrutinio segreto mediante procedimento elettrico. Ha chiesto di parlare l'onorevole Rosato. Ne ha facoltà.	
