speaker	role	text	extra
			PRESIDENZA DEL VICEPRESIDENTE LUIGI DI MAIO
			La seduta comincia alle 9,10.
LUIGI DI MAIO	PRESIDENTE	La seduta è aperta. Invito il deputato segretario a dare lettura del processo verbale della seduta precedente.	
RAFFAELLO VIGNALI	Segretario	legge il processo verbale della seduta di ieri.	
			Missioni.
LUIGI DI MAIO	PRESIDENTE	Se non vi sono osservazioni, il processo verbale si intende approvato. (È approvato).	
			Modifica nella composizione della Commissione parlamentare per l’indirizzo generale e la vigilanza dei servizi radiotelevisivi.
LUIGI DI MAIO	PRESIDENTE	Comunico che non vi sono ulteriori deputati in missione a partire dalla seduta odierna. I deputati in missione sono complessivamente ottantotto, come risulta dall'elenco depositato presso la Presidenza e che sarà pubblicato nell'allegato A al resoconto della seduta odierna (Ulteriori comunicazioni all'Assemblea saranno pubblicate nell'allegato Aal resoconto della seduta odierna).	
			Svolgimento di interpellanze urgenti (ore 9,15).
LUIGI DI MAIO	PRESIDENTE	Comunico che il Presidente del Senato, in data 28 settembre 2017, ha nominato componente della Commissione parlamentare per l’indirizzo generale e la vigilanza dei servizi radiotelevisivi la senatrice Magda Zanoni, in sostituzione del senatore Vincenzo Cuomo, cessato dal mandato parlamentare per incompatibilità.	
			(Chiarimenti in merito all’impugnazione da parte del Governo di una sentenza della Corte d’appello di Messina in relazione al risarcimento a favore dei figli di una vittima di femminicidio - n. 2-01951)
LUIGI DI MAIO	PRESIDENTE	L'ordine del giorno reca lo svolgimento di interpellanze urgenti.	
LUIGI DI MAIO	PRESIDENTE	Passiamo alla prima interpellanza urgente all’ordine del giorno Spadoni ed altri n. 2-01951 (Vedi l'allegato A). Chiedo alla collega Spadoni se intenda illustrare la sua interpellanza o se si riservi di intervenire in sede di replica. Sì, ne ha facoltà. Ha quindici minuti.	
MARIA EDERA SPADONI		Grazie, Presidente. Soltanto per capire, mi era stato comunicato che sarebbe intervenuta la sottosegretaria Sesa Amici.	
LUIGI DI MAIO	PRESIDENTE	No, risponde il Vice Ministro Morando. Ieri sera ci hanno comunicato che risponderà il rappresentante del Governo, Morando. Prego.	
MARIA EDERA SPADONI		Grazie, Presidente. Solo un’altra informazione: quanti minuti ho in fase di replica?	
LUIGI DI MAIO	PRESIDENTE	Lei ha quindici minuti adesso e dieci minuti in fase di replica.	
MARIA EDERA SPADONI		Perfetto. Sarò breve nell’introduzione, perché abbiamo davanti tutti quanti questa interpellanza urgente. Innanzitutto c’è da dire che quanto è successo a Marianna Manduca è un fatto tremendo, purtroppo un fatto che succede troppo spesso in Italia. Del femminicidio se ne parla, molto spesso, soprattutto quando ci sono delle informazioni che ci arrivano dalle testate giornalistiche e, nel momento in cui queste informazioni vengono meno, sostanzialmente non se ne parla e sembra che il fenomeno semplicemente non ci sia. Racconto brevemente la storia. Marianna Manduca viene uccisa dalla marito con sei coltellate al petto, dopo un lungo calvario di soprusi e violenze. Marianna era stata minacciata dal marito, un ex tossicodipendente, e aveva deciso di denunciare, aveva deciso di denunciare dodici volte quest’uomo e inspiegabilmente, dopo averlo lasciato, i figli sono stati affidati al marito, per cui la moglie, la donna, intenta una causa, ma viene uccisa a pochi giorni dall’udienza. Il cugino di Marianna, che è tutore dei tre figli, provvede con un’azione giudiziaria contro la magistratura per vedersi riconosciuta l’imperizia dei magistrati, che non hanno compreso la gravità del caso, considerandolo lite familiare. Il ricorso, dopo essere stato giudicato inammissibile in due gradi di giudizio, è stato accolto in Cassazione; la corte d’appello di Messina ha condannato la procura di Caltagirone e ha stabilito che la Presidenza del Consiglio dei ministri debba risarcire i figli della donna, con oltre 300.000 euro, per danno patrimoniale. Il problema è che la Presidenza del Consiglio dei ministri ha impugnato la sentenza, cioè cosa è successo? In poche parole, la corte d’appello di Messina ha deciso che la Presidenza dovesse risarcire i figli di Marianna - ricordo anche che recentemente è stata approvata la proposta di legge che tutela gli orfani di crimini domestici -, però la Presidenza decide di impugnare la sentenza. Io rimango semplicemente senza parole, nel senso che io, Vice Ministro, le chiedo - questa è proprio la domanda nella mia interpellanza - quali siano le ragioni della grave presa di posizione del Governo, ovvero del ricorso nei confronti della sentenza della corte d’appello di Messina, e se non ritenga doveroso - ripeto: doveroso - evitare di impugnare provvedimenti giurisdizionali come questo in presenza di orfani a causa di femminicidi.	
LUIGI DI MAIO	PRESIDENTE	Il Vice Ministro dell’Economia e delle finanze, Enrico Morando, ha facoltà di rispondere.	
ENRICO MORANDO	Vice Ministro dell'Economia e delle finanze	Grazie, signor Presidente. Come ricordato dagli interpellanti, il 3 ottobre 2007 a Palagonia, centro agricolo in provincia di Catania, Saverio Nolfo uccideva brutalmente Marianna Manduca, sua giovane moglie e madre dei suoi tre piccoli figli. La moglie aveva sporto denuncia il 27 settembre 2006, rappresentando in quell’occasione ai carabinieri di essere stata oggetto di violenza da parte del marito fin dal 2000, ma di non aver mai denunciato i fatti, sperando in un ravvedimento del coniuge. A seguito di tale denuncia, il sostituto procuratore di Caltagirone, con provvedimento del 4 ottobre 2006, chiese e ottenne dal GIP l’applicazione al Nolfo della misura cautelare personale dell’allontanamento dalla casa familiare, con divieto al prevenuto di “avvicinarsi alla persona offesa e ai luoghi da quest’ultima abitualmente frequentati”. Ho citato tra virgolette la decisione. La conflittualità tra i coniugi, tuttavia, non scemava e si susseguivano atti di violenza e sopraffazione e denunce, come è evidente dalla querela sporta il 2 giugno 2007, successivamente integrata dalla signora Manduca. Infine, il 3 ottobre 2007, come ho già detto, il tragico epilogo: l’uccisione della signora Marianna Manduca ad opera del marito. Sul presupposto di presunte negligenze addebitabili ai magistrati addetti alla procura della Repubblica di Caltagirone, il tribunale di Messina, con la sentenza depositata il 1° giugno 2017, condannava la Presidenza del Consiglio dei ministri al pagamento della somma di euro 259.200, a titolo di risarcimento del danno patrimoniale subito dai minori in dipendenza dell’omicidio della madre ad opera del coniuge loro padre, Saverio Nolfo. Voglio dirlo subito e chiaramente, in maniera tale che non ci siano equivoci: la Presidenza del Consiglio, a prescindere da ogni valutazione giuridica, ha avviato le procedure per l’esecuzione della sentenza di primo grado, in ragione proprio, come detto dagli interpellanti, della drammatica situazione dei tre orfani. Quanto al resto, le ragioni strettamente giuridiche, che hanno condotto la Presidenza del Consiglio a proporre l’impugnazione della sentenza del tribunale di Messina, emergono già dalla lettura degli atti processuali, che descrivono i tragici fatti occorsi. I magistrati requirenti sono stati ritenuti responsabili per negligenza inescusabile in ragione della presunta inerzia mantenuta a seguito delle due denunce presentate da Marianna Manduca il 2 e il 7 giugno 2007 per minaccia continuata e aggravata. Tale negligenza si sostanzierebbe nel mancato compimento di atti di indagine o nella mancata adozione di misure finalizzate a neutralizzare la condotta del Nolfo, misure che nella sentenza sono individuate esclusivamente con riferimento alla mancata perquisizione volta alla ricerca del coltello cui faceva riferimento la Manduca nella denuncia del 2 giugno 2007, coltello con il quale il delitto sarebbe stato perpetrato. In verità, da un attento esame degli atti di causa, imposto dalla gravità dei fatti accaduti, emerge che la procura della Repubblica di Caltagirone si è attivata a seguito delle denunce presentate dalla signora Manduca. In particolare, risulta dalle attestazioni rese dalla procura e versate in atti che fu avviato il procedimento n. 1226 del 2007, iscritto nel registro generale delle notizie di reato, a carico di Saverio Nolfo per i reati di minaccia aggravata e porto di coltello e che il procedimento stesso fu definito con l’emissione del decreto penale di condanna. Il procedimento in questione ha ad oggetto le due denunce presentate dalla signora Manduca, ma - ciò che più conta -, nell’ambito di tale procedimento, è stato convalidato il sequestro di un coltello richiudibile utilizzato per la minaccia di cui alla denuncia di giugno della signora stessa, ovvero lo stesso coltello che il tribunale ha ritenuto presuntivamente l’arma del delitto di omicidio ai danni della Manduca. È, dunque, smentito dagli stessi atti processuali il presupposto individuato dal tribunale come elemento fondante della presunta negligenza dell’ufficio del pubblico ministero. La sentenza è, quindi, apparsa viziata da vizi giuridici e, pertanto, meritevole di impugnazione. Bisogna porre in rilievo che la legislazione vigente all’epoca dei fatti non attribuiva alle procure strumenti ulteriori rispetto a quelli utilizzati dalla procura di Caltagirone. Proprio a causa della maturata consapevolezza che mancavano strumenti idonei a contrastare le condotte reiterate di minaccia e molestia, capaci di cagionare - cito tra virgolette - “perdurante e grave stato di ansia o di paura ovvero di ingenerare un fondato timore per l’incolumità”, fine della citazione, il legislatore, colmando il vuoto normativo che impediva adeguati interventi di tutela in favore delle vittime in pericolo, ha introdotto, nel febbraio del 2009, il reato di “atti persecutori” previsto dall’articolo 612-bis del codice penale. Ma i fatti per cui è causa, consumati in rapida successione dal 27 settembre 2006, data della prima denuncia, al 3 ottobre 2007, data dell’omicidio, sono anteriori, come è evidente, all’introduzione del delitto di “atti persecutori”. Solo con la novella legislativa le condotte reiterate di minaccia e molestia, atte a cagionare nella vittima grave stato di ansia o di paura ovvero il fondato pericolo per l’incolumità, ovvero ancora l’alterazione delle abitudini di vita, hanno assunto autonoma e più grave configurazione, che permette la pronta e durevole applicazione all’autore di provvedimenti cautelari, anche custodiali, in grado di fronteggiare situazioni di effettivo pericolo per l’incolumità della vittima. Al tempo in cui si sono verificati i tragici fatti in causa, tali strumenti non erano nella disponibilità del potere giudiziario. La sentenza del tribunale di Messina, dotata di provvisoria esecutività, appellata dalla difesa dello Stato, è stata notificata con formula esecutiva alla Presidenza del Consiglio il 17 luglio 2017. L’articolo 14, comma 1, del decreto-legge 31 dicembre 1996, n. 669, stabilisce che le Amministrazioni dello Stato completano le procedure per l’esecuzione dei provvedimenti giurisdizionali comportanti l’obbligo di pagamento di somme di danaro entro il termine di 120 giorni dalla notificazione del titolo esecutivo. In questo caso, il termine scadrà, quindi, il 14 novembre prossimo venturo. Durante tale termine è necessario svolgere l’istruttoria e acquisire la documentazione necessaria alla liquidazione. Nel corso di tale fase istruttoria, gli uffici della Presidenza hanno contattato l’avvocato di controparte, chiedendo la produzione della documentazione necessaria per la liquidazione del titolo e di indicare le modalità di pagamento, che, ripeto, il Governo ha tutta l’intenzione di fare. Poiché il pagamento, su richiesta dell’avvocato, dovrà essere effettuato mediante accredito sul conto corrente intestato ai minori, si è in attesa di ricevere l’autorizzazione del giudice tutelare, a norma dell’articolo 320, quarto comma, del codice civile. Ripeto, la Presidenza del Consiglio, a prescindere da ogni valutazione giuridica, ha avviato le procedure per l’esecuzione della sentenza di primo grado in ragione della drammatica situazione dei tre orfani e intende ispirare tutta la sua iniziativa a questo primario obiettivo. È, tuttavia, del pari necessario che la sentenza di primo grado, in ragione di quanto illustrato sopra, venga sottoposta ad un ulteriore vaglio giurisdizionale, onde verificare se la terribile morte della giovane Marianna Manduca e la situazione personale familiare dei minori sia conseguenza o meno della negligenza dei magistrati della procura della Repubblica di Caltagirone, oltre che, ovviamente, della violenza omicida dell’assassino. Da ultimo, sottolineo il cruciale rilievo e l’importanza che assumerebbe, anche rispetto a vicende analoghe a quelle prospettate dagli interpellanti, purtroppo ancora troppo numerose, l’approvazione definitiva del disegno di legge S. 2719, già approvato dalla Camera, cui lei ha fatto riferimento, purtroppo non è ancora legge dello Stato, recante modifiche al codice civile, al codice di procedura penale e altre disposizioni in favore, appunto, degli orfani dei crimini domestici: una norma che mira a dare, in via generale e a prescindere dall’esito delle inchieste giudiziarie conseguenti al crimine concernente gli atti persecutori, una risposta concreta ai bisogni dei figli delle vittime di femminicidio. La Commissione bilancio del Senato ha fornito proprio ieri il suo parere e l’iter della legge potrà adesso riprendere. Il Governo si è impegnato, quindi, ad assicurarne la rapidissima approvazione.	
LUIGI DI MAIO	PRESIDENTE	La collega Spadoni ha facoltà di dichiarare se sia soddisfatta per la risposta alla sua interpellanza. Le ricordo che ha dieci minuti.	
			(Iniziative a tutela del prestito sociale nel sistema delle cooperative – n. 2-01950)
MARIA EDERA SPADONI		Sì, grazie, Presidente. Prima di tutto, chiedo la cortesia al Vice Ministro Morando, eventualmente, di avere il testo della risposta all’interpellanza, se possibile. Sì, sono parzialmente soddisfatta, perché, da come ho interpretato - io, ovviamente, non essendo legale, cerco di interpretare sempre tra le righe quello che lei mi ha appena dichiarato - mi sembra di capire che state portando avanti e cercando di eseguire la richiesta di risarcimento e, contestualmente, state cercando di capire effettivamente le falle che ci sono state. Quindi, sono parzialmente contenta. Per l’atto Senato n. 2719 ha ragione, in effetti è stato bloccato in Senato proprio da quei gruppi che non volevano l’accelerazione dell’iter; anche noi ovviamente ci aspettiamo e ci auguriamo che il Senato riesca, quanto prima, ad approvare la legge. Soltanto qualche spunto, Vice Ministro. Prima di tutto, mi dispiace, so che è vostra facoltà farlo, ma mi dispiace che non ci sia qui la sottosegretaria alla Presidenza del Consiglio, Sesa Amici. Ovviamente lei mi ha dato la risposta, chiunque può venire, è vero, però, chiaramente, visto che era una richiesta che facevo alla Presidenza del Consiglio, avrei in qualche modo preferito che ci fosse proprio la sottosegretaria. Mi prendo questo tempo anche per comunicarle qualche criticità: prima di tutto, noi ci troviamo in una situazione in cui il Piano antiviolenza è scaduto a luglio. Noi stiamo richiedendo più o meno da due settimane ormai che la Boschi, in qualche modo, venga a riferire per capire effettivamente quali sono le linee guida del nuovo Piano antiviolenza, che, purtroppo, ripeto, è scaduto a luglio. Stiamo chiedendo che venga, abbiamo sollevato la questione anche nell’intergruppo pari opportunità, presieduto proprio dalla Presidente Boldrini, e abbiamo anche parlato di un atto che potesse essere fatto in questi mesi e, purtroppo, l’atto si è tradotto in una mozione da presentare a ottobre. Ora, io credo che sia veramente una presa in giro, personalmente, il fatto che ci sia un momento in cui si discute una mozione per impegnare un Governo che probabilmente durerà altri due o tre mesi. Mi aspettavo qualcosa di più, piuttosto che dare - mi permetta il termine - il contentino a quelle persone che stanno chiedendo, da più parti, che si faccia qualcosa. Il Presidente Grasso ha dichiarato che le leggi ci sono. Il Presidente Grasso in effetti ha ragione, cioè, con la ratifica della Convenzione di Istanbul e poi l’approvazione della legge sul femminicidio nel 2013, molto è stato fatto. Il problema è che non c’è stato un seguito a quel tipo di proposta di legge, cioè la prevenzione e la protezione contenute proprio nella Convenzione di Istanbul, dal mio punto di vista, non sono state attuate. È vero che c’è stato un investimento, è vero che ci sono stati dei fondi che sono stati erogati, poi, alle regioni, ma non è stato fatto abbastanza, manca ancora una banca dati sistematica, una raccolta dati per quanto riguarda proprio la violenza di genere, mancano misure adeguate per formare soprattutto il personale sanitario e, soprattutto, le forze dell’ordine. Vice Ministro, qua abbiamo un problema, un problema che è il seguente: moltissime donne, quando cercano di denunciare, si ritrovano di fronte a una sottovalutazione; purtroppo, moltissime volte le forze dell’ordine fanno un lavoro eccezionale, dall’altra parte, però, sono successi casi in cui c’è stata una sottovalutazione del fenomeno. Questo cosa vuol dire? Vuol dire che per una donna è già difficile arrivare ad avere il coraggio di andare in un ospedale o in un centro di polizia - cerca di andare - e appunto denunciare. Infatti, le ricordo anche che, secondo i dati del Consiglio d’Europa, la zona grigia è la zona più ampia, cioè quella costituita da donne che vengono malmenate e maltrattate ma non denunciano, perché poi c’è dietro anche una questione economica, che lei sicuramente conosce meglio di me in quanto Viceministro all’economia. C’è un problema, un problema grave: molto spesso le donne vengono lasciate sole o comunque non vengono ascoltate come dovrebbero. Abbiamo anche il problema dei centri antiviolenza a livello regionale: ci sono moltissime regioni che sono all’avanguardia, per quanto riguarda i centri antiviolenza, purtroppo ne abbiamo altre nelle quali i centri antiviolenza sono scarsissimi; e quindi, una donna, nel momento in cui vuole denunciare, dove va? Molto spesso c’è anche la problematica economica, legata purtroppo alla questione lavorativa, che fa sì che la donna non abbia un’indipendenza. La questione della violenza di genere è una questione che tocca tantissimi aspetti: l’aspetto lavorativo, l’aspetto sanitario, l’aspetto educativo, l’aspetto dei mass media. Nella Convenzione di Istanbul viene proprio specificato che i mass media devono fare la loro parte, che gli Stati membri che aderiscono alla Convenzione devono portare avanti delle misure per far sì che i mass media, in qualche modo, non offendano le donne attraverso l’immagine. Credo che questi siano tutti punti che devono essere toccati, ma purtroppo, da quando è stato scritto il piano antiviolenza, non c’è stato il susseguirsi di misure che dovevano essere portate avanti. Francamente non so cos’altro possiamo fare. Ripeto che mi dispiace molto che, dopo qualche riunione dell’intergruppo, ci sia stata questa dichiarazione del Presidente Grasso, il quale dice che, sì, le leggi sono state fatte, le leggi ci sono, quindi lasciamo tutto così, e poi abbia visto spuntare in calendario, come un fungo, questa mozione. Ovviamente lei mi può rispondere tranquillamente che il Parlamento è il Parlamento e quindi, se si decide di calendarizzare una mozione, dipende ovviamente dal Parlamento; però spero vivamente che ci sia un’attenzione diversa, che non ci sia un’attenzione soltanto in base alle notizie di giornale e che, quindi, quando c’è la guardia medica di Catania che viene violentata, allora seguono dichiarazioni e comunicati; quando c’è la ragazza che viene ammazzata, allora dichiarazioni e comunicati. Questo è purtroppo un fenomeno che riguarda moltissime persone, non soltanto quelle che vengono citate nei giornali. Noi continueremo a fare la nostra parte, ovviamente. Abbiamo presentato moltissimi atti, ma, purtroppo, ci tengo anche a dire che, su questo tema, è difficile accendere un faro. Credo sia stato complicato anche da parte nostra, però noi ci siamo: questo è il messaggio che vorremmo mandare a lei, Viceministro, e ovviamente anche agli altri gruppi parlamentari. Ci siamo per portare avanti qualsiasi azione che possa fare in modo che le donne siano in primis protette, ma che ci possa essere comunque anche una diminuzione di questo purtroppo tragico fenomeno.	
LUIGI DI MAIO	PRESIDENTE	Passiamo all’interpellanza urgente Pesco ed altri n. 2-01950 (Vedi l'allegato A). Chiedo al deputato Pesco se intenda illustrare la sua interpellanza o se si riservi di intervenire in sede di replica. Ha quindici minuti. Prego.	
