speaker	role	text	extra
MARINA SERENI	PRESIDENTE	Va bene, non mi pare che sia un problema insormontabile e adesso è inutile che andiamo a cercare. Poiché ci sono state cancellazioni che sono state comunicate a voce e non per iscritto, può darsi che ci sia stato un fraintendimento. Fermo restando che le votazioni che abbiamo già fatto non possono ovviamente essere ripetute, tuttavia possiamo tornare all'emendamento Liuzzi 2.179, che è identico ad un altro emendamento non segnalato Caparini 2.293. Ha chiesto di parlare per dichiarazione di voto l'onorevole Liuzzi. Ne ha facoltà.	
MIRELLA LIUZZI		Grazie, Presidente. Questo emendamento è molto importante per il gruppo del MoVimento 5 Stelle e ci tenevamo veramente che fosse discusso qui in Aula e quindi è tra i segnalati. Che cosa prevediamo in esso ? Spiego un attimo da cosa è nato. Qualche mese fa il consiglio di amministrazione della RAI (quindi non quello che è stato appena nominato ma quello antecedente) decise all'unanimità di dare il via libera all'emissione di obbligazioni. Ciò alimentò una polemica, giustamente anche ripresa dal Partito Democratico e dalla Lega, che questo fosse uno stratagemma per superare e per aggirare il tetto di 240 mila euro relativo allo stipendio dei consiglieri di amministrazione della RAI, imposto proprio da normativa vigente. Questo limite non varrebbe per le società che emettono titoli negoziati sui mercati regolamentati. Dato che Renzi ha posto il limite di 240 mila euro come una sua fortissima battaglia e considerato il raggiungimento dell'obiettivo di questa sua battaglia visto che è poi diventato legge, ci sembra strano che poi questo testo possa essere superato tramite l'emissione di obbligazioni. Ora questo tema è stato ampiamente dibattuto anche in Commissione e lo stesso relatore ha sottolineato come fosse comunque un emendamento giusto e corretto che però avrebbe dovuto essere applicato alla normativa generale; e su questo giustamente noi siamo assolutamente d'accordo, ci mancherebbe: se si votasse in questo momento una modifica della normativa vigente lo applicheremmo immediatamente, voteremmo a favore. Tuttavia è ovvio che tante cose a volte ci sembrano come una scusa: una scusa quella di non potere inserire in questo momento una normativa del genere perché dobbiamo andare a prendere la normativa generale; una scusa è stata quando, ad esempio, nell'ambito della riforma della Costituzione abbiamo inserito clausole delle quali ci è stato detto che andavano inserite nel conflitto di interesse; una scusa è stato quando il conflitto di interesse è venuto qui in Aula ed è stato rimandato in Commissione e alla fine poi le modifiche e anche le giuste modifiche non vengono mai fatte. Nel frattempo partono le obbligazioni, i manager e i consigli di amministrazione superano tranquillamente i 240 mila euro, che è il tetto stabilito, e quindi sono tutti felici e contenti. Dunque, dato che dal nostro punto di vista sono stati fatti anche grossolani errori legislativi in questo disegno di legge, non capiamo perché non si possa inserire una norma che giustamente verrebbe applicata nella norma quadro, nella norma generale anche per quanto riguarda la RAI, tenuto conto delle notizie che ci sono state negli ultimi tempi: proprio a maggio c’è stato questo voto all'unanimità che ha permesso l'emissione di obbligazioni nel consiglio di amministrazione della RAI per i consiglieri di amministrazione. Dunque tenuto conto che è stato votato anche da parlamentari del PD – questo è l'aspetto curioso e interessante: è stato denunciato in gran parte anche dagli stessi parlamentari del PD – noi del MoVimento 5 Stelle, poiché sostiene le battaglie giuste a prescindere dal fatto che vengano da un partito o l'altro, abbiamo creduto che un emendamento del genere potesse essere inserito nella riforma della RAI o nella cosiddetta riforma della RAI, perché alla fine si rivede soltanto la governance e i meccanismi di nomina, e potesse essere votato qui oggi in Parlamento. Vogliamo o no che i consigli di amministrazione possano aggirare il tetto dei 240 mila euro annui ? Questo è quello che chiediamo, ora, con questo emendamento e, per questo, auspico che ci sia un voto favorevole da parte di tutti i parlamentari, qui, oggi (Applausi dei deputati del gruppo MoVimento 5 Stelle).	
MARINA SERENI	PRESIDENTE	Ha chiesto di parlare per dichiarazione di voto il deputato Corsaro. Ne ha facoltà.	
MASSIMO ENRICO CORSARO		Grazie Presidente. Questo emendamento, come altri che sono stati discussi nel corso dell'esame dell'articolo 2, ha alimentato il dibattito riguardo la circostanza che i colleghi del MoVimento 5 Stelle esercitino una pressione mossa da sacro furore su vicende che forse potrebbero essere affrontate, secondo altri punti di vista, con sensibilità diverse, ma credo che il tema stia alla base del funzionamento della gestione della RAI e della proprietà della RAI. Infatti, i colleghi del MoVimento 5 Stelle che si pongono problemi in ordine alla gestione degli incarichi, in ordine al dimensionamento degli stipendi, in ordine alla qualità soggettiva dei nominati, pongono dei problemi che in natura non dovrebbero esistere. A dire il vero, se ci guardiamo intorno, nel considerare come ci sia stata una curiosa sovrapposizione tra i nomi che hanno composto questa Aula parlamentare così come quella del Senato rispetto a nomine importanti, è curioso come questa diventi automaticamente la fucina di tante nomine...	
MARINA SERENI	PRESIDENTE	Onorevole Corsaro, deve concludere...	
MASSIMO ENRICO CORSARO		Ma il tema principale, onorevole Presidente, e mi avvio a concludere, sta nel fatto che i problemi anche legittimi che pongono i colleghi del MoVimento 5 Stelle non dovrebbero esistere semplicemente evitando – e questo è dove manca questo progetto di riforma della RAI – la natura pubblica della RAI, privatizzando un sistema che non ha più motivo e bisogno di essere di natura pubblica.	
MARINA SERENI	PRESIDENTE	Ha chiesto di parlare per dichiarazione di voto l'onorevole Caparini. Ne ha facoltà.	
DAVIDE CAPARINI		Grazie Presidente, dal 2011 ad oggi, il tetto degli stipendi non si applica alle società controllate dallo Stato che emettono prestiti obbligazionari. La RAI lo ha fatto per 350 milioni di euro ed è per questo che, oggi, siamo qui a discutere del fatto se sia lecito o meno aggirare una norma dello Stato – quindi, fatta la legge, trovato l'inganno – per aumentarsi lo stipendio, perché questo è il risultato. Io ringrazio la collega Liuzzi che ha segnalato, con il gruppo del MoVimento 5 Stelle, questo emendamento, perché è un dato di fatto che salta agli occhi, non solo di coloro che seguono la materia con attenzione – io ricordo i tanti deputati e senatori del PD che si sono stracciate le vesti e hanno chiesto conto, al nuovo amministratore delegato Campo Dall'Orto, di questa operazione fatta per alzarsi lo stipendio – ma anche dei cittadini che sono sbigottiti di fronte al fatto che venga messo un tetto e poi questo tetto automaticamente venga violato. Ricordo che la stessa presidente mantiene il suo stipendio da direttore di Rai News, quindi sono 300 mila euro lordi, a cui aggiunge lo stipendio da consigliere, quindi, non da presidente, e sono altri 66 mila euro lordi, per un totale di 366 mila euro lordi. Quindi, ricordo lo sforzo encomiabile che era stato fatto dai precedenti manager, criticabilissimi dal punto di vista della gestione, che però, dal punto di vista della coerenza con il mandato che l'allora Governo Monti gli aveva dato, si erano auto ridotti gli stipendi, mantenendoli al di sotto del limite. Questo non avviene, non è ancora avvenuto e temiamo che non avverrà per le nuove nomine fatte da Renzi. Ora, è giusto e doveroso chiarire, e questo emendamento lo fa in modo egregio, come non si possa utilizzare l'emissione di titoli obbligazionari per aggirare la norma. Dopo di che, se noi decidiamo che un amministratore delegato di una società di Stato possa percepire una cifra da mercato, lo decidiamo, ma è la politica, è il Governo che lo decide, non è chi utilizza delle norme in modo furbesco.	
MARINA SERENI	PRESIDENTE	Ha chiesto di parlare per dichiarazione di voto, a titolo personale, l'onorevole Nuti. Ne ha facoltà.	
RICCARDO NUTI		Grazie Presidente, non ho capito qual è il parere del Governo.	
MARINA SERENI	PRESIDENTE	Non essendo stato segnalato previamente, non abbiamo in effetti chiesto i pareri. Dobbiamo chiedere i pareri a tutti, non solo al Governo, perché appunto non avevamo considerato questo emendamento tra i segnalati. Tra l'altro, colgo l'occasione per dire che, avendolo recuperato successivamente, si intende un emendamento aggiuntivo al comma 12-ter, per ragioni ovvie di collocazione coerente. Visto che lei ha sollevato giustamente questa questione, chiedo ai relatori e poi al Governo di esprimere i pareri sull'emendamento Liuzzi 2.179. Prego, onorevole Peluffo.	
VINICIO GIUSEPPE GUIDO PELUFFO	Relatore per la maggioranza per la IX Commissione	Grazie, Presidente. Le esprimo il parere e interverrò successivamente per motivarlo. Il parere è contrario.	
MARINA SERENI	PRESIDENTE	Onorevole Fico ?	
ROBERTO FICO	Relatore di minoranza	Presidente, il parere è favorevole.	
MARINA SERENI	PRESIDENTE	Il Governo ?	
ANTONELLO GIACOMELLI	Sottosegretario di Stato per lo sviluppo economico	Presidente, il parere del Governo è contrario. A preferenza della Presidenza posso motivare ora o intervenire successivamente.	
MARINA SERENI	PRESIDENTE	Può motivare ora.	
ANTONELLO GIACOMELLI		Sottosegretario di Stato per lo sviluppo economico. Perfetto. Presidente, io credo che per troppo tempo ci sia stata una condizione di RAI troppo specifica, che ha favorito la nascita di un ibrido che stava a metà tra troppe condizioni e troppi stati: la normativa pubblicistica, la dimensione privata, l'azienda, il rapporto con le istituzioni ma anche quello quotidiano con la politica. Insomma, una specie di strano mostro dove la dimensione della potenzialità aziendale è stata come limitata, soffocata da una commistione quotidiana tra gestione e politica. Per questo motivo, credo che dobbiamo – questo è il senso della riforma – riportare «a pulito» – vorrei dire con un'espressione atecnica – esattamente le condizioni di ciascuno e le responsabilità di ogni livello. È giusto che vi sia una vigilanza delle istituzioni sulla qualità del servizio pubblico e sul rispetto dei principi del servizio pubblico, dunque è giusto che la Commissione di vigilanza svolga questo compito; è giusto che vi sia un rapporto forte fra gli indirizzi delle istituzioni sul servizio pubblico e l'attività di RAI, dopodiché la dimensione che deve prevalere è quella aziendale: un CdA che vota gli atti fondamentali e dà gli indirizzi, un amministratore delegato che gestisce. E che gestisce rispettando la normativa in vigore, che vale per tutte le aziende pubbliche, che vale per tutte le controllate, che vale per tutte le situazioni, rifuggendo dal ricreare un'altra volta una condizione specifica e di incerta natura di RAI. Quindi, non entro nel merito se sia più o meno giusto legare ad alcune attività finanziarie la possibilità di rispettare o no il tetto, sono dell'opinione che questo appartenga ad una normativa di carattere generale. Se il Parlamento, nella sua sovranità, ritiene che l'emissione di obbligazioni non debba costituire condizione per superare il tetto, questo deve valere per tutte le società. Non può valere solo per RAI mentre per altre valgono condizioni ulteriormente diverse. Allora, il terreno non è questo testo, il terreno su cui operare è la normativa. Quello che in questo testo diciamo – che è un'ovvietà – è il pieno rispetto delle normative in vigore, ma che valgono per tutte le aziende.	
MARINA SERENI	PRESIDENTE	Questo era il parere del Governo. Era iscritto a parlare per dichiarazione di voto a titolo personale l'onorevole Nuti.	
DAVIDE CAPARINI		Non era un parere, era un intervento del Governo !	
MARINA SERENI	PRESIDENTE	Questo non era un intervento, era il parere del Governo, non avendo avuto il parere di nessuno. Prego, onorevole Nuti (Commenti del deputato Caparini).	
MARINA SERENI	PRESIDENTE	Onorevole Caparini, la Presidenza sta cercando di venire incontro ad un'esigenza dei gruppi, avendo recuperato un emendamento che a noi non risultava segnalato e che il gruppo proponente riteneva segnalato. Quindi, un po’ di elasticità va bene, però nessuno se ne approfitti.	
DAVIDE CAPARINI		Ha fatto un intervento ! Ho diritto di parlare anch'io dopo il rappresentante del Governo.	
MARINA SERENI	PRESIDENTE	No, il Governo ha espresso il parere su mia richiesta, motivandolo. Ha chiesto di parlare per dichiarazione di voto, a titolo personale, l'onorevole Nuti. Ne ha facoltà.	
RICCARDO NUTI		Signora Presidente, mi sarei aspettato che magari il Governo si rimettesse all'Aula, ma, tramite la spiegazione del Governo, abbiamo capito che in realtà si sta continuando a fare il gioco delle tre carte, si sta continuando a bluffare. Voi potete bluffare ad un tavolo da gioco, ma non in Parlamento, perché, continuando a dire per mesi che volevate mettere un tetto per poi aggirarlo tramite l'emissione di strumenti finanziari, non state facendo altro che mostrare le vostre carte, e voi non avete niente in mano ora. Non avete niente, e non ha niente non solo il Governo: non ha niente neanche il Parlamento rappresentato in questo caso dalla maggioranza del PD. I parlamentari del PD della maggioranza, che si sono prodigati a dichiarare che erano uno scandalo questi tetti di 600 mila euro, o comunque oltre i 240 mila euro, ora si dichiarano contrari alla proposta del MoVimento 5 Stelle di mettere questo tetto a 240 mila euro, ma soprattutto che l'emissione di strumenti finanziari non costituisca causa di esclusione dell'applicazione del limite che hanno imposto. Allora questa è la realtà dei fatti: voi non volete il tetto di 240 mila euro (Applausi dei deputati del gruppo MoVimento 5 Stelle).	
MARINA SERENI	PRESIDENTE	Ha chiesto di parlare per dichiarazione di voto, a titolo personale, il deputato Vacca. Ne ha facoltà.	
GIANLUCA VACCA		Signora Presidente, «Con l'emissione di bond la RAI potrebbe aggirare il tetto e tornare a stabilire compensi superiori al limite di 240 mila euro. A tutte le amministrazioni e aziende pubbliche vengono chiesti sacrifici, sarebbe paradossale se alla RAI quegli stessi sacrifici entrassero dalla porta e uscissero dalla finestra. Il tetto deve rimanere anche a Viale Mazzini». Queste parole, Presidente, sono di un collega deputato del Partito Democratico, Anzaldi, ovviamente deputato della Commissione vigilanza RAI, che, allineandosi al suo segretario, nonché Presidente del Consiglio, Matteo Renzi, prometteva che i tetti dovevano restare anche a Viale Mazzini e sarebbero rimasti invariati. Io capisco che ormai siamo in un'epoca di schizofrenia politica, dove si dice una cosa e il giorno dopo si fa esattamente l'opposto, però un minimo di coerenza ogni tanto non farebbe male.	
MARINA SERENI	PRESIDENTE	Ha chiesto di parlare per dichiarazione di voto, a titolo personale, il deputato Bonafede. Ne ha facoltà.	
ALFONSO BONAFEDE		Signora Presidente, intervengo soltanto per sottolineare e denunciare la gravità di quello che ha detto il sottosegretario nell'ultimo intervento. Sottosegretario, lei non può far finta che la RAI sia una delle tante aziende: non può parlarci di generalizzare rispetto alla RAI tutte le norme che ci sono, perché non so se se ne è accorto, siamo qui a parlare della RAI proprio perché è in una situazione particolare; ed è in una situazione particolare perché è il punto principale della gestione dell'informazione del servizio pubblico televisivo. Prima di tutto, Presidente, se volesse far allontanare dal banco del Governo... Va bè...la Presidenza... Grazie, Presidente. Primo... Sì, Presidente, però se il sottosegretario chiacchiera e lei parla per i fatti suoi diventa impossibile parlare.	
MARINA SERENI	PRESIDENTE	Onorevole Bonafede, abbia pazienza: non stiamo chiacchierando del più e del meno, questo glielo posso assicurare. Stiamo cercando di gestire...	
ALFONSO BONAFEDE		A me non interessa, Presidente: si figuri se entro nel merito di qual è l'oggetto della chiacchiera (Applausi dei deputati del gruppo MoVimento 5 Stelle). Mi lamentavo del fatto...	
MARINA SERENI	PRESIDENTE	Stiamo gestendo al meglio la situazione. Onorevole Bonafede, la prego di concludere il suo intervento perché ha anche finito il tempo.	
ALFONSO BONAFEDE		Presidente, delle scuse sarebbero state gradite, e sicuramente più oneste intellettualmente (Commenti dei deputati del gruppo Partito Democratico – Applausi del gruppo MoVimento 5 Stelle).	
MARINA SERENI	PRESIDENTE	Ma le scuse per che cosa, onorevole Bonafede ? Concluda l'intervento !	
ALFONSO BONAFEDE		Finisco il mio intervento dicendo che, sottosegretario, le altre aziende non sono oggetto costante di colonizzazione e conquista politica. Quindi, se lei vuole replicare nel merito, replichi, lo faccia pure e lo apprezziamo, perché è una rarità in questo Governo; ma entri nel merito, non ci dica che la RAI è come tutte le altre aziende !	
DAVIDE CAPARINI		Presidente ...	
MARINA SERENI	PRESIDENTE	Onorevole Caparini, un minuto, via. Facciamo un accordo tra gentiluomini. Capisco la situazione che è oggettivamente particolare però non riapriamo la discussione.	
DAVIDE CAPARINI		Presidente, lei non mi concede la parola, perdoni, mi dà la parola sull'ordine dei lavori.	
MARINA SERENI	PRESIDENTE	Va bene.	
DAVIDE CAPARINI		Lei non mi concede nulla perché ho diritto di parlare sull'ordine dei lavori.	
MARINA SERENI	PRESIDENTE	Allora svolga l'intervento sull'ordine dei lavori e poi vediamo. Prego ne ha facoltà.	
DAVIDE CAPARINI		Il mio intervento sull'ordine dei lavori è inerente alla genesi del problema che abbiamo appena affrontato, ovvero un emendamento su cui la segnalazione non è giunta a destinazione, ma questo perché ? Perché, rifacendomi al precedente intervento sull'ordine dei lavori, non è stato rispettato il termine di ieri delle ore 11 per la segnalazione, pertanto la successiva decisione della Presidenza di rendere possibile comunque la segnalazione anche all'ultimo minuto ha evidentemente messo in difficoltà gli uffici. L'invito che faccio, visto che ci siamo ribaditi che questo fatto non avrebbe costituito precedente, è che la prossima volta, nel caso i gruppi non segnalino gli emendamenti, proprio per evitare ciò che è appena avvenuto, la Presidenza metterà in votazione ciò che riterrà lei opportuno.	
MARINA SERENI	PRESIDENTE	Su questo la Presidenza concorda pienamente.	
DAVIDE CRIPPA		Chiedo di parlare per un richiamo al Regolamento.	
MARINA SERENI	PRESIDENTE	Ne ha facoltà.	
DAVIDE CRIPPA		Grazie, Presidente. Nel merito vorrei ricordare che all'interno del Regolamento l'articolo 85-bis comma 8 dell'articolo 85 non specificano le tempistiche entro cui devono essere comunicati gli emendamenti segnalati, pertanto il suo auspicio che vengano segnalati prima dell'inizio della discussione credo possa rimanere solo tale perché di fatto rispetto al Regolamento non c’è indicata una tempistica entro cui bisogna comunicare i segnalati, né tantomeno prima dell'inizio della discussione dei singoli emendamenti. Noi abbiamo comunicato prima di porre in votazione il primo emendamento e pertanto abbiamo rispettato le tempistiche permesse dal Regolamento.	
MARINA SERENI	PRESIDENTE	Onorevole Crippa, io non ho avuto direttamente la gestione di questa parte del processo di lavorazione del provvedimento. È chiaro che il Regolamento non pone un tempo rigido in quanto parla di tempi congrui e gli uffici, al fine di predisporre il materiale in maniera corretta, affinché tutti possano prenderne visione in tempo utile prima dell'esame del provvedimento, avevano segnalato a tutti i gruppi quale fosse il tempo congruo. Vi è poi stata una problematica nella segnalazione e noi abbiamo riconosciuto di avere tralasciato un emendamento segnalato, ma questo errore è dovuto alla tempistica che ha giustamente richiamato il collega Caparini. Penso quindi che in futuro sia interesse di tutti, dei gruppi e della Presidenza, far sì che il tempo congruo segnalato dagli uffici venga rispettato per poter preparare in maniera adeguata i materiali da portare all'esame dell'Assemblea. Ha chiesto ora di parlare per dichiarazione di voto, a titolo personale, l'onorevole Fico. Ne ha facoltà.	
ROBERTO FICO		Signor sottosegretario non sono d'accordo con le sue motivazioni e avendo ascoltato anche il discorso del relatore per la maggioranza all'interno della Commissione non sono d'accordo neanche con lui. Non sono d'accordo perché la RAI non è assimilabile alle altre aziende pubbliche; è infatti proprio questo il motivo per cui oggi siamo qui e ne stiamo parlando. È il motivo per cui oggi discutiamo la riforma della governance della RAI, degli stipendi, del consiglio di amministrazione, dei requisiti positivi e negativi, del fatto che deve essere un consiglio di amministrazione più vicino al codice civile. Quindi stiamo parlando di un unicum e la RAI è un unicum. Infatti, voi, con la deroga agli appalti, che avete inserito in questa legge, derogate in questo caso rendendo la RAI unica rispetto a tutte le altre aziende, in questa legge che già la rende un unicum, mentre con il tetto agli stipendi voi non volete inserire il fatto che non è possibile aggirarlo tramite le obbligazioni, i mercati regolamentati. È un'assurdità, perché vengono adottati nella stessa legge due pesi e due misure, dicendo una volta che la RAI non è un unicum e deve andare in normativa generale e una volta che è un unicum e non deve andare in normativa generale e si può andare in deroga agli appalti. Allora questa mi sembra un'assurdità e non riesco a comprenderne la ragione.	
MARINA SERENI	PRESIDENTE	Ha chiesto di parlare l'onorevole Peluffo. Ne ha facoltà.	
VINICIO GIUSEPPE GUIDO PELUFFO	Relatore per la maggioranza per la IX Commissione	Signora Presidente, intervengo sull'emendamento Liuzzi 2.179. Peraltro, il testo dell'emendamento è esattamente identico all'ultima parte dell'emendamento Nesci 2.173, infatti mi aspettavo che prima, durante l'illustrazione dell'emendamento, la collega Nesci si soffermasse su questo aspetto, che credo sia di rilievo, visto che se ne è discusso anche in Commissione. L'emendamento fa riferimento alla legge n. 89 del 2014, che ha stabilito in 240 mila euro lordi annui il limite massimo dei compensi degli amministratori e delle retribuzioni dei dipendenti delle società controllate dalle pubbliche amministrazioni. Recita anche la stessa norma che sono esentate dall'obbligo le società pubbliche autorizzate all'emissione di titoli obbligazionari sui mercati regolamentati. Ora, i precedenti vertici RAI, qualche mese fa, hanno deciso l'emissione di un bond obbligazionario di 350 milioni di euro. La questione è stata sollevata ed è all'evidenza del Parlamento dal collega Anzaldi, che ha fatto un'interrogazione alla Commissione di vigilanza RAI. Al momento, non c’è nessun aggiornamento delle retribuzioni in RAI; lo si desume da questa nota dell'azienda di mercoledì scorso, che recita: l'emissione del bond non ha comportato alcun rialzo automatico delle retribuzioni ai livelli precedenti al testo previsto dalla legge; si è invece colta l'opportunità di una rideterminazione dei livelli retributivi delle figure manageriali; a seguito di un'analisi condotta da una società leader mondiale nel settore delle risorse umane, sono stati fissati nuovi parametri più coerenti con il mercato. Quindi, ad oggi non è stato fatto l'adeguamento, domani chissà. Per questo credo – come ho detto in Commissione – utile questa discussione, all'interno della quale, per esempio, vi è l'argomento che abbiamo discusso in Commissione, ossia una società partecipata al 99 per cento dal Tesoro che non è quotata in borsa forse non è così automatico che possa essere esentata nel momento in cui emette bond, ma la legge è molto chiara da questo punto di vista. Per cui, io penso che sia utile una discussione in Parlamento, però, poiché la questione afferisce a una norma di carattere generale, che vale per tutte le società pubbliche, anche se ora è su questo caso specifico che si vuole apportare una modifica, è su quella norma di carattere generale che bisogna intervenire e non all'interno del disegno di legge di riforma della governance della RAI. Di qui il parere negativo sull'emendamento. Aggiungo, Presidente, che forse è utile richiamare il lavoro che stiamo facendo, perché abbiamo approvato il piano della trasparenza e abbiamo approvato, anche con il voto di una parte delle opposizioni, l'emendamento dei relatori, che introduce novità per le quali RAI entra in un territorio di total disclosure. Quindi, se RAI dovesse mai alzare le retribuzioni, la società concessionaria del servizio pubblico si dovrà assumere la responsabilità di fronte agli italiani anche di motivarlo. Quindi, da questo punto di vista credo che dovremmo rivendicare tutti quanti il lavoro che abbiamo fatto e che stiamo facendo.	
MARINA SERENI	PRESIDENTE	Passiamo ai voti. Indìco la votazione nominale, mediante procedimento elettronico, sull'emendamento Liuzzi 2.179, con il parere contrario delle Commissioni e del Governo e con il parere favorevole del relatore di minoranza. Dichiaro aperta la votazione. (Segue la votazione). Bolognesi, Piepoli, Carrozza, Frusone, Pili, Capelli, Vezzali, Lattuca... Dichiaro chiusa la votazione. Comunico il risultato della votazione: la Camera respinge (Vedi votazioni). (Presenti 408 Votanti 407 Astenuti 1 Maggioranza 204 Hanno votato sì 150 Hanno votato no 257). Passiamo all'emendamento Alfreider 2.192, a pagina 25 del fascicolo.	
DANIEL ALFREIDER		Chiedo di parlare.	
