speaker	role	text	extra
ANTONIO LEONE	PRESIDENTE	Passiamo alla votazione per schede per l'elezione del Presidente della Camera. Avverto che, trattandosi del quarto scrutinio, a norma dell'articolo 4, comma 2, del Regolamento, è richiesta per l'elezione la maggioranza assoluta dei voti, computando tra di essi anche le schede bianche oltre che, ovviamente, le schede nulle, come da prassi assolutamente costante. Conformemente alla prassi relativa alle votazioni per schede la chiama sarà effettuata secondo l'ordine alfabetico. Avverto altresì che ciascun deputato, dopo essere stato chiamato, all'atto di accedere al corridoio di votazione riceverà dagli assistenti parlamentari una scheda sulla quale potrà indicare un solo nominativo e che dovrà essere inserita nell'urna posta al di fuori della cabina. Le schede recanti più di un nominativo saranno dichiarate nulle. Avverto inoltre che, avendo taluni deputati lo stesso cognome, ove si intenda votare per uno di essi, occorrerà indicare sulla scheda – ai fini della attribuzione del voto – sia il cognome sia il nome dell'interessato. In mancanza dell'indicazione del nome il voto sarà considerato nullo. Per agevolare le operazioni di voto, invito i deputati ad avvicinarsi al banco della Presidenza seguendo il proprio turno di votazione, che è evidenziato sul tabellone elettronico, evitando quindi di stazionare nell'emiciclo e di rendere così più difficoltosa l'espressione del voto. Indìco la votazione per schede per l'elezione del Presidente della Camera e invito i deputati segretari a procedere alla chiama dei deputati. (Segue la votazione).	
ANTONIO LEONE	PRESIDENTE	Dichiaro chiusa la votazione. A norma dell'articolo 6, comma 1, del Regolamento, procederò, coadiuvato dai deputati segretari, allo spoglio delle schede. (Segue lo spoglio delle schede – Alla lettura della 310a scheda recante il nome «Boldrini» seguono vivi, prolungati applausi – Numerosi deputati si levano in piedi – Si riprende lo spoglio delle schede). Comunico il risultato della votazione per l'elezione del Presidente della Camera: Presenti e votanti 618 Maggioranza assoluta dei voti 310 Hanno ottenuto voti: Laura Boldrini 327; Roberto Fico 108. Voti dispersi 18 Schede bianche 155 Schede nulle 10 Proclamo pertanto eletta Presidente della Camera Laura Boldrini, che ha ottenuto la maggioranza assoluta dei voti (Vivi, prolungati applausi – I deputati si levano in piedi). Mi recherò immediatamente a comunicare alla Presidente eletta il risultato della votazione. Hanno preso parte alla votazione: Abrignani Ignazio Adornato Ferdinando Agostinelli Donatella Agostini Luciano Agostini Roberta Aiello Ferdinando Airaudo Giorgio Albanella Luisella Alberti Dino Alfano Angelino Alfano Gioacchino Alfreider Daniel Alli Paolo Amato Maria Amendola Vincenzo Amici Sesa Amoddio Sofia Angelucci Antonio Antezza Maria Anzaldi Michele Archi Bruno Argentin Ileana Arlotti Tiziano Artini Massimo Ascani Anna Attaguile Angelo Baldassarre Marco Baldelli Simone Balduzzi Renato Barbanti Sebastiano Baretta Pier Paolo Bargero Cristina Baroni Massimo Enrico Baruffi Davide Basilio Tatiana Basso Lorenzo Battaglia Demetrio Battelli Sergio Bazoli Alfredo Bechis Eleonora Bellanova Teresa Benamati Gianluca Benedetti Silvia Beni Paolo Bergamini Deborah Berlinghieri Marina Bernardo Maurizio Bernini Massimiliano Bernini Paolo Berretta Giuseppe Bersani Pier Luigi Bianchi Dorina Bianchi Mariastella Bianchi Nicola Biancofiore Michaela Bianconi Maurizio Biasotti Sandro Biffoni Matteo Bindi Rosy Binetti Paola Bini Caterina Biondelli Franca Blazina Tamara Bobba Luigi Boccadutri Sergio Bocci Gianpiero Boccia Francesco Boccuzzi Antonio Boldrini Laura Bolognesi Paolo Bombassei Alberto Bonaccorsi Lorenza Bonafè Simona Bonafede Alfonso Bonavitacola Fulvio Bonifazi Francesco Bonomo Francesca Bordo Franco Bordo Michele Borghese Mario Borghesi Stefano Borghi Enrico Borletti Dell'Acqua Buitoni Ilaria Carla Anna Boschi Maria Elena Bosco Antonino Bossa Luisa Bossi Umberto Braga Chiara Bragantini Matteo Bragantini Paola Brambilla Michela Vittoria Brandolin Giorgio Bratti Alessandro Bray Massimo Brescia Giuseppe Bressa Gianclaudio Brugnerotto Marco Brunetta Renato Bruno Franco Bruno Bossio Vincenza Bueno Renata Buonanno Gianluca Burtone Giovanni Mario Salvino Busin Filippo Businarolo Francesca Busto Mirko Buttiglione Rocco Calabria Annagrazia Calabrò Raffaele Campana Micaela Cancelleri Azzurra Pia Maria Cani Emanuele Caon Roberto Caparini Davide Capelli Roberto Capezzone Daniele Capodicasa Angelo Capone Salvatore Capozzolo Sabrina Capua Ilaria Carbone Ernesto Cardinale Daniela Carella Renzo Carfagna Maria Rosaria Cariello Francesco Carinelli Paola Carnevali Elena Carocci Mara Carra Marco Carrescia Piergiorgio Carrozza Maria Chiara Caruso Mario Casati Ezio Primo Casellato Floriana Casero Luigi Caso Vincenzo Cassano Franco Castelli Laura Castiello Giuseppina Castiglione Giuseppe Castricone Antonio Catalano Ivan Catania Mario Catanoso Genoese Francesco detto Basilio Catanoso Causi Marco Causin Andrea Cecconi Andrea Cenni Susanna Censore Bruno Centemero Elena Cera Angelo Cesa Lorenzo Cesaro Antimo Cesaro Luigi Chaouki Khalid Chiarelli Gianfranco Giovanni Chimienti Silvia Cicu Salvatore Cimbro Eleonora Cimmino Luciano Ciprini Tiziana Cirielli Edmondo Civati Giuseppe Coccia Laura Colaninno Matteo Colletti Andrea Colonnese Vega Cominardi Claudio Cominelli Miriam Coppola Paolo Corda Emanuela Corsaro Massimo Enrico Coscia Maria Costa Enrico Costantino Celeste Cota Roberto Cova Paolo Covello Stefania Cozzolino Emanuele Crimì Filippo Crimi Rocco Crippa Davide Crivellari Diego Culotta Magda Cuperlo Giovanni Currò Tommaso Dadone Fabiana Daga Federica D'Agostino Angelo Antonio D'Alessandro Luca D'Alia Giampiero Dallai Luigi Dall'Osso Matteo Dal Moro Gian Pietro D'Ambrosio Giuseppe Dambruoso Stefano D'Arienzo Vincenzo D'Attorre Alfredo Da Villa Marco Decaro Antonio De Girolamo Nunzia Del Basso De Caro Umberto Del Grosso Daniele Dellai Lorenzo Dell'Aringa Carlo Della Valle Ivan Dell'Orco Michele De Lorenzis Diego De Maria Andrea De Menech Roger De Micheli Paola De Mita Giuseppe De Rosa Massimo Felice Di Battista Alessandro Di Benedetto Chiara Dieni Federica Di Gioia Lello Di Lello Marco Di Maio Luigi Di Maio Marco D'Incà Federico D'Incecco Vittoria Di Salvo Titti Distaso Antonio Di Stefano Fabrizio Di Stefano Manlio Di Vita Giulia Donati Marco D'Ottavio Umberto Duranti Donatella D'Uva Francesco Epifani Ettore Guglielmo Ermini David Fabbri Marilena Faenzi Monica Famiglietti Luigi Fantinati Mattia Fanucci Edoardo Faraone Davide Farina Daniele Farina Gianni Fassina Stefano Fauttilli Federico Fava Claudio Fava Giovanni Fedi Marco Fedriga Massimiliano Ferranti Donatella Ferrara Ciccio Ferraresi Vittorio Ferrari Alan Ferro Andrea Fiano Emanuele Fico Roberto Fiorio Massimo Fioroni Giuseppe Fitto Raffaele Folino Vincenzo Fontana Cinzia Maria Fontana Gregorio Fontanelli Paolo Formisano Aniello Fossati Filippo Fraccaro Riccardo Fragomeli Gian Mario Franceschini Dario Fratoianni Nicola Fregolent Silvia Frusone Luca Fucci Benedetto Francesco Furnari Alessandro Gadda Maria Chiara Gagnarli Chiara Galan Giancarlo Galati Giuseppe Galgano Adriana Galli Carlo Galli Giampaolo Gallinella Filippo Gallo Luigi Gallo Afflitto Riccardo Antonio Galperti Guido Gandolfi Paolo Garavini Laura Garnero Santanchè Daniela Garofalo Vincenzo Garofani Francesco Saverio Gasbarra Enrico Gasparini Daniela Matilde Maria Gebhard Renate Gelli Federico Gelmini Mariastella Genovese Francantonio Gentiloni Silveri Paolo Ghizzoni Manuela Giachetti Roberto Giacobbe Anna Giacomelli Antonello Giacomoni Sestino Giammanco Gabriella Gigli Gian Luigi Ginato Federico Ginefra Dario Ginoble Tommaso Giordano Giancarlo Giordano Silvia Giorgetti Alberto Giorgetti Giancarlo Giorgis Andrea Gitti Gregorio Giuliani Fabrizia Giulietti Giampiero Gnecchi Marialuisa Gozi Sandro Grande Marta Grassi Gero Gregori Monica Gribaudo Chiara Grillo Giulia Grimoldi Paolo Guerini Giuseppe Guerini Lorenzo Guerra Mauro Gullo Maria Tindara Gutgeld Itzhak Yoram Iacono Maria Iannuzzi Cristian Iannuzzi Tino Impegno Leonardo Incerti Antonella Invernizzi Cristian Iori Vanna Kronbichler Florian Kyenge Cecile L'Abbate Giuseppe Labriola Vincenza Lacquaniti Luigi Laffranco Pietro Laforgia Francesco Lainati Giorgio La Marca Francesca La Russa Ignazio Latronico Cosimo Lattuca Enzo Lauricella Giuseppe Lavagno Fabio Legnini Giovanni Lenzi Donata Leonori Marta Letta Enrico Leva Danilo Librandi Gianfranco Liuzzi Mirella Locatelli Pia Elda Lodolini Emanuele Lombardi Roberta Lo Monte Carmelo Longo Piero Lorefice Marialucia Lorenzin Beatrice Losacco Alberto Lotti Luca Lupo Loredana Madia Maria Anna Maestri Patrizia Magorno Ernesto Maietta Pasquale Malisani Gianna Malpezzi Simona Flavia Manciulli Andrea Manfredi Massimiliano Mannino Claudia Mantero Matteo Manzi Irene Marantelli Daniele Marazziti Mario Marchetti Marco Marchi Maino Marcolin Marco Marcon Giulio Marguerettaz Rudi Franco Mariani Raffaella Mariano Elisa Marotta Antonio Marrocu Siro Marroni Umberto Martella Andrea Martelli Giovanna Marti Roberto Martino Antonio Martino Pierdomenico Marzana Maria Marzano Michela Matarrelli Toni Matarrese Salvatore Mattiello Davide Mauri Matteo Mazziotti Di Celso Andrea Mazzoli Alessandro Melilla Generoso Melilli Fabio Meloni Giorgia Meloni Marco Merlo Ricardo Antonio Meta Michele Pompeo Miccoli Marco Micillo Salvatore Migliore Gennaro Milanato Lorena Minardo Antonino Miotto Anna Margherita Misiani Antonio Misuraca Dore Mogherini Federica Mognato Michele Molea Bruno Molteni Nicola Monaco Francesco Monchiero Giovanni Mongiello Colomba Montroni Daniele Morani Alessia Morassut Roberto Moretti Alessandra Moretto Sara Mosca Alessia Maria Moscatt Antonino Mottola Giovanni Carlo Francesco Mucci Mara Mura Romina Murer Delia Naccarato Alessandro Nardella Dario Nardi Martina Narduolo Giulia Nastri Gaetano Nesci Dalila Nesi Edoardo Nicchi Marisa Nicoletti Michele Nissoli Fucsia Nuti Riccardo Oliaro Roberta Oliverio Nicodemo Nazzareno Orfini Matteo Orlando Andrea Ottobre Mauro Pagani Alberto Pagano Alessandro Paglia Giovanni Palazzotto Erasmo Palese Rocco Palma Giovanna Palmieri Antonio Palmizio Elio Massimo Pannarale Annalisa Paolucci Massimo Parentela Paolo Paris Valentina Parisi Massimo Parrini Dario Pastorelli Oreste Pastorino Luca Patriarca Edoardo Pelillo Michele Pellegrino Serena Peluffo Vinicio Giuseppe Guido Pes Caterina Pesco Daniele Petitti Emma Petraroli Cosimo Petrenga Giovanna Petrini Paolo Piazzoni Ileana Cathia Picchi Guglielmo Piccione Teresa Piccoli Nardelli Flavia Piccolo Giorgio Piccolo Salvatore Piccone Filippo Picierno Pina Piepoli Gaetano Pili Mauro Pilozzi Nazzareno Pini Gianluca Pini Giuditta Piras Michele Pisano Girolamo Pisicchio Pino Piso Vincenzo Pistelli Lapo Pizzolante Sergio Placido Antonio Plangger Albrecht Polidori Catia Pollastrini Barbara Polverini Renata Porta Fabio Portas Giacomo Antonio Prataviera Emanuele Prestigiacomo Stefania Preziosi Ernesto Prodani Aris Quaranta Stefano Quartapelle Procopio Lia Quintarelli Giuseppe Stefano Rabino Mariano Raciti Fausto Ragosta Michele Rampelli Fabio Rampi Roberto Ravetto Laura Realacci Ermete Ribaudo Francesco Ricciatti Lara Richetti Matteo Rigoni Andrea Rizzetto Walter Rizzo Gianluca Rocchi Maria Grazia Romano Andrea Romano Francesco Saverio Romano Paolo Nicolò Romele Giuseppe Rondini Marco Rosato Ettore Rossi Domenico Rossomando Anna Rostan Michela Rostellato Gessica Rotta Alessia Rubinato Simonetta Rughetti Angelo Ruocco Carla Russo Paolo Saltamartini Barbara Sammarco Gianfranco Sanga Giovanni Sani Luca Sanna Francesco Sanna Giovanna Santelli Jole Santerini Milena Sarro Carlo Sarti Giulia Savino Sandra Sberna Mario Sbrollini Daniela Scagliusi Emanuele Scalfarotto Ivan Scanu Gian Piero Schirò Planeta Gea Schullian Manfred Scopelliti Rosanna Scotto Arturo Scuvera Chiara Segoni Samuele Senaldi Angelo Sereni Marina Sibilia Carlo Sisto Francesco Paolo Smeriglio Massimiliano Sorial Girgis Giorgio Sottanelli Giulio Cesare Spadoni Maria Edera Speranza Roberto Spessotto Arianna Squeri Luca Stumpo Nicola Tabacci Bruno Tacconi Alessio Tancredi Paolo Taranto Luigi Taricco Mino Tartaglione Assunta Tentori Veronica Terrosi Alessandra Terzoni Patrizia Tidei Marietta Tinagli Irene Tofalo Angelo Toninelli Danilo Totaro Achille Tripiedi Davide Tullo Mario Turco Tancredi Vacca Gianluca Vaccaro Guglielmo Valente Simone Valente Valeria Valentini Valentino Valiante Simone Vallascas Andrea Vargiu Pierpaolo Vazio Franco Vecchio Andrea Vella Paolo Velo Silvia Vendola Nichi Venittelli Laura Ventricelli Liliana Verini Walter Vezzali Maria Valentina Vignali Raffaello Vignaroli Stefano Villarosa Alessio Villecco Calipari Rosa Maria Vitelli Paolo Vito Elio Zaccagnini Adriano Zampa Sandra Zan Alessandro Zanetti Enrico Zanin Giorgio Zappulla Giuseppe Zardini Diego Zoggia Davide Zolezzi Alberto	
			La seduta, sospesa alle 13,05, è ripresa alle 13,25.
			Insediamento e discorso del Presidente della Camera.
ANTONIO LEONE	PRESIDENTE	Sospendo pertanto la seduta, che riprenderà tra non molto.	
			PRESIDENZA DEL PRESIDENTE LAURA BOLDRINI
LAURA BOLDRINI	PRESIDENTE	Invito la Presidente della Camera dei deputati, Laura Boldrini, ad assumere la Presidenza (La Presidente Laura Boldrini fa il suo ingresso in Aula, sale al banco della Presidenza e scambia un saluto con il Presidente provvisorio Antonio Leone – Vivi applausi – I deputati si levano in piedi).	
			Invito alla costituzione dei gruppi parlamentari.
LAURA BOLDRINI	PRESIDENTE	(Pronunzia, stando in piedi, il seguente discorso). Care deputate e cari deputati, permettetemi di esprimere il mio più sentito ringraziamento per l'alto onore e la responsabilità che comporta il compito di presiedere i lavori di questa Assemblea. Vorrei, innanzitutto, rivolgere il saluto rispettoso e riconoscente di tutta l'Assemblea e mio personale al Presidente della Repubblica Giorgio Napolitano (Applausi – I deputati si levano in piedi), che è custode rigoroso dell'unità del Paese e dei valori della Costituzione repubblicana. Vorrei, inoltre, inviare un saluto cordiale al Presidente della Corte costituzionale e al Presidente del Consiglio. Faccio a tutti voi i miei auguri di buon lavoro, soprattutto ai più giovani, a chi siede per la prima volta in quest'Aula (Applausi). Sono sicura che, in un momento così difficile per il nostro Paese, insieme riusciremo ad affrontare l'impegno straordinario di rappresentare nel migliore dei modi le istituzioni repubblicane. Vorrei rivolgere, inoltre, un cordiale saluto a chi mi ha preceduto, al Presidente Gianfranco Fini, che ha svolto con responsabilità la sua funzione istituzionale (Applausi). Arrivo a questo incarico dopo avere trascorso tanti anni a difendere e a rappresentare i diritti degli ultimi, in Italia come in molte periferie del mondo. È un'esperienza che mi accompagnerà sempre e che da oggi metto al servizio di questa Camera. Farò in modo che questa istituzione sia anche il luogo di cittadinanza di chi ha più bisogno (Applausi). Il mio pensiero va a chi ha perduto certezze e speranze. Dovremo impegnarci tutti a restituire piena dignità a ogni diritto. Dovremo ingaggiare una battaglia vera contro la povertà, e non contro i poveri. In questa Aula sono stati scritti i diritti universali della nostra Costituzione, la più bella del mondo. La responsabilità di questa istituzione si misura anche nella capacità di saperli rappresentare e garantire uno a uno. Questa Aula dovrà ascoltare la sofferenza sociale di una generazione che ha smarrito se stessa, prigioniera della precarietà, costretta spesso a portare i propri talenti lontano dall'Italia (Applausi). Dovremo farci carico dell'umiliazione delle donne che subiscono violenza travestita da amore (Prolungati applausi), ed è un impegno che fin dal primo giorno affidiamo alla responsabilità della politica e del Parlamento. Dovremo stare accanto a chi è caduto senza trovare la forza o l'aiuto per rialzarsi, ai tanti detenuti che oggi vivono in una condizione disumana e degradante (Applausi), come ha autorevolmente denunziato la Corte europea dei diritti umani di Strasburgo. Dovremo dare strumenti a chi ha perso il lavoro o non lo ha mai trovato, a chi rischia di smarrire perfino l'ultimo sollievo della cassa integrazione, ai cosiddetti esodati, che nessuno di noi ha dimenticato (Applausi), ai tanti imprenditori che costituiscono una risorsa essenziale per l'economia italiana (Applausi) e che oggi sono schiacciati dal peso della crisi, alle vittime del terremoto e a chi subisce ogni giorno gli effetti della scarsa cura del nostro territorio (Applausi). Dovremo impegnarci per restituire fiducia a quei pensionati che hanno lavorato tutta la vita e che oggi non riescono ad andare avanti (Applausi). Dovremo imparare a capire il mondo con lo sguardo aperto di chi arriva da lontano, con l'intensità e lo stupore di un bambino, con la ricchezza interiore e inesplorata di un disabile. In Parlamento sono stati scritti questi diritti, ma sono stati costruiti fuori da qui, liberando l'Italia e gli italiani dal fascismo (Prolungati applausi). Ricordiamo il sacrificio di chi è morto per le istituzioni e per questa democrazia. Anche con questo spirito siamo idealmente vicini a chi oggi, a Firenze, assieme a Luigi Ciotti, ricorda tutti i morti per mano mafiosa (Prolungati applausi). Al loro sacrificio ciascuno di noi e questo Paese devono molto. E molto, molto, dobbiamo anche al sacrificio di Aldo Moro e degli uomini della sua scorta (Applausi), che ricordiamo con commozione oggi, nel giorno in cui cade l'anniversario del loro assassinio. Questo è un Parlamento largamente rinnovato. Scrolliamoci di dosso ogni indugio nel dare piena dignità alla nostra istituzione, che saprà riprendersi la centralità e la responsabilità del proprio ruolo. Facciamo di questa Camera la casa della buona politica (Applausi), rendiamo il Parlamento e il nostro lavoro trasparenti, anche in una scelta di sobrietà che dobbiamo agli italiani (Prolungati applausi). Sarò la Presidente di tutti, a partire da chi non mi ha votato. Mi impegnerò perché la mia funzione sia luogo di garanzia per ciascuno di voi e per tutto il Paese. L'Italia fa parte del nucleo dei fondatori del processo di integrazione europea. Dovremo impegnarci ad avvicinare i cittadini italiani a questa sfida, a un progetto che sappia recuperare per intero la visione e la missione che furono pensate con lungimiranza da Altiero Spinelli (Applausi). Lavoriamo perché l'Europa torni ad essere un grande sogno, un crocevia di popoli e di culture, un approdo certo per i diritti delle persone, appunto un luogo della libertà, della fraternità e della pace. Anche i protagonisti della vita spirituale e religiosa ci spronano ad osare di più. Per questo abbiamo accolto con gioia i gesti e le parole del nuovo pontefice (Generali applausi), venuto emblematicamente dalla fine del mondo. A Papa Francesco il saluto carico di speranza di tutti noi. Consentitemi un saluto anche alle istituzioni internazionali, alle associazioni e alle organizzazioni delle Nazioni Unite, in cui ho lavorato per 24 anni, e permettetemi, visto che questo è stato fino ad oggi il mio impegno, un pensiero per i molti, troppi morti senza nome che il nostro Mediterraneo custodisce (Applausi). Un mare che dovrà sempre più diventare un ponte verso altri luoghi, altre culture, altre religioni. Sento forte l'alto richiamo del Presidente della Repubblica all'unità del Paese. Un richiamo che quest'Aula è chiamata a raccogliere con pienezza e convinzione. La politica deve tornare ad essere una speranza, un servizio, una passione (Prolungati applausi). Stiamo iniziando un viaggio, oggi iniziamo un viaggio: cercherò di portare, assieme a ciascuno di voi, con cura e umiltà, la richiesta di cambiamento che alla politica oggi rivolgono tutti gli italiani, soprattutto i nostri figli. Grazie (Vivi, prolungati applausi).	
			Ordine del giorno della prossima seduta.
LAURA BOLDRINI	PRESIDENTE	Ricordo che l'articolo 14, comma 3, del Regolamento, prevede che i deputati debbano dichiarare al Segretario generale della Camera, entro due giorni dalla prima seduta, a quale gruppo parlamentare appartengono. La dichiarazione potrà, pertanto, essere effettuata entro il prossimo lunedì 18 marzo. Martedì 19 marzo, alle ore 15, i deputati aderenti ai gruppi parlamentari, nonché quelli che faranno parte del gruppo Misto, sono convocati simultaneamente per procedere all'elezione del presidente e degli altri organi direttivi dei gruppi stessi, secondo quanto previsto dall'articolo 15, comma 1, del Regolamento. La Camera tornerà a riunirsi giovedì 21 marzo alle ore 15 con il seguente ordine del giorno: votazione per l'elezione di quattro Vicepresidenti, di tre Questori e di otto Segretari. Ulteriori comunicazioni all'Assemblea saranno pubblicate nell'allegato A al resoconto della seduta odierna.	
			La seduta termina alle 13,45.
