speaker	role	text	extra
VITTORIA BALDINO	M5S	Grazie, Presidente. Io non credo che questa sia la sede adatta per fare dei processi politici al sindaco di Roma, anche perché, nel 2021, saranno i cittadini a poter scegliere e poter giudicare questa amministrazione. Io voglio ricordare ai colleghi, all’Aula e ai cittadini che ci seguono da casa che stiamo parlando di un emendamento che riguarda tutte le città che si compongono di circoscrizioni, non solo della città di Roma. La città di Roma si compone di quindici municipi, che sono grandi, che hanno una popolazione quanto una grande città, un’altra grande città italiana, quanto un capoluogo e, nello specifico, il municipio di cui si parla, il IV, conta 180 mila abitanti, quindi non è un quartiere, non stiamo parlando di un piccolo quartiere. Quale è la ratio di questa modifica che, a mio avviso, è stata di buonsenso, che è stata introdotta? Quella di evitare di richiamare al voto dei cittadini in emergenza: stiamo rinviando le elezioni proprio per consentire a tutti i cittadini di andare a votare in sicurezza e, poi, richiamarli al voto dopo nove mesi, perché le circoscrizioni di un comune seguono le sorti del comune, quindi, nel momento in cui il comune va al voto, anche tutti i municipi devono andare al voto.	
MARIA ROSARIA CARFAGNA	PRESIDENTE	Concluda, onorevole Baldino.	
VITTORIA BALDINO	M5S	Quindi, noi abbiamo in questo modo evitato che si dovessero richiamare dopo nove mesi gli stessi cittadini a confermare un consiglio circoscrizionale e una giunta circoscrizionale che, obiettivamente, in nove mesi di mandato, non potrebbe fare miracoli in quel territorio (Applausi dei deputati del gruppo MoVimento 5 Stelle).	
MARIA ROSARIA CARFAGNA	PRESIDENTE	Passiamo ai voti. Indìco la votazione nominale, mediante procedimento elettronico, sugli identici emendamenti 1.301 De Angelis e 1.349 Baldelli, con il parere contrario di Commissione e Governo. Dichiaro aperta la votazione. (Segue la votazione). Dichiaro chiusa la votazione. La Camera respinge (Vedi votazione n. 15). L’emendamento 1-bis.300 Sisto è stato ritirato prima della seduta. Passiamo, quindi, alla votazione dell’emendamento 1-bis.301 Magi. Ha chiesto di parlare l’onorevole Giachetti. Ne ha facoltà.	
ROBERTO GIACHETTI	IV	La ringrazio, Presidente. Sarò molto breve, utilizzo il tempo del gruppo, che continuerà a votare secondo le indicazioni della maggioranza, per delle brevi considerazioni a carattere personale che riguardano i due emendamenti che seguono, che sono rimasti in piedi, cioè l’1-bis.301 Magi e l’1-bis.2 a prima firma Sisto, perché, Presidente, ovviamente, non intendo intervenire nel merito del referendum, l’ho già fatto quando, l’8 ottobre, abbiamo votato la legge costituzionale. Io dichiarai in quell’occasione che l’unica ragione per la quale votavo una riforma costituzionale che ritengo sbagliata e demagogica era perché era all’interno di un accordo di governo che il partito di Italia Viva aveva siglato, ma conclusi il mio intervento dicendo che, per quel che mi riguardava, finiva in quel momento, con quel voto, il mio dovere di lealtà rispetto al Governo su questo argomento. Io ho partecipato anche al tentativo di raccogliere le firme alla Camera: vorrei dire a tutti coloro che si sono scandalizzati per questo che io penso che, quando si utilizzano degli strumenti che sono previsti dalla Costituzione, signor Presidente, non c’è nulla di cui vergognarsi, anzi c’è qualcosa di cui congratularsi. Detto questo, abbiamo ottenuto, grazie al lavoro che è stato fatto al Senato - lo hanno ricordato alcuni colleghi - la possibilità di svolgere il referendum. Per quanto riguarda il fatto che adesso si decida, io ho sentito il Ministro dell’Interno che diceva che non c’è nessuna alterazione, probabilmente non c’è nessuna alterazione formale, ma c’è sicuramente l’alterazione della ratio in ragione della quale la legge prevede che non si possano abbinare i referendum ad altre elezioni e la consuetudine ha previsto che sui referendum costituzionali si è sempre evitato di abbinare le due cose, soprattutto per il fatto che è una campagna elettorale molto delicata e molto particolare. In più, come abbiamo visto, magari in altri referendum che all’inizio sembravano essere scontati, poi, grazie alla campagna elettorale che era specifica su quei temi, purtroppo, dico io, l’esito di quei referendum che sembravano dai sondaggi scontati è cambiato e hanno avuto risultati diversi. Io penso che sia assolutamente ingiusto e sia sbagliato mettere insieme la data del referendum con quella delle elezioni amministrative in un election day che, ovviamente, è voluto, a mio avviso, strutturalmente, proprio per impedire che ci sia un dibattito pubblico sul referendum e, quindi, per quanto mi riguarda voterò a favore dei due emendamenti che chiedono che sia scorporata la data del referendum da quella delle elezioni amministrative, anche perché, a differenza, e ho concluso Presidente, dalle elezioni amministrative, che hanno una data in cui si devono svolgere, quindi, si prevede una deroga a quella data, non dimentichiamoci che per fissare la data del referendum il Governo ha una finestra dentro la quale può fissare quella data ed è una finestra che aveva già esercitato nel momento in cui era stato indetto il referendum che, poi, per le ragioni che sappiamo, è saltato. Poteva tranquillamente utilizzare la stessa possibilità di quella finestra per fissare una data diversa, non immediata, dal voto amministrativo e fare in modo che il referendum potesse avere il suo dibattito e la sua campagna elettorale (Applausi dei deputati del gruppo Italia Viva e Forza Italia-Berlusconi Presidente).	
MARIA ROSARIA CARFAGNA	PRESIDENTE	Ha chiesto di parlare il deputato Ceccanti. Ne ha facoltà.	
STEFANO CECCANTI	PD	Io vorrei dire che i colleghi, anche il collega Maci, usano spesso l’argomento che si sarebbe creata una prassi che quasi diventa, nelle loro parole, una specie di consuetudine costituzionale del non abbinamento del referendum. Noi abbiamo avuto tre referendum costituzionali, due dei quali a priori non erano abbinabili, perché nel 2001 è finito a ottobre, nel 2016 è finito a dicembre. C’è stata una scelta nel 2006, l’unico caso in cui era abbinabile, in cui il Governo non l’ha abbinato. Mi sembra un po’ poco dire che un caso in cui si è scelto in un modo costituisca un precedente, una prassi o una consuetudine. L’unica norma di proibizione, di cui mai si è parlato alla Costituente - perché se voi andate a vedere i lavori della Costituente sul referendum, mai si parla di divieti di abbinamenti di referendum abrogativi o referendum confermativi con altro tipo di elezioni -, l’unica inibizione che c’è, nella legge n. 352, è tra il referendum abrogativo e le elezioni politiche, ma tutti sappiamo perché c’è quella norma, non perché allora si teorizzò che il referendum dovesse avvenire in una data diversa, ma perché la maggioranza di Governo che stava dietro quella legge era divisa sulla legge sul divorzio; per cui il primo referendum si sarebbe svolto sulla legge sul divorzio e la maggioranza di Governo non voleva, il giorno delle elezioni politiche, dividersi sulla legge sul divorzio; c’era una preoccupazione politica del tutto legittima, ma contingente di quella fase politica. Tant’è che fu messa solo per abrogativo e politiche, non c’entrano nulla le regionali e le amministrative e non c’entra nulla il confermativo. Detto questo, il legislatore, quindi, sceglie quello che vuole; ora, io non riesco a capire la logica dei colleghi per cui se noi diamo a un cittadino due schede, la scelta su una scheda debba allinearsi sull’altra, non lo dice nessuno. Guardate che l’esperienza più intensiva di uso dei referendum c’è negli Stati americani, in cui si fa nell’election day. Capita spessissimo che in uno Stato vinca un Presidente di un certo colore politico e sulla scheda referendaria l’elettore scelga un comportamento del tutto diverso. L’ultima volta, quando ha vinto Trump, in molti Stati sono passati referendum antiproibizionisti lo stesso giorno. Quindi, organizziamo la campagna elettorale in tutti i modi possibili, per permettere agli elettori di formarsi un giudizio distinto su una scheda e sull’altra, ma non è che l’election day lo impedisca di per sé.	
MARIA ROSARIA CARFAGNA	PRESIDENTE	Ha chiesto di parlare l’onorevole Sgarbi.	
VITTORIO SGARBI	M-NI-USEI-C!-AC	Non so se sarà possibile, un giorno, avere un Parlamento che abbia libertà di parola e abbia emblematicamente la bocca libera, però è certo che questo referendum si avvia a una situazione nella quale sarà opportuno che noi riduciamo i parlamentari da 630 a 400, per poter avere, per la perdurata, che a questo punto è indicata dai comitati tecnico-scientifici, per molti decenni del Coronavirus, in maniera tale che la distanza sia garantita e di questi 630, i 400 posti consentano la distanza, perché in alternativa dovremmo pensare di portare, per i prossimi dieci anni, la maschera, anzi, il bavaglio, che, rammento per l’ennesima volta, essendo il virus documentatamente iniziato in ottobre, in quest’Aula non è stata portata fino al 20 aprile. Quindi, il 20 aprile c’erano 629 persone così intelligenti che non documentandosi pensavano che non ci fosse il Coronavirus, che in quel momento, esattamente tra il 10 marzo e il 20 aprile, aveva la sua più alta incidenza contro la salute dei cittadini. Oggi, che noi abbiamo dichiarazioni precise sulla curva del virus e che la malattia declina fino quasi a sparire, ostentatamente, portiamo quella maschera. Mi auguro che quando quest’Aula sarà bonificata di 230 parlamentari le distanze ci consentano di rispettare quello che, rammento a tutti i loro, cari 629 colleghi intelligenti, ha detto il capo della Protezione civile che mi pare più importante, dal punto di vista delle misure di sicurezza, del Questore che ha tentato di allontanarmi e poi ha rinunciato a farlo e cioè: “io non porto la mascherina” - capo della Protezione civile Borrelli – “perché mantengo le distanze”. Io le distanze le mantengo da sempre, credo che sia giusto mantenere le distanze verso persone per le quali non occorre vicinanza e così ho fatto e continuerò a fare. Il mio riferimento è la Protezione civile, non la volontà di 629 persone le quali sono state totalmente subornate e gli è stato imposto di portare quello che fino al 20 aprile non hanno portato, caro Presidente (Applausi dei deputati del gruppo Misto-Noi con l’Italia-USEI-Cambiamo!-Alleanza di Centro)!	
MARIA ROSARIA CARFAGNA	PRESIDENTE	Caro onorevole Sgarbi, intanto la invito a stare sull’emendamento ogni volta che interviene, perché anche questa è una regola che viene rispettata da 629 deputati (Applausi dei deputati dei gruppi Partito Democratico e Liberi e Uguali) e le regole…	
VITTORIO SGARBI	M-NI-USEI-C!-AC	Io ho parlato del referendum!	
MARIA ROSARIA CARFAGNA	PRESIDENTE	Non ha più la parola, onorevole Sgarbi. Le regole in quest’Aula le stabiliscono i Questori e siamo tutti tenuti ad osservarle. Lei è tenuto a rispettarle, io sono tenuta a farle rispettare, così funziona in quest’Aula.	
MARIA ROSARIA CARFAGNA	PRESIDENTE	Ha chiesto di parlare l’onorevole Baldelli. Prego.	
SIMONE BALDELLI	FI	La ringrazio, Presidente. Questo emendamento ha come obiettivo quello di disabbinare la scadenza dell’election day dal referendum costituzionale; sostanzialmente, cancella l’emendamento che ho definito in quest’Aula, citando autorevoli esponenti politici, peraltro non del mio partito, l’emendamento dell’onorevole Macina che inserisce, che introduce la porcata di abbinare il referendum costituzionale con la tornata amministrativa. Perché la definisco così? Non è nel mio linguaggio normalmente, ma perché è l’intenzione di cercare di tirare la volata al “sì” che è alla base di questa proposta emendativa. Collega Ceccanti, non so se fossero abbinabili due tornate su tre, ma l’unica in cui era possibile fare quell’abbinamento non fu fatto; tra l’altro, come dire, non è che perché non si è fatto si stabilisce un principio che non vada mai fatto, ma certamente l’emendamento che in qualche modo la impone è un’ammissione di colpa da questo punto di vista. Ripeto, nel ricostruire la storia, a marzo io e pochi altri vi dicevamo di cancellare questa data, di revocare la data del 29 marzo perché era una data che non permetteva la celebrazione in sicurezza del referendum ed era una data per la quale non ci sarebbe stata la possibilità dei cittadini di conoscere per deliberare. Infatti, ve lo ricordate pure voi che i primi di marzo nessuno parlava del referendum, o sbaglio? Allora, guardate, per fortuna c’è l’eterogenesi dei fini perché se quando uno fa queste furbate poi fosse anche premiato dal risultato, staremmo qui a guardare le macerie del Parlamento. Per fortuna questa cosa non è successa. Tra l’altro, sono state bocciate sonoramente le proposte di riduzione del numero dei parlamentari sia nelle riforme del centrodestra, sia nelle riforme del centrosinistra. Adesso, la più basica, quella che secondo Forciniti non c’è bisogno nemmeno di essere particolarmente intelligenti, brillanti o di avere chissà quali cognizioni per poterla votare, che è così facile, certo: è tanto facile, quanto inutile, quanto pericolosa: è la mia posizione personale; io appartengo a un partito che ha votato questa roba alla Camera, per cui ci tengo a precisarlo. Però, attenzione, lo stesso fatto che abbiate introdotto questa norma, anziché avvalervi della facoltà di poterlo fare, significa che la facoltà di poterlo fare evidentemente non c’era, altrimenti voi la norma non l’avreste introdotta, e non l’avete introdotta come facoltà - questa è la porcata - l’avete introdotta come obbligo, perché leggendo questa norma, anche a fronte dell’interpretazione che ne dà il Governo, non c’è la facoltà ma l’obbligo: è chiaro? Allora, in questa sede io ho rappresentato credo bene al Ministro, con un certo equilibrio, il fatto che il comitato promotore, che è un soggetto costituzionale, è di tutt’altra idea. Noi mandiamo al Senato per tre giorni questa norma, dopo che il comitato promotore è composto da un quinto dei senatori. Mi auguro che quanto anche il collega Fornaro dice con grande equilibrio, pacatezza e buon senso - ma spesso rimanendo inascoltato - avvenga, cioè che non venga messa la fiducia al Senato. Ma se i settantacinque senatori che hanno firmato questa roba vi chiedono di fare una valutazione diversa sulla data, che fate? Infatti la norma è fatta, il pasticcio è fatto. Allora io mi auguro che il Governo si prenda la facoltà di poter decidere, almeno all’interno di questo pasticcio, di questa porcata che avete voluto fare a colpi di maggioranza, si prenda la facoltà di poter assumere una posizione di buonsenso, perché magari da un servitore dello Stato come il Ministro Lamorgese, che ha esperienza e buon senso, posso aspettarmi di più di quanto non mi aspetto dal MoVimento 5 Stelle, che così come fa sui municipi di Roma fa per il referendum: fa tutte iniziative pro domo sua per il solo interesse politico, partitico del suo movimento.	
MARIA ROSARIA CARFAGNA	PRESIDENTE	Ha chiesto di parlare l’onorevole Magi. Ne ha facoltà.	
RICCARDO MAGI	MISTO-CD-RI-+E	Grazie, Presidente. Non possiedo la dottrina né la scienza del professore Ceccanti, per questo mi limiterò a inviare a tutti quanti i colleghi il parere che il professor Celotto, per conto del comitato del no, ha steso e che è stato fatto pervenire alla Presidenza del Consiglio. Credo che però noi siamo in una situazione molto diversa da quella che il collega Ceccanti ha rappresentato, la situazione degli Stati Uniti, e ne avremo la prova quando noi andremo al voto, se ci andremo in queste condizioni. Non credo che noi vedremo molti dei colleghi che pure hanno votato in quest’Aula contro la riduzione del numero dei parlamentari affrontare una campagna elettorale sostenendo il no e, se questo non avverrà, sarà anche perché quella campagna elettorale sarà coincidente con una campagna del tutto politica come quella delle regionali in sei importanti regioni. Questo mi sembra il punto dirimente: bisogna avere anche il senso della concretezza e delle modalità con cui poi avvengono le cose. Ora, potremmo rassegnarci al fatto che un giorno, con la distanza della storia e del tempo che passa, da parte di chi leggerà cos’è avvenuto quest’anno si accomuni la pandemia con la riduzione dei parlamentari e, come il collega Sgarbi ci diceva, qualcuno potrà pensare che nel 2020-2021 gli italiani hanno ritenuto per motivi di distanziamento di ridurre il numero dei parlamentari. Sarebbe sicuramente una motivazione più nobile e più fondata di tutte quelle che sono state poste alla base di questa scellerata riforma costituzionale. Ci vorrebbe almeno un po’ di coraggio e di senso delle istituzioni per dire che questo passaggio merita una campagna elettorale autonoma, un confronto franco di idee, nella quale anche all’interno dei singoli partiti ci si possa schierare diversamente senza dover rispondere a un legittimo interesse elettorale (Applausi dei deputati del gruppo Misto-Centro Democratico-Radicali Italiani-+Europa).	
MARIA ROSARIA CARFAGNA	PRESIDENTE	Passiamo ai voti. Indìco la votazione nominale, mediante procedimento elettronico, sull'emendamento 1-bis.301 Magi, con il parere contrario della Commissione e del Governo. Dichiaro aperta la votazione. (Segue la votazione). Dichiaro chiusa la votazione. La Camera respinge (Vedi votazione n. 16). Passiamo alla votazione dell’emendamento 1-bis.800 della Commissione. Chiedo il parere alla relatrice e al Governo.	
ANNA BILOTTI	Relatrice	Grazie, Presidente. Parere favorevole.	
ACHILLE VARIATI	Sottosegretario di Stato per l'Interno	Parere favorevole.	
MARIA ROSARIA CARFAGNA	PRESIDENTE	Passiamo ai voti. Indìco la votazione nominale, mediante procedimento elettronico, sull'emendamento 1-bis.800 della Commissione, con il parere favorevole della Commissione e del Governo. Dichiaro aperta la votazione. (Segue la votazione). Dichiaro chiusa la votazione. La Camera approva (Vedi votazione n. 17). Passiamo alla votazione dell’emendamento 1-bis.2 Sisto. Ha chiesto di parlare l’onorevole Baldelli, prego.	
SIMONE BALDELLI	FI	Grazie, Presidente. Anche questo emendamento di Forza Italia punta a cancellare l’emendamento Macina. Facevo una riflessione, colleghi, perché se mai - io me lo auguro per carità di patria, perché, guardate, per amor di patria, poi ognuno nella vita può fare mille altre cose e non è necessario né obbligatorio per nessuno anche continuare a candidarsi e fare la propria esperienza politica -, se per qualche ragione dovesse vincere il sì, sarà interessante capire una cosa, perché dal giorno dopo noi avremmo tutta una quantità di persone che considereranno questa legislatura blindata dalla vittoria del sì. Altri cominceranno a dire che il Parlamento è delegittimato perché è un Parlamento con un terzo di deputati in più e ci faremo delle grasse risate, al di là dell’ironia, pur intelligente, del collega Sgarbi sul distanziamento dato dalle norme sul COVID. Probabilmente si sottovaluta, per un aspetto e per un altro, l’impatto di questa norma costituzionale non sul sistema costituzionale e ordinamentale, ma sul sistema politico attuale. Infatti, guardate, ci sarà da ridere quando qualche gruppo dovrà spiegare che oltre ad aver ridotto abbondantemente il proprio consenso nelle elezioni e nei sondaggi, si ridurrà anche di un terzo il numero dei posti contendibili per rientrare nel Parlamento della prossima legislatura. Allora, voglio vedere quanto sarà bello, facile, sublime tenere i deputati di maggioranza in Aula o nelle Commissioni per sostenere quello o quell’altro provvedimento. Ci faremo le grasse risate. Ma pensavo anche: chissà quante trasmissioni televisive daranno informazione sul tema del referendum nel pieno di agosto: forse Omnibus Estate, non lo so. Se non si impone, per par condicio, a L’Eredità o ai “pacchi” di Insinna di ospitare un oratore a favore e un oratore contro sul tema del referendum, io sono disponibile a fare con chiunque un confronto in spiaggia dal 15 agosto in poi su questo tema, ma ho come la sensazione che la stragrande maggioranza dei bagnanti non sia propriamente attirata da questo tipo di confronto. Allora, lì è la porcheria di questa cosa. Collega Ceccanti, mi può venire a tirare fuori tutti i precedenti che vuole, ma non mi venga a raccontare che una campagna referendaria, che si celebra per la maggior parte del tempo nel mese di agosto, è una campagna referendaria vera. Lo fate per le elezioni amministrative e per le elezioni regionali: benissimo, ma questa campagna qui è una campagna che scomparirà sotto il peso e delle elezioni regionali e delle elezioni amministrative ed è questo l’obiettivo di chi pensa che meno se ne parli e più si vince, addirittura con un’ulteriore perversione, cioè che c’è qualcuno che pensa che l’aggiunta della scheda del “sì” porti vantaggio al proprio partito, che è quello che l’ha proposto, il “sì”. Per cui, ecco, queste sono tutte le ragioni per cui io continuo, in quest’Aula, insieme a pochissimi altri, a denunciare, da uomo libero, questo atteggiamento, perché credo che questo atteggiamento comprima letteralmente il diritto dei cittadini di conoscere per poter deliberare e mescoli le carte in maniera artificiosa e in malafede rispetto al confronto democratico che, invece, perfino in quest’Aula cerchiamo, spesso e volentieri, di mantenere su un livello di rispetto reciproco e di decenza.	
MARIA ROSARIA CARFAGNA	PRESIDENTE	Onorevole Ceccanti, i banchi del Governo. Ha chiesto di parlare l’onorevole Sgarbi. Onorevole Ceccanti…	
VITTORIO SGARBI	M-NI-USEI-C!-AC	Onorevole Ceccanti, sarà assai difficile spiegare ai cittadini per quale ragione nello stesso tempo una elezione legata a persone, a partiti, alla maggioranza che una coalizione può ottenere in una regione o in un comune, debba convivere con una indicazione costituzionale che ha richiesto quattro voti d’Aula, in cui per tre volte il partito di Ceccanti ha votato contro la riduzione dei parlamentari, in cui per tre volte il PD ha ritenuto di non ridurre i parlamentari. Io credo che occorrerà introdurre un elemento fondamentale, che per la riduzione dei parlamentari ci voglia il parere del Comitato tecnico-scientifico che spiegherà che la ragione è veramente metrica: la distanza di rispetto. È una buona ragione per portare questi 629 intelligentissimi a 400, meno intelligenti, ma più distanti Però, è anche evidente che la campagna elettorale condotta nello stesso tempo produrrà confusione, perché, dovendo nominare persone, sindaci, amministratori, consiglieri o presidenti di regione, noi abbiamo un’opzione personale e politica, non una delibazione costituzionale sofisticata e, naturalmente, legata al parere obbligatorio del Comitato tecnico-scientifico su questioni di distanza. Per questo credo che abbiano ragione l’amico Magi, e Sisto, e Baldelli a tentare di portarvi alla scelta che non capisco che dramma possa portare. Siete destinati a stare qui fino al 2029 con questo potentissimo Governo e un’alleanza così ragionevole fra 5 Stelle e il PD, che hanno sempre indicato come loro nemico e che oggi è il loro miglior alleato. D’altra parte, essere grillini senza Grillo vuol dire aver perso la situazione originaria e, quindi, possono essere… Però, è evidente che se io voglio spiegare a un cittadino perché deve votare “sì” al referendum ho degli argomenti dialettici diversi da quelli per cui posso indicare di votare De Luca o Emiliano. È chiaro che la ragione, la didattica, la capacità di persuasione in una campagna elettorale, caro onorevole Ceccanti, richiede concentrazione su un tema costituzionale e non sull’elezione legata a uomini, donne, consiglieri e presidenti. Per questo credo che lei abbia perfettamente torto, così come quando ha votato per questa riduzione dei parlamentari perfettamente all’opposto di quello che aveva fatto prima. Evidentemente, non ha le idee chiarissime (Applausi dei deputati del gruppo Misto-Noi con l’Italia-USEI-Cambiamo!-Alleanza di Centro).	
MARIA ROSARIA CARFAGNA	PRESIDENTE	Nessun altro chiedendo di parlare, passiamo ai voti. Indìco la votazione nominale, mediante procedimento elettronico, sull'emendamento 1-bis.2 Sisto, con il parere contrario della Commissione e del Governo. Dichiaro aperta la votazione. (Segue la votazione). Dichiaro chiusa la votazione. La Camera respinge (Vedi votazione n. 18). I successivi quattro sono stati ritirati prima della seduta. Passiamo, quindi, alla votazione dell’emendamento 1-bis.309 Baldelli. Ha chiesto di parlare l’onorevole Baldelli.	
