speaker	role	text	extra
YLENJA LUCASELLI	FDI	Presidente, grazie. Io comincio dalla definizione di “questione meridionale”, perché la locuzione, che indica nella storiografia italiana la situazione di difficoltà del Mezzogiorno d’Italia rispetto ad altre regioni, ha una storia molto lunga. Nasce, come diceva la mia collega, nel 1873 e, ad oggi, non è stata ancora risolta e, quindi, questo dovrebbe farci pensare che probabilmente in questa storia, nella storia d’Italia, nella storia che nasce nel momento in cui l’Italia viene unita, non c’è stata, in realtà, la capacità di risolvere la questione meridionale. Oggi, è diventato un luogo comune, è una frase fatta, una frase comune per quella parte di politica che non si preoccupa di trovare la soluzione, come se fosse, quella della questione meridionale, quella del Sud, una condizione voluta dal destino e alla quale ci si può semplicemente arrendere. E chi, però, da quei territori viene sa bene che, quando si parla di Sud, non si parla di Sud in generale. Il Sud non è un’unica entità; il Sud sono tante regioni con le loro specificità e con le loro diversità, diversità che vanno affrontate in maniera capillare ma soprattutto in maniera diversa, perché non c’è un’unica questione meridionale. C’è, come hanno detto molti colleghi, una questione nazionale, perché se il Sud fallisce, se le regioni del Sud falliscono, allora fallisce tutta l’Italia perché la questione meridionale è la questione italiana. Quindi, io partirei da questo, partirei dalla consapevolezza che ogni regione ha dei suoi problemi e che ognuno di quei problemi va affrontato in maniera diversa. È per ciò che questo Governo ha immaginato di avere un Ministro e un Ministero per il Sud. Eppure, pur avendo il Ministro e il Ministero per il Sud, di fatto le questioni non vengono affrontate e non si parla di quelle che possono essere le vere soluzioni alle condizioni. E, allora, per una volta, mentre abbiamo sentito sciorinare dati assolutamente negativi, a me piace, invece, evidenziare quelli positivi, perché io sono pugliese e, quindi, mi viene facile parlare della mia Puglia, della mia regione. Il Sud ha una vocazione e penso alla Puglia e la Puglia ha una vocazione, che è indubbiamente quella turistica. Dunque, mentre in Italia si accorpano Ministeri come quelli dell’agricoltura e del turismo, posizione che Fratelli d’Italia non ha assolutamente condiviso, in realtà invece la Puglia cresce e aumenta le presenze turistiche nei suoi territori e nei suoi stabilimenti del 75 per cento. E, allora, penso che magari potrebbe essere questo un motivo di orgoglio e, quindi, un punto sul quale focalizzare la propria attenzione. Ora, è chiaro che i problemi del Sud ci sono e sono reali. È inutile mettersi la benda davanti agli occhi: abbiamo necessita di infrastrutture, abbiamo bisogno di una nuova sanità, di un ridisegno di quella sanità, abbiamo bisogno di rivedere le nostre scuole, abbiamo bisogno di riportare la cultura della Magna Grecia lì dove quella cultura è nata e si è sviluppata. E, però, questo è solo l’inizio, perché noi abbiamo bisogno di avere un’idea. E, allora, se è vero come è vero che la questione meridionale è rimasta assolutamente identica a se stessa in tutta la storia d’Italia, allora forse oggi dovremmo poter immaginare e dovremmo avere la capacità di immaginare qualcosa di nuovo e di diverso, dovremmo cambiare rotta, dovremmo pensare in un modo diverso, dovremmo avere la forza di cambiare le nostre idee e di non immaginare più soltanto il Meridione come un problema da risolvere e da affrontare – e, probabilmente, alle volte, anche da dimenticare - ma dovremmo invece considerarlo come un’opportunità; e, fino a quando non ci sarà la capacità, la voglia e la forza di modificare quella visione che si ha del sud del nostro Paese, che si ha delle regioni che sono al sud dell’Italia, allora, fino a quando non si avrà quella capacità, in realtà il problema non verrà risolto. Il Sud deve necessariamente essere considerato come una risorsa: non può essere considerato come nulla di diverso. Allora, vedete, l’idea di Fratelli d’Italia è stata quella di presentare una mozione nella quale si mettono in evidenza tutti i problemi, ma si mettono in evidenza anche tutte le possibili risorse e le possibili risposte che si possono dare. È un articolato molto complesso perché si passa dalle – e ho quasi concluso – questioni fiscali, alle questioni culturali, alle questioni della sanità. Tutto questo, però, passa da un unico comun denominatore – e con questo concludo, Presidente – che quando parliamo di Sud, stiamo parlando non soltanto di un’area geografica ma di persone e, quando si parla di persone, dobbiamo inevitabilmente sapere che parliamo di capacità e di possibilità di rinnovarsi e rinascere (Applausi dei deputati del gruppo Fratelli d’Italia).	
			Discussione della proposta di legge: Molteni ed altri: Inapplicabilità del giudizio abbreviato ai delitti puniti con la pena dell’ergastolo (A.C. 392-A); e dell’abbinata proposta di legge: Morani (A.C. 460) (ore 16,45).
MARIA EDERA SPADONI	PRESIDENTE	Non essendovi altri iscritti a parlare, dichiaro chiusa la discussione sulle linee generali. Prendo atto che il Governo si riserva di intervenire in sede di replica. Il seguito del dibattito è rinviato ad altra seduta.	
			(Discussione sulle linee generali – A.C. 392-A)
MARIA EDERA SPADONI	PRESIDENTE	L’ordine del giorno reca la discussione della proposta di legge n. 392-A: Inapplicabilità del giudizio abbreviato ai delitti puniti con la pena dell’ergastolo; e dell’abbinata proposta di legge: n. 460. Avverto che lo schema recante la ripartizione dei tempi è pubblicato nell’allegato A al resoconto stenografico della seduta del 19 ottobre 2018 (Vedi l’allegato A della seduta del 19 ottobre 2018).	
MARIA EDERA SPADONI	PRESIDENTE	Dichiaro aperta la discussione sulle linee generali. Avverto che il presidente del gruppo parlamentare Forza Italia ne ha chiesto l’ampliamento senza limitazioni nelle iscrizioni a parlare, ai sensi dell’articolo 83, comma 2, del Regolamento. Avverto, altresì, che la II Commissione (Giustizia) si intende autorizzata a riferire oralmente. Ha facoltà di intervenire la relatrice, deputata Anna Rita Tateo.	
ANNA RITA TATEO	Relatrice	Grazie, Presidente. La presente proposta di legge, nel novellare alcune disposizioni del codice di procedura penale, mira a rendere inapplicabile il rito abbreviato ai delitti puniti con la pena dell’ergastolo, con conseguente inapplicabilità dello sconto di pena connesso a tale rito. Per questi delitti, infatti, che creano un grave allarme sociale – si pensi, ad esempio, alla devastazione, alla strage, all’ipotesi di omicidio aggravato o di sequestro di persona aggravato – non sembra giustificabile, da parte del legislatore, la scelta di consentire all’imputato il ricorso al rito abbreviato in ragione di esigenze puramente deflattive, avendo, in più di un’occasione, destato sconcerto nell’opinione pubblica l’applicazione di pene notevolmente ridotte rispetto a quelle previste dal codice penale. Nell’ambito della giustizia penale differenziata, il giudizio abbreviato, disciplinato dagli articoli da 438 a 443 del codice di procedura penale, si inserisce nel solco dei procedimenti speciali deflattivi del dibattimento, in virtù del quale il processo viene definito in sede di udienza preliminare con decisione assunta allo stato degli atti delle indagini preliminari, che hanno qui piena valenza probatoria. È un giudizio di tipo volontario, presupponendo una richiesta da parte dell’imputato. Infatti, allo stesso è riconosciuto un vero e proprio diritto a rinunciare al contraddittorio per la prova, in cambio di un apprezzabile effetto premiale in caso di condanna. La premialità consiste nel fatto che se l’imputato viene condannato, si opera una riduzione della pena nella misura di un terzo per i delitti e, invece, della metà per le contravvenzioni. Con la proposta di legge in esame si intende, di fatto, ritornare alle origini del rito abbreviato, ove non era consentito l’accesso al rito in questione a quei procedimenti relativi a delitti per i quali era prevista la pena dell’ergastolo. Sicuramente, la questione relativa al rapporto tra giudizio abbreviato e reati puniti con la pena dell’ergastolo è stata oggetto di ampio dibattito. Ricordo la legge 16 febbraio 1987, n. 81, la quale prevedeva, con eccesso di delega da parte del legislatore, che in caso di condanna alla pena dell’ergastolo, questa veniva sostituita con la pena di reclusione di anni trenta. Tale questione veniva affrontata dalla Corte costituzionale con la sentenza n. 176 del 1991 che, nel pronunciarsi sulla disposizione originaria, di cui all’articolo 442, comma 2, del codice di procedura penale, aveva dichiarato l’illegittimità della norma nella parte in cui individuava in modo fisso, vale a dire in trent’anni di reclusione, la pena da sostituire all’ergastolo. In particolare, la Corte affermava che, una volta riconosciuta la commistione tra giudizio abbreviato e diminuzione della pena e, quindi, l’impraticabilità del primo in mancanza della possibilità di operare la seconda, il venir meno di quest’ultima per effetto della dichiarazione di illegittimità costituzionale, rende di per sé inapplicabile il giudizio abbreviato quale disciplinato dagli articoli da 438 a 443 del codice di procedura penale, ai processi concernenti delitti punibili con l’ergastolo. Successivamente, solo con le modifiche introdotte dalla legge n. 479 del 1999, la cosiddetta legge Carotti, è stata ripristinata la possibilità di applicare il rito abbreviato anche ai delitti puniti con la pena perpetua, concedendo uno sconto di pena così consistente, a prescindere dalla gravità della condotta. Entrando, ora, nel dettaglio della proposta di legge, così come modificata dalla Commissione di merito, osservo che il testo si compone di cinque articoli, attraverso i quali si modificano gli articoli 429, 438, 441-bis e 442 del codice di procedura penale. L’articolo 1 modifica l’articolo 438 del codice di procedura penale, prevedendo l’introduzione di un comma-bis, ossia non è ammesso il giudizio abbreviato per i delitti per i quali la legge prevede la pena dell’ergastolo; prevede la riformulazione del comma 6, per cui, in caso di inammissibilità della richiesta di rito abbreviato, ai sensi del comma 1-bis o rigetto, ai sensi del comma 5, l’imputato può riproporre la richiesta fino a che non siano formulate le conclusioni nel corso dell’udienza preliminare; prevede anche l’introduzione di un ulteriore comma, 6-ter, ossia, in caso di inammissibilità della richiesta di rito abbreviato dichiarata in udienza preliminare, ai sensi del comma 1-bis, il giudice, all’esito del dibattimento, se ritiene che il fatto accertato non è punibile con l’ergastolo, applica la riduzione di pena connessa al negato rito speciale. In questo modo il provvedimento in esame recepisce la pronuncia della Corte costituzionale che, con la sentenza n. 23 del 1992, ha affermato che quando l’accesso al rito abbreviato sia stato ingiustamente negato, comunque il condannato ha diritto alla riduzione di pena prevista dall’articolo 442, secondo comma. L’articolo 2, invece, modifica l’articolo 441-bis del codice di procedura penale, che disciplina ipotesi di nuove contestazioni del pubblico ministero nel corso del giudizio abbreviato. Il provvedimento, avendo inserito un comma 1-bis, specifica che se le nuove contestazioni del pubblico ministero riguardano un delitto punito con l’ergastolo, il giudice revoca l’ordinanza con cui è stato disposto il rito abbreviato e il procedimento penale prosegue nelle forme ordinarie. L’articolo 3 interviene, anche con finalità di coordinamento, sull’articolo 442, comma 2, del codice di procedura penale, relativo all’entità della pena applicabile in caso di giudizio abbreviato conclusosi con sentenza di condanna. La riforma elimina le attuali previsioni sulla trasformazione, rispettivamente della pena dell’ergastolo, in reclusione di anni trenta, e della pena dell’ergastolo con isolamento diurno in ergastolo, stante l’esclusione del rito speciale per i reati puniti con tale pena. L’articolo 4 modifica l’articolo 429 del codice di procedura penale. Nel decreto che dispone il giudizio, infatti, è inserito un comma 2-bis. Il provvedimento prevede che se all’esito dell’udienza preliminare l’originaria imputazione per delitto punito con l’ergastolo viene derubricata dal GUP con il decreto di rinvio a giudizio, lo stesso giudice deve avvisare l’imputato della possibilità di richiedere, entro 15 giorni, il rito abbreviato. Il rito si svolgerà, in base al richiamato articolo 458 del codice di procedura penale, in camera di consiglio, dinanzi allo stesso giudice dell’udienza preliminare. Infine, l’ultimo articolo, il n. 5, della proposta di legge, prevede l’entrata in vigore della riforma il giorno successivo alla pubblicazione in Gazzetta Ufficiale e la sua applicabilità ai fatti commessi successivamente a tale entrata in vigore.	
MARIA EDERA SPADONI	PRESIDENTE	Ha facoltà di intervenire il rappresentante del Governo.	
JACOPO MORRONE	Sottosegretario di Stato per la Giustizia	Mi riservo di intervenire dopo.	
MARIA EDERA SPADONI	PRESIDENTE	iscritta a parlare la deputata Valentina D’Orso. Ne ha facoltà.	
