speaker	role	text	extra
DOMENICO FURGIUELE	LEGA	Presidente, onorevoli colleghi, i dati pubblicati dall’ISTAT, relativi all’anno 2017, evidenziano ancora un grave divario tra Nord e Sud del Paese in termini di produttività delle imprese e benessere degli abitanti. Il tasso di disoccupazione del Mezzogiorno è il triplo rispetto a quello del Nord, il doppio rispetto a quello del Centro Italia. L’economia delle regioni meridionali soffre ancora degli effetti della crisi e sconta ormai atavicamente un forte ritardo non solo rispetto al resto dell’Europa, ma anche al resto dal Paese. Si registra un peggioramento del saldo migratorio del Mezzogiorno: negli ultimi 16 anni hanno lasciato il Meridione più di 1 milione di residenti, di cui la metà giovani fra i 15 e i 34 anni, quasi un quinto laureati, il 16 per cento addirittura si è trasferito all’estero. Particolarmente significativo risulta poi il dato relativo all’immatricolazione del 25 per cento degli studenti universitari meridionali proprio nelle facoltà del Nord: questo certamente non perché gli studenti meridionali credano che le università del Nord siano migliori, ma fondamentalmente perché le università del Nord risiedono in dei luoghi che danno più opportunità dal punto di vista economico, e soprattutto dal punto di vista dei servizi e dell’occupazione. La mozione sulle politiche di rilancio del Mezzogiorno deve essere oggi un modo per avviare concretamente un dibattito approfondito, ma non infinito, su un corpus di misure realmente efficaci, specie sul fronte della migrazione delle competenze al Nord o addirittura verso i Paesi dell’Unione europea o extracomunitari. Se vogliamo davvero adoperarci affinché si dia vita ad un cambiamento visibile che investa i giovani, le infrastrutture e gli investimenti, dobbiamo convergere sulla consapevolezza che il Sud non può essere più un problema solo del Sud. Ce lo chiedono gli elettori che ci hanno dato fiducia, e ce lo chiede la nostra coscienza di parlamentari, di membri del Parlamento. Da calabrese non accetterò mai l’idea di un Parlamento e di Commissioni competenti dal punto di vista legislativo che si impegneranno a fare la stessa cosa che è stata fatta fino a poco tempo fa, cioè poco o nulla. È finito il tempo degli studi e delle diagnosi, dei dibattiti, dei talk sul Meridione d’Italia: ora bisogna parlare di misure concrete da varare, con velocità e con spirito costruttivo. D’altro canto, le evidenze degli indicatori ISTAT e Svimez sono chiare, li conosciamo tutti quanti: essi tra l’altro ci dicono di un peggioramento del mercato del lavoro, e con esso anche della conseguente crescita della povertà. Non possiamo ignorare la povertà: se ne facciano una ragione i sostenitori di quell’Europa burocratica, decadente e senza cuore che purtroppo anche qui dentro non sono pochi. Che senso ha parlare di Europa solidale - lo chiedo anche ai colleghi delle opposizioni -, se non possiamo incrociare i bisogni delle fasce deboli? Nell’Europa che vorremmo, il Sud deve essere protagonista. In questo senso procedono le politiche dell’Esecutivo che appoggiamo, nella consapevolezza però che molto dovrà essere fatto nei prossimi mesi, soprattutto nella convinzione che artefici di quella crescita dovranno essere proprio quei giovani che oggi continuano a scappare e ad andare via. Dobbiamo metterci in testa che, perché il Sud cresca, occorre non solo un cambio di passo, ma una visione lungimirante che ci consenta di traguardare nuove vie di sviluppo, nuovi orizzonti strategici. La competizione non può essere giocata al nostro interno, ma dobbiamo avere la capacità di elevare la nostra visuale, guardando al Mezzogiorno come baricentro e snodo fondamentale del Mediterraneo, collocato nel quadrante mondiale dei traffici commerciali tra lo Stretto di Gibilterra e Suez: è inimmaginabile ancora che ad oggi i porti del Mediterraneo vengano considerati Rotterdam, Anversa e Amburgo (Applausi dei deputati del gruppo Lega-SalviniPremier). Ecco, questo deve essere il nostro orizzonte, per questa ragione dobbiamo ribaltare la percezione di Sud periferia, per acquisirne una tutta nuova, fondata sulla centralità della piastra logistica euro-mediterranea del Mezzogiorno d’Italia: un sistema intermodale interno ed esterno, che sappia ripensare la collocazione del Sud nel contesto internazionale e mondiale. Qui il porto di Gioia Tauro deve tornare centrale nelle politiche di sviluppo! Abbiamo bisogno di ripensare visione e strategia, di concretizzare progetti funzionali non al soddisfacimento di micro-interessi, ma di focalizzarli in piani strategici, capaci di perseguire concretamente questi nuovi orizzonti. Abbiamo bisogno di accelerare l’esecuzione delle opere in corso, e se necessario prevedere cantieri aperti H24 (Applausi dei deputati del gruppo Lega-SalviniPremier). Bisogna passare dalla programmazione all’attuazione. Dai dati dell’Agenzia per la coesione territoriale, non ancora resi pubblici, emerge che appena il 20 per cento delle risorse sono in fase di esecuzione, mentre il restante 80 per cento è racchiuso in un limbo di fase di programmazione o di avvio di progettazione. Tutto questo è intollerabile e frustrante! È necessario concentrare risorse sui macro-obiettivi della coesione, ridimensionando la logica del passato, dei mille rivoli e dell’indefinita programmazione di spesa: su 40 miliardi di stanziamenti complessivi per i Patti per il Sud, stiamo parlando di 27 miliardi di euro ancora senza programmazione e senza progettazione, di 5 miliardi appena in affidamento e di 9 miliardi in esecuzione; ma molto spesso si tratta di progetti vecchi e finanziati con risorse precedentemente affidate e affidabili a cicli produttivi precedenti. In questa direzione, il Governo deve farsi carico in modo deciso di valutare compiutamente il reale stato di attuazione dei Patti, proponendo, laddove si rendesse necessario, strumenti attuativi in grado di intervenire su efficacia ed efficienza della spesa. Servono progetti strategici, interregionali, mediterranei, per unire le sponde, per rendere il Sud cerniera e perno del Mediterraneo. Serve funzionalizzare le infrastrutture interne, renderle intermodali, per connetterle con il resto del mondo: questo dev’essere fatto! Serve rendere convenienti a livello fiscale gli investimenti nelle aree industriali del Mezzogiorno: obiettivi alti per connettere il Sud con il resto del Mediterraneo, dell’Europa e del mondo. Con questa visione dobbiamo puntare a definire la nuova programmazione dei fondi strutturali e di coesione, ed al contempo rimodulare quanto non speso e ancora pianificabile nell’attuale programma 2014-2020. In quest’ottica, mi permetto di riprendere un concetto di responsabilità meridionale. Abbiamo speso ingenti risorse? Forse le abbiamo sprecate? Non abbiamo più molte opportunità: ora o mai più, dobbiamo porci come asticella quella del riequilibrio infrastrutturale, sociale e culturale. Deve essere un riequilibrio da misurare e compensare in termini economici e fiscali. Penso ad un piano intermodale di sistema per il Sud, da realizzare con capitali pubblici e privati, facendo ricorso a percorsi di ingegneria finanziaria innovativi, a partire dal project financing, mai concretamente attuato al Sud. Penso alla internazionalizzazione delle università del Sud, in partnership con le più grandi università al mondo. Penso a zone franche di riequilibrio, zone economiche speciali capaci di riequilibrare e riallineare la competitività. I trasporti, l’interconnessione, l’intermodalità sono leve e strumenti di intervento decisivi, non solo in termini microeconomici o settoriali, ma anche in senso macroeconomico ai fini dello sviluppo economico generale. Occorre recuperare competitività strategica, non in chiave semplicemente regionale, bensì in un’ottica di sistema integrato. Perché l’Italia sia più forte è necessario che ci sia un Sud sempre più forte. La continuità, la prossimità, la funzionalità territoriale delle infrastrutture, a supporto delle catene logistiche e globali, nel senso delle relazioni spaziali e funzionali tra porti, aeroporti, collegamenti ferroviari e stradali, è la strategia che dobbiamo perseguire con forza e determinazione. E il mio pensiero, da calabrese, torna ancora al porto di Gioia Tauro e alle altre realtà del Sud. È lì il futuro e continua ad essere lì il futuro. Colleghi onorevoli, abbiamo avuto la fiducia dei cittadini per attuare un reale cambiamento di prospettiva delle politiche fin qui seguite. Il 4 marzo scorso il Sud non ha votato per avere ancora politiche assistenziali, ma per spezzare le catene che ad esse lo legavano (Applausi dei deputati del gruppo Lega-SalviniPremier).	
MARIA EDERA SPADONI	PRESIDENTE	Saluto gli studenti e i docenti dell’Istituto Comprensivo “Foligno 4”, che assistono ai nostri lavori dalle tribune (Applausi). È iscritta a parlare la collega Elvira Savino. Ne ha facoltà.	
ELVIRA SAVINO	FI	Grazie signora Presidente. Nella manovra, come nel resto del dibattito interno alla maggioranza, risuona assordante, a nostro avviso, il silenzio in merito ad una qualsiasi strategia per il Sud. Anzi, a guardar bene, l’unica misura adottata è il mancato rifinanziamento del bonus per il Sud. Il Mezzogiorno non può essere liquidato come il buco nero d’Italia e può invece costituire - anzi, deve costituire - una punta di diamante per il rilancio economico e sociale del nostro Paese, in Europa e sul piano internazionale. Il rilancio del Sud richiede interventi organici razionali, improntati a logiche di valorizzazione delle risorse umane e materiali già presenti sul territorio, volti a consentire alla realtà locale di esprimere appieno le sue grandi potenzialità endogene. All’opposto appaiono deleterie misure emergenziali, assistenziali e puntiformi, le quali rappresentano la riedizione di interventi già rivelatisi fallimentari in passato, protese, al massimo, al fine poco lusinghiero di incassare i dividendi politici o elettorali di breve periodo. Sembrano invece maturi i tempi, anche a livello culturale, per abbandonare i vecchi paradigmi e affidare al Sud e alla sua popolazione, a cominciare dai giovani e dalle donne, gli strumenti per affrancarsi da sé dai vincoli burocratici ed economici che ne soffocano lo sviluppo e rilanciarsi nell’ottica di principi liberali, moderni e meritocratici. In questa prospettiva da tempo Forza Italia ha individuato una serie di problematiche strutturali, da risolvere in via prioritaria, attraverso soluzioni e proposte di intervento, elaborate in modo non autoreferenziale o astratto, ma grazie al confronto serio e costante con le realtà locali, con gli amministratori del territorio, con autorevoli studiosi di ambito economico, giuridico e politologico, nonché con le esperienze più virtuose registrate a livello europeo e internazionale. Il piano strategico di Forza Italia prevede cinque fondamentali capitoli di intervento: le imprese, il lavoro, i diritti, le infrastrutture e la governance istituzionale. Con riguardo alle imprese, il tessuto imprenditoriale del Sud è in sofferenza, evidentemente, rispetto al resto del Paese, però ha grandi potenzialità di sviluppo. Benefici sicuri e rilevanti deriverebbero, a nostro avviso, dall’azzeramento dell’Ires, almeno per le quattro regioni dell’obiettivo convergenza, ossia Calabria, Campania, Puglia e Sicilia, per un valore di 2 miliardi all’anno, che dovrebbe essere coperto mediante la riallocazione di fondi europei oggi male investiti. I vantaggi di questa misura sono presto detti: il carattere automatico e diretto del beneficio, l’assenza dell’intermediazione burocratica, niente infiltrazioni della criminalità organizzata, attrazione degli investimenti e delle imprese internazionali e italiane - che oggi purtroppo delocalizzano in altri Paesi -, piena compatibilità con i Trattati europei. Sempre con riguardo alle imprese, un altro nodo nevralgico riguarda l’estrema difficoltà che riscontrano nel Mezzogiorno le piccole e medie imprese relativamente all’accesso al credito. Questo ovviamente ne impedisce lo sviluppo. Da questo angolo visuale, è necessario rafforzare il Fondo di garanzia per le piccole e medie imprese, destinando il 45 per cento delle risorse, adesso conferite da Cassa depositi e prestiti, all’uso esclusivo delle piccole e medie imprese del Mezzogiorno. In questo modo esse potranno ottenere finanziamenti per gli investimenti, necessari a rinnovarsi, a crescere e a competere sul mercato. Per quanto riguarda il lavoro, è centrale innanzitutto al Sud il tema dei giovani. Al Sud ci sono un milione 800 mila NEET, under 35, che non lavorano e non cercano un lavoro. Due donne su tre sono disoccupate. Esiste un elevato tasso di dispersione scolastica e un basso numero di studenti che conseguono la laurea. Si dovrebbe prevedere l’istituzione di un conto giovani per il Mezzogiorno, a valere sui fondi europei, destinato agli under 35 e alle donne under 40, da utilizzare per l’alternanza scuola-lavoro, per ricerca e sviluppo in università e in azienda, formazione e orientamento all’occupazione, impiego e auto-impiego. L’obiettivo è finanziare una formazione effettiva, attiva e on the job, realmente calibrata sullo sviluppo delle professionalità e sul collocamento lavorativo. Sempre sul fronte lavoro, un tema cardine è poi quello delle donne. Nel Mezzogiorno solo il 31 per cento delle donne ha un lavoro. Per mitigare in modo efficace e concreto tale problema, per ogni nuova assunzione di una donna, a tempo pieno o parziale, con contratto almeno annuale, si dovrebbe riconoscere all’impresa che effettua l’assunzione un credito di imposta, pari al costo relativo al contributo Irpef. Molti studi autorevolissimi, svolti a livello europeo e internazionale, dimostrano ormai, come è noto, al di là di ogni ragionevole dubbio, che più donne occupate significano più crescita, perché una donna che lavora è una donna che consuma e che ha bisogno di altre donne che l’assistano, quando lei è occupata al lavoro. Quindi, si crea inevitabilmente un circolo virtuoso, di cui beneficia tutto il sistema. Ancora, sul decisivo fronte del lavoro, occorre constatare come la fascia di età tra i trenta e quarantanove anni oggi sia clamorosamente ignorata da qualsiasi misura occupazionale. Bisognerebbe istituire un apposito assegno, pari almeno a 800 euro mensili, erogati per una durata di dodici mensilità, anche non continuative, a beneficio di chi sia in stato di disoccupazione da oltre ventiquattro mesi e non percepisca alcun sostegno al reddito. La misura dovrà essere riconosciuta solo se agganciata a percorsi di reinserimento nel mercato del lavoro e a prestazioni lavorative. Quest’assegno sarebbe un vero incentivo al lavoro, anziché a oziare sul divano, e funzionerebbe come una dote, che il lavoratore porta con sé all’interno dell’impresa. A livello infrastrutturale, invece, una forte criticità attiene per esempio al Sud alle strutture idriche. È una cosa della quale si parla poco, ma importantissima. Esse al Sud risalgono a più di trent’anni fa e le perdite nella rete al Sud si aggirano intorno al 45 per cento, a fronte del 26 per cento al Nord. È giunto il momento di riammodernare il sistema infrastrutturale, attraverso una rete e un sistema di micro-invasi. Il costo di questo intervento è stimato intorno ai 5 miliardi, che è decisamente inferiore alle perdite e alle sanzioni europee che gestiamo attualmente. Gli obiettivi, oltre a salvaguardare le risorse idriche, sono quelli di assicurare gli approvvigionamenti alle famiglie e alle imprese del Sud, nonché di consentire il rilancio di un settore strategico fondamentale per le regioni del Mezzogiorno, che è l’agricoltura. Una seconda criticità infrastrutturale riguarda poi le linee dell’alta velocità. Come è noto, l’alta velocità si ferma a Salerno e, da lì in poi, non è più servito quel territorio. Ma anche il servizio ferroviario ordinario, oltre all’alta velocità, è altamente inefficiente. Basti pensare che in Sicilia sono 429 le corse regionali giornaliere, contro le 2.396 della Lombardia. La media di età dei convogli passa dai diciannove anni del Meridione ai tredici del nord Italia, con una media nazionale di sedici anni, con comprensibili ed evidenti ripercussioni negative, sia sulla velocità degli spostamenti - che al Sud sono evidentemente elefantiaci - che sul comfort e la qualità di vita dei passeggeri. Da questo punto di vista, è necessario un piano strategico per rilanciare la mobilità al Sud e anche, soprattutto, come dicevo prima, l’alta velocità. Con riferimento ai diritti, invece, un primo allarme riguarda gli asili, come è stato detto anche in precedenza. In particolare, la copertura dei servizi di asili nido e nido per l’infanzia nel Meridione è scarsissima, copre soltanto il 7 per cento circa dei bambini, a fronte di una media nazionale del 20 per cento ed europea del 40 per cento. In questa prospettiva è necessario assolutamente stanziare dei fondi per realizzare strutture e servizi pubblici di asili nido, affidando magari l’operazione a una SGR pubblica, come, ad esempio Invimit e Cassa depositi e prestiti immobiliare, e prevedendo costi contenuti del servizio in base al reddito per chi ne fruisce. I vantaggi sono enormi e si colgono su due piani: da un lato, i benefici occupazionali immediati per le donne madri lavoratrici, che avrebbero finalmente la possibilità di affidare i loro bambini a strutture dedicate a costi contenuti o anche nulli, dall’altro lato i benefici sociali e culturali per la nostra società, di medio lungo periodo, sotto il profilo della crescita demografica e della natalità, sia sotto il profilo dell’affermazione del ruolo della donna lavoratrice, che abbiamo detto prima essere appunto una questione fondamentale. Parlando di diritti poi, è impossibile non parlare del diritto alla salute. Le forti disomogeneità territoriali nelle prestazioni sanitarie hanno una creato nel tempo una situazione di costante lesione al Sud del diritto alla salute, che, voglio ricordare, è costituzionalmente riconosciuto. Quindi è necessario un piano integrato finalizzato a ristabilire la piena osservanza dell’articolo 32 della Costituzione, da svilupparsi sui seguenti versanti: l’introduzione immediata dei costi e dei fabbisogni standard nella sanità; l’istituzione di un’agenzia nazionale che controlli in modo più stringente l’operato dei singoli servizi regionali e delle province autonome, assicurandone l’efficienza e l’efficacia anche con funzioni sostitutive o eventualmente commissariali; l’introduzione immediata del reddito di salute, cioè di un bonus sanità da attribuire in base all’ISEE ai residenti nelle regioni dove è minore l’aspettativa di vita. Nel capitolo dei diritti rientra anche il dossier sulle pensioni. Sul territorio nazionale, come si è detto, esistono forti disomogeneità fra Nord e Sud anche relativamente all’aspettativa di vita, con differenziali anche di quattro anni. In Campania, per fare un esempio, nel 2017 gli uomini sono vissuti 78 anni e le donne 83; nella provincia autonoma di Trento, 81 anni gli uomini e 83 le donne. La maggiore sopravvivenza si è registrata proprio delle regioni del Nord Est, dove la speranza di vita è stata per gli uomini di 81 anni e per le donne di 85. Invece, nelle regioni del Mezzogiorno, 79 anni per gli uomini e 84 per le donne. Alla luce di questo dato, evidentemente clamoroso e allarmante, occorre rimodulare i criteri anagrafici di accesso alla pensione calcolandoli su base regionale e anche in ragione della speranza di vita. Non può essere trascurato poi il diritto all’ambiente, che dovrebbe stare a cuore a questa maggioranza, che va declinato con maggior vigore sul piano della mobilità sostenibile, pubblica e privata. Il trasporto pubblico al Sud è ancora fortemente legato allo spostamento obsoleto su gomma, come è noto, ed è prestato con servizi e con mezzi ormai superati. Anche le auto private, purtroppo, al Sud sono per la maggior parte ad elevato indice inquinante; quindi per promuovere l’ambiente ed il trasporto green, sicuri benefici verrebbero dalla scelta di azzerare l’IVA per l’acquisto di tutti gli autoveicoli elettrici e la compensazione del 50 per cento per gli enti locali nell’acquisto di vettori per il trasporto pubblico locale a basso impatto ambientale, come gas, metano o auto elettriche. A livello istituzionale, invece, parlando adesso di governance, che è l’ultimo tema che noi abbiamo affrontato nella nostra mozione, la governance degli investimenti e della gestione dei fondi di coesione nazionali ed europei è ad oggi evidentemente troppo complessa, dispersa fra una miriade di istituzioni, livelli territoriali, procedimenti, che creano ritardi e inefficienze. Proponiamo di accentrare tutte le competenze in un unico soggetto, la Cassa per le infrastrutture e i diritti del Sud, Caid, che funga da collettore, gestore e controllore unico dei fondi nazionali ed europei e delle attività, e che tra l’altro assorba la vecchia Agenzia per la coesione. Per alimentare la Cassa si dovrebbe modificare l’attuale sistema della quota De Vincenti e, sul modello della quota Ciampi, prevedere che ad essa sia le amministrazioni centrali che le società partecipate pubbliche conferiscano il 45 per cento dei propri stanziamenti ordinari in conto capitale. Infine, sono inattuate dal 2001 parti importanti della Costituzione, quale l’indicazione dei LEP, cioè i livelli essenziali delle prestazioni concernenti i diritti civili e sociali che devono essere garantiti su tutto il territorio nazionale, non in alcune zone sì e in altre no, e l’istituzione del Fondo di perequazione, articolo 119 della Costituzione, indispensabile per consentire ai territori con minore capacità fiscale per abitante il finanziamento integrale delle funzioni pubbliche che gli sono attribuite. In particolare, sono rimasti purtroppo lettera morta quelli che erano dei condivisibili criteri enunciati nella legge sul federalismo fiscale, la n. 42 del 2009, che avrebbe potuto presiedere alle misure perequative: capacità fiscale, densità demografica, sviluppo infrastrutturale, gettito dei tributi, stato dei servizi. Oltre agli evidenti riflessi negativi sulle popolazioni, la mancata attuazione di queste previsioni di perequazione preclude alle regioni del Sud di sfruttare le virtualità autonomistiche speciali consentite dall’articolo 116, terzo comma, della Costituzione. È chiaro infatti che nessuna condizione ulteriore di autonomia può essere acquisita senza le relative risorse, ed è altrettanto chiaro che queste risorse non saranno mai sufficienti nelle realtà in questione senza l’effettiva attuazione di un fondo perequativo; è un cane che si morde la coda. L’autonomia senza il supporto delle risorse è solo un fantasma, sia per l’esercizio delle funzioni attribuite direttamente dalla Costituzione sia, a maggior ragione, per quelle ulteriori funzioni che le regioni volessero eventualmente intestarsi ai sensi dell’articolo 116, terzo comma, della Costituzione stessa. Quindi, concludendo, tutti questi punti sono stati sviluppati dai parlamentari di Forza Italia in una serie di proposte di legge che sono state già depositate e che saranno poi ripresentate come impegni all’interno delle mozione che stiamo presentando. Noi ci auguriamo che il Governo inizi seriamente a prendere consapevolezza della questione meridionale, perché è una questione nazionale tout-court e ad andare oltre una logica assistenzialistica, che è quella alla quale purtroppo abbiamo assistito finora, oppure di trascurare il tema per quanto attiene ad azioni veramente di prospettiva, di visione e strutturali, e di offrire quelle risposte concrete che purtroppo il Mezzogiorno d’Italia attende da troppo tempo (Applausi dei deputati del gruppo Forza Italia-Berlusconi Presidente)	
MARIA EDERA SPADONI	PRESIDENTE	Avverto che è stata testé presentata la mozione D’Uva e Molinari n. 1-00065, il relativo testo è in distribuzione (Vedi l’allegato A). È iscritta a parlare la collega Conny Giordano. Ne ha facoltà.	
