speaker	role	text	extra
MARIA ROSARIA CARFAGNA	PRESIDENTE	Comunico che, ai sensi dell'articolo 46, comma 2, del Regolamento, i deputati Battelli, Brescia, Colucci, Covolo, De Maria, Delrio, Gallo, Gebhard, Gelmini, Giaccone, Giachetti, Iovino, Liuni, Lollobrigida, Lorefice, Lupi, Molinari, Ruocco, Saltamartini, Speranza e Tasso sono in missione a decorrere dalla ripresa pomeridiana della seduta. I deputati in missione sono complessivamente novanta, come risulta dall'elenco depositato presso la Presidenza e che sarà pubblicato nell'allegato A al resoconto della seduta odierna.	
			(Ripresa esame dell’articolo unico – A.C. 2471–A)
MARIA ROSARIA CARFAGNA	PRESIDENTE	L'ordine del giorno reca il seguito della discussione del disegno di legge n. 2471-A: Conversione in legge del decreto-legge 20 aprile 2020, n. 26, recante disposizioni urgenti in materia di consultazioni elettorali per l'anno 2020. Ricordo che nella seduta di ieri è stato, da ultimo, respinto l’emendamento Prisco 1.236. Avverto che la Commissione ha presentato l’emendamento 1-bis.800 (Vedi l’allegato A), che è in distribuzione, e in relazione al quale risulta alla Presidenza che tutti i gruppi abbiano rinunciato alla fissazione del termine per la presentazione di subemendamenti. Avverto che, fuori della seduta, gli emendamenti Sisto 1-bis.300, 1-bis.5, 1-bis.6, 1-bis.4 e 1-bis.3 e Prisco 1-bis.12 sono stati ritirati dai presentatori. Passiamo quindi all’emendamento Prisco 1.237.	
MARIA ROSARIA CARFAGNA	PRESIDENTE	Ha chiesto di parlare sull’ordine dei lavori l’onorevole Borghi. Ne ha facoltà. Chiedo scusa la mascherina, onorevole Borghi.	
ENRICO BORGHI	PD	Chiedo scusa, signora Presidente, mi è sfuggito l’elenco: ho segnato solo gli emendamenti 1-bis.5 e 1-bis.4. Quali sono gli altri ritirati?	
MARIA ROSARIA CARFAGNA	PRESIDENTE	Glieli facciamo avere immediatamente, onorevole Borghi. Ha chiesto di intervenire sull’1.337 l’onorevole Prisco, prego.	
EMANUELE PRISCO	FDI	Grazie, Presidente. Mi pare che qualche ragionamento rispetto alle sollecitazioni fatte da Fratelli d’Italia, sia diciamo, in esame. Vedo che è arrivato il Ministro, quindi faccio il buon gesto di lasciare la parola al Ministro, visto che era programmato il suo intervento, perché credo che dalle parole del Ministro potremo capire anche l’andamento successivo della discussione.	
MARIA ROSARIA CARFAGNA	PRESIDENTE	Alla Presidenza non risulta che il Ministro abbia chiesto la parola. Quindi, fintanto che il Ministro non chiede la parola, non può un deputato lasciare la parola all’onorevole Ministro. Quindi, Ministro, chiede di intervenire oppure si riserva di farlo successivamente? Chiede di intervenire adesso? Prego, onorevole Ministro.	
LUCIANA LAMORGESE	Ministra dell'Interno	Posso togliere la mascherina?	
MARIA ROSARIA CARFAGNA	PRESIDENTE	Sì, dal centro, così riusciamo a osservare la distanza anche dal sottosegretario. Prego.	
LUCIANA LAMORGESE	Ministra dell'Interno	Signora Presidente, onorevoli deputati, in occasione di questa mia partecipazione ai lavori dell’Aula penso che sia utile fare un poco il punto sull’andamento del provvedimento che vi ha visti impegnati per tutti questi giorni e che riguarda la vita delle istituzioni in un momento così delicato per il nostro Paese. Con il presente decreto-legge, nel rispetto delle disposizioni per il contenimento della diffusione del Coronavirus già in vigore, in relazione alla necessità di svolgere le elezioni per l’anno 2020, sono stati adottati diversi interventi in materia di elezioni suppletive della Camera, del Senato della Repubblica, di rinnovo dei consigli comunali per scadenza di mandato e di durata degli organi elettivi delle regioni a statuto ordinario. Si è anche ritenuto di prevedere che i comuni che dovessero essere sciolti entro il 27 luglio potranno andare ad elezioni nel prossimo turno 2020, evitando così un lungo periodo di commissariamento. Lo svolgimento delle elezioni del 2020 indubbiamente deve contemperare l’esigenza della tutela della salute, mediante lo svolgimento in sicurezza delle operazioni elettorali, con quella del rinnovo della rappresentanza popolare. L’intervento normativo è finalizzato ad individuare soluzioni tali da non alterare i delicati equilibri del meccanismo elettorale posti a garanzia della partecipazione e della trasparenza delle operazioni elettorali, conciliando l’esigenza dell’ordinato svolgimento delle elezioni con quella fondamentale di tutela della salute dei cittadini. Il lavoro svolto fino ad ora che è stato seguito dal Ministero dell’Interno per il tramite del sottosegretario Variati, che ringrazio per queste lunghe giornate e per la costante attenzione rivolta al provvedimento, penso che rappresenti il punto di sintesi migliore che è proprio delle prerogative del Parlamento. Il provvedimento è rispettoso dei principi costituzionali anche con riferimento alle autonomie regionali; fissa una finestra elettorale dal 15 settembre per lo svolgimento delle elezioni regionali e comunali. Nel corso dei lavori parlamentari è stato anche previsto che il principio dell’election day, già presente nel sistema normativo fin dal 2011, si applichi anche al referendum confermativo relativo alla riduzione del numero dei parlamentari, già peraltro differito con le ultime disposizioni. Così come rilevato da questo ramo del Parlamento, mediante un emendamento, è stata prevista l’adozione di protocolli sanitari e di sicurezza che il Governo dovrà adottare al fine di consentire ai cittadini di recarsi in tutta sicurezza alle urne e, sempre nell’ottica di una ripresa della vita ordinaria di tutti i livelli di Governo, è stato previsto che l’elezione degli organi provinciali si svolga entro 90 giorni dal rinnovo dei consigli comunali. Sempre al fine della maggiore sicurezza è stato anche approvato, in questa sede, un emendamento del relatore che distribuisce su due giorni, domenica e lunedì sino alle 15, le operazioni di voto. Il testo quindi è stato significativamente emendato; sono state recepite importanti proposte volte ad armonizzare l’esigenza di prevenzione del contagio con quella di garanzia della rappresentanza e della partecipazione democratica. È stato anche presentato un emendamento che riserva attenzione ad un tema che sta a cuore a tutti, che è quello della par condicio. Quindi, intendo ringraziare del lavoro sicuramente migliorativo del testo che la Commissione ha svolto e la stessa Aula, per l’ulteriore contributo che si accinge a fornire per la positiva definizione del testo. L’adozione e l’approvazione del decreto ha visto momenti di interlocuzione con le regioni, con le forze politiche e, quindi, appare auspicabile che, nella prosecuzione del dialogo istituzionale, si individui una data da parte di tutti i soggetti deputati a farlo, dal Governo come dalle regioni, che rappresenti un punto di equilibrio per lo svolgimento delle elezioni nelle migliori condizioni; una data che ritengo auspicabilmente unitaria, al fine di conciliare, con modalità uniformi, le esigenze di tutela della salute con quella della ripresa economica. Il risultato che si va a raggiungere è quindi il frutto del lavoro di tutte le forze politiche e rappresenta davvero una efficace sintesi nello svilupparsi di un dialogo sempre necessario e doveroso. Ringrazio quest’Aula e i parlamentari che hanno prestato il loro contributo per l’approvazione, spero prossima, di questo decreto, che persegue l’importante obiettivo dell’ordinaria ripresa della vita delle istituzioni. Ringrazio davvero tanto, perché so che è stato un lavoro complesso su cui non era semplice trovare una sintesi, però il risultato che oggi abbiamo - e spero davvero che venga approvato quanto prima - rappresenta, secondo me, un risultato ottimo e di questo devo ringraziare l’Aula e le Commissioni (Applausi dei deputati dei gruppi MoVimento 5 Stelle, Partito Democratico, Italia Viva e Liberi e Uguali).	
MARIA ROSARIA CARFAGNA	PRESIDENTE	Ha chiesto di intervenire l’onorevole Lollobrigida. Ne ha facoltà.	
FRANCESCO LOLLOBRIGIDA	FDI	Perché non sia inusuale, l’intervento lo faccio sull’ordine dei lavori in quanto, ovviamente, il mio collega era intervenuto sull’emendamento e, quindi…	
MARIA ROSARIA CARFAGNA	PRESIDENTE	Può intervenire anche sull’emendamento, perché l’intervento del Ministro ha riaperto la discussione. Quindi, ha cinque minuti a disposizione in dichiarazione di voto.	
FRANCESCO LOLLOBRIGIDA	FDI	La ringrazio per la sempre puntuale precisione, Presidente. Mi permetta di ringraziare il sottosegretario Variati per l’impegno e per essere stato qui presente in tutto il puntuale lavoro che il nostro Parlamento, in questa Camera, ha svolto finora e immagino quello che svolgerà poi in Senato. Il mio intervento, ovviamente, non è conclusivo, perché ci sono ancora tanti emendamenti presenti, molti dei quali, ancora una volta, puntuali, nel tentativo di migliorare un decreto che, per noi, resta insoddisfacente. Ringrazio però - mi permetta - il Ministro Lamorgese, che ha raccolto il nostro invito. Io credo che il Ministro Lamorgese abbia un compito storico: è il Ministro dell’Interno che affronta l’emergenza più importante che l’Italia attraversa dal dopoguerra. Lo fa in una situazione in cui la sospensione spesso della Costituzione, che lei richiamava, è all’ordine del giorno, e questo impone al Parlamento un attento compito di vigilanza che Fratelli d’Italia ha voluto, in qualche modo, sottolineare fin dall’inizio dell’emergenza. La nostra è stata sempre una disponibilità totale al dialogo, una disponibilità che abbiamo richiamato in senso patriottico di servizio alla nostra nazione, che non può essere confusa con la volontà di voler ottenere posti, poltrone, spartizioni. Fratelli d’Italia non ha questa conformazione o questa aspirazione. Restiamo nei nostri banchi di opposizione finché non avremo la possibilità di votare e quindi, probabilmente, cambiare posizione (non in termini personali, ma sicuramente come forze politiche). Nel frattempo, però, vorremmo che il dialogo fosse quello che abbiamo percepito in queste ore, in cui noi facciamo delle sollecitazioni e poniamo dei suggerimenti, e non quello, invece, che è stato la matrice di questo decreto, cioè una sintesi che è stata richiamata più volte ma che non è stata una sintesi parlamentare ma una sintesi tra le forze di maggioranza. Non è sufficiente, in una democrazia parlamentare, una sintesi tra le forze di maggioranza per fare un buon prodotto, specie sulle regole comuni, su regole quali la scelta della data del voto, il modello con il quale ci si accinge a votare, le scelte che sottintendono la campagna elettorale. Non si può immaginare di approfittare di un’emergenza come quella del COVID-19 per avere l’occasione di piegare regole agli interessi di parte. Quindi, rispetto a questo abbiamo richiamato tutti a un lavoro costante e l’abbiamo fatto in questi giorni, noi non crediamo perdendo tempo, perché quando l’opposizione fa il suo dovere e, quindi, tenta di denunciare le questioni che non vanno non è certamente una perdita di tempo. L’abbiamo fatto richiamando il rinvio delle elezioni a Roma, che, a nostro avviso, sono una distorsione, perché, ovviamente, con un sindaco come la Raggi che coinvolge una sfiduciata dal suo partito all’unanimità nella squadra di governo, insomma, è evidentemente un problema serio rinviare le elezioni e non è un risparmio economico e basta. È una distorsione di un processo di confronto. L’abbiamo richiamato sulla vicenda della data del voto, perché sulla scelta di orientamento della data del voto, che era stata data come perentoria mentre io colgo, invece, nelle sue parole la possibilità di discuterne, leggiamo che le regioni sono insoddisfatte e leggiamo che le forze di minoranza sono insoddisfatte. Quindi, dov’è il punto di caduta che viene richiamato? A nostro avviso, è assente. Noi abbiamo, in queste ore, sottolineato tutte queste criticità e alcune abbiamo provato a correggerle. Non siamo riusciti a farlo pienamente…	
MARIA ROSARIA CARFAGNA	PRESIDENTE	I banchi del Governo, per favore.	
FRANCESCO LOLLOBRIGIDA	FDI	…ma riteniamo che sia legittimo, da parte nostra, chiedere, anche nelle prossime ore, una riflessione…	
MARIA ROSARIA CARFAGNA	PRESIDENTE	Onorevole De Filippo.	
FRANCESCO LOLLOBRIGIDA	FDI	Ministro, lei non ha passato tanto tempo con noi. Se quel poco tempo che passa con noi lo passa ad ascoltare forse ci fa un regalo (Applausi dei deputati del gruppo Fratelli d’Italia). Lei è ospite in questo Parlamento - non glielo devo dire - dei parlamentari. Quindi, la prossima volta, se vuole fare scelte autonome, si faccia eleggere (questa è una modalità nuova che vorremmo porre alla sua attenzione). Detto questo, torno alla vicenda legata alla possibilità di approfondire alcuni temi che abbiamo citato. Le elezioni, se venissero svolte il 20 settembre, provocherebbero un danno al turismo e qui voglio richiamare un’altra questione che noi avevamo posto all’attenzione, non in questo dibattito perché avrebbe poco senso. C’è un rapporto serio tra questa emergenza e approfittarsi di questa emergenza. Allora, il richiamo è a tutti gli uomini delle istituzioni. Abbiamo chiesto lo streaming nel dialogo tra maggioranza e opposizione perché, come avviene qui, potessimo essere trasparenti e vogliamo esserlo fino in fondo anche nei confronti di chi ne approfitta per modificare gli assetti di alcune strutture. Abbiamo un Ministero, il Ministero per il turismo, che dovrebbe consigliare a lei di rinviare le elezioni di una settimana, di quindici giorni, per salvaguardare il mondo del turismo, che è intento a far saltare…	
MARIA ROSARIA CARFAGNA	PRESIDENTE	Onorevole Sgarbi, intanto deve allontanarsi dai banchi del Governo e, poi, deve indossare correttamente la mascherina (Commenti del deputato Sgarbi). Non diamo spettacolo in quest’Aula (Applausi dei deputati dei gruppi Partito Democratico, Italia Viva e Liberi e Uguali). Prego, onorevole Lollobrigida. Ha anche esaurito il tempo a sua disposizione.	
FRANCESCO LOLLOBRIGIDA	FDI	Io esaurisco il tempo, però…	
MARIA ROSARIA CARFAGNA	PRESIDENTE	Le ho fatto già recuperare del tempo. Quindi, la prego di avviarsi alle conclusioni.	
VITTORIO SGARBI	M-NI-USEI-C!-AC	Ridicoli! Ridicoli (Commenti dei deputati dei gruppi Partito Democratico, Italia Viva e Liberi e Uguali)!	
MARIA ROSARIA CARFAGNA	PRESIDENTE	Colleghi! Onorevole Sgarbi, onorevole Sgarbi, in quest’Aula ci sono delle regole; se non intende rispettarle può accomodarsi fuori (Applausi dei deputati dei gruppi MoVimento 5 Stelle, Partito Democratico, Italia Viva e Liberi e Uguali). Indossi correttamente la mascherina; per rispetto dei suoi colleghi deve farlo. Prego, onorevole Lollobrigida.	
FRANCESCO LOLLOBRIGIDA	FDI	Quindi, chiudo. Mi dia 60 secondi per chiudere, perché uno perde la concentrazione con queste continue interruzioni anche, sulle quali non entro. Comunque, ha un Ministro che dovrebbe consigliarle di occuparsi della materia del turismo indirettamente, quindi salvaguardando quel mondo che, invece, è intento a far saltare consigli di amministrazione per vendicarsi dei consigli di amministrazione che magari gli fanno saltare qualche assunzione a tempo indeterminato di qualche suo collaboratore. Su questo faremo piena luce nei prossimi giorni e sarà oggetto anche di dibattito in quest’Aula, perché per noi la trasparenza - lo dico agli amici del MoVimento 5 Stelle - è un valore vero, non che si esercita in campagna elettorale come annuncio…	
MARIA ROSARIA CARFAGNA	PRESIDENTE	Concluda, onorevole Lollobrigida.	
FRANCESCO LOLLOBRIGIDA	FDI	…e poi ci si pente di aver scelto lo streaming. Noi lo streaming, non potendolo avere nelle riunioni che abbiamo auspicato tra maggioranza e opposizione, lo facciamo qui, all’interno del Parlamento. Diremo tutto quello che accade, in maniera chiara e trasparente. Ve lo diciamo in anticipo, perché non facciamo agguati e trabocchetti. Quindi, auspichiamo che la data del voto, Ministro, sia posticipata, come abbiamo chiesto. Il dibattito si esaurirà in quest’Aula e continuerà al Senato. Vedremo se avrete tempo di riflettere sia in questa fase sia in quella successiva all’eventuale approvazione di questo decreto (Applausi dei deputati del gruppo Fratelli d’Italia).	
MARIA ROSARIA CARFAGNA	PRESIDENTE	Ha chiesto di parlare l’onorevole Baldelli. Ne ha facoltà.	
SIMONE BALDELLI	FI	Grazie, Presidente Carfagna. La presenza del Ministro Lamorgese oggi qui in quest’Aula e il suo intervento sono un segnale di rispetto verso il Parlamento e anche un segnale di equilibrio; quell’equilibrio che, tra l’altro, proprio il Ministro dell’Interno, per la sua natura di Ministro regolatore del confronto elettorale in tante occasioni, ha, in qualche misura, il dovere ontologico di avere. Per cui, la ringrazio, signor Ministro, anche per la ricostruzione che lei ha fatto dell’iter parlamentare di questo provvedimento. Un provvedimento a cui il mio gruppo, il gruppo di Forza Italia, ha voluto offrire un contributo costruttivo e propositivo che è stato poi in fondo anche la ragione del cambio di atteggiamento tra la Commissione e l’Aula, dove alcune proposte di Forza Italia sono state accolte. Fin qui diciamo la questione che riguarda la dialettica tra partiti, tra gruppi politici. Io per un attimo, invece, smetto i panni di rappresentante del mio gruppo e indosso quelli di deputato di questo Parlamento, che ha sottoscritto la richiesta di referendum e che, insieme ai colleghi del Senato, i senatori che hanno sottoscritto questa richiesta di referendum, ha espresso al Presidente del Consiglio una volontà chiara. La volontà di non sovrapporre le scadenze nazionali delle elezioni amministrative e di quella del referendum costituzionale (altra valenza, altra dinamica costituzionalmente hanno le date delle consultazioni regionali, proprio per ragioni diciamo così di natura statutaria e costituzionale). Allora, nel riconoscere - come lo stesso Ministro ha fatto - l’impegno, il lavoro, l’attenzione del sottosegretario Variati, io mi permetto di aggiungere alle considerazioni condivisibili che il Ministro faceva in relazione a una data auspicabilmente unitaria - cito testualmente l’intervento del Ministro stesso - il fatto che c’è un convitato di pietra in questa fase, che è proprio il comitato promotore, perché io capisco la volontà di concertare una data tra le forze politiche, di cercare di venire incontro, seppur ciascuna delle regioni ha esigenze diverse, anche alle esigenze della maggior parte o, come dire, del maggior numero possibile delle regioni, ma mi permetto di ricordare in questa sede, proprio perché il rischio è che di qui a lunedì noi invieremo all’altro ramo del Parlamento un provvedimento dove un quinto dell’altro ramo ha firmato per il referendum consultivo, di non avere in qualche modo tenuto in considerazione che cosa? La volontà del comitato promotore, che è l’unico soggetto costituzionale che, come dire, anche in un giudizio costituzionale può rappresentare “la voce del no”. Allora, qual è l’appello che io faccio (ed è quello che ho cercato di spiegare in un numero diciamo ormai consistente di interventi)? E’ che io trovo la volontà unilaterale di una parte della maggioranza, che ha imposto la concentrazione delle scadenze con il referendum costituzionale, attraverso una norma che è assolutamente singolare, Ministro, perché qui non si parla di introdurre questa norma per sempre, è una norma che prevede addirittura ormai diciamo l’impegno a realizzare questa convergenza solo per questo referendum costituzionale, per cui io la considero una scorrettezza, a maggior ragione a fronte di quella che è l’opinione del comitato promotore, ma faccio appello al Ministro degli interni come figura di mediazione tra gli interessi, che non sono interessi in questo caso che vengono rappresentati in questo Parlamento, ma che hanno nel comitato promotore una delle loro controparti, nel cercare di riservarsi la possibilità di celebrare o il referendum costituzionale in altra data rispetto ai turni (al primo turno o al secondo turno) o, in subordine, almeno, se si volesse almeno rispettare l’indirizzo della volontà del comitato promotore, l’idea di poter immaginare di celebrarla in un secondo turno di ballottaggio. Dico questo perché? Perché il dibattito già da marzo era chiaro e già da marzo era chiaro che qualcuno immaginava di portare acqua a favore di una delle due direzioni dell’esito del referendum attraverso la sovrapposizione di questo. Noi rischiamo che la campagna elettorale per il referendum scompaia, derubricata come una paginetta insieme alle amministrative e schiacciata dalle regionali, che sono campagne più politiche. Allora, i primi di marzo io la campagna l’avevo cominciata, ma sono stato uno dei primi a dire, per la sicurezza dei cittadini di fronte alla possibilità di andare tutti insieme a votare lo stesso giorno, assembrati, con un virus che non si sapeva che conseguenze avrebbe avuto e per l’informazione ai cittadini, cambiamo data. Qualcun altro - concludo - insisteva già per l’election day, con una campagna di propaganda di risparmio. Ora, benissimo il risparmio, ma questo Parlamento vota sforamenti per decine di miliardi, allora salvaguardiamo il diritto dei cittadini a essere informati in una condizione di par condicio e salvaguardiamo anche l’indipendenza di quella consultazione, che non è elettorale, rispetto alle altre, grazie.	
MARIA ROSARIA CARFAGNA	PRESIDENTE	Onorevole Iezzi, prego.	
