speaker	role	text	extra
			PRESIDENZA DELLA VICEPRESIDENTE MARIA EDERA SPADONI
			La seduta comincia alle 15.
MARIA EDERA SPADONI	PRESIDENTE	La seduta è aperta. Invito la deputata segretaria a dare lettura del processo verbale della seduta precedente.	
AZZURRA PIA MARIA CANCELLERI		Segretaria, legge il processo verbale della seduta del 15 ottobre 2018.	
			Missioni.
MARIA EDERA SPADONI	PRESIDENTE	Se non vi sono osservazioni, il processo verbale si intende approvato. (È approvato).	
			Annunzio di petizioni (ore 15,05).
MARIA EDERA SPADONI	PRESIDENTE	Comunico che, ai sensi dell'articolo 46, comma 2, del Regolamento, i deputati Battelli, Benvenuto, Bonafede, Claudio Borghi, Brescia, Buffagni, Carfagna, Castelli, Castiello, Cenni, Cirielli, Cominardi, Davide Crippa, D’Incà, D’Uva, Del Re, Delrio, Luigi Di Maio, Di Stefano, Durigon, Fantinati, Ferraresi, Fioramonti, Gregorio Fontana, Lorenzo Fontana, Fraccaro, Fugatti, Gagnarli, Galli, Gallinella, Garavaglia, Gava, Gelmini, Giaccone, Giachetti, Giorgetti, Grande, Guerini, Guidesi, Lollobrigida, Lorefice, Losacco, Manzato, Mazzetti, Micillo, Molteni, Morelli, Morrone, Picchi, Rampelli, Rixi, Ruocco, Spadafora, Tofalo, Vacca, Valente, Villarosa, Viviani e Raffaele Volpi sono in missione a decorrere dalla seduta odierna. I deputati in missione sono complessivamente sessantaquattro, come risulta dall'elenco depositato presso la Presidenza e che sarà pubblicato nell'allegato A al resoconto della seduta odierna (Ulteriori comunicazioni all'Assemblea saranno pubblicate nell'allegato A al resoconto della seduta odierna).	
MARIA EDERA SPADONI	PRESIDENTE	Invito la deputata segretaria di Presidenza a dare la lettura delle petizioni pervenute alla Presidenza, che saranno trasmesse alle sottoindicate Commissioni.	
			Discussione della mozione Conte ed altri n. 1-00061 concernente iniziative per il rilancio del Mezzogiorno (ore 15,12).
AZZURRA PIA MARIA CANCELLERI	Segretaria	legge: Annunzio di petizioni: Andreas Pöder, da Lana (Bolzano), e altri cittadini chiedono l'abolizione degli obblighi vaccinali introdotti dal decreto-legge n. 73 del 2017 (141) - alla XII Commissione (Affari sociali); Dario Bossi, da Montegrino Valtravaglia (Varese), chiede: nuove norme in materia di comunicazioni concernenti le iscrizioni nel registro delle notizie di reato, da rendere agli indagati e alle persone offese ai sensi dell'articolo 335 del codice di procedura penale (142) - alla II Commissione (Giustizia); l’esenzione dal pagamento dei diritti di segreteria per l’estrazione di copie del proprio fascicolo processuale (143) - alla II Commissione (Giustizia); iniziative per assicurare che tutte le procure della Repubblica si dotino di un sito web e di un indirizzo di posta certificata e nuove norme in materia di presentazione delle denunce in via telematica e di elezione di domicilio presso un indirizzo di posta elettronica certificata (144) - alla II Commissione (Giustizia); l’introduzione dell'obbligo di residenza in Italia per i membri del Parlamento (145) - alla I Commissione (Affari costituzionali); Massimiliano Valdannini, da Roma, chiede: l’accorpamento dei commissariati di polizia "Monte Mario" e "Primavalle", nel comune di Roma (146) – alla I Commissione (Affari costituzionali); iniziative per garantire la gratuità della tenuta dei conti correnti per i titolari di assegni pensionistici di importo inferiore a 1.000 euro mensili (147) – alla VI Commissione (Finanze); norme per l'immissione nelle Forze dell'ordine di personale di madre lingua non italiana (148) – alla I Commissione (Affari costituzionali); interventi per la liberalizzazione del servizio di taxi e nuove norme in materia di noleggio di vetture con conducente (149) – alla IX Commissione (Trasporti); l’abrogazione delle norme del decreto legislativo n. 564 del 1996 in materia di trattamento previdenziale dei lavoratori chiamati a ricoprire cariche sindacali (150) – alla XI Commissione (Lavoro); Mimmo Di Garbo, da Milano, chiede iniziative per l'installazione di una targa commemorativa nel luogo della strage di Nassiryia (151) -alla III Commissione (Affari esteri); Roberto Di Gaetano, da Vecchiano (Pisa), chiede nuove norme in materia di dipendenza del personale delle Forze armate cui sono attribuiti compiti in materia di documenti classificati (152) – alla IV Commissione (Difesa); Rinaldo Di Nino, da Cuneo, chiede l'abolizione del Consiglio nazionale dell'economia e del lavoro (153) – alla I Commissione (Affari costituzionali); Franco Brugnola, da Sabaudia (Latina), chiede la revisione dei criteri per la riorganizzazione sul territorio dei punti di primo intervento sanitario (154) – alla XII Commissione (Affari sociali); Francesco Di Pasquale, da Cancello ed Arnone (Caserta), chiede: iniziative per la creazione di nuovi organismi sovranazionali per il controllo della gestione delle risorse del pianeta e la soluzione delle controversie internazionali (155) - alla III Commissione (Affari esteri); iniziative per l'abolizione del diritto di veto all’interno del Consiglio di sicurezza dell’ONU (156) - alla III Commissione (Affari esteri); l’istituzione della Giornata della pacificazione nazionale (157) – alla I Commissione (Affari costituzionali); nuove norme in materia di espulsione dei cittadini stranieri che commettono reati e altri interventi per contrastare il fenomeno dell'immigrazione irregolare (158) - alla I Commissione (Affari costituzionali); iniziative per assicurare l'innalzamento dei redditi e il miglioramento dell'assistenza sanitaria a livello globale, anche al fine di assicurare il diritto di ciascuna persona di vivere dignitosamente nella propria nazione di origine (159) - alla III Commissione (Affari esteri); misure per il riconoscimento di un reddito minimo garantito a tutti i cittadini italiani (160) - alle Commissioni riunite XI (Lavoro) e XII (Affari sociali); iniziative affinché i più gravi reati contro l'ambiente e in materia di traffico di stupefacenti e associazione a delinquere siano dichiarati delitti contro l'umanità (161) - alla III Commissione (Affari esteri); misure diverse a tutela del diritto alla prima casa (162) – alla VIII Commissione (Ambiente); che gli amministratori locali non possano candidarsi alle elezioni politiche (163) - alla I Commissione (Affari costituzionali); Giacomo Pierini, da Firenze, chiede la creazione di un "cassetto digitale unico" del cittadino per tutte le comunicazioni e i rapporti con la pubblica amministrazione (164) - alla I Commissione (Affari costituzionali); Salvatore Coscarelli, da Laino Borgo (Cosenza), e numerosi altri cittadini chiedono interventi urgenti per garantire la copertura telefonica mobile e l'accesso alla rete internet nel comune di Laino Borgo (165) - alla IX Commissione (Trasporti); Simon Baraldi, da Bologna, chiede: l'abolizione dell'accesso programmato ai corsi universitari (166) – alla VII Commissione (Cultura); l’introduzione del reato di istigazione a pratiche alimentari idonee a provocare l'anoressia, la bulimia o altri disturbi del comportamento alimentare, nonché altre disposizioni in materia di prevenzione e contrasto dei disturbi alimentari (167) - alla XII Commissione (Affari sociali); Mirko Antonio Spampinato, da Motta Sant’Anastasia (Catania), chiede: modifiche alla disciplina delle graduatorie ad esaurimento dei docenti con titolo di specializzazione sul sostegno didattico ad alunni con disabilità (168) - alla XI Commissione (Lavoro); l’elezione diretta del Presidente della Repubblica e che i giudici costituzionali siano eletti esclusivamente dalle supreme magistrature ordinaria ed amministrative (169) - alla I Commissione (Affari costituzionali); nuove norme in materia di ordinamento, status e progressione di carriera degli ufficiali delle Forze armate (170) - alla IV Commissione (Difesa); iniziative per la revisione del servizio di assistenza spirituale al personale delle Forze armate, a fini di piena garanzia della libertà religiosa del medesimo personale (171) - alle Commissioni riunite I (Affari costituzionali) e IV (Difesa); Gabriele Pomar, da Palermo, chiede iniziative per innalzare il numero delle squadre partecipanti al campionato di serie B e per l'introduzione di nuovi criteri in materia di ripescaggio di società calcistiche (172) - alla VII Commissione (Cultura); Alessia Marzolini, da Anzio, chiede modifiche diverse alle norme in materia di razionalizzazione e accorpamento delle classi di concorso a cattedre e a posti di insegnamento (173) - alla XI Commissione (Lavoro); Titti Di Salvo, da Roma, e altri cittadini chiedono che il congedo obbligatorio di paternità diventi una misura strutturale e che la sua durata sia portata a dieci giorni nei primi cinque mesi di vita del neonato (174) - alla XI Commissione (Lavoro).	
			(Discussione sulle linee generali)
MARIA EDERA SPADONI	PRESIDENTE	L'ordine del giorno reca la discussione della mozione Conte ed altri n. 1-00061 concernente iniziative per il rilancio del Mezzogiorno (Vedi l'allegato A). La ripartizione dei tempi riservati alla discussione è pubblicata nell’allegato A al resoconto stenografico della seduta del 18 ottobre 2018 (Vedi l’allegato A della seduta del 18 ottobre 2018). Avverto che sono state presentate le mozioni Pezzopane ed altri n. 1-00063 e Lollobrigida ed altri n. 1-00064, che, vertendo su materia analoga a quella trattata dalla mozione all’ordine del giorno, verranno svolte congiuntamente (Vedi l’allegato A). I relativi testi sono in distribuzione.	
MARIA EDERA SPADONI	PRESIDENTE	Dichiaro aperta la discussione sulle linee generali delle mozioni. È iscritto a parlare il deputato Federico Conte, che illustrerà anche la sua mozione n. 1-00061. Ne ha facoltà.	
FEDERICO CONTE	LEU	Grazie, Presidente. La crisi del Mezzogiorno ha assunto ormai caratteristiche, come mai prima, di sistema. Sono riassumibili in pochi dati aggregati: la produzione del prodotto interno lordo pro capite del Mezzogiorno d’Italia, rispetto al nord del Paese, è del 55-56 per cento, poco più della metà. Dal 2008 ad oggi, si sono persi nel Mezzogiorno 500 mila posti di lavoro. Nello stesso periodo, il nord del Paese ne ha guadagnati 242 mila. C’è stata, in questi quindici anni, una evoluzione del tasso di occupazione, che vede la percentuale del Mezzogiorno al 44 per cento, quella del nord del Paese al 65 per cento. Un dato di questo elemento aggregato che riguarda le donne è ancora più significativo: il 35 per cento delle donne meridionali è occupato rispetto al 62 del Nord del Paese. Ci sono circa 600 mila famiglie in cui tutti i componenti cercano lavoro nel Mezzogiorno d’Italia: 835 mila famiglie sono in condizione, come si dice, di povertà assoluta. C’è poi un fenomeno enorme, che è quello delle migrazioni: dal 2009 al 2015 sono andati via dal Mezzogiorno oltre un milione e 800 mila persone tra i 15 e i 34 anni, cioè la parte del Paese più produttiva, la parte giovane del Paese. Di questi, sono tornati soltanto un milione, mentre 800 mila sono rimasti fuori, lontano dal Mezzogiorno d’Italia. Gli istituti demografici ci dicono che, se questo trend continuasse, nel 2070 cinque milioni sarebbero i soggetti andati via dal Mezzogiorno. Questo determinerebbe un innalzamento dell’età media del Mezzogiorno da 42 a 52 anni, rendendola una delle parti più vecchie d’Europa. Questi dati danno il segno evidente, Presidente, di una clamorosa diseguaglianza che riguarda il Paese, che viene sintetizzata nell’indice di Gini, cioè l’indice che misura la distribuzione del reddito e della ricchezza, con un dato molto semplice: l’Italia è al penultimo posto in Europa per capacità di distribuzione di ricchezza e reddito tra i propri cittadini (evidentemente, il Sud è all’ultimo posto). Si tratta di una violazione patente e insopportabile del secondo comma dell’articolo 3 della Costituzione, che vuole che lo Stato operi per rimuovere gli ostacoli alla libera espressione dei cittadini, che vuole che lo Stato operi per garantire diritti di eguaglianza. Le cause di questa regressione del Mezzogiorno sono molteplici, risalenti, ma anche qui possiamo provare a dare un’indicazione sintetica. Sicuramente, l’affermazione in Italia delle logiche del mercato, di politiche liberiste che hanno badato ai poteri forti, alla parte più ricca del Paese e non alla parte più povera. Ha contribuito a questo la politica di austerity dell’Unione europea, l’idea, cioè, di porre al centro dell’azione politica dell’Unione la riduzione del debito e il consolidamento finanziario. L’Europa è nata e cresciuta sul modello tedesco, quello del rigore dei conti. La nostra Costituzione, invece, tiene in equilibrio economia, lavoro e democrazia, con un ruolo dello Stato importante, principale, che attraverso la cosiddetta regola keynesiana vuole negli investimenti per spesa produttiva, per infrastrutture, per sviluppo, la misura per combattere la crisi economica e la disoccupazione. L’attrito, lo iato, tra questi due modelli ha messo in difficoltà il Paese, che non ha saputo reagire alla restrizione della spesa pubblica, soprattutto nelle parti del Paese in cui questa era più necessaria, nelle parti del Paese in cui più ce n’era bisogno. Questo ha coinciso, evidentemente, con lo spiegarsi del più grande fenomeno economico della storia dell’umanità, la globalizzazione, la cui curva calante, la cui curva discendente, evidentemente, ha lasciato sul terreno del Mezzogiorno costi elevatissimi. Che cosa significa questo? Significa che nel ripensare a un intervento a favore del Mezzogiorno, bisogna ripensare al ruolo dello Stato nel nostro Paese e nella parte più debole del suo stesso assetto territoriale. Un ruolo che riguardi la promozione di investimenti, che riguardi la creazione di condizioni di crescita e sviluppo, che riguardi l’erogazione di servizi. Per darci una misura, anche qui, di tipo oggettivo di quanto sia importante l’intervento dello Stato nell’economia meridionale, basti pensare che nel 2009 lo Stato spendeva 23 miliardi per investimenti (parlo della spesa in conto capitale, ma i parametri sono gli stessi anche per la spesa in conto corrente). Ventitré miliardi di investimenti del 2009 sono diventati 12 nel 2016, ancora di meno nel 2017. Una riduzione drammatica che, evidentemente, ha ridotto anche la capacità di attrattiva del Mezzogiorno per investimenti esteri. Fatto lo stesso periodo di tempo, su 25 miliardi di euro provenuti dall’estero, solo cinque sono stati investiti nel Mezzogiorno. Per fare fronte a questa riduzione insopportabile della spesa pubblica nel Mezzogiorno, il Governo Gentiloni ha varato, con il decreto Mezzogiorno, la cosiddetta clausola del 34 per cento, che stabilisce un obbligo di destinazione del bilancio dello Stato a favore del Mezzogiorno del 34 per cento delle risorse. Non è una novità, ma una misura che fu utilizzata con successo dal Governo Ciampi (lì la soglia era stata fissata ancora più in alto, al 40 per cento) e che garantì in quel periodo un recupero del gap economico tra Sud e Nord molto significativo. Questa regola, però, non è stata mai inverata, perché il Governo uscente - e con gravi responsabilità anche quello in carica - ancora non ha emesso i regolamenti attuativi che ne consentono la piena operatività nei capitoli di spesa. Non c’è la traccia, non c’è l’operatività di questa clausola nella legge di stabilità che ci apprestiamo a votare. Vuole sapere l’importanza, Presidente, di questa clausola? La possiamo ricostruire andando a ritroso: se questa clausola fosse stata in vigore negli ultimi quindici anni, noi avremmo avuto che la riduzione del prodotto interno lordo del Mezzogiorno sarebbe stata del 5,4 e non del 10,7, cioè sarebbe stata della metà; che il tasso di occupazione sarebbe stato meno 2,8 e non meno 6,8. Dietro questi numeri ci sono 300 mila posti di lavoro, cioè non se ne sarebbero persi 500 mila, ma 200 mila. Stavo per dire solo 200 mila, se così ci si può esprimere: si rende conto che si tratta di un’intera popolazione, probabilmente di un’intera generazione. Allora, è evidente che la leva pubblica, la leva dell’investimento pubblico, continua a essere quella che tiene su l’economia, altrimenti non ci spiegheremmo perché la previsione di prodotto interno lordo per l’anno prossimo del Sud è più 0,7. Negli scorsi anni, grazie alla resilienza degli imprenditori del Sud, è stata di un punto - o una alinea inferiore o superiore, a seconda dei momenti - di quella del Centro-Nord. Questa riduzione, evidentemente, graverà anche sui conti generali dello Stato, sui quali si andrà a esercitare la manovra che ci apprestiamo a votare. Si tratta di un dato che ha ricadute sul piano sociale per quanto riguarda le erogazioni di servizi, servizi essenziali, la sanità, le prestazioni socioassistenziali, per quanto riguarda l’istruzione, per quanto riguarda tutto ciò che è convivenza civile, che nel Mezzogiorno vive una condizione di degrado inaccettabile. Ciò riguarda le capacità reddituali, riguarda, evidentemente, la dignità delle persone.	
MARIA EDERA SPADONI	PRESIDENTE	Concluda, onorevole.	
FEDERICO CONTE	LEU	Rispetto a questo fenomeno non sono stati in grado di svolgere una funzione surrogatoria e integrativa neanche i finanziamenti provenienti dall’Unione europea, che purtroppo sono stati utilizzati con finalità di sostituzione dei fondi europei. Di qui il calo dell’aspettativa di vita dei cittadini meridionali da più 1 a meno 4, secondo l’indice dato; di qui la visione nuova che prospettiamo in questa mozione di un rilancio della questione meridionale a livello europeo, una nuova frontiera della questione meridionale come questione europea, che vede il Mediterraneo al centro di un progetto di investimenti…	
MARIA EDERA SPADONI	PRESIDENTE	Deve concludere, onorevole.	
FEDERICO CONTE	LEU	…che possano essere adottati dall’Unione europea come investimenti strategici per il suo stesso sviluppo e le proposte di seguito rassegnate.	
MARIA EDERA SPADONI	PRESIDENTE	iscritta a parlare la deputata Pezzopane, che illustrerà anche la sua mozione n. 1-00063. Ne ha facoltà.	
